has_identifier_has_id_value,unknown,unknown,has_name,unknown,unknown,unknown,unknown,has_identifier_has_id_value,unknown,has_identifier_is_source_of_has_startDate,unknown,unknown,unknown,unknown,unknown,has_name,unknown,unknown,unknown,unknown,unknown,unknown,unknown,unknown,is_source_of_has_startDate,has_description,is_destination_of_has_source_has_identifier_has_id_value,unknown,unknown,unknown,has_name,unknown,unknown,unknown,unknown,is_source_of_has_classification_has_term,unknown,is_destination_of_has_source_is_source_of_has_destination_has_name,is_source_of_has_classification_has_term,unknown,is_destination_of_has_source_is_source_of_has_destination_has_name,unknown,unknown,unknown,unknown,unknown,unknown,unknown,unknown,unknown,is_destination_of_has_source_is_source_of_has_destination_has_URI,unknown,unknown,has_identifier_has_id_value,unknown,has_identifier_has_id_value,unknown,unknown,unknown,unknown,has_identifier_has_id_value,unknown,unknown,unknown,unknown,unknown,unknown,is_destination_of_has_source_is_source_of_has_destination_has_name,is_source_of_has_classification_has_term,unknown,unknown,unknown,unknown,unknown,unknown
1f36514a-eac1-4255-8b89-0d26d9cae86a,5,"http://www.fao.org/figis/geoserver/wms?service=WMS&version=1.1.0&request=GetMap&layers=fifao:UN_CONTINENT2,fsa:FSA_37-3-1&bbox=20.5238,32.0,31.0,43.0103&width=571&height=631&srs=EPSG:4326&format=image%2Fpng",Raster,-159.75,active,36.25,environment,18c6337e-b7f0-4f30-93b3-04eb92faadb5,http://geonetwork.d4science.org:8080/geonetwork/srv/en/xml.metadata.get?uuid=2ceafac0-4d4b-461e-a84f-454081c4e9e7,2017-12-23T01:35:26.206511,2017-12-04T00:08:19.660+01:00,True,Unnamed resource,True,False,alpheus cylindricus Aquamaps Native 2050 Raster,False,d4sciencelabs,34eb4ca0-12de-4aa8-8044-4718a8e1f255,2ceafac0-4d4b-461e-a84f-454081c4e9e7,"[{""type"": ""creation"", ""value"": ""2017-12-04T00:08:19.660+01:00""}, {""type"": ""publication"", ""value"": ""2017-12-04T00:08:19.660+01:00""}, {""type"": ""revision"", ""value"": ""2017-12-04T00:08:19.660+01:00""}]",-32.75,eng,active,2017-12-23T01:35:23.815954,"This alpheus cylindricus Species Distribution Map for 2050 has been generated with the AquaMaps methodology by exploiting the technology and the computational resources provided by iMarine. In particular, this map has been produced using the HSPEC Native Range dataset, generated using the AquaMaps NativeRange 2050 algorithm. Hosted on the D4Science Thredds CataSystem.out.println: http://thredds.d4science.org",ebc02b4a-f774-4e7e-afe1-d52ab93126de,http://thredds.d4science.org/thredds/fileServer/public/netcdf/AquamapsNative2050/aquamaps_native2050_alpheus_cylindricus.nc,WCS,4,fishery statistical areas,30.25,"ISO 19115 Topic Category. Environmental resources, protection and conservation, for example environmental pollution, waste storage and treatment, environmental impact assessment, monitoring environmental risk, nature reserves, landscape, water quality, air quality, environmental modeling",[],"D4Science has developed a series of applications (accessible through the D4Science Labs) which can be used by any user to upload, manipulate, use and re-use products with the aim to share them with other users following the principle of the OpenScience",Dataset,D4Science Labs,bb,dataset,[],FAO - Fisheries and Aquaculture Department (FI). Fisheries and Aquaculture Policy and Resources Division (FIA),http://geonetwork.d4science.org:8080/geonetwork,2017-01-31,organization,Fabio.Carocci@fao.org,"{""type"": ""Polygon"", ""coordinates"": [[[-159.75, -32.75], [30.25, -32.75], [30.25, 36.25], [-159.75, 36.25], [-159.75, -32.75]]]}",http://geonetwork.d4science.org:8080/geonetwork/srv/en/metadata.show?uuid=2ceafac0-4d4b-461e-a84f-454081c4e9e7,environment,22dde829-fe22-4db6-875d-5ae13aed8a5a,2017-09-19T13:34:39.851850,bluebridge.catalogue@d4science.org,False,revision,alpheus-cylindricus-aquamaps-native-2050-raster,8,5c844944-5f55-45ba-9865-e9b906ae6790,[],8c9d13a9-cca4-4d63-8943-34f6dadb6882,730e5b91-2265-431e-b033-7f310474e4f3,active,21f8341c-6324-49d0-93e3-c9ed1d8c2765,approved,11680099-3fd0-427c-8cfc-b1fbcde0623e,environment,active,https://ckan-bb2.d4science.org/images/organisations/d4sciencelabs.png,WWW:LINK-1.0-http--link,FAO - Fisheries and Aquaculture Department (FI). Fisheries and Aquaculture Policy and Resources Division (FIA),dataset,2017-11-24T11:56:48.241435,11680099-3fd0-427c-8cfc-b1fbcde0623e,asNeeded,environment,http://data.d4science.org/ctlg/gCubeApps/alpheus-cylindricus-aquamaps-native-2050-raster,"[{""name"": """", ""roles"": [""originator""]}]"
21f8341c-6324-49d0-93e3-c9ed1d8c2765,0,http://node49.p.d4science.research-infrastructures.eu:9003/83/Animalia/Chordata/Actinopterygii/Perciformes/Acanthuridae/Fis-31082/Ocean_View__Pacific.jpg,FAO,22.5238,active,41.0103,environment,5c844944-5f55-45ba-9865-e9b906ae6790,http://geonetwork.d4science.org:8080/geonetwork/srv/en/xml.metadata.get?uuid=fao-fsa-map-37.3.1,2017-11-28T14:42:17.134129,2017-01-31T18:08:07,True,FSA_37-3-1,True,False,Aegean (Division 37.3.1 of FAO Major Area 37),False,fao,759e7752-a487-4d44-a2d4-13df39516e6c,fao-fsa-map-37.3.1,"[{""type"": ""revision"", ""value"": ""2017-01-31""}]",34.0,eng,active,2017-11-28T14:42:15.114591,The FAO major fishing areas for statistical purpose are defined by the CWP handbook of fishery statistical standards available at http://www.fao.org/fishery/cwp/handbook/h/en,ebc02b4a-f774-4e7e-afe1-d52ab93126de,http://www.fao.org/figis/geoserver/fsa/ows?SERVICE=WMS,WFS,7,AquaMaps,29.0,"ISO 19115 Topic Category. Environmental resources, protection and conservation, for example environmental pollution, waste storage and treatment, environmental impact assessment, monitoring environmental risk, nature reserves, landscape, water quality, air quality, environmental modeling",[],"Achieving food security for all is at the heart of FAO's efforts – to make sure people have regular access to enough high-quality food to lead active, healthy lives. 

Our three main goals are: the eradication of hunger, food insecurity and malnutrition; the elimination of poverty and the driving forward of economic and social progress for all; and, the sustainable management and utilization of natural resources, including land, water, air, climate and genetic resources for the benefit of present and future generations.
See More: http://www.fao.org",Dataset,FAO,bb,dataset,[],"iMarine Consortium,iMarine.eu",http://geonetwork.d4science.org:8080/geonetwork,2012-12-21T03:10:38.322+01:00,organization,info@i-marine.eu,"{""type"": ""Polygon"", ""coordinates"": [[[22.5238, 34.0], [29.0, 34.0], [29.0, 41.0103], [22.5238, 41.0103], [22.5238, 34.0]]]}",http://geonetwork.d4science.org:8080/geonetwork/srv/en/metadata.show?uuid=fao-fsa-map-37.3.1,environment,8ce7af83-407b-45d7-b921-b4112056f031,2017-12-15T22:47:07.726772,bluebridge.catalogue@d4science.org,False,creation,aegean-division-37-3-1-of-fao-major-area-37,11,5c844944-5f55-45ba-9865-e9b906ae6790,[],1fe71b44-2a29-451a-8a49-6af82895363e,730e5b91-2265-431e-b033-7f310474e4f3,active,1f36514a-eac1-4255-8b89-0d26d9cae86a,approved,3d727615-9ce4-4cb2-a9c9-93526de650e2,boundaries,active,https://ckan-bb2.d4science.org/images/organisations/fao.png,OGC:WFS-1.0.0-http-get-feature,iMarine.eu,dataset,2017-11-24T11:57:25.865048,3d727615-9ce4-4cb2-a9c9-93526de650e2,asNeeded,environment,http://data.d4science.org/ctlg/BlueBridgeProject/aegean-division-37-3-1-of-fao-major-area-37,"[{""name"": ""FAO - Fisheries and Aquaculture Department (FI). Fisheries and Aquaculture Policy and Resources Division (FIA)"", ""roles"": [""pointOfContact""]}]"
9a14050f-9c2a-410f-b766-c394483ee20a,0,http://node49.p.d4science.research-infrastructures.eu:9003/407/Animalia/Arthropoda/Malacostraca/Decapoda/Sergestidae/ITS-95898/Ocean_View__Pacific.jpg,Probability Distribution,-179.75,active,78.25,biota,0681b13f-c1b6-4225-b772-0a2828015745,http://geonetwork.d4science.org:8080/geonetwork/srv/en/xml.metadata.get?uuid=bfc08c9b-5a5e-43b9-8b34-8d9d391a448d,2017-12-24T07:04:49.206982,2017-12-02T12:17:23.100+01:00,True,Unnamed resource,True,False,alepisaurus brevirostris Aquamaps Native 2050 Raster,False,d4sciencelabs,c415fab9-35e8-45df-8790-d087f71698ae,bfc08c9b-5a5e-43b9-8b34-8d9d391a448d,"[{""type"": ""creation"", ""value"": ""2017-12-02T12:17:23.100+01:00""}, {""type"": ""publication"", ""value"": ""2017-12-02T12:17:23.100+01:00""}, {""type"": ""revision"", ""value"": ""2017-12-02T12:17:23.100+01:00""}]",-68.25,eng,active,2017-12-24T07:04:45.870555,"This alepisaurus brevirostris Species Distribution Map for 2050 has been generated with the AquaMaps methodology by exploiting the technology and the computational resources provided by iMarine. In particular, this map has been produced using the HSPEC Native Range dataset, generated using the AquaMaps NativeRange 2050 algorithm. Hosted on the D4Science Thredds CataSystem.out.println: http://thredds.d4science.org",ebc02b4a-f774-4e7e-afe1-d52ab93126de,http://thredds.d4science.org/thredds/fileServer/public/netcdf/AquamapsNative2050/aquamaps_native2050_alepisaurus_brevirostris.nc,WCS,4,37.3.1,180.25,"ISO 19115 Topic Category. Flora or fauna in natural environment, for example wildlife, vegetation, biological sciences, ecology, wilderness, sea life, wetlands, habitat, biological resources",[],"D4Science has developed a series of applications (accessible through the D4Science Labs) which can be used by any user to upload, manipulate, use and re-use products with the aim to share them with other users following the principle of the OpenScience",Dataset,D4Science Labs,bb,dataset,[],"iMarine Consortium,iMarine.eu",http://geonetwork.d4science.org:8080/geonetwork,2013-04-12T16:30:19.786+02:00,organization,info@i-marine.eu,"{""type"": ""Polygon"", ""coordinates"": [[[-179.75, -68.25], [180.25, -68.25], [180.25, 78.25], [-179.75, 78.25], [-179.75, -68.25]]]}",http://geonetwork.d4science.org:8080/geonetwork/srv/en/metadata.show?uuid=bfc08c9b-5a5e-43b9-8b34-8d9d391a448d,biota,22dde829-fe22-4db6-875d-5ae13aed8a5a,2017-09-19T13:34:39.851840,bluebridge.catalogue@d4science.org,False,creation,alepisaurus-brevirostris-aquamaps-native-2050-raster,8,18c6337e-b7f0-4f30-93b3-04eb92faadb5,[],20715b22-e170-4496-ad05-5a6122bd9a21,7bf889d1-7829-4c2e-ad72-222798006eee,active,21f8341c-6324-49d0-93e3-c9ed1d8c2765,approved,11680099-3fd0-427c-8cfc-b1fbcde0623e,environment,active,https://ckan-bb2.d4science.org/images/organisations/d4sciencelabs.png,OGC:WFS-1.0.0-http-get-feature,iMarine.eu,dataset,2017-11-24T11:56:48.241435,11680099-3fd0-427c-8cfc-b1fbcde0623e,asNeeded,biota,http://data.d4science.org/ctlg/gCubeApps/alepisaurus-brevirostris-aquamaps-native-2050-raster,"[{""name"": """", ""roles"": [""originator""]}]"
e286c1cc-463d-4a0a-8f5b-5e669463f2c4,0,http://node49.p.d4science.research-infrastructures.eu:9003/80/Animalia/Chordata/Actinopterygii/Pleuronectiformes/Paralichthyidae/Fis-32725/Earth.jpg,SpeciesDistribution,-180.0,active,90.0,biota,e59cfce6-cb01-446a-ad55-d5ca7b7c3c4d,http://geonetwork.d4science.org:8080/geonetwork/srv/en/xml.metadata.get?uuid=5d0819c2-dc2a-46c7-9e25-2700d52ef731,2017-11-26T06:15:49.839411,2013-06-19T04:51:54.649+02:00,True,WMS link to resource,True,False,Acanthurus olivaceus,False,imarine,172d04b9-eb96-4684-a7e3-0cf40b2b8af4,5d0819c2-dc2a-46c7-9e25-2700d52ef731,"[{""type"": ""creation"", ""value"": ""2012-12-21T03:10:38.322+01:00""}]",-90.0,eng,active,2017-11-26T06:15:48.458765,"This Acanthurus olivaceus Species Distribution Map has been generated with the AquaMaps methodology by exploiting the technology and the computational resources provided by iMarine. In particular, this map has been produced using the HSPEC 2050 Native Range dataset, generated using AquaMaps NativeRange2050 algorithm.",ebc02b4a-f774-4e7e-afe1-d52ab93126de,"http://geoserver4.d4science.research-infrastructures.eu/geoserver/wms?service=wms&version=1.1.0&request=GetMap&layers=lacanthurusolivaceus20121221031012024cet&styles=&bbox=-180,-90,180,90&width=676&height=330&srs=EPSG:4326&crs=EPSG:4326&format=application/openlayers",WMS,4,65031a65-6624-41a6-a4d7-ce8209fcc54d,180.0,"ISO 19115 Topic Category. Flora or fauna in natural environment, for example wildlife, vegetation, biological sciences, ecology, wilderness, sea life, wetlands, habitat, biological resources",[],"iMarine is an access point to a number of Virtual Research Environments deployed and operated in the context of the iMarine project to support the Ecosystem Approach to fisheries management and conservation of marine living resources. It empowers practitioners and policy makers from multiple scientific fields such as fisheries, biodiversity and ocean observation by ensuring that otherwise dispersed and heterogeneous data is available to all stakeholder communities through a shared virtual environment that brings together multidisciplinary data sources, supports cross-cutting scientific analysis, and assists communication.
See More: https://i-marine.d4science.org/",Dataset,iMarine,bb,dataset,[],"iMarine Consortium,iMarine.eu",http://geonetwork.d4science.org:8080/geonetwork,2012-12-10T16:42:44.065+01:00,organization,info@i-marine.eu,"{""type"": ""Polygon"", ""coordinates"": [[[-180.0, -90.0], [180.0, -90.0], [180.0, 90.0], [-180.0, 90.0], [-180.0, -90.0]]]}",http://geonetwork.d4science.org:8080/geonetwork/srv/en/metadata.show?uuid=5d0819c2-dc2a-46c7-9e25-2700d52ef731,biota,70a489ea-a910-40b8-ae63-431084dc99a6,2017-12-16T05:09:45.014127,bluebridge.catalogue@d4science.org,False,creation,acanthurus-olivaceus1,6,5c844944-5f55-45ba-9865-e9b906ae6790,[],d4efafea-4610-4477-852e-5a142d425135,7bf889d1-7829-4c2e-ad72-222798006eee,active,9a14050f-9c2a-410f-b766-c394483ee20a,approved,81f5e6ae-92ab-410a-9a75-f809d43ec1ee,biota,active,https://ckan-bb2.d4science.org/images/organisations/imarine.png,OGC:WFS-1.0.0-http-get-feature,iMarine.eu,dataset,2017-11-24T11:56:37.199304,81f5e6ae-92ab-410a-9a75-f809d43ec1ee,asNeeded,biota,http://data.d4science.org/ctlg/d4science.research-infrastructures.eu/acanthurus-olivaceus1,"[{""name"": ""iMarine Consortium"", ""roles"": [""author""]}, {""name"": ""iMarine.eu"", ""roles"": [""distributor"", ""resourceProvider""]}]"
e8925089-34b9-4b99-979a-a4e0b8470dc2,0,http://node49.p.d4science.research-infrastructures.eu:9003/405/Animalia/Chordata/Reptilia/Squamata/Hydrophiidae/Rep-205/Ocean_View__Pacific.jpg,SpeciesDistribution,-180.0,active,90.0,biota,8b033857-0de0-44f5-ba7f-18067855a209,http://geonetwork.d4science.org:8080/geonetwork/srv/en/xml.metadata.get?uuid=954175a6-2305-439b-a86f-6d7ffa679b94,2017-11-30T23:27:55.110293,2013-06-19T14:13:41.805+02:00,True,WMS link to resource,True,False,Acetes erythraeus,False,imarine,172d04b9-eb96-4684-a7e3-0cf40b2b8af4,954175a6-2305-439b-a86f-6d7ffa679b94,"[{""type"": ""creation"", ""value"": ""2013-04-12T16:30:19.786+02:00""}]",-90.0,eng,active,2017-11-30T23:27:53.389277,"This Acetes erythraeus Species Distribution Map has been generated with the AquaMaps methodology by exploiting the technology and the computational resources provided by iMarine. In particular, this map has been produced using the Default Suitable 2050 maps_SuitableRange2050 dataset, generated using AquaMaps SuitableRange2050 algorithm.",ebc02b4a-f774-4e7e-afe1-d52ab93126de,"http://geoserver3.d4science.research-infrastructures.eu/geoserver/wms?service=wms&version=1.1.0&request=GetMap&layers=laceteserythraeus20130412162952950cest&styles=&bbox=-180,-90,180,90&width=676&height=330&srs=EPSG:4326&crs=EPSG:4326&format=application/openlayers",WMS,4,Acanthurus olivaceus,180.0,"ISO 19115 Topic Category. Flora or fauna in natural environment, for example wildlife, vegetation, biological sciences, ecology, wilderness, sea life, wetlands, habitat, biological resources",[],"iMarine is an access point to a number of Virtual Research Environments deployed and operated in the context of the iMarine project to support the Ecosystem Approach to fisheries management and conservation of marine living resources. It empowers practitioners and policy makers from multiple scientific fields such as fisheries, biodiversity and ocean observation by ensuring that otherwise dispersed and heterogeneous data is available to all stakeholder communities through a shared virtual environment that brings together multidisciplinary data sources, supports cross-cutting scientific analysis, and assists communication.
See More: https://i-marine.d4science.org/",Dataset,iMarine,bb,dataset,[],"iMarine Consortium,iMarine.eu",http://geonetwork.d4science.org:8080/geonetwork,2013-04-12T00:13:25.477+02:00,organization,info@i-marine.eu,"{""type"": ""Polygon"", ""coordinates"": [[[-180.0, -90.0], [180.0, -90.0], [180.0, 90.0], [-180.0, 90.0], [-180.0, -90.0]]]}",http://geonetwork.d4science.org:8080/geonetwork/srv/en/metadata.show?uuid=954175a6-2305-439b-a86f-6d7ffa679b94,biota,70a489ea-a910-40b8-ae63-431084dc99a6,2017-09-21T23:32:36.569448,bluebridge.catalogue@d4science.org,False,creation,acetes-erythraeus1,8,0681b13f-c1b6-4225-b772-0a2828015745,[],5df82cd8-13f2-47f3-a462-e401f3946795,7bf889d1-7829-4c2e-ad72-222798006eee,active,e286c1cc-463d-4a0a-8f5b-5e669463f2c4,approved,81f5e6ae-92ab-410a-9a75-f809d43ec1ee,biota,active,https://ckan-bb2.d4science.org/images/organisations/imarine.png,OGC:WFS-1.0.0-http-get-feature,iMarine.eu,dataset,2017-11-24T11:56:37.199304,81f5e6ae-92ab-410a-9a75-f809d43ec1ee,asNeeded,biota,http://data.d4science.org/ctlg/d4science.research-infrastructures.eu/acetes-erythraeus1,"[{""name"": ""iMarine Consortium"", ""roles"": [""author""]}, {""name"": ""iMarine.eu"", ""roles"": [""distributor"", ""resourceProvider""]}]"
ec77b4f0-db30-4bc0-9606-b4d7e18e7a77,0,http://node49.p.d4science.research-infrastructures.eu:9003/405/Animalia/Chordata/Actinopterygii/Perciformes/Sparidae/Fis-153602/Ocean_View__Pacific.jpg,Three-spot flounder,-180.0,active,90.0,biota,c69013c4-8ed5-4251-a850-c82b29ee3f56,http://geonetwork.d4science.org:8080/geonetwork/srv/en/xml.metadata.get?uuid=2e6e2bea-3099-4ec6-b4d1-e7136a7114de,2017-11-26T08:51:52.497500,2013-06-18T19:58:34.043+02:00,True,WMS link to resource,True,False,Ancylopsetta dendritica,False,imarine,ef3e5d29-cd92-4031-add2-c3e0bd92e3af,2e6e2bea-3099-4ec6-b4d1-e7136a7114de,"[{""type"": ""creation"", ""value"": ""2012-12-10T16:42:44.065+01:00""}]",-90.0,eng,active,2017-11-26T08:51:51.542334,"This Ancylopsetta dendritica Species Distribution Map has been generated with the AquaMaps methodology by exploiting the technology and the computational resources provided by iMarine. In particular, this map has been produced using the HSPEC Native Range dataset, generated using AquaMaps NativeRange algorithm.",ebc02b4a-f774-4e7e-afe1-d52ab93126de,"http://geoserver4.d4science.research-infrastructures.eu/geoserver/wms?service=wms&version=1.1.0&request=GetMap&layers=lancylopsettadendritica20121210164232640cet&styles=&bbox=-180,-90,180,90&width=676&height=330&srs=EPSG:4326&crs=EPSG:4326&format=application/openlayers",WMS,4,7614324,180.0,"ISO 19115 Topic Category. Flora or fauna in natural environment, for example wildlife, vegetation, biological sciences, ecology, wilderness, sea life, wetlands, habitat, biological resources",[],"iMarine is an access point to a number of Virtual Research Environments deployed and operated in the context of the iMarine project to support the Ecosystem Approach to fisheries management and conservation of marine living resources. It empowers practitioners and policy makers from multiple scientific fields such as fisheries, biodiversity and ocean observation by ensuring that otherwise dispersed and heterogeneous data is available to all stakeholder communities through a shared virtual environment that brings together multidisciplinary data sources, supports cross-cutting scientific analysis, and assists communication.
See More: https://i-marine.d4science.org/",Dataset,iMarine,bb,dataset,[],"iMarine Consortium,iMarine.eu",http://geonetwork.d4science.org:8080/geonetwork,2013-04-12T11:45:01.086+02:00,organization,info@i-marine.eu,"{""type"": ""Polygon"", ""coordinates"": [[[-180.0, -90.0], [180.0, -90.0], [180.0, 90.0], [-180.0, 90.0], [-180.0, -90.0]]]}",http://geonetwork.d4science.org:8080/geonetwork/srv/en/metadata.show?uuid=2e6e2bea-3099-4ec6-b4d1-e7136a7114de,biota,70a489ea-a910-40b8-ae63-431084dc99a6,2017-09-22T11:54:30.384833,bluebridge.catalogue@d4science.org,False,creation,ancylopsetta-dendritica3,6,e59cfce6-cb01-446a-ad55-d5ca7b7c3c4d,[],7f2711ff-9d35-4581-9848-5ce11c5450d6,7bf889d1-7829-4c2e-ad72-222798006eee,active,e8925089-34b9-4b99-979a-a4e0b8470dc2,approved,81f5e6ae-92ab-410a-9a75-f809d43ec1ee,biota,active,https://ckan-bb2.d4science.org/images/organisations/imarine.png,OGC:WFS-1.0.0-http-get-feature,iMarine.eu,dataset,2017-11-24T11:56:37.199304,81f5e6ae-92ab-410a-9a75-f809d43ec1ee,asNeeded,biota,http://data.d4science.org/ctlg/d4science.research-infrastructures.eu/ancylopsetta-dendritica3,"[{""name"": ""iMarine Consortium"", ""roles"": [""author""]}, {""name"": ""iMarine.eu"", ""roles"": [""distributor"", ""resourceProvider""]}]"
935a24e7-8b98-4c71-b4f5-31f4aec7c367,0,http://node49.p.d4science.research-infrastructures.eu:9003/407/Animalia/Mollusca/Bivalvia/Arcoida/Arcidae/SLB-88582/Ocean_View__Pacific.jpg,SpeciesDistribution,-180.0,active,90.0,biota,d6125f44-ec49-4b06-883c-42b84b1c72ca,http://geonetwork.d4science.org:8080/geonetwork/srv/en/xml.metadata.get?uuid=be8b1b20-a2a7-409e-ab98-b09eab52973c,2017-11-30T03:30:26.428603,2013-06-19T12:21:53.707+02:00,True,WMS link to resource,True,False,Aipysurus eydouxii,False,imarine,172d04b9-eb96-4684-a7e3-0cf40b2b8af4,be8b1b20-a2a7-409e-ab98-b09eab52973c,"[{""type"": ""creation"", ""value"": ""2013-04-12T00:13:25.477+02:00""}]",-90.0,eng,active,2017-11-30T03:30:23.965712,"This Aipysurus eydouxii Species Distribution Map has been generated with the AquaMaps methodology by exploiting the technology and the computational resources provided by iMarine. In particular, this map has been produced using the Default Suitable maps_SuitableRange dataset, generated using AquaMaps SuitableRange algorithm.",ebc02b4a-f774-4e7e-afe1-d52ab93126de,"http://geoserver4.d4science.research-infrastructures.eu/geoserver/wms?service=wms&version=1.1.0&request=GetMap&layers=laipysuruseydouxii20130412001305043cest&styles=&bbox=-180,-90,180,90&width=676&height=330&srs=EPSG:4326&crs=EPSG:4326&format=application/openlayers",WMS,4,Ancylopsetta dendritica,180.0,"ISO 19115 Topic Category. Flora or fauna in natural environment, for example wildlife, vegetation, biological sciences, ecology, wilderness, sea life, wetlands, habitat, biological resources",[],"iMarine is an access point to a number of Virtual Research Environments deployed and operated in the context of the iMarine project to support the Ecosystem Approach to fisheries management and conservation of marine living resources. It empowers practitioners and policy makers from multiple scientific fields such as fisheries, biodiversity and ocean observation by ensuring that otherwise dispersed and heterogeneous data is available to all stakeholder communities through a shared virtual environment that brings together multidisciplinary data sources, supports cross-cutting scientific analysis, and assists communication.
See More: https://i-marine.d4science.org/",Dataset,iMarine,bb,dataset,[],"iMarine Consortium,iMarine.eu",http://geonetwork.d4science.org:8080/geonetwork,2013-04-14T18:45:21.848+02:00,organization,info@i-marine.eu,"{""type"": ""Polygon"", ""coordinates"": [[[-180.0, -90.0], [180.0, -90.0], [180.0, 90.0], [-180.0, 90.0], [-180.0, -90.0]]]}",http://geonetwork.d4science.org:8080/geonetwork/srv/en/metadata.show?uuid=be8b1b20-a2a7-409e-ab98-b09eab52973c,biota,70a489ea-a910-40b8-ae63-431084dc99a6,2017-09-23T13:31:55.919583,bluebridge.catalogue@d4science.org,False,creation,aipysurus-eydouxii,8,8b033857-0de0-44f5-ba7f-18067855a209,[],a53cce50-542c-4d31-ac29-7ad0dc1cf80e,7bf889d1-7829-4c2e-ad72-222798006eee,active,ec77b4f0-db30-4bc0-9606-b4d7e18e7a77,approved,81f5e6ae-92ab-410a-9a75-f809d43ec1ee,biota,active,https://ckan-bb2.d4science.org/images/organisations/imarine.png,OGC:WFS-1.0.0-http-get-feature,iMarine.eu,dataset,2017-11-24T11:56:37.199304,81f5e6ae-92ab-410a-9a75-f809d43ec1ee,asNeeded,biota,http://data.d4science.org/ctlg/d4science.research-infrastructures.eu/aipysurus-eydouxii,"[{""name"": ""iMarine Consortium"", ""roles"": [""author""]}, {""name"": ""iMarine.eu"", ""roles"": [""distributor"", ""resourceProvider""]}]"
