58bdb6ac-ebb8-454c-8fe8-77390243b89e,0,http://node49.p.d4science.research-infrastructures.eu:9003/405/Animalia/Mollusca/Bivalvia/Arcoida/Philobryidae/SLB-103105/Ocean_View__Pacific.jpg,Splitfin flashlightfish,-180.0,active,90.0,environment,f6651af4-2262-4524-9e0e-77fcf7b028d5,http://geonetwork.d4science.org:8080/geonetwork/srv/en/xml.metadata.get?uuid=f0a2bc4e-ddcb-4867-a558-0f538a4947a9,2017-11-25T00:15:26.893337,2013-06-19T03:53:59.106+02:00,True,WMS link to resource,True,False,Anomalops katoptron,False,imarine,c415fab9-35e8-45df-8790-d087f71698ae,f0a2bc4e-ddcb-4867-a558-0f538a4947a9,"[{""type"": ""creation"", ""value"": ""2012-12-20T16:51:17.221+01:00""}]",-90.0,eng,active,2017-11-25T00:15:26.425077,"This Anomalops katoptron Species Distribution Map has been generated with the AquaMaps methodology by exploiting the technology and the computational resources provided by iMarine. In particular, this map has been produced using the HSPEC 2050 Native Range dataset, generated using AquaMaps NativeRange2050 algorithm.",ebc02b4a-f774-4e7e-afe1-d52ab93126de,"http://geoserver4.d4science.research-infrastructures.eu/geoserver/wms?service=wms&version=1.1.0&request=GetMap&layers=lanomalopskatoptron20121220165104747cet&styles=&bbox=-180,-90,180,90&width=676&height=330&srs=EPSG:4326&crs=EPSG:4326&format=application/openlayers",WMS,4,48620ad0-bfe4-4927-ad4c-e93e55a95771,180.0,"ISO 19115 Topic Category. Environmental resources, protection and conservation, for example environmental pollution, waste storage and treatment, environmental impact assessment, monitoring environmental risk, nature reserves, landscape, water quality, air quality, environmental modeling",[],"iMarine is an access point to a number of Virtual Research Environments deployed and operated in the context of the iMarine project to support the Ecosystem Approach to fisheries management and conservation of marine living resources. It empowers practitioners and policy makers from multiple scientific fields such as fisheries, biodiversity and ocean observation by ensuring that otherwise dispersed and heterogeneous data is available to all stakeholder communities through a shared virtual environment that brings together multidisciplinary data sources, supports cross-cutting scientific analysis, and assists communication.
See More: https://i-marine.d4science.org/",Dataset,iMarine,bb,dataset,[],"iMarine Consortium,iMarine.eu",http://geonetwork.d4science.org:8080/geonetwork,2013-04-12T05:06:56.526+02:00,organization,info@i-marine.eu,"{""type"": ""Polygon"", ""coordinates"": [[[-180.0, -90.0], [180.0, -90.0], [180.0, 90.0], [-180.0, 90.0], [-180.0, -90.0]]]}",http://geonetwork.d4science.org:8080/geonetwork/srv/en/metadata.show?uuid=f0a2bc4e-ddcb-4867-a558-0f538a4947a9,environment,70a489ea-a910-40b8-ae63-431084dc99a6,2017-10-13T18:48:07.704208,bluebridge.catalogue@d4science.org,False,creation,anomalops-katoptron3,6,196ff457-7bfe-4795-9c6c-4f19cf95b0b8,[],d3922cb4-1a9f-4ce8-8457-15974c8bc3f9,730e5b91-2265-431e-b033-7f310474e4f3,active,a3af93e2-450b-445c-b064-ea41c051eddd,approved,81f5e6ae-92ab-410a-9a75-f809d43ec1ee,biota,active,https://ckan-bb2.d4science.org/images/organisations/imarine.png,OGC:WFS-1.0.0-http-get-feature,iMarine.eu,dataset,2017-11-24T11:56:37.199304,81f5e6ae-92ab-410a-9a75-f809d43ec1ee,asNeeded,environment,http://data.d4science.org/ctlg/d4science.research-infrastructures.eu/anomalops-katoptron3,"[{""name"": ""iMarine Consortium"", ""roles"": [""author""]}, {""name"": ""iMarine.eu"", ""roles"": [""distributor"", ""resourceProvider""]}]"
65e899ce-3d98-4392-a753-92b7c147d9dc,0,http://node49.p.d4science.research-infrastructures.eu:9003/83/Animalia/Chordata/Actinopterygii/Clupeiformes/Engraulidae/Fis-23360/Earth.jpg,Probability Distribution,-176.75,active,38.25,biota,d7794aeb-37a3-450e-af5f-2f172e7ff3b3,http://geonetwork.d4science.org:8080/geonetwork/srv/en/xml.metadata.get?uuid=c8a79942-c936-4edb-91d3-8a69edddcbf0,2017-12-23T18:10:48.821763,2017-12-02T12:17:23.100+01:00,True,Unnamed resource,True,False,anaitides madeirensis Aquamaps Native 2050 Raster,False,d4sciencelabs,c415fab9-35e8-45df-8790-d087f71698ae,c8a79942-c936-4edb-91d3-8a69edddcbf0,"[{""type"": ""creation"", ""value"": ""2017-12-02T12:17:23.100+01:00""}, {""type"": ""publication"", ""value"": ""2017-12-02T12:17:23.100+01:00""}, {""type"": ""revision"", ""value"": ""2017-12-02T12:17:23.100+01:00""}]",-27.75,eng,active,2017-12-23T18:10:46.337623,"This anaitides madeirensis Species Distribution Map for 2050 has been generated with the AquaMaps methodology by exploiting the technology and the computational resources provided by iMarine. In particular, this map has been produced using the HSPEC Native Range dataset, generated using the AquaMaps NativeRange 2050 algorithm. Hosted on the D4Science Thredds CataSystem.out.println: http://thredds.d4science.org",ebc02b4a-f774-4e7e-afe1-d52ab93126de,http://thredds.d4science.org/thredds/fileServer/public/netcdf/AquamapsNative2050/aquamaps_native2050_anaitides_madeirensis.nc,WCS,4,Anomalops katoptron,179.75,"ISO 19115 Topic Category. Flora or fauna in natural environment, for example wildlife, vegetation, biological sciences, ecology, wilderness, sea life, wetlands, habitat, biological resources",[],"D4Science has developed a series of applications (accessible through the D4Science Labs) which can be used by any user to upload, manipulate, use and re-use products with the aim to share them with other users following the principle of the OpenScience",Dataset,D4Science Labs,bb,dataset,[],"iMarine Consortium,iMarine.eu",http://geonetwork.d4science.org:8080/geonetwork,2012-12-19T19:31:29.637+01:00,organization,info@i-marine.eu,"{""type"": ""Polygon"", ""coordinates"": [[[-176.75, -27.75], [179.75, -27.75], [179.75, 38.25], [-176.75, 38.25], [-176.75, -27.75]]]}",http://geonetwork.d4science.org:8080/geonetwork/srv/en/metadata.show?uuid=c8a79942-c936-4edb-91d3-8a69edddcbf0,biota,22dde829-fe22-4db6-875d-5ae13aed8a5a,2017-09-23T09:58:21.983662,bluebridge.catalogue@d4science.org,False,creation,anaitides-madeirensis-aquamaps-native-2050-raster,8,87daa1cb-3cf6-4154-b644-4a48328b0833,[],c25047f1-9fb7-4a13-92f8-93e201bb30d6,7bf889d1-7829-4c2e-ad72-222798006eee,active,58bdb6ac-ebb8-454c-8fe8-77390243b89e,approved,11680099-3fd0-427c-8cfc-b1fbcde0623e,environment,active,https://ckan-bb2.d4science.org/images/organisations/d4sciencelabs.png,OGC:WFS-1.0.0-http-get-feature,iMarine.eu,dataset,2017-11-24T11:56:48.241435,11680099-3fd0-427c-8cfc-b1fbcde0623e,asNeeded,biota,http://data.d4science.org/ctlg/gCubeApps/anaitides-madeirensis-aquamaps-native-2050-raster,"[{""name"": """", ""roles"": [""originator""]}]"
474758bc-0a2b-47be-b507-53d31be343a6,0,http://node49.p.d4science.research-infrastructures.eu:9003/405/Animalia/Chordata/Actinopterygii/Osmeriformes/Alepocephalidae/Fis-31228/Ocean_View__Pacific.jpg,Zabaleta anchovy,-180.0,active,90.0,environment,27ee9099-7be3-4f1e-bd67-9bf5ab551374,http://geonetwork.d4science.org:8080/geonetwork/srv/en/xml.metadata.get?uuid=78462f36-9924-42ae-8c2c-aa1eb8858683,2017-11-24T21:06:00.280387,2013-06-18T20:31:30.001+02:00,True,WMS link to resource,True,False,Anchovia clupeoides,False,imarine,172d04b9-eb96-4684-a7e3-0cf40b2b8af4,78462f36-9924-42ae-8c2c-aa1eb8858683,"[{""type"": ""creation"", ""value"": ""2012-12-17T17:13:26.440+01:00""}]",-90.0,eng,active,2017-11-24T21:05:59.768024,"This Anchovia clupeoides Species Distribution Map has been generated with the AquaMaps methodology by exploiting the technology and the computational resources provided by iMarine. In particular, this map has been produced using the HSPEC Native Range dataset, generated using AquaMaps NativeRange algorithm.",ebc02b4a-f774-4e7e-afe1-d52ab93126de,"http://geoserver.d4science-ii.research-infrastructures.eu/geoserver/wms?service=wms&version=1.1.0&request=GetMap&layers=lanchoviaclupeoides20121217171259053cet&styles=&bbox=-180,-90,180,90&width=676&height=330&srs=EPSG:4326&crs=EPSG:4326&format=application/openlayers",WMS,4,659f6eae-9424-4040-a22d-32556100179b,180.0,"ISO 19115 Topic Category. Environmental resources, protection and conservation, for example environmental pollution, waste storage and treatment, environmental impact assessment, monitoring environmental risk, nature reserves, landscape, water quality, air quality, environmental modeling",[],"iMarine is an access point to a number of Virtual Research Environments deployed and operated in the context of the iMarine project to support the Ecosystem Approach to fisheries management and conservation of marine living resources. It empowers practitioners and policy makers from multiple scientific fields such as fisheries, biodiversity and ocean observation by ensuring that otherwise dispersed and heterogeneous data is available to all stakeholder communities through a shared virtual environment that brings together multidisciplinary data sources, supports cross-cutting scientific analysis, and assists communication.
See More: https://i-marine.d4science.org/",Dataset,iMarine,bb,dataset,[],"iMarine Consortium,iMarine.eu",http://geonetwork.d4science.org:8080/geonetwork,2013-04-12T10:24:18.310+02:00,organization,info@i-marine.eu,"{""type"": ""Polygon"", ""coordinates"": [[[-180.0, -90.0], [180.0, -90.0], [180.0, 90.0], [-180.0, 90.0], [-180.0, -90.0]]]}",http://geonetwork.d4science.org:8080/geonetwork/srv/en/metadata.show?uuid=78462f36-9924-42ae-8c2c-aa1eb8858683,environment,70a489ea-a910-40b8-ae63-431084dc99a6,2017-12-16T03:28:24.116088,bluebridge.catalogue@d4science.org,False,creation,anchovia-clupeoides3,6,f6651af4-2262-4524-9e0e-77fcf7b028d5,[],59fb670b-64b4-4c64-9e74-99fde3ef6f06,730e5b91-2265-431e-b033-7f310474e4f3,active,65e899ce-3d98-4392-a753-92b7c147d9dc,approved,81f5e6ae-92ab-410a-9a75-f809d43ec1ee,biota,active,https://ckan-bb2.d4science.org/images/organisations/imarine.png,OGC:WFS-1.0.0-http-get-feature,iMarine.eu,dataset,2017-11-24T11:56:37.199304,81f5e6ae-92ab-410a-9a75-f809d43ec1ee,asNeeded,environment,http://data.d4science.org/ctlg/d4science.research-infrastructures.eu/anchovia-clupeoides3,"[{""name"": ""iMarine Consortium"", ""roles"": [""author""]}, {""name"": ""iMarine.eu"", ""roles"": [""distributor"", ""resourceProvider""]}]"
2b8970a3-2c0a-4185-a0dc-30738fcc2297,0,http://node49.p.d4science.research-infrastructures.eu:9003/80/Animalia/Chordata/Actinopterygii/Perciformes/Scombridae/Fis-29265/Ocean_View__Pacific.jpg,Probability Distribution,-179.75,active,28.25,biota,d2ac37c2-943a-4e06-8179-e36f7643039e,http://geonetwork.d4science.org:8080/geonetwork/srv/en/xml.metadata.get?uuid=8efc27d4-b231-400e-99ac-be987f3b2c58,2017-11-24T16:59:30.750384,2017-10-10T17:48:42.445+02:00,True,Unnamed resource,True,False,Aetomylaeus Vespertilio Aquamaps Native Raster,False,d4sciencelabs,8985ac2e-a513-4cd3-9bdc-7ec1c5f9ae5a,8efc27d4-b231-400e-99ac-be987f3b2c58,"[{""type"": ""creation"", ""value"": ""2017-10-10T17:48:42.445+02:00""}, {""type"": ""publication"", ""value"": ""2017-10-10T17:48:42.445+02:00""}, {""type"": ""revision"", ""value"": ""2017-10-10T17:48:42.445+02:00""}]",-32.75,eng,active,2017-11-24T16:59:30.321945,"This Aetomylaeus Vespertilio Species Distribution Map has been generated with the AquaMaps methodology by exploiting the technology and the computational resources provided by iMarine. In particular, this map has been produced using the HSPEC Native Range dataset, generated using the AquaMaps NativeRange algorithm. Hosted on the D4Science Thredds CataSystem.out.println: http://thredds.d4science.org",ebc02b4a-f774-4e7e-afe1-d52ab93126de,http://thredds.d4science.org/thredds/fileServer/public/netcdf/AquamapsNative/aquamaps_native_aetomylaeus_vespertilio.nc,WCS,4,Anchovia clupeoides,180.25,"ISO 19115 Topic Category. Flora or fauna in natural environment, for example wildlife, vegetation, biological sciences, ecology, wilderness, sea life, wetlands, habitat, biological resources",[],"D4Science has developed a series of applications (accessible through the D4Science Labs) which can be used by any user to upload, manipulate, use and re-use products with the aim to share them with other users following the principle of the OpenScience",Dataset,D4Science Labs,bb,dataset,[],"iMarine Consortium,iMarine.eu",http://geonetwork.d4science.org:8080/geonetwork,2012-12-18T04:34:56.684+01:00,organization,info@i-marine.eu,"{""type"": ""Polygon"", ""coordinates"": [[[-179.75, -32.75], [180.25, -32.75], [180.25, 28.25], [-179.75, 28.25], [-179.75, -32.75]]]}",http://geonetwork.d4science.org:8080/geonetwork/srv/en/metadata.show?uuid=8efc27d4-b231-400e-99ac-be987f3b2c58,biota,22dde829-fe22-4db6-875d-5ae13aed8a5a,2017-09-23T04:07:52.119381,bluebridge.catalogue@d4science.org,False,creation,aetomylaeus-vespertilio-aquamaps-native-raster,8,d7794aeb-37a3-450e-af5f-2f172e7ff3b3,[],5feb8ee3-33c1-436d-9eef-dc646a39d457,7bf889d1-7829-4c2e-ad72-222798006eee,active,474758bc-0a2b-47be-b507-53d31be343a6,approved,11680099-3fd0-427c-8cfc-b1fbcde0623e,environment,active,https://ckan-bb2.d4science.org/images/organisations/d4sciencelabs.png,OGC:WFS-1.0.0-http-get-feature,iMarine.eu,dataset,2017-11-24T11:56:48.241435,11680099-3fd0-427c-8cfc-b1fbcde0623e,asNeeded,biota,http://data.d4science.org/ctlg/gCubeApps/aetomylaeus-vespertilio-aquamaps-native-raster,"[{""name"": """", ""roles"": [""originator""]}]"
be21fe5e-18e6-4ff3-a9d7-6e22035b1392,0,http://node49.p.d4science.research-infrastructures.eu:9003/407/Animalia/Chordata/Actinopterygii/Clupeiformes/Engraulidae/Fis-22983/Ocean_View__Pacific.jpg,SpeciesDistribution,-180.0,active,90.0,environment,ab2bc890-b94a-4839-b397-895660bb0013,http://geonetwork.d4science.org:8080/geonetwork/srv/en/xml.metadata.get?uuid=ad5e5c2f-362a-4a2c-aae4-6dd6699e976e,2017-11-25T20:27:44.653690,2013-06-18T21:43:23.672+02:00,True,WMS link to resource,True,False,Amanses scopas,False,imarine,172d04b9-eb96-4684-a7e3-0cf40b2b8af4,ad5e5c2f-362a-4a2c-aae4-6dd6699e976e,"[{""type"": ""creation"", ""value"": ""2012-12-18T01:43:36.376+01:00""}]",-90.0,eng,active,2017-11-25T20:27:43.534109,"This Amanses scopas Species Distribution Map has been generated with the AquaMaps methodology by exploiting the technology and the computational resources provided by iMarine. In particular, this map has been produced using the HSPEC Native Range dataset, generated using AquaMaps NativeRange algorithm.",ebc02b4a-f774-4e7e-afe1-d52ab93126de,"http://geoserver4.d4science.research-infrastructures.eu/geoserver/wms?service=wms&version=1.1.0&request=GetMap&layers=lamansesscopas20121218014309996cet&styles=&bbox=-180,-90,180,90&width=676&height=330&srs=EPSG:4326&crs=EPSG:4326&format=application/openlayers",WMS,4,Aetomylaeus Vespertilio,180.0,"ISO 19115 Topic Category. Environmental resources, protection and conservation, for example environmental pollution, waste storage and treatment, environmental impact assessment, monitoring environmental risk, nature reserves, landscape, water quality, air quality, environmental modeling",[],"iMarine is an access point to a number of Virtual Research Environments deployed and operated in the context of the iMarine project to support the Ecosystem Approach to fisheries management and conservation of marine living resources. It empowers practitioners and policy makers from multiple scientific fields such as fisheries, biodiversity and ocean observation by ensuring that otherwise dispersed and heterogeneous data is available to all stakeholder communities through a shared virtual environment that brings together multidisciplinary data sources, supports cross-cutting scientific analysis, and assists communication.
See More: https://i-marine.d4science.org/",Dataset,iMarine,bb,dataset,[],"iMarine Consortium,iMarine.eu",http://geonetwork.d4science.org:8080/geonetwork,2013-04-13T04:04:03.423+02:00,organization,info@i-marine.eu,"{""type"": ""Polygon"", ""coordinates"": [[[-180.0, -90.0], [180.0, -90.0], [180.0, 90.0], [-180.0, 90.0], [-180.0, -90.0]]]}",http://geonetwork.d4science.org:8080/geonetwork/srv/en/metadata.show?uuid=ad5e5c2f-362a-4a2c-aae4-6dd6699e976e,environment,70a489ea-a910-40b8-ae63-431084dc99a6,2017-10-14T03:01:35.723789,bluebridge.catalogue@d4science.org,False,creation,amanses-scopas,6,27ee9099-7be3-4f1e-bd67-9bf5ab551374,[],2684eb89-0f0b-4f48-ae29-26023be9c8ef,730e5b91-2265-431e-b033-7f310474e4f3,active,2b8970a3-2c0a-4185-a0dc-30738fcc2297,approved,81f5e6ae-92ab-410a-9a75-f809d43ec1ee,biota,active,https://ckan-bb2.d4science.org/images/organisations/imarine.png,OGC:WFS-1.0.0-http-get-feature,iMarine.eu,dataset,2017-11-24T11:56:37.199304,81f5e6ae-92ab-410a-9a75-f809d43ec1ee,asNeeded,environment,http://data.d4science.org/ctlg/d4science.research-infrastructures.eu/amanses-scopas,"[{""name"": ""iMarine Consortium"", ""roles"": [""author""]}, {""name"": ""iMarine.eu"", ""roles"": [""distributor"", ""resourceProvider""]}]"
bb4ef856-44a5-4e2c-8ef7-85179ba8aca3,0,http://node49.p.d4science.research-infrastructures.eu:9003/83/Animalia/Chordata/Actinopterygii/Perciformes/Pomacentridae/Fis-33250/Ocean_View__Pacific.jpg,Probability Distribution,-97.75,active,64.25,environment,d30d6cc8-5571-4743-b03c-c36825bc2b9e,http://geonetwork.d4science.org:8080/geonetwork/srv/en/xml.metadata.get?uuid=e44d77a3-85e7-46c4-a06d-084d7c4386bf,2017-11-25T19:47:07.468259,2017-10-10T17:49:06.163+02:00,True,Unnamed resource,True,False,Ahlia Egmontis Aquamaps Native Raster,False,d4sciencelabs,ac7fa9cd-5d4b-4689-abf1-5efb1868cec8,e44d77a3-85e7-46c4-a06d-084d7c4386bf,"[{""type"": ""creation"", ""value"": ""2017-10-10T17:49:06.163+02:00""}, {""type"": ""publication"", ""value"": ""2017-10-10T17:49:06.163+02:00""}, {""type"": ""revision"", ""value"": ""2017-10-10T17:49:06.163+02:00""}]",-55.25,eng,active,2017-11-25T19:47:06.299040,"This Ahlia Egmontis Species Distribution Map has been generated with the AquaMaps methodology by exploiting the technology and the computational resources provided by iMarine. In particular, this map has been produced using the HSPEC Native Range dataset, generated using the AquaMaps NativeRange algorithm. Hosted on the D4Science Thredds CataSystem.out.println: http://thredds.d4science.org",ebc02b4a-f774-4e7e-afe1-d52ab93126de,http://thredds.d4science.org/thredds/fileServer/public/netcdf/AquamapsNative/aquamaps_native_ahlia_egmontis.nc,WCS,4,Amanses scopas,-29.25,"ISO 19115 Topic Category. Environmental resources, protection and conservation, for example environmental pollution, waste storage and treatment, environmental impact assessment, monitoring environmental risk, nature reserves, landscape, water quality, air quality, environmental modeling",[],"D4Science has developed a series of applications (accessible through the D4Science Labs) which can be used by any user to upload, manipulate, use and re-use products with the aim to share them with other users following the principle of the OpenScience",Dataset,D4Science Labs,bb,dataset,[],"iMarine Consortium,iMarine.eu",http://geonetwork.d4science.org:8080/geonetwork,2012-12-21T08:12:37.253+01:00,organization,info@i-marine.eu,"{""type"": ""Polygon"", ""coordinates"": [[[-97.75, -55.25], [-29.25, -55.25], [-29.25, 64.25], [-97.75, 64.25], [-97.75, -55.25]]]}",http://geonetwork.d4science.org:8080/geonetwork/srv/en/metadata.show?uuid=e44d77a3-85e7-46c4-a06d-084d7c4386bf,environment,22dde829-fe22-4db6-875d-5ae13aed8a5a,2017-09-21T10:12:27.978887,bluebridge.catalogue@d4science.org,False,creation,ahlia-egmontis-aquamaps-native-raster,8,d2ac37c2-943a-4e06-8179-e36f7643039e,[],5dfcdf27-08d3-406e-ae85-c62df2c8a0e1,730e5b91-2265-431e-b033-7f310474e4f3,active,be21fe5e-18e6-4ff3-a9d7-6e22035b1392,approved,11680099-3fd0-427c-8cfc-b1fbcde0623e,environment,active,https://ckan-bb2.d4science.org/images/organisations/d4sciencelabs.png,OGC:WFS-1.0.0-http-get-feature,iMarine.eu,dataset,2017-11-24T11:56:48.241435,11680099-3fd0-427c-8cfc-b1fbcde0623e,asNeeded,environment,http://data.d4science.org/ctlg/gCubeApps/ahlia-egmontis-aquamaps-native-raster,"[{""name"": """", ""roles"": [""originator""]}]"
3ba3904b-cd09-434b-bce4-ed2e8bcfaa98,0,http://node49.p.d4science.research-infrastructures.eu:9003/83/Animalia/Chordata/Actinopterygii/Clupeiformes/Clupeidae/Fis-23333/Earth.jpg,Probability Distribution,-178.25,active,41.25,environment,e288ccc3-9926-4849-8324-5809b02c3fee,http://geonetwork.d4science.org:8080/geonetwork/srv/en/xml.metadata.get?uuid=61f538d9-8d09-4d90-9eec-e282e4616fa9,2017-12-23T08:30:42.744150,2017-12-02T12:17:23.100+01:00,True,Unnamed resource,True,False,acropoma hanedai Aquamaps Native 2050 Raster,False,d4sciencelabs,bf9c1fc6-610c-4683-9906-ab38eeb55835,61f538d9-8d09-4d90-9eec-e282e4616fa9,"[{""type"": ""creation"", ""value"": ""2017-12-02T12:17:23.100+01:00""}, {""type"": ""publication"", ""value"": ""2017-12-02T12:17:23.100+01:00""}, {""type"": ""revision"", ""value"": ""2017-12-02T12:17:23.100+01:00""}]",15.25,eng,active,2017-12-23T08:30:40.071373,"This acropoma hanedai Species Distribution Map for 2050 has been generated with the AquaMaps methodology by exploiting the technology and the computational resources provided by iMarine. In particular, this map has been produced using the HSPEC Native Range dataset, generated using the AquaMaps NativeRange 2050 algorithm. Hosted on the D4Science Thredds CataSystem.out.println: http://thredds.d4science.org",ebc02b4a-f774-4e7e-afe1-d52ab93126de,http://thredds.d4science.org/thredds/fileServer/public/netcdf/AquamapsNative2050/aquamaps_native2050_acropoma_hanedai.nc,WCS,4,Ahlia Egmontis,157.75,"ISO 19115 Topic Category. Environmental resources, protection and conservation, for example environmental pollution, waste storage and treatment, environmental impact assessment, monitoring environmental risk, nature reserves, landscape, water quality, air quality, environmental modeling",[],"D4Science has developed a series of applications (accessible through the D4Science Labs) which can be used by any user to upload, manipulate, use and re-use products with the aim to share them with other users following the principle of the OpenScience",Dataset,D4Science Labs,bb,dataset,[],"iMarine Consortium,iMarine.eu",http://geonetwork.d4science.org:8080/geonetwork,2012-12-20T08:59:50.539+01:00,organization,info@i-marine.eu,"{""type"": ""Polygon"", ""coordinates"": [[[-178.25, 15.25], [157.75, 15.25], [157.75, 41.25], [-178.25, 41.25], [-178.25, 15.25]]]}",http://geonetwork.d4science.org:8080/geonetwork/srv/en/metadata.show?uuid=61f538d9-8d09-4d90-9eec-e282e4616fa9,environment,22dde829-fe22-4db6-875d-5ae13aed8a5a,2017-10-14T01:03:07.618678,bluebridge.catalogue@d4science.org,False,creation,acropoma-hanedai-aquamaps-native-2050-raster,8,ab2bc890-b94a-4839-b397-895660bb0013,[],3dbeb8af-5bc0-42e5-9afa-01525c0aae1c,730e5b91-2265-431e-b033-7f310474e4f3,active,bb4ef856-44a5-4e2c-8ef7-85179ba8aca3,approved,11680099-3fd0-427c-8cfc-b1fbcde0623e,environment,active,https://ckan-bb2.d4science.org/images/organisations/d4sciencelabs.png,OGC:WFS-1.0.0-http-get-feature,iMarine.eu,dataset,2017-11-24T11:56:48.241435,11680099-3fd0-427c-8cfc-b1fbcde0623e,asNeeded,environment,http://data.d4science.org/ctlg/gCubeApps/acropoma-hanedai-aquamaps-native-2050-raster,"[{""name"": """", ""roles"": [""originator""]}]"
