has_identifier_has_id_value,unknown,unknown,has_name,unknown,unknown,unknown,unknown,has_identifier_has_id_value,unknown,has_identifier_is_source_of_has_startDate,unknown,unknown,unknown,unknown,has_name,unknown,unknown,unknown,unknown,unknown,unknown,unknown,unknown,is_source_of_has_startDate,has_description,is_destination_of_has_source_has_identifier_has_id_value,unknown,unknown,unknown,has_name,unknown,unknown,unknown,unknown,is_source_of_has_classification_has_term,unknown,is_destination_of_has_source_is_source_of_has_destination_has_name,is_source_of_has_classification_has_term,unknown,is_destination_of_has_source_is_source_of_has_destination_has_name,unknown,unknown,unknown,unknown,unknown,unknown,unknown,unknown,unknown,is_destination_of_has_source_is_source_of_has_destination_has_URI,unknown,unknown,has_identifier_has_id_value,unknown,has_identifier_has_id_value,unknown,unknown,unknown,unknown,unknown,unknown,unknown,unknown,unknown,is_destination_of_has_source_is_source_of_has_destination_has_name,is_source_of_has_classification_has_term,unknown,unknown,unknown,unknown,unknown,unknown
223e51f5-3921-459d-ba31-badd1a01d2da,0,http://node49.p.d4science.research-infrastructures.eu:9003/424/null/null/Actinopterygii/Cypriniformes/Cyprinidae/Fis-25279/Earth.jpg,Probability Distribution,-176.25,active,37.25,environment,55626dc5-753e-434f-9aef-c1927a0bf03f,http://geonetwork.d4science.org:8080/geonetwork/srv/en/xml.metadata.get?uuid=4d9d21dd-272a-4d3e-a3ec-50fa1491425a,2017-12-23T02:21:24.101923,2017-12-02T12:17:23.100+01:00,True,True,False,anadara nodifera Aquamaps Native 2050 Raster,False,11680099-3fd0-427c-8cfc-b1fbcde0623e,c415fab9-35e8-45df-8790-d087f71698ae,4d9d21dd-272a-4d3e-a3ec-50fa1491425a,"[{""type"": ""creation"", ""value"": ""2017-12-02T12:17:23.100+01:00""}, {""type"": ""publication"", ""value"": ""2017-12-02T12:17:23.100+01:00""}, {""type"": ""revision"", ""value"": ""2017-12-02T12:17:23.100+01:00""}]",-34.25,eng,d4sciencelabs,2017-12-23T02:21:20.132401,"This anadara nodifera Species Distribution Map for 2050 has been generated with the AquaMaps methodology by exploiting the technology and the computational resources provided by iMarine. In particular, this map has been produced using the HSPEC Native Range dataset, generated using the AquaMaps NativeRange 2050 algorithm. Hosted on the D4Science Thredds CataSystem.out.println: http://thredds.d4science.org",ebc02b4a-f774-4e7e-afe1-d52ab93126de,https://goo.gl/UJj9PG,WCS,4,52b1b9fa-bc4b-4df7-856c-4fd3bd895ce6,179.75,"ISO 19115 Topic Category. Environmental resources, protection and conservation, for example environmental pollution, waste storage and treatment, environmental impact assessment, monitoring environmental risk, nature reserves, landscape, water quality, air quality, environmental modeling",[],"D4Science has developed a series of applications (accessible through the D4Science Labs) which can be used by any user to upload, manipulate, use and re-use products with the aim to share them with other users following the principle of the OpenScience",Dataset,D4Science Labs,bb,dataset,[],"iMarine Consortium,iMarine.eu",http://geonetwork.d4science.org:8080/geonetwork,2013-06-07T06:00:03.422+02:00,organization,info@i-marine.eu,"{""type"": ""Polygon"", ""coordinates"": [[[-176.25, -34.25], [179.75, -34.25], [179.75, 37.25], [-176.25, 37.25], [-176.25, -34.25]]]}",http://geonetwork.d4science.org:8080/geonetwork/srv/en/metadata.show?uuid=4d9d21dd-272a-4d3e-a3ec-50fa1491425a,environment,22dde829-fe22-4db6-875d-5ae13aed8a5a,2017-05-04T12:09:38.464388,bluebridge.catalogue@d4science.org,False,creation,anadara-nodifera-aquamaps-native-2050-raster,8,b824a480-7689-47ba-888d-350169abd949,[],25cac0d1-b662-4c3e-9ffd-02397546e9d4,730e5b91-2265-431e-b033-7f310474e4f3,active,approved,environment,active,https://ckan-bb2.d4science.org/images/organisations/d4sciencelabs.png,OGC:WFS-1.0.0-http-get-feature,iMarine Consortium,dataset,2017-11-24T11:56:48.241435,11680099-3fd0-427c-8cfc-b1fbcde0623e,asNeeded,environment,http://data.d4science.org/ctlg/gCubeApps/anadara-nodifera-aquamaps-native-2050-raster,"[{""name"": """", ""roles"": [""originator""]}]"
49515a26-ab10-4938-88b2-ba83e5085776,1,http://node49.p.d4science.research-infrastructures.eu:9003/83/Animalia/Chordata/Actinopterygii/Scorpaeniformes/Aploactinidae/Fis-57849/Ocean_View__Pacific.jpg,Probability Distribution,-180.0,active,90.0,biota,bf02fad3-f770-4fb0-946e-56fc34afe9af,http://geonetwork.d4science.org:8080/geonetwork/srv/en/xml.metadata.get?uuid=6f457900-f5af-4cf6-b108-6fa5dc399af8,2017-11-24T21:26:18.791791,2013-06-26T15:54:24.109+02:00,True,True,False,Alburnus alburnus,False,81f5e6ae-92ab-410a-9a75-f809d43ec1ee,c415fab9-35e8-45df-8790-d087f71698ae,6f457900-f5af-4cf6-b108-6fa5dc399af8,"[{""type"": ""creation"", ""value"": ""2013-06-07T06:00:03.422+02:00""}]",-90.0,eng,imarine,2017-11-24T21:26:18.390698,"This Alburnus alburnus Species Distribution Map has been generated with the AquaMaps methodology by exploiting the technology and the computational resources provided by iMarine. In particular, this map has been produced using the Freshwater suitable dataset, generated using AquaMaps SuitableRange algorithm.",ebc02b4a-f774-4e7e-afe1-d52ab93126de,"http://thredds.d4science.org/thredds/wcs/public/netcdf/AquamapsNative2050/aquamaps_native2050_anadara_nodifera.nc?service=wcs&version=1.0.0&request=GetCoverage&coverage=probability&CRS=EPSG:4326&bbox=-34.25,-176.25,37.25,179.75&width=640&height=480&format=geotiff",WCS,4,AquaMaps,180.0,"ISO 19115 Topic Category. Flora or fauna in natural environment, for example wildlife, vegetation, biological sciences, ecology, wilderness, sea life, wetlands, habitat, biological resources",[],"iMarine is an access point to a number of Virtual Research Environments deployed and operated in the context of the iMarine project to support the Ecosystem Approach to fisheries management and conservation of marine living resources. It empowers practitioners and policy makers from multiple scientific fields such as fisheries, biodiversity and ocean observation by ensuring that otherwise dispersed and heterogeneous data is available to all stakeholder communities through a shared virtual environment that brings together multidisciplinary data sources, supports cross-cutting scientific analysis, and assists communication.
See More: https://i-marine.d4science.org/",Dataset,iMarine,bb,dataset,[],"iMarine Consortium,iMarine.eu",http://geonetwork.d4science.org:8080/geonetwork,2012-12-21T16:38:39.006+01:00,organization,info@i-marine.eu,"{""type"": ""Polygon"", ""coordinates"": [[[-180.0, -90.0], [180.0, -90.0], [180.0, 90.0], [-180.0, 90.0], [-180.0, -90.0]]]}",http://geonetwork.d4science.org:8080/geonetwork/srv/en/metadata.show?uuid=6f457900-f5af-4cf6-b108-6fa5dc399af8,biota,70a489ea-a910-40b8-ae63-431084dc99a6,2017-12-15T22:49:56.100281,bluebridge.catalogue@d4science.org,False,creation,alburnus-alburnus,4,55626dc5-753e-434f-9aef-c1927a0bf03f,[],04fa7d2e-707d-4b6d-a952-25161675bf73,7bf889d1-7829-4c2e-ad72-222798006eee,active,approved,biota,active,https://ckan-bb2.d4science.org/images/organisations/imarine.png,OGC:WFS-1.0.0-http-get-feature,iMarine Consortium,dataset,2017-11-24T11:56:37.199304,81f5e6ae-92ab-410a-9a75-f809d43ec1ee,asNeeded,biota,http://data.d4science.org/ctlg/d4science.research-infrastructures.eu/alburnus-alburnus,"[{""name"": ""iMarine Consortium"", ""roles"": [""author""]}, {""name"": ""iMarine.eu"", ""roles"": [""distributor"", ""resourceProvider""]}]"
dd032d9b-9c12-4da6-a826-f765bf49baee,1,http://node49.p.d4science.research-infrastructures.eu:9003/405/Animalia/Chordata/Actinopterygii/Clupeiformes/Engraulidae/Fis-22987/Ocean_View__Pacific.jpg,Wasp-spine velvetfish,145.25,active,-14.75,environment,e8d822ae-10c7-4d84-b493-47a63669c991,http://geonetwork.d4science.org:8080/geonetwork/srv/en/xml.metadata.get?uuid=28d7017f-4db3-4611-b023-7bda1d9d2a68,2017-12-24T23:13:21.836313,2017-12-02T02:24:15.539+01:00,True,True,False,acanthistius ocellatus Aquamaps Native 2050 Raster,False,11680099-3fd0-427c-8cfc-b1fbcde0623e,c415fab9-35e8-45df-8790-d087f71698ae,28d7017f-4db3-4611-b023-7bda1d9d2a68,"[{""type"": ""creation"", ""value"": ""2017-12-02T02:24:15.539+01:00""}, {""type"": ""publication"", ""value"": ""2017-12-02T02:24:15.539+01:00""}, {""type"": ""revision"", ""value"": ""2017-12-02T02:24:15.539+01:00""}]",-37.75,eng,d4sciencelabs,2017-12-24T23:13:19.178552,"This acanthistius ocellatus Species Distribution Map for 2050 has been generated with the AquaMaps methodology by exploiting the technology and the computational resources provided by iMarine. In particular, this map has been produced using the HSPEC Native Range dataset, generated using the AquaMaps NativeRange 2050 algorithm. Hosted on the D4Science Thredds CataSystem.out.println: http://thredds.d4science.org",ebc02b4a-f774-4e7e-afe1-d52ab93126de,"http://geoserver2.d4science.research-infrastructures.eu/geoserver/wcs?service=wcs&version=1.0.0&request=GetCoverage&coverage=lalburnusalburnus20130607055907284cest&CRS=EPSG:4326&bbox=-180,-90,180,90&width=676&height=330&format=geotiff",WCS,4,40ee80da-2d99-476c-9d0f-861a37a74692,170.75,"ISO 19115 Topic Category. Environmental resources, protection and conservation, for example environmental pollution, waste storage and treatment, environmental impact assessment, monitoring environmental risk, nature reserves, landscape, water quality, air quality, environmental modeling",[],"D4Science has developed a series of applications (accessible through the D4Science Labs) which can be used by any user to upload, manipulate, use and re-use products with the aim to share them with other users following the principle of the OpenScience",Dataset,D4Science Labs,bb,dataset,[],"iMarine Consortium,iMarine.eu",http://geonetwork.d4science.org:8080/geonetwork,2013-04-11T10:49:47.585+02:00,organization,info@i-marine.eu,"{""type"": ""Polygon"", ""coordinates"": [[[145.25, -37.75], [170.75, -37.75], [170.75, -14.75], [145.25, -14.75], [145.25, -37.75]]]}",http://geonetwork.d4science.org:8080/geonetwork/srv/en/metadata.show?uuid=28d7017f-4db3-4611-b023-7bda1d9d2a68,environment,22dde829-fe22-4db6-875d-5ae13aed8a5a,2017-09-21T21:16:22.334809,bluebridge.catalogue@d4science.org,False,creation,acanthistius-ocellatus-aquamaps-native-2050-raster,8,bf02fad3-f770-4fb0-946e-56fc34afe9af,[],7b93c30a-c00c-4539-a306-84d11ff90a41,730e5b91-2265-431e-b033-7f310474e4f3,active,approved,environment,active,https://ckan-bb2.d4science.org/images/organisations/d4sciencelabs.png,OGC:WFS-1.0.0-http-get-feature,iMarine Consortium,dataset,2017-11-24T11:56:48.241435,11680099-3fd0-427c-8cfc-b1fbcde0623e,asNeeded,environment,http://data.d4science.org/ctlg/gCubeApps/acanthistius-ocellatus-aquamaps-native-2050-raster,"[{""name"": """", ""roles"": [""originator""]}]"
d11a0251-81cb-4834-be8a-0c137d466256,1,http://node49.p.d4science.research-infrastructures.eu:9003/405/Animalia/Chordata/Actinopterygii/Clupeiformes/Clupeidae/Fis-23335/Ocean_View__Pacific.jpg,SpeciesDistribution,-180.0,active,90.0,biota,ae20be63-0ce2-4204-84a3-6fe4d805dac1,http://geonetwork.d4science.org:8080/geonetwork/srv/en/xml.metadata.get?uuid=d5ef63f8-81af-494a-9141-92d9126d0726,2017-11-26T01:22:23.900362,2013-06-19T06:09:01.013+02:00,True,True,False,Acanthosphex leurynnis,False,81f5e6ae-92ab-410a-9a75-f809d43ec1ee,c415fab9-35e8-45df-8790-d087f71698ae,d5ef63f8-81af-494a-9141-92d9126d0726,"[{""type"": ""creation"", ""value"": ""2012-12-21T16:38:39.006+01:00""}]",-90.0,eng,imarine,2017-11-26T01:22:22.907813,"This Acanthosphex leurynnis Species Distribution Map has been generated with the AquaMaps methodology by exploiting the technology and the computational resources provided by iMarine. In particular, this map has been produced using the HSPEC 2050 Native Range dataset, generated using AquaMaps NativeRange2050 algorithm.",ebc02b4a-f774-4e7e-afe1-d52ab93126de,"http://thredds.d4science.org/thredds/wcs/public/netcdf/AquamapsNative2050/aquamaps_native2050_acanthistius_ocellatus.nc?service=wcs&version=1.0.0&request=GetCoverage&coverage=probability&CRS=EPSG:4326&bbox=-37.75,145.25,-14.75,170.75&width=640&height=480&format=geotiff",WMS,4,Acanthosphex leurynnis,180.0,"ISO 19115 Topic Category. Flora or fauna in natural environment, for example wildlife, vegetation, biological sciences, ecology, wilderness, sea life, wetlands, habitat, biological resources",[],"iMarine is an access point to a number of Virtual Research Environments deployed and operated in the context of the iMarine project to support the Ecosystem Approach to fisheries management and conservation of marine living resources. It empowers practitioners and policy makers from multiple scientific fields such as fisheries, biodiversity and ocean observation by ensuring that otherwise dispersed and heterogeneous data is available to all stakeholder communities through a shared virtual environment that brings together multidisciplinary data sources, supports cross-cutting scientific analysis, and assists communication.
See More: https://i-marine.d4science.org/",Dataset,iMarine,bb,dataset,[],"iMarine Consortium,iMarine.eu",http://geonetwork.d4science.org:8080/geonetwork,2013-04-11T20:40:58.294+02:00,organization,info@i-marine.eu,"{""type"": ""Polygon"", ""coordinates"": [[[-180.0, -90.0], [180.0, -90.0], [180.0, 90.0], [-180.0, 90.0], [-180.0, -90.0]]]}",http://geonetwork.d4science.org:8080/geonetwork/srv/en/metadata.show?uuid=d5ef63f8-81af-494a-9141-92d9126d0726,biota,70a489ea-a910-40b8-ae63-431084dc99a6,2017-12-15T20:48:04.761458,bluebridge.catalogue@d4science.org,False,creation,acanthosphex-leurynnis,6,e8d822ae-10c7-4d84-b493-47a63669c991,[],cc79cf80-1bd8-449f-8932-dd42f39d772c,7bf889d1-7829-4c2e-ad72-222798006eee,active,approved,biota,active,https://ckan-bb2.d4science.org/images/organisations/imarine.png,OGC:WFS-1.0.0-http-get-feature,iMarine Consortium,dataset,2017-11-24T11:56:37.199304,81f5e6ae-92ab-410a-9a75-f809d43ec1ee,asNeeded,biota,http://data.d4science.org/ctlg/d4science.research-infrastructures.eu/acanthosphex-leurynnis,"[{""name"": ""iMarine Consortium"", ""roles"": [""author""]}, {""name"": ""iMarine.eu"", ""roles"": [""distributor"", ""resourceProvider""]}]"
46c3667a-7d65-481a-b9cb-1eef44cd7515,1,http://node49.p.d4science.research-infrastructures.eu:9003/405/Animalia/Chordata/Actinopterygii/Pleuronectiformes/Achiridae/Fis-28883/Ocean_View__Pacific.jpg,SpeciesDistribution,-180.0,active,90.0,biota,cc239ec3-1a60-42be-8fdb-bb93568127d4,http://geonetwork.d4science.org:8080/geonetwork/srv/en/xml.metadata.get?uuid=7915e1f3-836f-45a2-b1d0-f7734b3758ef,2017-11-24T21:01:30.740599,2013-06-19T11:03:35.708+02:00,True,True,False,Anchoa parva,False,81f5e6ae-92ab-410a-9a75-f809d43ec1ee,172d04b9-eb96-4684-a7e3-0cf40b2b8af4,7915e1f3-836f-45a2-b1d0-f7734b3758ef,"[{""type"": ""creation"", ""value"": ""2013-04-11T10:49:47.585+02:00""}]",-90.0,eng,imarine,2017-11-24T21:01:30.271212,"This Anchoa parva Species Distribution Map has been generated with the AquaMaps methodology by exploiting the technology and the computational resources provided by iMarine. In particular, this map has been produced using the Default Suitable maps_SuitableRange dataset, generated using AquaMaps SuitableRange algorithm.",ebc02b4a-f774-4e7e-afe1-d52ab93126de,"http://geoserver.d4science-ii.research-infrastructures.eu/geoserver/wms?service=wms&version=1.1.0&request=GetMap&layers=lacanthosphexleurynnis20121221163809560cet&styles=&bbox=-180,-90,180,90&width=676&height=330&srs=EPSG:4326&crs=EPSG:4326&format=application/openlayers",WMS,4,Anchoa parva,180.0,"ISO 19115 Topic Category. Flora or fauna in natural environment, for example wildlife, vegetation, biological sciences, ecology, wilderness, sea life, wetlands, habitat, biological resources",[],"iMarine is an access point to a number of Virtual Research Environments deployed and operated in the context of the iMarine project to support the Ecosystem Approach to fisheries management and conservation of marine living resources. It empowers practitioners and policy makers from multiple scientific fields such as fisheries, biodiversity and ocean observation by ensuring that otherwise dispersed and heterogeneous data is available to all stakeholder communities through a shared virtual environment that brings together multidisciplinary data sources, supports cross-cutting scientific analysis, and assists communication.
See More: https://i-marine.d4science.org/",Dataset,iMarine,bb,dataset,[],"iMarine Consortium,iMarine.eu",http://geonetwork.d4science.org:8080/geonetwork,2013-04-10T17:07:06.048+02:00,organization,info@i-marine.eu,"{""type"": ""Polygon"", ""coordinates"": [[[-180.0, -90.0], [180.0, -90.0], [180.0, 90.0], [-180.0, 90.0], [-180.0, -90.0]]]}",http://geonetwork.d4science.org:8080/geonetwork/srv/en/metadata.show?uuid=7915e1f3-836f-45a2-b1d0-f7734b3758ef,biota,70a489ea-a910-40b8-ae63-431084dc99a6,2017-09-21T22:24:33.692245,bluebridge.catalogue@d4science.org,False,creation,anchoa-parva2,6,ae20be63-0ce2-4204-84a3-6fe4d805dac1,[],d2513230-2c43-4f64-a723-21f547f543ab,7bf889d1-7829-4c2e-ad72-222798006eee,active,approved,biota,active,https://ckan-bb2.d4science.org/images/organisations/imarine.png,OGC:WFS-1.0.0-http-get-feature,iMarine Consortium,dataset,2017-11-24T11:56:37.199304,81f5e6ae-92ab-410a-9a75-f809d43ec1ee,asNeeded,biota,http://data.d4science.org/ctlg/d4science.research-infrastructures.eu/anchoa-parva2,"[{""name"": ""iMarine Consortium"", ""roles"": [""author""]}, {""name"": ""iMarine.eu"", ""roles"": [""distributor"", ""resourceProvider""]}]"
a077ca6b-957d-4435-ae3f-0d6c583dec29,1,http://node49.p.d4science.research-infrastructures.eu:9003/80/Animalia/Chordata/Actinopterygii/Perciformes/Stichaeidae/Fis-24399/Ocean_View__Pacific.jpg,SpeciesDistribution,-180.0,active,90.0,biota,040004a9-606c-4052-9627-4d8e18a904f2,http://geonetwork.d4science.org:8080/geonetwork/srv/en/xml.metadata.get?uuid=a0c76e9f-5428-441e-9b98-826dd43ea865,2017-11-25T13:57:07.666428,2013-06-19T12:00:27.176+02:00,True,True,False,Alosa sapidissima,False,81f5e6ae-92ab-410a-9a75-f809d43ec1ee,172d04b9-eb96-4684-a7e3-0cf40b2b8af4,a0c76e9f-5428-441e-9b98-826dd43ea865,"[{""type"": ""creation"", ""value"": ""2013-04-11T20:40:58.294+02:00""}]",-90.0,eng,imarine,2017-11-25T13:57:06.807649,"This Alosa sapidissima Species Distribution Map has been generated with the AquaMaps methodology by exploiting the technology and the computational resources provided by iMarine. In particular, this map has been produced using the Default Suitable maps_SuitableRange dataset, generated using AquaMaps SuitableRange algorithm.",ebc02b4a-f774-4e7e-afe1-d52ab93126de,"http://geoserver2.d4science.research-infrastructures.eu/geoserver/wms?service=wms&version=1.1.0&request=GetMap&layers=lanchoaparva20130411104928769cest&styles=&bbox=-180,-90,180,90&width=676&height=330&srs=EPSG:4326&crs=EPSG:4326&format=application/openlayers",WMS,4,Alosa sapidissima,180.0,"ISO 19115 Topic Category. Flora or fauna in natural environment, for example wildlife, vegetation, biological sciences, ecology, wilderness, sea life, wetlands, habitat, biological resources",[],"iMarine is an access point to a number of Virtual Research Environments deployed and operated in the context of the iMarine project to support the Ecosystem Approach to fisheries management and conservation of marine living resources. It empowers practitioners and policy makers from multiple scientific fields such as fisheries, biodiversity and ocean observation by ensuring that otherwise dispersed and heterogeneous data is available to all stakeholder communities through a shared virtual environment that brings together multidisciplinary data sources, supports cross-cutting scientific analysis, and assists communication.
See More: https://i-marine.d4science.org/",Dataset,iMarine,bb,dataset,[],"iMarine Consortium,iMarine.eu",http://geonetwork.d4science.org:8080/geonetwork,2012-12-07T16:21:35.349+01:00,organization,info@i-marine.eu,"{""type"": ""Polygon"", ""coordinates"": [[[-180.0, -90.0], [180.0, -90.0], [180.0, 90.0], [-180.0, 90.0], [-180.0, -90.0]]]}",http://geonetwork.d4science.org:8080/geonetwork/srv/en/metadata.show?uuid=a0c76e9f-5428-441e-9b98-826dd43ea865,biota,70a489ea-a910-40b8-ae63-431084dc99a6,2017-09-22T12:34:12.801476,bluebridge.catalogue@d4science.org,False,creation,alosa-sapidissima2,6,cc239ec3-1a60-42be-8fdb-bb93568127d4,[],d335e698-f3dd-45f9-9804-3b4905c788ba,7bf889d1-7829-4c2e-ad72-222798006eee,active,approved,biota,active,https://ckan-bb2.d4science.org/images/organisations/imarine.png,WWW:LINK-1.0-http--link,iMarine Consortium,dataset,2017-11-24T11:56:37.199304,81f5e6ae-92ab-410a-9a75-f809d43ec1ee,asNeeded,biota,http://data.d4science.org/ctlg/d4science.research-infrastructures.eu/alosa-sapidissima2,"[{""name"": ""iMarine Consortium"", ""roles"": [""author""]}, {""name"": ""iMarine.eu"", ""roles"": [""distributor"", ""resourceProvider""]}]"
af525505-b6d1-4822-b793-6a98edcc8628,1,http://node49.p.d4science.research-infrastructures.eu:9003/80/Animalia/Chordata/Actinopterygii/Perciformes/Cepolidae/Fis-62878/Earth.jpg,SpeciesDistribution,-180.0,active,90.0,biota,758dbc73-43e1-4866-ad32-8147e017d0be,http://geonetwork.d4science.org:8080/geonetwork/srv/en/xml.metadata.get?uuid=fdb96852-1fa4-4158-8345-16d0a18ad4fe,2017-11-25T17:02:16.522114,2013-06-19T09:15:08.961+02:00,True,True,False,Achirus klunzingeri,False,81f5e6ae-92ab-410a-9a75-f809d43ec1ee,172d04b9-eb96-4684-a7e3-0cf40b2b8af4,fdb96852-1fa4-4158-8345-16d0a18ad4fe,"[{""type"": ""creation"", ""value"": ""2013-04-10T17:07:06.048+02:00""}]",-90.0,eng,imarine,2017-11-25T17:02:15.765017,"This Achirus klunzingeri Species Distribution Map has been generated with the AquaMaps methodology by exploiting the technology and the computational resources provided by iMarine. In particular, this map has been produced using the Default Suitable maps_SuitableRange dataset, generated using AquaMaps SuitableRange algorithm.",ebc02b4a-f774-4e7e-afe1-d52ab93126de,"http://geoserver2.d4science.research-infrastructures.eu/geoserver/wms?service=wms&version=1.1.0&request=GetMap&layers=lalosasapidissima20130411204042699cest&styles=&bbox=-180,-90,180,90&width=676&height=330&srs=EPSG:4326&crs=EPSG:4326&format=application/openlayers",WMS,4,Achirus klunzingeri,180.0,"ISO 19115 Topic Category. Flora or fauna in natural environment, for example wildlife, vegetation, biological sciences, ecology, wilderness, sea life, wetlands, habitat, biological resources",[],"iMarine is an access point to a number of Virtual Research Environments deployed and operated in the context of the iMarine project to support the Ecosystem Approach to fisheries management and conservation of marine living resources. It empowers practitioners and policy makers from multiple scientific fields such as fisheries, biodiversity and ocean observation by ensuring that otherwise dispersed and heterogeneous data is available to all stakeholder communities through a shared virtual environment that brings together multidisciplinary data sources, supports cross-cutting scientific analysis, and assists communication.
See More: https://i-marine.d4science.org/",Dataset,iMarine,bb,dataset,[],"iMarine Consortium,iMarine.eu",http://geonetwork.d4science.org:8080/geonetwork,2012-12-17T16:19:51.212+01:00,organization,info@i-marine.eu,"{""type"": ""Polygon"", ""coordinates"": [[[-180.0, -90.0], [180.0, -90.0], [180.0, 90.0], [-180.0, 90.0], [-180.0, -90.0]]]}",http://geonetwork.d4science.org:8080/geonetwork/srv/en/metadata.show?uuid=fdb96852-1fa4-4158-8345-16d0a18ad4fe,biota,70a489ea-a910-40b8-ae63-431084dc99a6,2017-09-22T12:37:36.806019,bluebridge.catalogue@d4science.org,False,creation,achirus-klunzingeri1,6,040004a9-606c-4052-9627-4d8e18a904f2,[],0709ddf3-1d01-4167-b23c-a0f7eb2ade6b,7bf889d1-7829-4c2e-ad72-222798006eee,active,approved,biota,active,https://ckan-bb2.d4science.org/images/organisations/imarine.png,OGC:WFS-1.0.0-http-get-feature,iMarine Consortium,dataset,2017-11-24T11:56:37.199304,81f5e6ae-92ab-410a-9a75-f809d43ec1ee,asNeeded,biota,http://data.d4science.org/ctlg/d4science.research-infrastructures.eu/achirus-klunzingeri1,"[{""name"": ""iMarine Consortium"", ""roles"": [""author""]}, {""name"": ""iMarine.eu"", ""roles"": [""distributor"", ""resourceProvider""]}]"
