has_identifier_has_id_value,unknown,unknown,has_name,unknown,unknown,unknown,unknown,has_identifier_has_id_value,unknown,has_identifier_is_source_of_has_startDate,unknown,unknown,unknown,unknown,unknown,unknown,has_name,unknown,unknown,unknown,unknown,unknown,unknown,unknown,unknown,is_source_of_has_startDate,has_description,is_destination_of_has_source_has_identifier_has_id_value,unknown,unknown,unknown,has_name,unknown,unknown,unknown,unknown,is_source_of_has_classification_has_term,unknown,is_destination_of_has_source_is_source_of_has_destination_has_name,is_source_of_has_classification_has_term,unknown,is_destination_of_has_source_is_source_of_has_destination_has_name,unknown,unknown,unknown,unknown,unknown,unknown,unknown,unknown,unknown,is_destination_of_has_source_is_source_of_has_destination_has_URI,unknown,unknown,has_identifier_has_id_value,unknown,has_identifier_has_id_value,unknown,unknown,unknown,unknown,has_identifier_has_id_value,unknown,unknown,unknown,unknown,unknown,unknown,is_destination_of_has_source_is_source_of_has_destination_has_name,is_source_of_has_classification_has_term,unknown,unknown,unknown,unknown,unknown,unknown
3753bb66-10df-4187-9445-efa35f2dd603,0,http://node49.p.d4science.research-infrastructures.eu:9003/83/Animalia/Chordata/Actinopterygii/Perciformes/Acanthuridae/Fis-29584/Ocean_View__Pacific.jpg,Yellowfin surgeonfish,-180.0,active,90.0,biota,b1485d3f-7bce-4caa-9991-b87f3c9abb21,http://geonetwork.d4science.org:8080/geonetwork/srv/en/xml.metadata.get?uuid=6d8229b4-4fc4-4172-b86d-1aea29ef0257,2017-11-24T18:41:03.853353,2013-06-19T04:33:51.885+02:00,True,WMS link to resource,originator,True,False,Acanthurus xanthopterus,False,imarine,bf9c1fc6-610c-4683-9906-ab38eeb55835,6d8229b4-4fc4-4172-b86d-1aea29ef0257,"[{""type"": ""creation"", ""value"": ""2012-12-20T23:37:16.429+01:00""}]",-90.0,eng,active,2017-11-24T18:41:03.145892,"This Acanthurus xanthopterus Species Distribution Map has been generated with the AquaMaps methodology by exploiting the technology and the computational resources provided by iMarine. In particular, this map has been produced using the HSPEC 2050 Native Range dataset, generated using AquaMaps NativeRange2050 algorithm.",ebc02b4a-f774-4e7e-afe1-d52ab93126de,"http://geoserver.d4science-ii.research-infrastructures.eu/geoserver/wms?service=wms&version=1.1.0&request=GetMap&layers=lacanthurusxanthopterus20121220233659481cet&styles=&bbox=-180,-90,180,90&width=676&height=330&srs=EPSG:4326&crs=EPSG:4326&format=application/openlayers",WMS,4,Acanthurus xanthopterus,180.0,"ISO 19115 Topic Category. Flora or fauna in natural environment, for example wildlife, vegetation, biological sciences, ecology, wilderness, sea life, wetlands, habitat, biological resources",[],"iMarine is an access point to a number of Virtual Research Environments deployed and operated in the context of the iMarine project to support the Ecosystem Approach to fisheries management and conservation of marine living resources. It empowers practitioners and policy makers from multiple scientific fields such as fisheries, biodiversity and ocean observation by ensuring that otherwise dispersed and heterogeneous data is available to all stakeholder communities through a shared virtual environment that brings together multidisciplinary data sources, supports cross-cutting scientific analysis, and assists communication.
See More: https://i-marine.d4science.org/",Dataset,iMarine,bb,dataset,[],"iMarine Consortium,iMarine.eu",http://geonetwork.d4science.org:8080/geonetwork,2012-12-20T23:37:16.429+01:00,organization,info@i-marine.eu,"{""type"": ""Polygon"", ""coordinates"": [[[-180.0, -90.0], [180.0, -90.0], [180.0, 90.0], [-180.0, 90.0], [-180.0, -90.0]]]}",http://geonetwork.d4science.org:8080/geonetwork/srv/en/metadata.show?uuid=6d8229b4-4fc4-4172-b86d-1aea29ef0257,biota,70a489ea-a910-40b8-ae63-431084dc99a6,2017-09-21T19:07:45.566017,bluebridge.catalogue@d4science.org,False,creation,acanthurus-xanthopterus,6,b1485d3f-7bce-4caa-9991-b87f3c9abb21,[],d7b42b24-3fa4-4463-9c20-cbb17c1de1e4,7bf889d1-7829-4c2e-ad72-222798006eee,active,3753bb66-10df-4187-9445-efa35f2dd603,approved,81f5e6ae-92ab-410a-9a75-f809d43ec1ee,biota,active,https://ckan-bb2.d4science.org/images/organisations/imarine.png,OGC:WFS-1.0.0-http-get-feature,iMarine.eu,dataset,2017-11-24T11:56:37.199304,81f5e6ae-92ab-410a-9a75-f809d43ec1ee,asNeeded,biota,http://data.d4science.org/ctlg/d4science.research-infrastructures.eu/acanthurus-xanthopterus,"[{""name"": ""iMarine Consortium"", ""roles"": [""author""]}, {""name"": ""iMarine.eu"", ""roles"": [""distributor"", ""resourceProvider""]}]"
752e4944-ad29-4504-841c-fd19f7714d11,0,http://node49.p.d4science.research-infrastructures.eu:9003/405/Animalia/Chordata/Actinopterygii/Perciformes/Blenniidae/Fis-26680/Ocean_View__Pacific.jpg,NetCDF,-97.75,active,65.25,environment,8ee102ef-ce27-47a4-b3da-8d9f80653142,http://geonetwork.d4science.org:8080/geonetwork/srv/en/xml.metadata.get?uuid=4622a373-ddee-489f-94aa-b49739497f06,2017-11-25T05:37:17.595450,2017-10-10T17:47:20.876+02:00,True,Unnamed resource,originator,True,False,Acetes Americanus Aquamaps Native Raster,False,d4sciencelabs,172d04b9-eb96-4684-a7e3-0cf40b2b8af4,4622a373-ddee-489f-94aa-b49739497f06,"[{""type"": ""creation"", ""value"": ""2017-10-10T17:47:20.876+02:00""}, {""type"": ""publication"", ""value"": ""2017-10-10T17:47:20.876+02:00""}, {""type"": ""revision"", ""value"": ""2017-10-10T17:47:20.876+02:00""}]",-54.75,eng,active,2017-11-25T05:37:16.773118,"This Acetes Americanus Species Distribution Map has been generated with the AquaMaps methodology by exploiting the technology and the computational resources provided by iMarine. In particular, this map has been produced using the HSPEC Native Range dataset, generated using the AquaMaps NativeRange algorithm. Hosted on the D4Science Thredds CataSystem.out.println: http://thredds.d4science.org",ebc02b4a-f774-4e7e-afe1-d52ab93126de,http://thredds.d4science.org/thredds/fileServer/public/netcdf/AquamapsNative/aquamaps_native_acetes_americanus.nc,WCS,4,9f19f63f-dfc0-43ec-b436-4563a45fc1d8,-34.25,"ISO 19115 Topic Category. Environmental resources, protection and conservation, for example environmental pollution, waste storage and treatment, environmental impact assessment, monitoring environmental risk, nature reserves, landscape, water quality, air quality, environmental modeling",[],"D4Science has developed a series of applications (accessible through the D4Science Labs) which can be used by any user to upload, manipulate, use and re-use products with the aim to share them with other users following the principle of the OpenScience",Dataset,D4Science Labs,bb,dataset,[],"iMarine Consortium,iMarine.eu",http://geonetwork.d4science.org:8080/geonetwork,2013-04-10T15:44:26.813+02:00,organization,info@i-marine.eu,"{""type"": ""Polygon"", ""coordinates"": [[[-97.75, -54.75], [-34.25, -54.75], [-34.25, 65.25], [-97.75, 65.25], [-97.75, -54.75]]]}",http://geonetwork.d4science.org:8080/geonetwork/srv/en/metadata.show?uuid=4622a373-ddee-489f-94aa-b49739497f06,environment,22dde829-fe22-4db6-875d-5ae13aed8a5a,2017-10-13T19:50:31.774123,bluebridge.catalogue@d4science.org,False,creation,acetes-americanus-aquamaps-native-raster,8,8ee102ef-ce27-47a4-b3da-8d9f80653142,[],b58a66c0-915b-4f12-ac26-507d3dfc1b03,730e5b91-2265-431e-b033-7f310474e4f3,active,752e4944-ad29-4504-841c-fd19f7714d11,approved,11680099-3fd0-427c-8cfc-b1fbcde0623e,environment,active,https://ckan-bb2.d4science.org/images/organisations/d4sciencelabs.png,OGC:WFS-1.0.0-http-get-feature,iMarine.eu,dataset,2017-11-24T11:56:48.241435,11680099-3fd0-427c-8cfc-b1fbcde0623e,asNeeded,environment,http://data.d4science.org/ctlg/gCubeApps/acetes-americanus-aquamaps-native-raster,"[{""name"": """", ""roles"": [""originator""]}]"
a0b8883c-017e-41bf-973c-bd7cc7bb3cbb,0,http://node49.p.d4science.research-infrastructures.eu:9003/80/Animalia/Arthropoda/Malacostraca/Stomatopoda/Squillidae/SLB-101712/Ocean_View__Pacific.jpg,Suckerlip blenny,-180.0,active,90.0,biota,db281afc-dc09-4b38-977a-cb404bd1d702,http://geonetwork.d4science.org:8080/geonetwork/srv/en/xml.metadata.get?uuid=19d82573-878a-42c7-9c34-0816c65a8753,2017-11-25T14:00:54.899948,2013-06-19T09:04:09.071+02:00,True,WMS link to resource,originator,True,False,Andamia reyi,False,imarine,c415fab9-35e8-45df-8790-d087f71698ae,19d82573-878a-42c7-9c34-0816c65a8753,"[{""type"": ""creation"", ""value"": ""2013-04-10T15:44:26.813+02:00""}]",-90.0,eng,active,2017-11-25T14:00:54.053656,"This Andamia reyi Species Distribution Map has been generated with the AquaMaps methodology by exploiting the technology and the computational resources provided by iMarine. In particular, this map has been produced using the Default Suitable maps_SuitableRange dataset, generated using AquaMaps SuitableRange algorithm.",ebc02b4a-f774-4e7e-afe1-d52ab93126de,"http://geoserver.d4science-ii.research-infrastructures.eu/geoserver/wms?service=wms&version=1.1.0&request=GetMap&layers=landamiareyi20130410154409811cest&styles=&bbox=-180,-90,180,90&width=676&height=330&srs=EPSG:4326&crs=EPSG:4326&format=application/openlayers",WMS,4,Andamia reyi,180.0,"ISO 19115 Topic Category. Flora or fauna in natural environment, for example wildlife, vegetation, biological sciences, ecology, wilderness, sea life, wetlands, habitat, biological resources",[],"iMarine is an access point to a number of Virtual Research Environments deployed and operated in the context of the iMarine project to support the Ecosystem Approach to fisheries management and conservation of marine living resources. It empowers practitioners and policy makers from multiple scientific fields such as fisheries, biodiversity and ocean observation by ensuring that otherwise dispersed and heterogeneous data is available to all stakeholder communities through a shared virtual environment that brings together multidisciplinary data sources, supports cross-cutting scientific analysis, and assists communication.
See More: https://i-marine.d4science.org/",Dataset,iMarine,bb,dataset,[],"iMarine Consortium,iMarine.eu",http://geonetwork.d4science.org:8080/geonetwork,2012-12-18T20:21:01.560+01:00,organization,info@i-marine.eu,"{""type"": ""Polygon"", ""coordinates"": [[[-180.0, -90.0], [180.0, -90.0], [180.0, 90.0], [-180.0, 90.0], [-180.0, -90.0]]]}",http://geonetwork.d4science.org:8080/geonetwork/srv/en/metadata.show?uuid=19d82573-878a-42c7-9c34-0816c65a8753,biota,70a489ea-a910-40b8-ae63-431084dc99a6,2017-09-22T23:05:39.352521,bluebridge.catalogue@d4science.org,False,creation,andamia-reyi1,6,db281afc-dc09-4b38-977a-cb404bd1d702,[],cd3930a9-4762-4896-9818-85cf94f54d35,7bf889d1-7829-4c2e-ad72-222798006eee,active,a0b8883c-017e-41bf-973c-bd7cc7bb3cbb,approved,81f5e6ae-92ab-410a-9a75-f809d43ec1ee,biota,active,https://ckan-bb2.d4science.org/images/organisations/imarine.png,OGC:WFS-1.0.0-http-get-feature,iMarine.eu,dataset,2017-11-24T11:56:37.199304,81f5e6ae-92ab-410a-9a75-f809d43ec1ee,asNeeded,biota,http://data.d4science.org/ctlg/d4science.research-infrastructures.eu/andamia-reyi1,"[{""name"": ""iMarine Consortium"", ""roles"": [""author""]}, {""name"": ""iMarine.eu"", ""roles"": [""distributor"", ""resourceProvider""]}]"
6de58fff-051d-4ad8-a512-5c97ac52aacf,0,http://node49.p.d4science.research-infrastructures.eu:9003/405/Animalia/Arthropoda/Malacostraca/Decapoda/Alpheidae/SLB-130765/Ocean_View__Pacific.jpg,SpeciesDistribution,-180.0,active,90.0,biota,20c9fc3a-f567-4dec-9d95-f31dcf447ed1,http://geonetwork.d4science.org:8080/geonetwork/srv/en/xml.metadata.get?uuid=f01f8b68-d9df-4f58-a7b5-7261070745d0,2017-11-29T18:14:33.124931,2013-06-18T23:44:45.120+02:00,True,WMS link to resource,originator,True,False,Anchisquilla fasciata,False,imarine,172d04b9-eb96-4684-a7e3-0cf40b2b8af4,f01f8b68-d9df-4f58-a7b5-7261070745d0,"[{""type"": ""creation"", ""value"": ""2012-12-18T20:21:01.560+01:00""}]",-90.0,eng,active,2017-11-29T18:14:31.374561,"This Anchisquilla fasciata Species Distribution Map has been generated with the AquaMaps methodology by exploiting the technology and the computational resources provided by iMarine. In particular, this map has been produced using the HSPEC Native Range dataset, generated using AquaMaps NativeRange algorithm.",ebc02b4a-f774-4e7e-afe1-d52ab93126de,"http://geoserver2.d4science.research-infrastructures.eu/geoserver/wms?service=wms&version=1.1.0&request=GetMap&layers=lanchisquillafasciata20121218202029020cet&styles=&bbox=-180,-90,180,90&width=676&height=330&srs=EPSG:4326&crs=EPSG:4326&format=application/openlayers",WMS,4,7614324,180.0,"ISO 19115 Topic Category. Flora or fauna in natural environment, for example wildlife, vegetation, biological sciences, ecology, wilderness, sea life, wetlands, habitat, biological resources",[],"iMarine is an access point to a number of Virtual Research Environments deployed and operated in the context of the iMarine project to support the Ecosystem Approach to fisheries management and conservation of marine living resources. It empowers practitioners and policy makers from multiple scientific fields such as fisheries, biodiversity and ocean observation by ensuring that otherwise dispersed and heterogeneous data is available to all stakeholder communities through a shared virtual environment that brings together multidisciplinary data sources, supports cross-cutting scientific analysis, and assists communication.
See More: https://i-marine.d4science.org/",Dataset,iMarine,bb,dataset,[],"iMarine Consortium,iMarine.eu",http://geonetwork.d4science.org:8080/geonetwork,2013-04-11T06:21:23.396+02:00,organization,info@i-marine.eu,"{""type"": ""Polygon"", ""coordinates"": [[[-180.0, -90.0], [180.0, -90.0], [180.0, 90.0], [-180.0, 90.0], [-180.0, -90.0]]]}",http://geonetwork.d4science.org:8080/geonetwork/srv/en/metadata.show?uuid=f01f8b68-d9df-4f58-a7b5-7261070745d0,biota,70a489ea-a910-40b8-ae63-431084dc99a6,2017-09-22T00:49:53.543173,bluebridge.catalogue@d4science.org,False,creation,anchisquilla-fasciata,7,20c9fc3a-f567-4dec-9d95-f31dcf447ed1,[],5547537a-f8b1-499d-b028-e963e66357e2,7bf889d1-7829-4c2e-ad72-222798006eee,active,6de58fff-051d-4ad8-a512-5c97ac52aacf,approved,81f5e6ae-92ab-410a-9a75-f809d43ec1ee,biota,active,https://ckan-bb2.d4science.org/images/organisations/imarine.png,OGC:WFS-1.0.0-http-get-feature,iMarine.eu,dataset,2017-11-24T11:56:37.199304,81f5e6ae-92ab-410a-9a75-f809d43ec1ee,asNeeded,biota,http://data.d4science.org/ctlg/d4science.research-infrastructures.eu/anchisquilla-fasciata,"[{""name"": ""iMarine Consortium"", ""roles"": [""author""]}, {""name"": ""iMarine.eu"", ""roles"": [""distributor"", ""resourceProvider""]}]"
5375437b-b3f5-4343-9be0-3db77342d972,0,http://node49.p.d4science.research-infrastructures.eu:9003/405/Animalia/Chordata/Actinopterygii/Perciformes/Chaenopsidae/Fis-113560/Ocean_View__Pacific.jpg,Probability Distribution,-90.25,active,29.75,environment,103e3eeb-a712-446d-badb-b9cbe920b02f,http://geonetwork.d4science.org:8080/geonetwork/srv/en/xml.metadata.get?uuid=d740d7fa-cb7e-4eb6-917b-98c5e6d9e80b,2017-12-02T16:56:19.377961,2017-11-30T19:13:57.064+01:00,True,Unnamed resource,originator,True,False,alionematichthys minyomma Aquamaps Native 2050 Raster,False,d4sciencelabs,172d04b9-eb96-4684-a7e3-0cf40b2b8af4,d740d7fa-cb7e-4eb6-917b-98c5e6d9e80b,"[{""type"": ""creation"", ""value"": ""2017-11-30T19:13:57.064+01:00""}, {""type"": ""publication"", ""value"": ""2017-11-30T19:13:57.064+01:00""}, {""type"": ""revision"", ""value"": ""2017-11-30T19:13:57.064+01:00""}]",-5.75,eng,active,2017-12-02T16:56:16.905209,"This alionematichthys minyomma Species Distribution Map for 2050 has been generated with the AquaMaps methodology by exploiting the technology and the computational resources provided by iMarine. In particular, this map has been produced using the HSPEC Native Range dataset, generated using the AquaMaps NativeRange 2050 algorithm. Hosted on the D4Science Thredds CataSystem.out.println: http://thredds.d4science.org",ebc02b4a-f774-4e7e-afe1-d52ab93126de,http://thredds.d4science.org/thredds/fileServer/public/netcdf/AquamapsNative2050/aquamaps_native2050_alionematichthys_minyomma.nc,WCS,4,14202c4b-e3ac-4d97-abea-8492921b7358,157.75,"ISO 19115 Topic Category. Environmental resources, protection and conservation, for example environmental pollution, waste storage and treatment, environmental impact assessment, monitoring environmental risk, nature reserves, landscape, water quality, air quality, environmental modeling",[],"D4Science has developed a series of applications (accessible through the D4Science Labs) which can be used by any user to upload, manipulate, use and re-use products with the aim to share them with other users following the principle of the OpenScience",Dataset,D4Science Labs,bb,dataset,[],"iMarine Consortium,iMarine.eu",http://geonetwork.d4science.org:8080/geonetwork,2013-04-10T05:21:06.137+02:00,organization,info@i-marine.eu,"{""type"": ""Polygon"", ""coordinates"": [[[-90.25, -5.75], [157.75, -5.75], [157.75, 29.75], [-90.25, 29.75], [-90.25, -5.75]]]}",http://geonetwork.d4science.org:8080/geonetwork/srv/en/metadata.show?uuid=d740d7fa-cb7e-4eb6-917b-98c5e6d9e80b,environment,22dde829-fe22-4db6-875d-5ae13aed8a5a,2017-12-01T14:34:57.697109,bluebridge.catalogue@d4science.org,False,creation,alionematichthys-minyomma-aquamaps-native-2050-raster,8,103e3eeb-a712-446d-badb-b9cbe920b02f,[],6258568b-8beb-44c3-a245-1b180f0ab5ac,730e5b91-2265-431e-b033-7f310474e4f3,active,5375437b-b3f5-4343-9be0-3db77342d972,approved,11680099-3fd0-427c-8cfc-b1fbcde0623e,environment,active,https://ckan-bb2.d4science.org/images/organisations/d4sciencelabs.png,OGC:WFS-1.0.0-http-get-feature,iMarine.eu,dataset,2017-11-24T11:56:48.241435,11680099-3fd0-427c-8cfc-b1fbcde0623e,asNeeded,environment,http://data.d4science.org/ctlg/gCubeApps/alionematichthys-minyomma-aquamaps-native-2050-raster,"[{""name"": """", ""roles"": [""originator""]}]"
637e80dc-0afd-46af-812c-3027b58f9478,0,http://node49.p.d4science.research-infrastructures.eu:9003/80/Animalia/Chordata/Actinopterygii/Clupeiformes/Engraulidae/Fis-29272/Earth.jpg,SpeciesDistribution,-180.0,active,90.0,biota,bd5c2778-0c50-49dd-af20-e7386200b948,http://geonetwork.d4science.org:8080/geonetwork/srv/en/xml.metadata.get?uuid=7b8aa001-bf94-4211-a33d-17fe5fce6530,2017-11-29T15:40:25.651080,2013-06-19T10:36:17.111+02:00,True,WMS link to resource,originator,True,False,Alpheus compressus,False,imarine,172d04b9-eb96-4684-a7e3-0cf40b2b8af4,7b8aa001-bf94-4211-a33d-17fe5fce6530,"[{""type"": ""creation"", ""value"": ""2013-04-11T06:21:23.396+02:00""}]",-90.0,eng,active,2017-11-29T15:40:24.049108,"This Alpheus compressus Species Distribution Map has been generated with the AquaMaps methodology by exploiting the technology and the computational resources provided by iMarine. In particular, this map has been produced using the Default Suitable maps_SuitableRange dataset, generated using AquaMaps SuitableRange algorithm.",ebc02b4a-f774-4e7e-afe1-d52ab93126de,"http://geoserver2.d4science.research-infrastructures.eu/geoserver/wms?service=wms&version=1.1.0&request=GetMap&layers=lalpheuscompressus20130411062107141cest&styles=&bbox=-180,-90,180,90&width=676&height=330&srs=EPSG:4326&crs=EPSG:4326&format=application/openlayers",WMS,4,7614324,180.0,"ISO 19115 Topic Category. Flora or fauna in natural environment, for example wildlife, vegetation, biological sciences, ecology, wilderness, sea life, wetlands, habitat, biological resources",[],"iMarine is an access point to a number of Virtual Research Environments deployed and operated in the context of the iMarine project to support the Ecosystem Approach to fisheries management and conservation of marine living resources. It empowers practitioners and policy makers from multiple scientific fields such as fisheries, biodiversity and ocean observation by ensuring that otherwise dispersed and heterogeneous data is available to all stakeholder communities through a shared virtual environment that brings together multidisciplinary data sources, supports cross-cutting scientific analysis, and assists communication.
See More: https://i-marine.d4science.org/",Dataset,iMarine,bb,dataset,[],"iMarine Consortium,iMarine.eu",http://geonetwork.d4science.org:8080/geonetwork,2012-12-10T13:12:00.564+01:00,organization,info@i-marine.eu,"{""type"": ""Polygon"", ""coordinates"": [[[-180.0, -90.0], [180.0, -90.0], [180.0, 90.0], [-180.0, 90.0], [-180.0, -90.0]]]}",http://geonetwork.d4science.org:8080/geonetwork/srv/en/metadata.show?uuid=7b8aa001-bf94-4211-a33d-17fe5fce6530,biota,70a489ea-a910-40b8-ae63-431084dc99a6,2017-09-22T05:45:28.323378,bluebridge.catalogue@d4science.org,False,creation,alpheus-compressus1,7,bd5c2778-0c50-49dd-af20-e7386200b948,[],22fadd7a-34a4-477a-8000-b004e9e420f3,7bf889d1-7829-4c2e-ad72-222798006eee,active,637e80dc-0afd-46af-812c-3027b58f9478,approved,81f5e6ae-92ab-410a-9a75-f809d43ec1ee,biota,active,https://ckan-bb2.d4science.org/images/organisations/imarine.png,OGC:WFS-1.0.0-http-get-feature,iMarine.eu,dataset,2017-11-24T11:56:37.199304,81f5e6ae-92ab-410a-9a75-f809d43ec1ee,asNeeded,biota,http://data.d4science.org/ctlg/d4science.research-infrastructures.eu/alpheus-compressus1,"[{""name"": ""iMarine Consortium"", ""roles"": [""author""]}, {""name"": ""iMarine.eu"", ""roles"": [""distributor"", ""resourceProvider""]}]"
949b2c63-fb8a-4421-8a57-b8d4f7e98b5e,0,http://node49.p.d4science.research-infrastructures.eu:9003/407/Animalia/Chordata/Actinopterygii/Perciformes/Chaenopsidae/Fis-113588/Ocean_View__Pacific.jpg,SpeciesDistribution,-180.0,active,90.0,biota,75275998-80e9-4bec-ad2e-3d007c51ea73,http://geonetwork.d4science.org:8080/geonetwork/srv/en/xml.metadata.get?uuid=f2aa258a-7590-446e-bbc6-1edb7e44ed8e,2017-11-25T11:34:49.582271,2013-06-19T08:15:49.855+02:00,True,WMS link to resource,originator,True,False,Acanthemblemaria crockeri,False,imarine,bf9c1fc6-610c-4683-9906-ab38eeb55835,f2aa258a-7590-446e-bbc6-1edb7e44ed8e,"[{""type"": ""creation"", ""value"": ""2013-04-10T05:21:06.137+02:00""}]",-90.0,eng,active,2017-11-25T11:34:48.796644,"This Acanthemblemaria crockeri Species Distribution Map has been generated with the AquaMaps methodology by exploiting the technology and the computational resources provided by iMarine. In particular, this map has been produced using the Default Suitable maps_SuitableRange dataset, generated using AquaMaps SuitableRange algorithm.",ebc02b4a-f774-4e7e-afe1-d52ab93126de,"http://geoserver4.d4science.research-infrastructures.eu/geoserver/wms?service=wms&version=1.1.0&request=GetMap&layers=lacanthemblemariacrockeri20130410052042886cest&styles=&bbox=-180,-90,180,90&width=676&height=330&srs=EPSG:4326&crs=EPSG:4326&format=application/openlayers",WMS,4,Acanthemblemaria crockeri,180.0,"ISO 19115 Topic Category. Flora or fauna in natural environment, for example wildlife, vegetation, biological sciences, ecology, wilderness, sea life, wetlands, habitat, biological resources",[],"iMarine is an access point to a number of Virtual Research Environments deployed and operated in the context of the iMarine project to support the Ecosystem Approach to fisheries management and conservation of marine living resources. It empowers practitioners and policy makers from multiple scientific fields such as fisheries, biodiversity and ocean observation by ensuring that otherwise dispersed and heterogeneous data is available to all stakeholder communities through a shared virtual environment that brings together multidisciplinary data sources, supports cross-cutting scientific analysis, and assists communication.
See More: https://i-marine.d4science.org/",Dataset,iMarine,bb,dataset,[],"iMarine Consortium,iMarine.eu",http://geonetwork.d4science.org:8080/geonetwork,2013-04-12T19:39:17.596+02:00,organization,info@i-marine.eu,"{""type"": ""Polygon"", ""coordinates"": [[[-180.0, -90.0], [180.0, -90.0], [180.0, 90.0], [-180.0, 90.0], [-180.0, -90.0]]]}",http://geonetwork.d4science.org:8080/geonetwork/srv/en/metadata.show?uuid=f2aa258a-7590-446e-bbc6-1edb7e44ed8e,biota,70a489ea-a910-40b8-ae63-431084dc99a6,2017-09-22T16:53:29.634609,bluebridge.catalogue@d4science.org,False,creation,acanthemblemaria-crockeri2,6,75275998-80e9-4bec-ad2e-3d007c51ea73,[],794b6e6c-452b-4f62-81dc-4d126792b441,7bf889d1-7829-4c2e-ad72-222798006eee,active,949b2c63-fb8a-4421-8a57-b8d4f7e98b5e,approved,81f5e6ae-92ab-410a-9a75-f809d43ec1ee,biota,active,https://ckan-bb2.d4science.org/images/organisations/imarine.png,OGC:WFS-1.0.0-http-get-feature,iMarine.eu,dataset,2017-11-24T11:56:37.199304,81f5e6ae-92ab-410a-9a75-f809d43ec1ee,asNeeded,biota,http://data.d4science.org/ctlg/d4science.research-infrastructures.eu/acanthemblemaria-crockeri2,"[{""name"": ""iMarine Consortium"", ""roles"": [""author""]}, {""name"": ""iMarine.eu"", ""roles"": [""distributor"", ""resourceProvider""]}]"
