55a02f00-7fba-45bf-9481-87a30aefb313,0,,Raster,-90.25,active,30.25,environment,5f6cd5e8-0573-495a-b8f6-1f867b031e4e,http://geonetwork.d4science.org:8080/geonetwork/srv/en/xml.metadata.get?uuid=413a6063-a2ef-463d-a50a-d14d5ce5c337,2017-12-16T09:38:32.341811,2017-12-04T00:08:19.660+01:00,True,Unnamed resource,,True,False,anchoa colonensis Aquamaps Native 2050 Raster,False,d4sciencelabs,f0aed558-85bf-4a2d-9058-96c06d305431,413a6063-a2ef-463d-a50a-d14d5ce5c337,"[{""type"": ""creation"", ""value"": ""2017-12-04T00:08:19.660+01:00""}, {""type"": ""publication"", ""value"": ""2017-12-04T00:08:19.660+01:00""}, {""type"": ""revision"", ""value"": ""2017-12-04T00:08:19.660+01:00""}]",5.75,eng,active,2017-12-16T09:38:28.690431,"This anchoa colonensis Species Distribution Map for 2050 has been generated with the AquaMaps methodology by exploiting the technology and the computational resources provided by iMarine. In particular, this map has been produced using the HSPEC Native Range dataset, generated using the AquaMaps NativeRange 2050 algorithm. Hosted on the D4Science Thredds CataSystem.out.println: http://thredds.d4science.org",ebc02b4a-f774-4e7e-afe1-d52ab93126de,http://thredds.d4science.org/thredds/fileServer/public/netcdf/AquamapsNative2050/aquamaps_native2050_anchoa_colonensis.nc,WCS,4,AquaMaps,-50.75,"ISO 19115 Topic Category. Environmental resources, protection and conservation, for example environmental pollution, waste storage and treatment, environmental impact assessment, monitoring environmental risk, nature reserves, landscape, water quality, air quality, environmental modeling",[],"D4Science has developed a series of applications (accessible through the D4Science Labs) which can be used by any user to upload, manipulate, use and re-use products with the aim to share them with other users following the principle of the OpenScience",Dataset,D4Science Labs,bb,,[],,http://geonetwork.d4science.org:8080/geonetwork,,organization,,"{""type"": ""Polygon"", ""coordinates"": [[[-90.25, 5.75], [-50.75, 5.75], [-50.75, 30.25], [-90.25, 30.25], [-90.25, 5.75]]]}",http://geonetwork.d4science.org:8080/geonetwork/srv/en/metadata.show?uuid=413a6063-a2ef-463d-a50a-d14d5ce5c337,environment,22dde829-fe22-4db6-875d-5ae13aed8a5a,2017-12-15T16:50:21.129475,bluebridge.catalogue@d4science.org,False,,anchoa-colonensis-aquamaps-native-2050-raster,8,5f6cd5e8-0573-495a-b8f6-1f867b031e4e,[],29f895f3-dccd-4a51-b671-4c19a83b44e4,730e5b91-2265-431e-b033-7f310474e4f3,active,55a02f00-7fba-45bf-9481-87a30aefb313,approved,11680099-3fd0-427c-8cfc-b1fbcde0623e,environment,active,https://ckan-bb2.d4science.org/images/organisations/d4sciencelabs.png,OGC:WMS-1.3.0-http-get-map,iMarine Consortium,dataset,2017-11-24T11:56:48.241435,11680099-3fd0-427c-8cfc-b1fbcde0623e,asNeeded,environment,http://data.d4science.org/ctlg/gCubeApps/anchoa-colonensis-aquamaps-native-2050-raster,"[{""name"": """", ""roles"": [""originator""]}]"
e40f1cc7-36f2-45b1-84ab-e51ea8589b67,0,,NetCDF,-179.75,active,-42.75,environment,c9e0824c-348e-4c6d-87dc-45e4834f7428,http://geonetwork.d4science.org:8080/geonetwork/srv/en/xml.metadata.get?uuid=f86d8262-06ac-4ed0-8789-cf01367a16dd,2017-11-26T06:40:42.834360,2017-10-10T17:50:01.333+02:00,True,Unnamed resource,,True,False,Allocyttus Niger Aquamaps Native Raster,False,d4sciencelabs,c4418477-a9f9-4340-a417-9a16364cc98e,f86d8262-06ac-4ed0-8789-cf01367a16dd,"[{""type"": ""creation"", ""value"": ""2017-10-10T17:50:01.333+02:00""}, {""type"": ""publication"", ""value"": ""2017-10-10T17:50:01.333+02:00""}, {""type"": ""revision"", ""value"": ""2017-10-10T17:50:01.333+02:00""}]",-54.75,eng,active,2017-11-26T06:40:41.503400,"This Allocyttus Niger Species Distribution Map has been generated with the AquaMaps methodology by exploiting the technology and the computational resources provided by iMarine. In particular, this map has been produced using the HSPEC Native Range dataset, generated using the AquaMaps NativeRange algorithm. Hosted on the D4Science Thredds CataSystem.out.println: http://thredds.d4science.org",ebc02b4a-f774-4e7e-afe1-d52ab93126de,http://thredds.d4science.org/thredds/fileServer/public/netcdf/AquamapsNative/aquamaps_native_allocyttus_niger.nc,WCS,4,87e7df41-6459-448e-bbc9-c1e38ad6082b,180.25,"ISO 19115 Topic Category. Environmental resources, protection and conservation, for example environmental pollution, waste storage and treatment, environmental impact assessment, monitoring environmental risk, nature reserves, landscape, water quality, air quality, environmental modeling",[],"D4Science has developed a series of applications (accessible through the D4Science Labs) which can be used by any user to upload, manipulate, use and re-use products with the aim to share them with other users following the principle of the OpenScience",Dataset,D4Science Labs,bb,,[],,http://geonetwork.d4science.org:8080/geonetwork,,organization,,"{""type"": ""Polygon"", ""coordinates"": [[[-179.75, -54.75], [180.25, -54.75], [180.25, -42.75], [-179.75, -42.75], [-179.75, -54.75]]]}",http://geonetwork.d4science.org:8080/geonetwork/srv/en/metadata.show?uuid=f86d8262-06ac-4ed0-8789-cf01367a16dd,environment,22dde829-fe22-4db6-875d-5ae13aed8a5a,2017-10-13T19:50:44.230828,bluebridge.catalogue@d4science.org,False,,allocyttus-niger-aquamaps-native-raster,8,c9e0824c-348e-4c6d-87dc-45e4834f7428,[],df259260-e729-437b-adcc-b8d6a88cd712,730e5b91-2265-431e-b033-7f310474e4f3,active,e40f1cc7-36f2-45b1-84ab-e51ea8589b67,approved,11680099-3fd0-427c-8cfc-b1fbcde0623e,environment,active,https://ckan-bb2.d4science.org/images/organisations/d4sciencelabs.png,OGC:WMS-1.3.0-http-get-map,iMarine Consortium,dataset,2017-11-24T11:56:48.241435,11680099-3fd0-427c-8cfc-b1fbcde0623e,asNeeded,environment,http://data.d4science.org/ctlg/gCubeApps/allocyttus-niger-aquamaps-native-raster,"[{""name"": """", ""roles"": [""originator""]}]"
5d173fad-0f5c-4b44-9625-5715e5943623,0,,Probability Distribution,-124.25,active,43.25,environment,0b335fe9-b793-486e-891f-b5b2d9252b79,http://geonetwork.d4science.org:8080/geonetwork/srv/en/xml.metadata.get?uuid=164ef1a6-c6b1-4893-89cc-1d20666a6dd9,2017-12-02T18:39:44.841013,2017-11-30T16:04:03.713+01:00,True,Unnamed resource,,True,False,amphistichus argenteus Aquamaps Native 2050 Raster,False,d4sciencelabs,26a86c41-69f5-4462-a043-0d46135fc2d9,164ef1a6-c6b1-4893-89cc-1d20666a6dd9,"[{""type"": ""creation"", ""value"": ""2017-11-30T16:04:03.713+01:00""}, {""type"": ""publication"", ""value"": ""2017-11-30T16:04:03.713+01:00""}, {""type"": ""revision"", ""value"": ""2017-11-30T16:04:03.713+01:00""}]",-48.75,eng,active,2017-12-02T18:39:42.341384,"This amphistichus argenteus Species Distribution Map for 2050 has been generated with the AquaMaps methodology by exploiting the technology and the computational resources provided by iMarine. In particular, this map has been produced using the HSPEC Native Range dataset, generated using the AquaMaps NativeRange 2050 algorithm. Hosted on the D4Science Thredds CataSystem.out.println: http://thredds.d4science.org",ebc02b4a-f774-4e7e-afe1-d52ab93126de,http://thredds.d4science.org/thredds/fileServer/public/netcdf/AquamapsNative2050/aquamaps_native2050_amphistichus_argenteus.nc,WCS,4,0458274e-f840-43c4-a7be-adb03bcfc287,-70.25,"ISO 19115 Topic Category. Environmental resources, protection and conservation, for example environmental pollution, waste storage and treatment, environmental impact assessment, monitoring environmental risk, nature reserves, landscape, water quality, air quality, environmental modeling",[],"D4Science has developed a series of applications (accessible through the D4Science Labs) which can be used by any user to upload, manipulate, use and re-use products with the aim to share them with other users following the principle of the OpenScience",Dataset,D4Science Labs,bb,,[],,http://geonetwork.d4science.org:8080/geonetwork,,organization,,"{""type"": ""Polygon"", ""coordinates"": [[[-124.25, -48.75], [-70.25, -48.75], [-70.25, 43.25], [-124.25, 43.25], [-124.25, -48.75]]]}",http://geonetwork.d4science.org:8080/geonetwork/srv/en/metadata.show?uuid=164ef1a6-c6b1-4893-89cc-1d20666a6dd9,environment,22dde829-fe22-4db6-875d-5ae13aed8a5a,2017-12-01T15:36:37.977830,bluebridge.catalogue@d4science.org,False,,amphistichus-argenteus-aquamaps-native-2050-raster,8,0b335fe9-b793-486e-891f-b5b2d9252b79,[],6591ac7d-8e32-4500-b9f4-ca7c7ee91561,730e5b91-2265-431e-b033-7f310474e4f3,active,5d173fad-0f5c-4b44-9625-5715e5943623,approved,11680099-3fd0-427c-8cfc-b1fbcde0623e,environment,active,https://ckan-bb2.d4science.org/images/organisations/d4sciencelabs.png,OGC:WMS-1.3.0-http-get-map,iMarine Consortium,dataset,2017-11-24T11:56:48.241435,11680099-3fd0-427c-8cfc-b1fbcde0623e,asNeeded,environment,http://data.d4science.org/ctlg/gCubeApps/amphistichus-argenteus-aquamaps-native-2050-raster,"[{""name"": """", ""roles"": [""originator""]}]"
b9a038b8-e5fa-46ec-8d37-419d12b47c13,0,,NetCDF,-179.75,active,15.25,environment,31623efc-8b0b-4c6c-82d8-9a7982350f06,http://geonetwork.d4science.org:8080/geonetwork/srv/en/xml.metadata.get?uuid=e38ae111-111c-4a0f-b351-5434b9987e60,2017-11-25T19:20:53.351657,2017-10-10T17:51:38.808+02:00,True,Unnamed resource,,True,False,Amblyglyphidodon Curacao Aquamaps Native Raster,False,d4sciencelabs,c4418477-a9f9-4340-a417-9a16364cc98e,e38ae111-111c-4a0f-b351-5434b9987e60,"[{""type"": ""creation"", ""value"": ""2017-10-10T17:51:38.808+02:00""}, {""type"": ""publication"", ""value"": ""2017-10-10T17:51:38.808+02:00""}, {""type"": ""revision"", ""value"": ""2017-10-10T17:51:38.808+02:00""}]",-29.75,eng,active,2017-11-25T19:20:52.524708,"This Amblyglyphidodon Curacao Species Distribution Map has been generated with the AquaMaps methodology by exploiting the technology and the computational resources provided by iMarine. In particular, this map has been produced using the HSPEC Native Range dataset, generated using the AquaMaps NativeRange algorithm. Hosted on the D4Science Thredds CataSystem.out.println: http://thredds.d4science.org",ebc02b4a-f774-4e7e-afe1-d52ab93126de,http://thredds.d4science.org/thredds/fileServer/public/netcdf/AquamapsNative/aquamaps_native_amblyglyphidodon_curacao.nc,WCS,4,2533f6aa-0f6d-4b70-abba-1abc063b8e7e,180.25,"ISO 19115 Topic Category. Environmental resources, protection and conservation, for example environmental pollution, waste storage and treatment, environmental impact assessment, monitoring environmental risk, nature reserves, landscape, water quality, air quality, environmental modeling",[],"D4Science has developed a series of applications (accessible through the D4Science Labs) which can be used by any user to upload, manipulate, use and re-use products with the aim to share them with other users following the principle of the OpenScience",Dataset,D4Science Labs,bb,,[],,http://geonetwork.d4science.org:8080/geonetwork,,organization,,"{""type"": ""Polygon"", ""coordinates"": [[[-179.75, -29.75], [180.25, -29.75], [180.25, 15.25], [-179.75, 15.25], [-179.75, -29.75]]]}",http://geonetwork.d4science.org:8080/geonetwork/srv/en/metadata.show?uuid=e38ae111-111c-4a0f-b351-5434b9987e60,environment,22dde829-fe22-4db6-875d-5ae13aed8a5a,2017-10-13T15:28:17.430330,bluebridge.catalogue@d4science.org,False,,amblyglyphidodon-curacao-aquamaps-native-raster,8,31623efc-8b0b-4c6c-82d8-9a7982350f06,[],577ed300-5f12-449c-9820-cc24fa870aae,730e5b91-2265-431e-b033-7f310474e4f3,active,b9a038b8-e5fa-46ec-8d37-419d12b47c13,approved,11680099-3fd0-427c-8cfc-b1fbcde0623e,environment,active,https://ckan-bb2.d4science.org/images/organisations/d4sciencelabs.png,OGC:WMS-1.3.0-http-get-map,iMarine Consortium,dataset,2017-11-24T11:56:48.241435,11680099-3fd0-427c-8cfc-b1fbcde0623e,asNeeded,environment,http://data.d4science.org/ctlg/gCubeApps/amblyglyphidodon-curacao-aquamaps-native-raster,"[{""name"": """", ""roles"": [""originator""]}]"
c0123a6d-c1c3-4f20-98fb-6b6b7da54b53,0,,Probability Distribution,-179.75,active,37.25,environment,b35fbcd0-42a0-433b-9bba-6ccc01668598,http://geonetwork.d4science.org:8080/geonetwork/srv/en/xml.metadata.get?uuid=adc669dd-1574-440d-b08e-c69f7f12c873,2017-12-24T16:15:44.963830,2017-12-02T03:13:53.342+01:00,True,Unnamed resource,,True,False,alpheus alcyone Aquamaps Native 2050 Raster,False,d4sciencelabs,c4418477-a9f9-4340-a417-9a16364cc98e,adc669dd-1574-440d-b08e-c69f7f12c873,"[{""type"": ""creation"", ""value"": ""2017-12-02T03:13:53.342+01:00""}, {""type"": ""publication"", ""value"": ""2017-12-02T03:13:53.342+01:00""}, {""type"": ""revision"", ""value"": ""2017-12-02T03:13:53.342+01:00""}]",-36.75,eng,active,2017-12-24T16:15:42.576591,"This alpheus alcyone Species Distribution Map for 2050 has been generated with the AquaMaps methodology by exploiting the technology and the computational resources provided by iMarine. In particular, this map has been produced using the HSPEC Native Range dataset, generated using the AquaMaps NativeRange 2050 algorithm. Hosted on the D4Science Thredds CataSystem.out.println: http://thredds.d4science.org",ebc02b4a-f774-4e7e-afe1-d52ab93126de,http://thredds.d4science.org/thredds/fileServer/public/netcdf/AquamapsNative2050/aquamaps_native2050_alpheus_alcyone.nc,WCS,4,45ba1e6f-2d02-4362-b610-6d654bada6cb,180.25,"ISO 19115 Topic Category. Environmental resources, protection and conservation, for example environmental pollution, waste storage and treatment, environmental impact assessment, monitoring environmental risk, nature reserves, landscape, water quality, air quality, environmental modeling",[],"D4Science has developed a series of applications (accessible through the D4Science Labs) which can be used by any user to upload, manipulate, use and re-use products with the aim to share them with other users following the principle of the OpenScience",Dataset,D4Science Labs,bb,,[],,http://geonetwork.d4science.org:8080/geonetwork,,organization,,"{""type"": ""Polygon"", ""coordinates"": [[[-179.75, -36.75], [180.25, -36.75], [180.25, 37.25], [-179.75, 37.25], [-179.75, -36.75]]]}",http://geonetwork.d4science.org:8080/geonetwork/srv/en/metadata.show?uuid=adc669dd-1574-440d-b08e-c69f7f12c873,environment,22dde829-fe22-4db6-875d-5ae13aed8a5a,2017-12-15T20:35:12.514994,bluebridge.catalogue@d4science.org,False,,alpheus-alcyone-aquamaps-native-2050-raster,8,b35fbcd0-42a0-433b-9bba-6ccc01668598,[],dc07898a-e51b-4606-a09e-45969c537482,730e5b91-2265-431e-b033-7f310474e4f3,active,c0123a6d-c1c3-4f20-98fb-6b6b7da54b53,approved,11680099-3fd0-427c-8cfc-b1fbcde0623e,environment,active,https://ckan-bb2.d4science.org/images/organisations/d4sciencelabs.png,OGC:WMS-1.3.0-http-get-map,iMarine Consortium,dataset,2017-11-24T11:56:48.241435,11680099-3fd0-427c-8cfc-b1fbcde0623e,asNeeded,environment,http://data.d4science.org/ctlg/gCubeApps/alpheus-alcyone-aquamaps-native-2050-raster,"[{""name"": """", ""roles"": [""originator""]}]"
80a0bdf3-3229-46d2-b336-a6f279d37690,0,,SpeciesDistribution,-180.0,active,90.0,biota,31ad5bd1-45b6-4f55-9fd1-9ed07fbf6bc2,http://geonetwork.d4science.org:8080/geonetwork/srv/en/xml.metadata.get?uuid=d961d50b-9352-4276-8b8f-56871f50e0e8,2017-11-29T22:57:27.827028,2013-06-19T07:01:06.826+02:00,True,WMS link to resource,,True,False,Acrosterigma transcendens,False,imarine,e4329398-d9a8-4e73-a03b-9b3937b5b1d0,d961d50b-9352-4276-8b8f-56871f50e0e8,"[{""type"": ""creation"", ""value"": ""2012-12-22T01:12:26.636+01:00""}]",-90.0,eng,active,2017-11-29T22:57:26.291711,"This Acrosterigma transcendens Species Distribution Map has been generated with the AquaMaps methodology by exploiting the technology and the computational resources provided by iMarine. In particular, this map has been produced using the HSPEC 2050 Native Range dataset, generated using AquaMaps NativeRange2050 algorithm.",ebc02b4a-f774-4e7e-afe1-d52ab93126de,"http://geoserver.d4science-ii.research-infrastructures.eu/geoserver/wms?service=wms&version=1.1.0&request=GetMap&layers=lacrosterigmatranscendens20121222011200691cet&styles=&bbox=-180,-90,180,90&width=676&height=330&srs=EPSG:4326&crs=EPSG:4326&format=application/openlayers",WMS,4,7614324,180.0,"ISO 19115 Topic Category. Flora or fauna in natural environment, for example wildlife, vegetation, biological sciences, ecology, wilderness, sea life, wetlands, habitat, biological resources",[],"iMarine is an access point to a number of Virtual Research Environments deployed and operated in the context of the iMarine project to support the Ecosystem Approach to fisheries management and conservation of marine living resources. It empowers practitioners and policy makers from multiple scientific fields such as fisheries, biodiversity and ocean observation by ensuring that otherwise dispersed and heterogeneous data is available to all stakeholder communities through a shared virtual environment that brings together multidisciplinary data sources, supports cross-cutting scientific analysis, and assists communication.
See More: https://i-marine.d4science.org/",Dataset,iMarine,bb,,[],,http://geonetwork.d4science.org:8080/geonetwork,,organization,,"{""type"": ""Polygon"", ""coordinates"": [[[-180.0, -90.0], [180.0, -90.0], [180.0, 90.0], [-180.0, 90.0], [-180.0, -90.0]]]}",http://geonetwork.d4science.org:8080/geonetwork/srv/en/metadata.show?uuid=d961d50b-9352-4276-8b8f-56871f50e0e8,biota,70a489ea-a910-40b8-ae63-431084dc99a6,2017-09-22T15:16:13.680198,bluebridge.catalogue@d4science.org,False,,acrosterigma-transcendens1,7,31ad5bd1-45b6-4f55-9fd1-9ed07fbf6bc2,[],7bde36da-5c0b-4137-98fe-0694668240fe,7bf889d1-7829-4c2e-ad72-222798006eee,active,80a0bdf3-3229-46d2-b336-a6f279d37690,approved,81f5e6ae-92ab-410a-9a75-f809d43ec1ee,biota,active,https://ckan-bb2.d4science.org/images/organisations/imarine.png,OGC:WMS-1.3.0-http-get-map,iMarine Consortium,dataset,2017-11-24T11:56:37.199304,81f5e6ae-92ab-410a-9a75-f809d43ec1ee,asNeeded,biota,http://data.d4science.org/ctlg/d4science.research-infrastructures.eu/acrosterigma-transcendens1,"[{""name"": ""iMarine Consortium"", ""roles"": [""author""]}, {""name"": ""iMarine.eu"", ""roles"": [""distributor"", ""resourceProvider""]}]"
b1ff2629-e861-4881-a068-53f70536180b,0,,SpeciesDistribution,-180.0,active,90.0,biota,615bb6a2-4bb7-43d5-843b-b78041b1750f,http://geonetwork.d4science.org:8080/geonetwork/srv/en/xml.metadata.get?uuid=f00e4c20-9b17-4023-9fcf-6ecd1db6df67,2017-11-30T10:20:04.655606,2013-06-19T09:46:36.884+02:00,True,WMS link to resource,,True,False,Alticus monochrus,False,imarine,c4418477-a9f9-4340-a417-9a16364cc98e,f00e4c20-9b17-4023-9fcf-6ecd1db6df67,"[{""type"": ""creation"", ""value"": ""2013-04-10T22:26:28.115+02:00""}]",-90.0,eng,active,2017-11-30T10:20:01.978768,"This Alticus monochrus Species Distribution Map has been generated with the AquaMaps methodology by exploiting the technology and the computational resources provided by iMarine. In particular, this map has been produced using the Default Suitable maps_SuitableRange dataset, generated using AquaMaps SuitableRange algorithm.",ebc02b4a-f774-4e7e-afe1-d52ab93126de,"http://geoserver.d4science-ii.research-infrastructures.eu/geoserver/wms?service=wms&version=1.1.0&request=GetMap&layers=lalticusmonochrus20130410222549074cest&styles=&bbox=-180,-90,180,90&width=676&height=330&srs=EPSG:4326&crs=EPSG:4326&format=application/openlayers",WMS,4,7614324,180.0,"ISO 19115 Topic Category. Flora or fauna in natural environment, for example wildlife, vegetation, biological sciences, ecology, wilderness, sea life, wetlands, habitat, biological resources",[],"iMarine is an access point to a number of Virtual Research Environments deployed and operated in the context of the iMarine project to support the Ecosystem Approach to fisheries management and conservation of marine living resources. It empowers practitioners and policy makers from multiple scientific fields such as fisheries, biodiversity and ocean observation by ensuring that otherwise dispersed and heterogeneous data is available to all stakeholder communities through a shared virtual environment that brings together multidisciplinary data sources, supports cross-cutting scientific analysis, and assists communication.
See More: https://i-marine.d4science.org/",Dataset,iMarine,bb,,[],,http://geonetwork.d4science.org:8080/geonetwork,,organization,,"{""type"": ""Polygon"", ""coordinates"": [[[-180.0, -90.0], [180.0, -90.0], [180.0, 90.0], [-180.0, 90.0], [-180.0, -90.0]]]}",http://geonetwork.d4science.org:8080/geonetwork/srv/en/metadata.show?uuid=f00e4c20-9b17-4023-9fcf-6ecd1db6df67,biota,70a489ea-a910-40b8-ae63-431084dc99a6,2017-09-22T09:05:29.708478,bluebridge.catalogue@d4science.org,False,,alticus-monochrus1,7,615bb6a2-4bb7-43d5-843b-b78041b1750f,[],ae363f48-10c5-4447-bff8-eecad9370392,7bf889d1-7829-4c2e-ad72-222798006eee,active,b1ff2629-e861-4881-a068-53f70536180b,approved,81f5e6ae-92ab-410a-9a75-f809d43ec1ee,biota,active,https://ckan-bb2.d4science.org/images/organisations/imarine.png,OGC:WMS-1.3.0-http-get-map,iMarine Consortium,dataset,2017-11-24T11:56:37.199304,81f5e6ae-92ab-410a-9a75-f809d43ec1ee,asNeeded,biota,http://data.d4science.org/ctlg/d4science.research-infrastructures.eu/alticus-monochrus1,"[{""name"": ""iMarine Consortium"", ""roles"": [""author""]}, {""name"": ""iMarine.eu"", ""roles"": [""distributor"", ""resourceProvider""]}]"
97e2dbb0-8d79-4d71-921d-e5f721bf2938,0,,Probability Distribution,-179.75,active,2.25,environment,c6e4f10d-7eb0-4e72-b2ee-aa4e87a546a9,http://geonetwork.d4science.org:8080/geonetwork/srv/en/xml.metadata.get?uuid=1250f47e-f61a-452f-82cc-c46ad8e24aee,2017-12-24T06:30:27.392842,2017-12-02T12:17:23.100+01:00,True,Unnamed resource,,True,False,anguilla obscura Aquamaps Native 2050 Raster,False,d4sciencelabs,c4418477-a9f9-4340-a417-9a16364cc98e,1250f47e-f61a-452f-82cc-c46ad8e24aee,"[{""type"": ""creation"", ""value"": ""2017-12-02T12:17:23.100+01:00""}, {""type"": ""publication"", ""value"": ""2017-12-02T12:17:23.100+01:00""}, {""type"": ""revision"", ""value"": ""2017-12-02T12:17:23.100+01:00""}]",-26.75,eng,active,2017-12-24T06:30:24.034731,"This anguilla obscura Species Distribution Map for 2050 has been generated with the AquaMaps methodology by exploiting the technology and the computational resources provided by iMarine. In particular, this map has been produced using the HSPEC Native Range dataset, generated using the AquaMaps NativeRange 2050 algorithm. Hosted on the D4Science Thredds CataSystem.out.println: http://thredds.d4science.org",ebc02b4a-f774-4e7e-afe1-d52ab93126de,http://thredds.d4science.org/thredds/fileServer/public/netcdf/AquamapsNative2050/aquamaps_native2050_anguilla_obscura.nc,WCS,4,73fb64a5-1dc3-456e-8283-45a19173bdd9,180.25,"ISO 19115 Topic Category. Environmental resources, protection and conservation, for example environmental pollution, waste storage and treatment, environmental impact assessment, monitoring environmental risk, nature reserves, landscape, water quality, air quality, environmental modeling",[],"D4Science has developed a series of applications (accessible through the D4Science Labs) which can be used by any user to upload, manipulate, use and re-use products with the aim to share them with other users following the principle of the OpenScience",Dataset,D4Science Labs,bb,,[],,http://geonetwork.d4science.org:8080/geonetwork,,organization,,"{""type"": ""Polygon"", ""coordinates"": [[[-179.75, -26.75], [180.25, -26.75], [180.25, 2.25], [-179.75, 2.25], [-179.75, -26.75]]]}",http://geonetwork.d4science.org:8080/geonetwork/srv/en/metadata.show?uuid=1250f47e-f61a-452f-82cc-c46ad8e24aee,environment,22dde829-fe22-4db6-875d-5ae13aed8a5a,2017-12-15T18:30:48.316577,bluebridge.catalogue@d4science.org,False,,anguilla-obscura-aquamaps-native-2050-raster,8,c6e4f10d-7eb0-4e72-b2ee-aa4e87a546a9,[],82c07543-bcfd-44e4-8993-3ae7aa45be2e,730e5b91-2265-431e-b033-7f310474e4f3,active,97e2dbb0-8d79-4d71-921d-e5f721bf2938,approved,11680099-3fd0-427c-8cfc-b1fbcde0623e,environment,active,https://ckan-bb2.d4science.org/images/organisations/d4sciencelabs.png,OGC:WMS-1.3.0-http-get-map,iMarine Consortium,dataset,2017-11-24T11:56:48.241435,11680099-3fd0-427c-8cfc-b1fbcde0623e,asNeeded,environment,http://data.d4science.org/ctlg/gCubeApps/anguilla-obscura-aquamaps-native-2050-raster,"[{""name"": """", ""roles"": [""originator""]}]"
