has_identifier_has_id_value,unknown,unknown,has_name,unknown,unknown,unknown,unknown,has_identifier_has_id_value,unknown,has_identifier_is_source_of_has_startDate,unknown,unknown,unknown,unknown,unknown,has_name,unknown,unknown,unknown,unknown,unknown,unknown,unknown,unknown,is_source_of_has_startDate,has_description,is_destination_of_has_source_has_identifier_has_id_value,unknown,unknown,unknown,has_name,unknown,unknown,unknown,unknown,is_source_of_has_classification_has_term,unknown,is_destination_of_has_source_is_source_of_has_destination_has_name,is_source_of_has_classification_has_term,unknown,is_destination_of_has_source_is_source_of_has_destination_has_name,unknown,unknown,unknown,unknown,unknown,unknown,unknown,unknown,unknown,is_destination_of_has_source_is_source_of_has_destination_has_URI,unknown,unknown,has_identifier_has_id_value,unknown,has_identifier_has_id_value,unknown,unknown,unknown,unknown,has_identifier_has_id_value,unknown,unknown,unknown,unknown,unknown,unknown,is_destination_of_has_source_is_source_of_has_destination_has_name,is_source_of_has_classification_has_term,unknown,unknown,unknown,unknown,unknown,unknown
0bfd8d45-1967-4626-a986-7dff418e580c,0,http://node49.p.d4science.research-infrastructures.eu:9003/80/Animalia/Chordata/Actinopterygii/Perciformes/Pomacentridae/Fis-33558/Earth.jpg,Whitley s sergeant,-180.0,active,90.0,biota,27cc1c08-40ec-45cc-ae7f-3b967ac317f1,http://geonetwork.d4science.org:8080/geonetwork/srv/en/xml.metadata.get?uuid=3aeaa3fa-97f2-4fc6-8ddc-02ea1f83c20e,2017-11-24T12:34:56.113321,2013-06-18T20:01:24.598+02:00,True,WMS link to resource,True,False,Abudefduf whitleyi,False,imarine,79ac7e03-1830-4415-a268-6d760e382c16,3aeaa3fa-97f2-4fc6-8ddc-02ea1f83c20e,"[{""type"": ""creation"", ""value"": ""2012-12-10T17:06:55.406+01:00""}]",-90.0,eng,active,2017-11-24T12:34:55.601063,"This Abudefduf whitleyi Species Distribution Map has been generated with the AquaMaps methodology by exploiting the technology and the computational resources provided by iMarine. In particular, this map has been produced using the HSPEC Native Range dataset, generated using AquaMaps NativeRange algorithm.",ebc02b4a-f774-4e7e-afe1-d52ab93126de,"http://geoserver2.d4science.research-infrastructures.eu/geoserver/wms?service=wms&version=1.1.0&request=GetMap&layers=labudefdufwhitleyi20121210170636767cet&styles=&bbox=-180,-90,180,90&width=676&height=330&srs=EPSG:4326&crs=EPSG:4326&format=application/openlayers",WMS,4,Abudefduf whitleyi,180.0,"ISO 19115 Topic Category. Flora or fauna in natural environment, for example wildlife, vegetation, biological sciences, ecology, wilderness, sea life, wetlands, habitat, biological resources",[],"iMarine is an access point to a number of Virtual Research Environments deployed and operated in the context of the iMarine project to support the Ecosystem Approach to fisheries management and conservation of marine living resources. It empowers practitioners and policy makers from multiple scientific fields such as fisheries, biodiversity and ocean observation by ensuring that otherwise dispersed and heterogeneous data is available to all stakeholder communities through a shared virtual environment that brings together multidisciplinary data sources, supports cross-cutting scientific analysis, and assists communication.
See More: https://i-marine.d4science.org/",Dataset,iMarine,bb,dataset,[],"iMarine Consortium,iMarine.eu",http://geonetwork.d4science.org:8080/geonetwork,2012-12-10T17:06:55.406+01:00,organization,info@i-marine.eu,"{""type"": ""Polygon"", ""coordinates"": [[[-180.0, -90.0], [180.0, -90.0], [180.0, 90.0], [-180.0, 90.0], [-180.0, -90.0]]]}",http://geonetwork.d4science.org:8080/geonetwork/srv/en/metadata.show?uuid=3aeaa3fa-97f2-4fc6-8ddc-02ea1f83c20e,biota,70a489ea-a910-40b8-ae63-431084dc99a6,2017-09-21T16:29:57.426571,bluebridge.catalogue@d4science.org,False,creation,abudefduf-whitleyi1,6,27cc1c08-40ec-45cc-ae7f-3b967ac317f1,[],60b7fe2a-55f3-4328-8462-b86415d8e983,7bf889d1-7829-4c2e-ad72-222798006eee,active,0bfd8d45-1967-4626-a986-7dff418e580c,approved,81f5e6ae-92ab-410a-9a75-f809d43ec1ee,biota,active,https://ckan-bb2.d4science.org/images/organisations/imarine.png,OGC:WFS-1.0.0-http-get-feature,iMarine.eu,dataset,2017-11-24T11:56:37.199304,81f5e6ae-92ab-410a-9a75-f809d43ec1ee,asNeeded,biota,http://data.d4science.org/ctlg/d4science.research-infrastructures.eu/abudefduf-whitleyi1,"[{""name"": ""iMarine Consortium"", ""roles"": [""author""]}, {""name"": ""iMarine.eu"", ""roles"": [""distributor"", ""resourceProvider""]}]"
06737c16-6a22-4d28-aac7-15727086902b,0,http://node49.p.d4science.research-infrastructures.eu:9003/80/Animalia/Chordata/Actinopterygii/Perciformes/Pomacentridae/Fis-34853/Earth.jpg,SpeciesDistribution,-180.0,active,90.0,biota,5b12aced-bd51-42da-b2b9-75ec601c2c2d,http://geonetwork.d4science.org:8080/geonetwork/srv/en/xml.metadata.get?uuid=f48d4113-0dae-46ce-a3fe-ef244fce7716,2017-11-24T11:48:18.564599,2013-06-18T22:32:18.734+02:00,True,WMS link to resource,True,False,Abudefduf natalensis,False,imarine,c415fab9-35e8-45df-8790-d087f71698ae,f48d4113-0dae-46ce-a3fe-ef244fce7716,"[{""type"": ""creation"", ""value"": ""2012-12-18T09:00:07.861+01:00""}]",-90.0,eng,active,2017-11-24T11:48:18.114804,"This Abudefduf natalensis Species Distribution Map has been generated with the AquaMaps methodology by exploiting the technology and the computational resources provided by iMarine. In particular, this map has been produced using the HSPEC Native Range dataset, generated using AquaMaps NativeRange algorithm.",ebc02b4a-f774-4e7e-afe1-d52ab93126de,"http://geoserver3.d4science.research-infrastructures.eu/geoserver/wms?service=wms&version=1.1.0&request=GetMap&layers=labudefdufnatalensis20121218085953011cet&styles=&bbox=-180,-90,180,90&width=676&height=330&srs=EPSG:4326&crs=EPSG:4326&format=application/openlayers",WMS,4,Abudefduf natalensis,180.0,"ISO 19115 Topic Category. Flora or fauna in natural environment, for example wildlife, vegetation, biological sciences, ecology, wilderness, sea life, wetlands, habitat, biological resources",[],"iMarine is an access point to a number of Virtual Research Environments deployed and operated in the context of the iMarine project to support the Ecosystem Approach to fisheries management and conservation of marine living resources. It empowers practitioners and policy makers from multiple scientific fields such as fisheries, biodiversity and ocean observation by ensuring that otherwise dispersed and heterogeneous data is available to all stakeholder communities through a shared virtual environment that brings together multidisciplinary data sources, supports cross-cutting scientific analysis, and assists communication.
See More: https://i-marine.d4science.org/",Dataset,iMarine,bb,dataset,[],"iMarine Consortium,iMarine.eu",http://geonetwork.d4science.org:8080/geonetwork,2012-12-18T09:00:07.861+01:00,organization,info@i-marine.eu,"{""type"": ""Polygon"", ""coordinates"": [[[-180.0, -90.0], [180.0, -90.0], [180.0, 90.0], [-180.0, 90.0], [-180.0, -90.0]]]}",http://geonetwork.d4science.org:8080/geonetwork/srv/en/metadata.show?uuid=f48d4113-0dae-46ce-a3fe-ef244fce7716,biota,70a489ea-a910-40b8-ae63-431084dc99a6,2017-09-23T15:37:13.884022,bluebridge.catalogue@d4science.org,False,creation,abudefduf-natalensis3,6,5b12aced-bd51-42da-b2b9-75ec601c2c2d,[],d399cf73-e704-4d5e-a53b-06548ef2faff,7bf889d1-7829-4c2e-ad72-222798006eee,active,06737c16-6a22-4d28-aac7-15727086902b,approved,81f5e6ae-92ab-410a-9a75-f809d43ec1ee,biota,active,https://ckan-bb2.d4science.org/images/organisations/imarine.png,OGC:WFS-1.0.0-http-get-feature,iMarine.eu,dataset,2017-11-24T11:56:37.199304,81f5e6ae-92ab-410a-9a75-f809d43ec1ee,asNeeded,biota,http://data.d4science.org/ctlg/d4science.research-infrastructures.eu/abudefduf-natalensis3,"[{""name"": ""iMarine Consortium"", ""roles"": [""author""]}, {""name"": ""iMarine.eu"", ""roles"": [""distributor"", ""resourceProvider""]}]"
c97c86af-ebc1-43c1-81df-b7c93bb1a9db,0,http://node49.p.d4science.research-infrastructures.eu:9003/424/null/null/null/null/null/ITS-558420/Earth.jpg,Raster,-155.75,active,83.25,environment,f30d0fb5-6280-4c8b-8365-8115de51ae0e,http://geonetwork.d4science.org:8080/geonetwork/srv/en/xml.metadata.get?uuid=fd68b23a-9ea2-412f-bacb-f31e7026c6a7,2017-12-24T18:28:13.776208,2017-12-03T10:28:39.675+01:00,True,Unnamed resource,True,False,ampelisca aequicornis Aquamaps Native 2050 Raster,False,d4sciencelabs,c415fab9-35e8-45df-8790-d087f71698ae,fd68b23a-9ea2-412f-bacb-f31e7026c6a7,"[{""type"": ""creation"", ""value"": ""2017-12-03T10:28:39.675+01:00""}, {""type"": ""publication"", ""value"": ""2017-12-03T10:28:39.675+01:00""}, {""type"": ""revision"", ""value"": ""2017-12-03T10:28:39.675+01:00""}]",36.25,eng,active,2017-12-24T18:28:10.917088,"This ampelisca aequicornis Species Distribution Map for 2050 has been generated with the AquaMaps methodology by exploiting the technology and the computational resources provided by iMarine. In particular, this map has been produced using the HSPEC Native Range dataset, generated using the AquaMaps NativeRange 2050 algorithm. Hosted on the D4Science Thredds CataSystem.out.println: http://thredds.d4science.org",ebc02b4a-f774-4e7e-afe1-d52ab93126de,http://thredds.d4science.org/thredds/fileServer/public/netcdf/AquamapsNative2050/aquamaps_native2050_ampelisca_aequicornis.nc,WCS,4,AquaMaps,129.25,"ISO 19115 Topic Category. Environmental resources, protection and conservation, for example environmental pollution, waste storage and treatment, environmental impact assessment, monitoring environmental risk, nature reserves, landscape, water quality, air quality, environmental modeling",[],"D4Science has developed a series of applications (accessible through the D4Science Labs) which can be used by any user to upload, manipulate, use and re-use products with the aim to share them with other users following the principle of the OpenScience",Dataset,D4Science Labs,bb,dataset,[],"iMarine Consortium,iMarine.eu",http://geonetwork.d4science.org:8080/geonetwork,2013-06-07T07:41:35.213+02:00,organization,info@i-marine.eu,"{""type"": ""Polygon"", ""coordinates"": [[[-155.75, 36.25], [129.25, 36.25], [129.25, 83.25], [-155.75, 83.25], [-155.75, 36.25]]]}",http://geonetwork.d4science.org:8080/geonetwork/srv/en/metadata.show?uuid=fd68b23a-9ea2-412f-bacb-f31e7026c6a7,environment,22dde829-fe22-4db6-875d-5ae13aed8a5a,2017-12-16T02:25:49.590985,bluebridge.catalogue@d4science.org,False,creation,ampelisca-aequicornis-aquamaps-native-2050-raster,8,f30d0fb5-6280-4c8b-8365-8115de51ae0e,[],afa99354-41ff-414c-8a58-ad700dfe097a,730e5b91-2265-431e-b033-7f310474e4f3,active,c97c86af-ebc1-43c1-81df-b7c93bb1a9db,approved,11680099-3fd0-427c-8cfc-b1fbcde0623e,environment,active,https://ckan-bb2.d4science.org/images/organisations/d4sciencelabs.png,OGC:WFS-1.0.0-http-get-feature,iMarine.eu,dataset,2017-11-24T11:56:48.241435,11680099-3fd0-427c-8cfc-b1fbcde0623e,asNeeded,environment,http://data.d4science.org/ctlg/gCubeApps/ampelisca-aequicornis-aquamaps-native-2050-raster,"[{""name"": """", ""roles"": [""originator""]}]"
a8070769-d397-483d-a6e5-fe0000739b92,0,http://node49.p.d4science.research-infrastructures.eu:9003/80/Animalia/Cnidaria/Anthozoa/Scleractinia/Mussidae/URM-Cn-5846/Ocean_View__Pacific.jpg,Probability Distribution,-180.0,active,90.0,biota,e9c70773-e7e2-4eff-8a5e-ec2654277a80,http://geonetwork.d4science.org:8080/geonetwork/srv/en/xml.metadata.get?uuid=61f4a74c-83a0-4793-aa1f-e39f45a9dde9,2017-11-25T15:30:17.882716,2013-06-26T16:09:03.596+02:00,True,WCS link to resource,True,False,Acrocephalus melanopogon,False,imarine,172d04b9-eb96-4684-a7e3-0cf40b2b8af4,61f4a74c-83a0-4793-aa1f-e39f45a9dde9,"[{""type"": ""creation"", ""value"": ""2013-06-07T07:41:35.213+02:00""}]",-90.0,eng,active,2017-11-25T15:30:16.969882,"This Acrocephalus melanopogon Species Distribution Map has been generated with the AquaMaps methodology by exploiting the technology and the computational resources provided by iMarine. In particular, this map has been produced using the Freshwater suitable dataset, generated using AquaMaps SuitableRange algorithm.",ebc02b4a-f774-4e7e-afe1-d52ab93126de,"http://geoserver3.d4science.research-infrastructures.eu/geoserver/wms?service=wms&version=1.1.0&request=GetMap&layers=lacrocephalusmelanopogon20130607074115402cest&styles=&bbox=-180,-90,180,90&width=676&height=330&srs=EPSG:4326&crs=EPSG:4326&format=application/openlayers",WCS,4,AquaMaps,180.0,"ISO 19115 Topic Category. Flora or fauna in natural environment, for example wildlife, vegetation, biological sciences, ecology, wilderness, sea life, wetlands, habitat, biological resources",[],"iMarine is an access point to a number of Virtual Research Environments deployed and operated in the context of the iMarine project to support the Ecosystem Approach to fisheries management and conservation of marine living resources. It empowers practitioners and policy makers from multiple scientific fields such as fisheries, biodiversity and ocean observation by ensuring that otherwise dispersed and heterogeneous data is available to all stakeholder communities through a shared virtual environment that brings together multidisciplinary data sources, supports cross-cutting scientific analysis, and assists communication.
See More: https://i-marine.d4science.org/",Dataset,iMarine,bb,dataset,[],"iMarine Consortium,iMarine.eu",http://geonetwork.d4science.org:8080/geonetwork,2012-12-19T02:25:47.391+01:00,organization,info@i-marine.eu,"{""type"": ""Polygon"", ""coordinates"": [[[-180.0, -90.0], [180.0, -90.0], [180.0, 90.0], [-180.0, 90.0], [-180.0, -90.0]]]}",http://geonetwork.d4science.org:8080/geonetwork/srv/en/metadata.show?uuid=61f4a74c-83a0-4793-aa1f-e39f45a9dde9,biota,70a489ea-a910-40b8-ae63-431084dc99a6,2017-09-23T17:26:45.163102,bluebridge.catalogue@d4science.org,False,creation,acrocephalus-melanopogon1,4,e9c70773-e7e2-4eff-8a5e-ec2654277a80,[],692d23ba-af6f-4ae4-b81f-3299882882c8,7bf889d1-7829-4c2e-ad72-222798006eee,active,a8070769-d397-483d-a6e5-fe0000739b92,approved,81f5e6ae-92ab-410a-9a75-f809d43ec1ee,biota,active,https://ckan-bb2.d4science.org/images/organisations/imarine.png,OGC:WFS-1.0.0-http-get-feature,iMarine.eu,dataset,2017-11-24T11:56:37.199304,81f5e6ae-92ab-410a-9a75-f809d43ec1ee,asNeeded,biota,http://data.d4science.org/ctlg/d4science.research-infrastructures.eu/acrocephalus-melanopogon1,"[{""name"": ""iMarine Consortium"", ""roles"": [""author""]}, {""name"": ""iMarine.eu"", ""roles"": [""distributor"", ""resourceProvider""]}]"
4fd407f1-3a58-45a7-aabc-ba917235b28d,0,http://node49.p.d4science.research-infrastructures.eu:9003/405/Animalia/Arthropoda/Malacostraca/Isopoda/Leptanthuridae/ITS-92210/Ocean_View__Pacific.jpg,Probability Distribution,30.25,active,37.25,environment,14c3cab8-8dc2-43d3-80d4-3aa10c7b3e5b,http://geonetwork.d4science.org:8080/geonetwork/srv/en/xml.metadata.get?uuid=d22ffba3-cac3-4eb4-b56a-9db56f63fead,2017-12-23T13:07:47.381707,2017-12-02T12:17:23.100+01:00,True,Unnamed resource,True,False,acropora striata Aquamaps Native 2050 Raster,False,d4sciencelabs,172d04b9-eb96-4684-a7e3-0cf40b2b8af4,d22ffba3-cac3-4eb4-b56a-9db56f63fead,"[{""type"": ""creation"", ""value"": ""2017-12-02T12:17:23.100+01:00""}, {""type"": ""publication"", ""value"": ""2017-12-02T12:17:23.100+01:00""}, {""type"": ""revision"", ""value"": ""2017-12-02T12:17:23.100+01:00""}]",-35.75,eng,active,2017-12-23T13:07:44.871998,"This acropora striata Species Distribution Map for 2050 has been generated with the AquaMaps methodology by exploiting the technology and the computational resources provided by iMarine. In particular, this map has been produced using the HSPEC Native Range dataset, generated using the AquaMaps NativeRange 2050 algorithm. Hosted on the D4Science Thredds CataSystem.out.println: http://thredds.d4science.org",ebc02b4a-f774-4e7e-afe1-d52ab93126de,http://thredds.d4science.org/thredds/fileServer/public/netcdf/AquamapsNative2050/aquamaps_native2050_acropora_striata.nc,WCS,4,6f865f73-1936-44f0-bbad-22ded0ee5ede,151.25,"ISO 19115 Topic Category. Environmental resources, protection and conservation, for example environmental pollution, waste storage and treatment, environmental impact assessment, monitoring environmental risk, nature reserves, landscape, water quality, air quality, environmental modeling",[],"D4Science has developed a series of applications (accessible through the D4Science Labs) which can be used by any user to upload, manipulate, use and re-use products with the aim to share them with other users following the principle of the OpenScience",Dataset,D4Science Labs,bb,dataset,[],"iMarine Consortium,iMarine.eu",http://geonetwork.d4science.org:8080/geonetwork,2013-04-11T04:40:58.643+02:00,organization,info@i-marine.eu,"{""type"": ""Polygon"", ""coordinates"": [[[30.25, -35.75], [151.25, -35.75], [151.25, 37.25], [30.25, 37.25], [30.25, -35.75]]]}",http://geonetwork.d4science.org:8080/geonetwork/srv/en/metadata.show?uuid=d22ffba3-cac3-4eb4-b56a-9db56f63fead,environment,22dde829-fe22-4db6-875d-5ae13aed8a5a,2017-12-16T00:44:12.558757,bluebridge.catalogue@d4science.org,False,creation,acropora-striata-aquamaps-native-2050-raster,8,14c3cab8-8dc2-43d3-80d4-3aa10c7b3e5b,[],d883ce58-000d-409c-9a24-eb7344880304,730e5b91-2265-431e-b033-7f310474e4f3,active,4fd407f1-3a58-45a7-aabc-ba917235b28d,approved,11680099-3fd0-427c-8cfc-b1fbcde0623e,environment,active,https://ckan-bb2.d4science.org/images/organisations/d4sciencelabs.png,OGC:WFS-1.0.0-http-get-feature,iMarine.eu,dataset,2017-11-24T11:56:48.241435,11680099-3fd0-427c-8cfc-b1fbcde0623e,asNeeded,environment,http://data.d4science.org/ctlg/gCubeApps/acropora-striata-aquamaps-native-2050-raster,"[{""name"": """", ""roles"": [""originator""]}]"
7ec74634-f013-42ee-aa5f-297ead87b5d9,0,http://node49.p.d4science.research-infrastructures.eu:9003/83/Animalia/Chordata/Elasmobranchii/Rajiformes/Anacanthobatidae/Fis-32448/Earth.jpg,SpeciesDistribution,-179.75,active,39.25,environment,2ab33976-4062-446b-92ee-a638917ee451,http://geonetwork.d4science.org:8080/geonetwork/srv/en/xml.metadata.get?uuid=46fbe58b-1d11-4451-8650-0c008017f60e,2017-12-23T23:56:30.390253,2017-12-02T03:36:47.847+01:00,True,Unnamed resource,True,False,allogalathea elegans Aquamaps Native 2050 Raster,False,d4sciencelabs,c415fab9-35e8-45df-8790-d087f71698ae,46fbe58b-1d11-4451-8650-0c008017f60e,"[{""type"": ""creation"", ""value"": ""2017-12-02T03:36:47.847+01:00""}, {""type"": ""publication"", ""value"": ""2017-12-02T03:36:47.847+01:00""}, {""type"": ""revision"", ""value"": ""2017-12-02T03:36:47.847+01:00""}]",-38.25,eng,active,2017-12-23T23:56:24.706183,"This allogalathea elegans Species Distribution Map for 2050 has been generated with the AquaMaps methodology by exploiting the technology and the computational resources provided by iMarine. In particular, this map has been produced using the HSPEC Native Range dataset, generated using the AquaMaps NativeRange 2050 algorithm. Hosted on the D4Science Thredds CataSystem.out.println: http://thredds.d4science.org",ebc02b4a-f774-4e7e-afe1-d52ab93126de,http://thredds.d4science.org/thredds/fileServer/public/netcdf/AquamapsNative2050/aquamaps_native2050_allogalathea_elegans.nc,WCS,4,47e937a4-9a1a-48b0-9d80-95d7dceb1328,180.25,"ISO 19115 Topic Category. Environmental resources, protection and conservation, for example environmental pollution, waste storage and treatment, environmental impact assessment, monitoring environmental risk, nature reserves, landscape, water quality, air quality, environmental modeling",[],"D4Science has developed a series of applications (accessible through the D4Science Labs) which can be used by any user to upload, manipulate, use and re-use products with the aim to share them with other users following the principle of the OpenScience",Dataset,D4Science Labs,bb,dataset,[],"iMarine Consortium,iMarine.eu",http://geonetwork.d4science.org:8080/geonetwork,2012-12-21T06:23:07.198+01:00,organization,info@i-marine.eu,"{""type"": ""Polygon"", ""coordinates"": [[[-179.75, -38.25], [180.25, -38.25], [180.25, 39.25], [-179.75, 39.25], [-179.75, -38.25]]]}",http://geonetwork.d4science.org:8080/geonetwork/srv/en/metadata.show?uuid=46fbe58b-1d11-4451-8650-0c008017f60e,environment,22dde829-fe22-4db6-875d-5ae13aed8a5a,2017-12-15T18:49:17.426466,bluebridge.catalogue@d4science.org,False,creation,allogalathea-elegans-aquamaps-native-2050-raster,8,2ab33976-4062-446b-92ee-a638917ee451,[],bbddee81-3966-46e4-8444-681b6f964aa9,730e5b91-2265-431e-b033-7f310474e4f3,active,7ec74634-f013-42ee-aa5f-297ead87b5d9,approved,11680099-3fd0-427c-8cfc-b1fbcde0623e,environment,active,https://ckan-bb2.d4science.org/images/organisations/d4sciencelabs.png,OGC:WFS-1.0.0-http-get-feature,iMarine.eu,dataset,2017-11-24T11:56:48.241435,11680099-3fd0-427c-8cfc-b1fbcde0623e,asNeeded,environment,http://data.d4science.org/ctlg/gCubeApps/allogalathea-elegans-aquamaps-native-2050-raster,"[{""name"": """", ""roles"": [""originator""]}]"
745d8d83-4bb8-4547-a6b4-bc0b7701efe4,0,http://node49.p.d4science.research-infrastructures.eu:9003/407/Animalia/Chordata/Actinopterygii/Clupeiformes/Engraulidae/Fis-23345/Ocean_View__Pacific.jpg,SpeciesDistribution,-180.0,active,90.0,biota,1616cc44-78d3-4404-8a0a-dae04006d46f,http://geonetwork.d4science.org:8080/geonetwork/srv/en/xml.metadata.get?uuid=1985af27-c9fc-460a-a104-290519dbc925,2017-11-29T19:47:58.189209,2013-06-19T01:02:33.404+02:00,True,WMS link to resource,True,False,Acanthastrea echinata,False,imarine,bf9c1fc6-610c-4683-9906-ab38eeb55835,1985af27-c9fc-460a-a104-290519dbc925,"[{""type"": ""creation"", ""value"": ""2012-12-19T02:25:47.391+01:00""}]",-90.0,eng,active,2017-11-29T19:47:56.447429,"This Acanthastrea echinata Species Distribution Map has been generated with the AquaMaps methodology by exploiting the technology and the computational resources provided by iMarine. In particular, this map has been produced using the HSPEC Native Range dataset, generated using AquaMaps NativeRange algorithm.",ebc02b4a-f774-4e7e-afe1-d52ab93126de,"http://geoserver4.d4science.research-infrastructures.eu/geoserver/wms?service=wms&version=1.1.0&request=GetMap&layers=lacanthastreaechinata20121219022521797cet&styles=&bbox=-180,-90,180,90&width=676&height=330&srs=EPSG:4326&crs=EPSG:4326&format=application/openlayers",WMS,4,7614324,180.0,"ISO 19115 Topic Category. Flora or fauna in natural environment, for example wildlife, vegetation, biological sciences, ecology, wilderness, sea life, wetlands, habitat, biological resources",[],"iMarine is an access point to a number of Virtual Research Environments deployed and operated in the context of the iMarine project to support the Ecosystem Approach to fisheries management and conservation of marine living resources. It empowers practitioners and policy makers from multiple scientific fields such as fisheries, biodiversity and ocean observation by ensuring that otherwise dispersed and heterogeneous data is available to all stakeholder communities through a shared virtual environment that brings together multidisciplinary data sources, supports cross-cutting scientific analysis, and assists communication.
See More: https://i-marine.d4science.org/",Dataset,iMarine,bb,dataset,[],"iMarine Consortium,iMarine.eu",http://geonetwork.d4science.org:8080/geonetwork,2013-04-13T05:53:37.923+02:00,organization,info@i-marine.eu,"{""type"": ""Polygon"", ""coordinates"": [[[-180.0, -90.0], [180.0, -90.0], [180.0, 90.0], [-180.0, 90.0], [-180.0, -90.0]]]}",http://geonetwork.d4science.org:8080/geonetwork/srv/en/metadata.show?uuid=1985af27-c9fc-460a-a104-290519dbc925,biota,70a489ea-a910-40b8-ae63-431084dc99a6,2017-09-22T05:52:42.774572,bluebridge.catalogue@d4science.org,False,creation,acanthastrea-echinata,7,1616cc44-78d3-4404-8a0a-dae04006d46f,[],04d63dac-7117-492b-9776-59ed7c78d393,7bf889d1-7829-4c2e-ad72-222798006eee,active,745d8d83-4bb8-4547-a6b4-bc0b7701efe4,approved,81f5e6ae-92ab-410a-9a75-f809d43ec1ee,biota,active,https://ckan-bb2.d4science.org/images/organisations/imarine.png,OGC:WFS-1.0.0-http-get-feature,iMarine.eu,dataset,2017-11-24T11:56:37.199304,81f5e6ae-92ab-410a-9a75-f809d43ec1ee,asNeeded,biota,http://data.d4science.org/ctlg/d4science.research-infrastructures.eu/acanthastrea-echinata,"[{""name"": ""iMarine Consortium"", ""roles"": [""author""]}, {""name"": ""iMarine.eu"", ""roles"": [""distributor"", ""resourceProvider""]}]"
