f5336376-5506-43f7-8166-bfc3cf9a2e4f,0,http://node49.p.d4science.research-infrastructures.eu:9003/407/Animalia/Chordata/Actinopterygii/Perciformes/Acanthuridae/Fis-25282/Ocean_View__Pacific.jpg,Probability Distribution,-179.75,active,41.25,environment,05e09375-81fa-4d45-baa9-bbce0fb59d85,http://geonetwork.d4science.org:8080/geonetwork/srv/en/xml.metadata.get?uuid=d90ee76c-8c68-41e4-827a-f8a96f8f0e52,2017-11-26T11:08:28.870479,2017-10-10T17:52:01.013+02:00,True,Unnamed resource,True,False,Amblyrhynchotes Honckenii Aquamaps Native Raster,False,d4sciencelabs,a7c76a5b-1958-4cb7-b86e-b8def0ecf580,d90ee76c-8c68-41e4-827a-f8a96f8f0e52,"[{""type"": ""creation"", ""value"": ""2017-10-10T17:52:01.013+02:00""}, {""type"": ""publication"", ""value"": ""2017-10-10T17:52:01.013+02:00""}, {""type"": ""revision"", ""value"": ""2017-10-10T17:52:01.013+02:00""}]",-44.75,eng,active,2017-11-26T11:08:27.844980,"This Amblyrhynchotes Honckenii Species Distribution Map has been generated with the AquaMaps methodology by exploiting the technology and the computational resources provided by iMarine. In particular, this map has been produced using the HSPEC Native Range dataset, generated using the AquaMaps NativeRange algorithm. Hosted on the D4Science Thredds CataSystem.out.println: http://thredds.d4science.org",ebc02b4a-f774-4e7e-afe1-d52ab93126de,http://thredds.d4science.org/thredds/fileServer/public/netcdf/AquamapsNative/aquamaps_native_amblyrhynchotes_honckenii.nc,WCS,4,5cc4da08-c7be-4ebd-be59-be686e5d1d41,180.25,"ISO 19115 Topic Category. Environmental resources, protection and conservation, for example environmental pollution, waste storage and treatment, environmental impact assessment, monitoring environmental risk, nature reserves, landscape, water quality, air quality, environmental modeling",[],"D4Science has developed a series of applications (accessible through the D4Science Labs) which can be used by any user to upload, manipulate, use and re-use products with the aim to share them with other users following the principle of the OpenScience",Dataset,D4Science Labs,bb,dataset,[],"iMarine Consortium,iMarine.eu",http://geonetwork.d4science.org:8080/geonetwork,2013-04-13T10:56:01.615+02:00,organization,info@i-marine.eu,"{""type"": ""Polygon"", ""coordinates"": [[[-179.75, -44.75], [180.25, -44.75], [180.25, 41.25], [-179.75, 41.25], [-179.75, -44.75]]]}",http://geonetwork.d4science.org:8080/geonetwork/srv/en/metadata.show?uuid=d90ee76c-8c68-41e4-827a-f8a96f8f0e52,environment,22dde829-fe22-4db6-875d-5ae13aed8a5a,2017-10-13T17:24:39.970583,bluebridge.catalogue@d4science.org,False,creation,amblyrhynchotes-honckenii-aquamaps-native-raster,8,05e09375-81fa-4d45-baa9-bbce0fb59d85,[],d6bc9a92-0d2b-4f1b-b906-401e6d78502d,730e5b91-2265-431e-b033-7f310474e4f3,active,f5336376-5506-43f7-8166-bfc3cf9a2e4f,approved,11680099-3fd0-427c-8cfc-b1fbcde0623e,environment,active,https://ckan-bb2.d4science.org/images/organisations/d4sciencelabs.png,OGC:WFS-1.0.0-http-get-feature,iMarine.eu,dataset,2017-11-24T11:56:48.241435,11680099-3fd0-427c-8cfc-b1fbcde0623e,asNeeded,environment,http://data.d4science.org/ctlg/gCubeApps/amblyrhynchotes-honckenii-aquamaps-native-raster,"[{""name"": """", ""roles"": [""originator""]}]"
ea1f1bba-a790-4d71-8ea5-9812fa209fe0,0,http://node49.p.d4science.research-infrastructures.eu:9003/407/Animalia/Chordata/Actinopterygii/Perciformes/Anarhichadidae/Fis-29624/Ocean_View__Pacific.jpg,Probability Distribution,-97.25,active,61.25,environment,9dc11e38-7d8d-46ec-ba94-f400ee99367c,http://geonetwork.d4science.org:8080/geonetwork/srv/en/xml.metadata.get?uuid=d2905e95-2653-418b-bc9c-9bac4c8bdfd8,2017-12-25T02:49:02.059934,2017-12-03T10:28:39.675+01:00,True,Unnamed resource,True,False,anacanthobatis folirostris Aquamaps Native 2050 Raster,False,d4sciencelabs,45b96a2a-da0e-4987-a61a-a4458aefb966,d2905e95-2653-418b-bc9c-9bac4c8bdfd8,"[{""type"": ""creation"", ""value"": ""2017-12-03T10:28:39.675+01:00""}, {""type"": ""publication"", ""value"": ""2017-12-03T10:28:39.675+01:00""}, {""type"": ""revision"", ""value"": ""2017-12-03T10:28:39.675+01:00""}]",-54.75,eng,active,2017-12-25T02:48:57.857751,"This anacanthobatis folirostris Species Distribution Map for 2050 has been generated with the AquaMaps methodology by exploiting the technology and the computational resources provided by iMarine. In particular, this map has been produced using the HSPEC Native Range dataset, generated using the AquaMaps NativeRange 2050 algorithm. Hosted on the D4Science Thredds CataSystem.out.println: http://thredds.d4science.org",ebc02b4a-f774-4e7e-afe1-d52ab93126de,http://thredds.d4science.org/thredds/fileServer/public/netcdf/AquamapsNative2050/aquamaps_native2050_anacanthobatis_folirostris.nc,WCS,4,98b8a0be-dd88-4587-b68a-c57f6fc77b98,-34.25,"ISO 19115 Topic Category. Environmental resources, protection and conservation, for example environmental pollution, waste storage and treatment, environmental impact assessment, monitoring environmental risk, nature reserves, landscape, water quality, air quality, environmental modeling",[],"D4Science has developed a series of applications (accessible through the D4Science Labs) which can be used by any user to upload, manipulate, use and re-use products with the aim to share them with other users following the principle of the OpenScience",Dataset,D4Science Labs,bb,dataset,[],"iMarine Consortium,iMarine.eu",http://geonetwork.d4science.org:8080/geonetwork,2013-04-13T21:32:23.906+02:00,organization,info@i-marine.eu,"{""type"": ""Polygon"", ""coordinates"": [[[-97.25, -54.75], [-34.25, -54.75], [-34.25, 61.25], [-97.25, 61.25], [-97.25, -54.75]]]}",http://geonetwork.d4science.org:8080/geonetwork/srv/en/metadata.show?uuid=d2905e95-2653-418b-bc9c-9bac4c8bdfd8,environment,22dde829-fe22-4db6-875d-5ae13aed8a5a,2017-12-15T19:49:56.358000,bluebridge.catalogue@d4science.org,False,creation,anacanthobatis-folirostris-aquamaps-native-2050-raster,8,9dc11e38-7d8d-46ec-ba94-f400ee99367c,[],10519394-dbe0-4b93-a396-4efdab3cc9b5,730e5b91-2265-431e-b033-7f310474e4f3,active,ea1f1bba-a790-4d71-8ea5-9812fa209fe0,approved,11680099-3fd0-427c-8cfc-b1fbcde0623e,environment,active,https://ckan-bb2.d4science.org/images/organisations/d4sciencelabs.png,OGC:WFS-1.0.0-http-get-feature,iMarine.eu,dataset,2017-11-24T11:56:48.241435,11680099-3fd0-427c-8cfc-b1fbcde0623e,asNeeded,environment,http://data.d4science.org/ctlg/gCubeApps/anacanthobatis-folirostris-aquamaps-native-2050-raster,"[{""name"": """", ""roles"": [""originator""]}]"
69e951df-f8c1-414a-b2fd-0d670cbfabf9,0,http://node49.p.d4science.research-infrastructures.eu:9003/405/Animalia/Chordata/Actinopterygii/Perciformes/Anarhichadidae/Fis-29626/Ocean_View__Pacific.jpg,SpeciesDistribution,-179.75,active,37.25,environment,848da6f9-11d3-4453-9c3f-8643d67bb7c4,http://geonetwork.d4science.org:8080/geonetwork/srv/en/xml.metadata.get?uuid=a822caae-1e3f-4841-b5ce-e0772a579a52,2017-12-23T19:02:41.387634,2017-12-02T04:08:32.256+01:00,True,Unnamed resource,True,False,andamia tetradactylus Aquamaps Native 2050 Raster,False,d4sciencelabs,172d04b9-eb96-4684-a7e3-0cf40b2b8af4,a822caae-1e3f-4841-b5ce-e0772a579a52,"[{""type"": ""creation"", ""value"": ""2017-12-02T04:08:32.256+01:00""}, {""type"": ""publication"", ""value"": ""2017-12-02T04:08:32.256+01:00""}, {""type"": ""revision"", ""value"": ""2017-12-02T04:08:32.256+01:00""}]",-25.75,eng,active,2017-12-23T19:02:39.111263,"This andamia tetradactylus Species Distribution Map for 2050 has been generated with the AquaMaps methodology by exploiting the technology and the computational resources provided by iMarine. In particular, this map has been produced using the HSPEC Native Range dataset, generated using the AquaMaps NativeRange 2050 algorithm. Hosted on the D4Science Thredds CataSystem.out.println: http://thredds.d4science.org",ebc02b4a-f774-4e7e-afe1-d52ab93126de,http://thredds.d4science.org/thredds/fileServer/public/netcdf/AquamapsNative2050/aquamaps_native2050_andamia_tetradactylus.nc,WCS,4,4b37c359-45d6-43cc-93f7-4d01c1c8d394,180.25,"ISO 19115 Topic Category. Environmental resources, protection and conservation, for example environmental pollution, waste storage and treatment, environmental impact assessment, monitoring environmental risk, nature reserves, landscape, water quality, air quality, environmental modeling",[],"D4Science has developed a series of applications (accessible through the D4Science Labs) which can be used by any user to upload, manipulate, use and re-use products with the aim to share them with other users following the principle of the OpenScience",Dataset,D4Science Labs,bb,dataset,[],"iMarine Consortium,iMarine.eu",http://geonetwork.d4science.org:8080/geonetwork,2013-04-12T08:17:07.620+02:00,organization,info@i-marine.eu,"{""type"": ""Polygon"", ""coordinates"": [[[-179.75, -25.75], [180.25, -25.75], [180.25, 37.25], [-179.75, 37.25], [-179.75, -25.75]]]}",http://geonetwork.d4science.org:8080/geonetwork/srv/en/metadata.show?uuid=a822caae-1e3f-4841-b5ce-e0772a579a52,environment,22dde829-fe22-4db6-875d-5ae13aed8a5a,2017-12-15T18:04:09.659291,bluebridge.catalogue@d4science.org,False,creation,andamia-tetradactylus-aquamaps-native-2050-raster,8,848da6f9-11d3-4453-9c3f-8643d67bb7c4,[],dc5fd509-8c8a-4fac-8537-4af7bd2eef9e,730e5b91-2265-431e-b033-7f310474e4f3,active,69e951df-f8c1-414a-b2fd-0d670cbfabf9,approved,11680099-3fd0-427c-8cfc-b1fbcde0623e,environment,active,https://ckan-bb2.d4science.org/images/organisations/d4sciencelabs.png,OGC:WFS-1.0.0-http-get-feature,iMarine.eu,dataset,2017-11-24T11:56:48.241435,11680099-3fd0-427c-8cfc-b1fbcde0623e,asNeeded,environment,http://data.d4science.org/ctlg/gCubeApps/andamia-tetradactylus-aquamaps-native-2050-raster,"[{""name"": """", ""roles"": [""originator""]}]"
fc727e77-a964-40ed-adc7-0970555c5868,0,http://node49.p.d4science.research-infrastructures.eu:9003/80/Animalia/Chordata/Actinopterygii/Anguilliformes/Muraenidae/Fis-28980/Earth.jpg,Lamarck s sheet coral,-180.0,active,90.0,biota,65c09bfa-837e-4574-a6ab-60e599409209,http://geonetwork.d4science.org:8080/geonetwork/srv/en/xml.metadata.get?uuid=a350d17e-5417-4302-978a-f1c524a822e7,2017-12-01T04:26:37.557318,2013-06-19T15:05:08.734+02:00,True,WMS link to resource,True,False,Aioliops tetrophthalmus,False,imarine,172d04b9-eb96-4684-a7e3-0cf40b2b8af4,a350d17e-5417-4302-978a-f1c524a822e7,"[{""type"": ""creation"", ""value"": ""2013-04-13T00:37:40.912+02:00""}]",-90.0,eng,active,2017-12-01T04:26:34.242968,"This Aioliops tetrophthalmus Species Distribution Map has been generated with the AquaMaps methodology by exploiting the technology and the computational resources provided by iMarine. In particular, this map has been produced using the Default Suitable 2050 maps_SuitableRange2050 dataset, generated using AquaMaps SuitableRange2050 algorithm.",ebc02b4a-f774-4e7e-afe1-d52ab93126de,"http://geoserver2.d4science.research-infrastructures.eu/geoserver/wms?service=wms&version=1.1.0&request=GetMap&layers=laioliopstetrophthalmus20130413003713374cest&styles=&bbox=-180,-90,180,90&width=676&height=330&srs=EPSG:4326&crs=EPSG:4326&format=application/openlayers",WMS,4,7614324,180.0,"ISO 19115 Topic Category. Flora or fauna in natural environment, for example wildlife, vegetation, biological sciences, ecology, wilderness, sea life, wetlands, habitat, biological resources",[],"iMarine is an access point to a number of Virtual Research Environments deployed and operated in the context of the iMarine project to support the Ecosystem Approach to fisheries management and conservation of marine living resources. It empowers practitioners and policy makers from multiple scientific fields such as fisheries, biodiversity and ocean observation by ensuring that otherwise dispersed and heterogeneous data is available to all stakeholder communities through a shared virtual environment that brings together multidisciplinary data sources, supports cross-cutting scientific analysis, and assists communication.
See More: https://i-marine.d4science.org/",Dataset,iMarine,bb,dataset,[],"iMarine Consortium,iMarine.eu",http://geonetwork.d4science.org:8080/geonetwork,2012-12-07T16:49:15.854+01:00,organization,info@i-marine.eu,"{""type"": ""Polygon"", ""coordinates"": [[[-180.0, -90.0], [180.0, -90.0], [180.0, 90.0], [-180.0, 90.0], [-180.0, -90.0]]]}",http://geonetwork.d4science.org:8080/geonetwork/srv/en/metadata.show?uuid=a350d17e-5417-4302-978a-f1c524a822e7,biota,70a489ea-a910-40b8-ae63-431084dc99a6,2017-09-21T18:17:13.919662,bluebridge.catalogue@d4science.org,False,creation,aioliops-tetrophthalmus,7,65c09bfa-837e-4574-a6ab-60e599409209,[],f6de5b8b-753b-4cc8-bb1c-4e37f385b5a7,7bf889d1-7829-4c2e-ad72-222798006eee,active,fc727e77-a964-40ed-adc7-0970555c5868,approved,81f5e6ae-92ab-410a-9a75-f809d43ec1ee,biota,active,https://ckan-bb2.d4science.org/images/organisations/imarine.png,WWW:LINK-1.0-http--link,iMarine.eu,dataset,2017-11-24T11:56:37.199304,81f5e6ae-92ab-410a-9a75-f809d43ec1ee,asNeeded,biota,http://data.d4science.org/ctlg/d4science.research-infrastructures.eu/aioliops-tetrophthalmus,"[{""name"": ""iMarine Consortium"", ""roles"": [""author""]}, {""name"": ""iMarine.eu"", ""roles"": [""distributor"", ""resourceProvider""]}]"
4a25c988-8ff9-41be-8e3e-20dcc648482d,0,http://node49.p.d4science.research-infrastructures.eu:9003/83/Animalia/Chordata/Actinopterygii/Perciformes/Percophidae/Fis-115260/Earth.jpg,Raster,-180.0,active,90.0,biota,95de16c9-a8d9-4f6a-a77c-9d035498f981,http://geonetwork.d4science.org:8080/geonetwork/srv/en/xml.metadata.get?uuid=f8ead86b-8cfd-432f-862a-f84cb94e50ea,2017-11-29T09:29:48.100335,2013-06-19T20:10:36.678+02:00,True,WMS link to resource,True,False,Agaricia lamarcki,False,imarine,172d04b9-eb96-4684-a7e3-0cf40b2b8af4,f8ead86b-8cfd-432f-862a-f84cb94e50ea,"[{""type"": ""creation"", ""value"": ""2013-04-14T23:11:20.822+02:00""}]",-90.0,eng,active,2017-11-29T09:29:46.772651,"This Agaricia lamarcki Species Distribution Map has been generated with the AquaMaps methodology by exploiting the technology and the computational resources provided by iMarine. In particular, this map has been produced using the Default Suitable 2050 maps_SuitableRange2050 dataset, generated using AquaMaps SuitableRange2050 algorithm.",ebc02b4a-f774-4e7e-afe1-d52ab93126de,"http://geoserver4.d4science.research-infrastructures.eu/geoserver/wms?service=wms&version=1.1.0&request=GetMap&layers=lagaricialamarcki20130414231104507cest&styles=&bbox=-180,-90,180,90&width=676&height=330&srs=EPSG:4326&crs=EPSG:4326&format=application/openlayers",WMS,4,7614324,180.0,"ISO 19115 Topic Category. Flora or fauna in natural environment, for example wildlife, vegetation, biological sciences, ecology, wilderness, sea life, wetlands, habitat, biological resources",[],"iMarine is an access point to a number of Virtual Research Environments deployed and operated in the context of the iMarine project to support the Ecosystem Approach to fisheries management and conservation of marine living resources. It empowers practitioners and policy makers from multiple scientific fields such as fisheries, biodiversity and ocean observation by ensuring that otherwise dispersed and heterogeneous data is available to all stakeholder communities through a shared virtual environment that brings together multidisciplinary data sources, supports cross-cutting scientific analysis, and assists communication.
See More: https://i-marine.d4science.org/",Dataset,iMarine,bb,dataset,[],"iMarine Consortium,iMarine.eu",http://geonetwork.d4science.org:8080/geonetwork,2012-12-19T23:04:49.401+01:00,organization,info@i-marine.eu,"{""type"": ""Polygon"", ""coordinates"": [[[-180.0, -90.0], [180.0, -90.0], [180.0, 90.0], [-180.0, 90.0], [-180.0, -90.0]]]}",http://geonetwork.d4science.org:8080/geonetwork/srv/en/metadata.show?uuid=f8ead86b-8cfd-432f-862a-f84cb94e50ea,biota,70a489ea-a910-40b8-ae63-431084dc99a6,2017-09-22T02:52:51.465489,bluebridge.catalogue@d4science.org,False,creation,agaricia-lamarcki1,8,95de16c9-a8d9-4f6a-a77c-9d035498f981,[],de6fbafd-a6f2-48a0-a6ea-e370f2f610f3,7bf889d1-7829-4c2e-ad72-222798006eee,active,4a25c988-8ff9-41be-8e3e-20dcc648482d,approved,81f5e6ae-92ab-410a-9a75-f809d43ec1ee,biota,active,https://ckan-bb2.d4science.org/images/organisations/imarine.png,OGC:WFS-1.0.0-http-get-feature,iMarine.eu,dataset,2017-11-24T11:56:37.199304,81f5e6ae-92ab-410a-9a75-f809d43ec1ee,asNeeded,biota,http://data.d4science.org/ctlg/d4science.research-infrastructures.eu/agaricia-lamarcki1,"[{""name"": ""iMarine Consortium"", ""roles"": [""author""]}, {""name"": ""iMarine.eu"", ""roles"": [""distributor"", ""resourceProvider""]}]"
17efc5c7-e438-404a-9b28-5e570cf8e03d,0,http://node49.p.d4science.research-infrastructures.eu:9003/405/Animalia/Chordata/Actinopterygii/Pleuronectiformes/Paralichthyidae/Fis-24419/Ocean_View__Pacific.jpg,Raster,-172.75,active,61.75,environment,c3216d06-280b-4ba7-a9dd-fac14ef59604,http://geonetwork.d4science.org:8080/geonetwork/srv/en/xml.metadata.get?uuid=978ad22b-911c-4c53-b8f5-2e9b123517b8,2017-12-22T23:51:25.219569,2017-12-03T10:28:39.675+01:00,True,Unnamed resource,True,False,acipenser transmontanus Aquamaps Native 2050 Raster,False,d4sciencelabs,c415fab9-35e8-45df-8790-d087f71698ae,978ad22b-911c-4c53-b8f5-2e9b123517b8,"[{""type"": ""creation"", ""value"": ""2017-12-03T10:28:39.675+01:00""}, {""type"": ""publication"", ""value"": ""2017-12-03T10:28:39.675+01:00""}, {""type"": ""revision"", ""value"": ""2017-12-03T10:28:39.675+01:00""}]",18.25,eng,active,2017-12-22T23:51:21.724759,"This acipenser transmontanus Species Distribution Map for 2050 has been generated with the AquaMaps methodology by exploiting the technology and the computational resources provided by iMarine. In particular, this map has been produced using the HSPEC Native Range dataset, generated using the AquaMaps NativeRange 2050 algorithm. Hosted on the D4Science Thredds CataSystem.out.println: http://thredds.d4science.org",ebc02b4a-f774-4e7e-afe1-d52ab93126de,http://thredds.d4science.org/thredds/fileServer/public/netcdf/AquamapsNative2050/aquamaps_native2050_acipenser_transmontanus.nc,WCS,4,AquaMaps,-101.75,"ISO 19115 Topic Category. Environmental resources, protection and conservation, for example environmental pollution, waste storage and treatment, environmental impact assessment, monitoring environmental risk, nature reserves, landscape, water quality, air quality, environmental modeling",[],"D4Science has developed a series of applications (accessible through the D4Science Labs) which can be used by any user to upload, manipulate, use and re-use products with the aim to share them with other users following the principle of the OpenScience",Dataset,D4Science Labs,bb,dataset,[],"iMarine Consortium,iMarine.eu",http://geonetwork.d4science.org:8080/geonetwork,2013-04-12T01:33:21.519+02:00,organization,info@i-marine.eu,"{""type"": ""Polygon"", ""coordinates"": [[[-172.75, 18.25], [-101.75, 18.25], [-101.75, 61.75], [-172.75, 61.75], [-172.75, 18.25]]]}",http://geonetwork.d4science.org:8080/geonetwork/srv/en/metadata.show?uuid=978ad22b-911c-4c53-b8f5-2e9b123517b8,environment,22dde829-fe22-4db6-875d-5ae13aed8a5a,2017-12-15T23:29:13.347280,bluebridge.catalogue@d4science.org,False,creation,acipenser-transmontanus-aquamaps-native-2050-raster,8,c3216d06-280b-4ba7-a9dd-fac14ef59604,[],6f7e1bce-b4a2-465e-b0e1-7d19dcdb0fc1,730e5b91-2265-431e-b033-7f310474e4f3,active,17efc5c7-e438-404a-9b28-5e570cf8e03d,approved,11680099-3fd0-427c-8cfc-b1fbcde0623e,environment,active,https://ckan-bb2.d4science.org/images/organisations/d4sciencelabs.png,OGC:WFS-1.0.0-http-get-feature,iMarine.eu,dataset,2017-11-24T11:56:48.241435,11680099-3fd0-427c-8cfc-b1fbcde0623e,asNeeded,environment,http://data.d4science.org/ctlg/gCubeApps/acipenser-transmontanus-aquamaps-native-2050-raster,"[{""name"": """", ""roles"": [""originator""]}]"
7bb38141-20ec-4736-a60c-2b052056088c,0,http://node49.p.d4science.research-infrastructures.eu:9003/407/Animalia/Chordata/Actinopterygii/Clupeiformes/Clupeidae/Fis-23369/Ocean_View__Pacific.jpg,SpeciesDistribution,-43.75,active,80.75,environment,3d110c96-b3ca-4bb3-aea9-fa9bafb137ee,http://geonetwork.d4science.org:8080/geonetwork/srv/en/xml.metadata.get?uuid=8994163a-bde1-4ce7-818d-020a0cc41790,2017-12-23T23:10:54.155617,2017-12-03T10:28:39.675+01:00,True,Unnamed resource,True,False,acanthocardia paucicostata Aquamaps Native 2050 Raster,False,d4sciencelabs,bf9c1fc6-610c-4683-9906-ab38eeb55835,8994163a-bde1-4ce7-818d-020a0cc41790,"[{""type"": ""creation"", ""value"": ""2017-12-03T10:28:39.675+01:00""}, {""type"": ""publication"", ""value"": ""2017-12-03T10:28:39.675+01:00""}, {""type"": ""revision"", ""value"": ""2017-12-03T10:28:39.675+01:00""}]",34.75,eng,active,2017-12-23T23:10:51.533237,"This acanthocardia paucicostata Species Distribution Map for 2050 has been generated with the AquaMaps methodology by exploiting the technology and the computational resources provided by iMarine. In particular, this map has been produced using the HSPEC Native Range dataset, generated using the AquaMaps NativeRange 2050 algorithm. Hosted on the D4Science Thredds CataSystem.out.println: http://thredds.d4science.org",ebc02b4a-f774-4e7e-afe1-d52ab93126de,http://thredds.d4science.org/thredds/fileServer/public/netcdf/AquamapsNative2050/aquamaps_native2050_acanthocardia_paucicostata.nc,WCS,4,AquaMaps,67.75,"ISO 19115 Topic Category. Environmental resources, protection and conservation, for example environmental pollution, waste storage and treatment, environmental impact assessment, monitoring environmental risk, nature reserves, landscape, water quality, air quality, environmental modeling",[],"D4Science has developed a series of applications (accessible through the D4Science Labs) which can be used by any user to upload, manipulate, use and re-use products with the aim to share them with other users following the principle of the OpenScience",Dataset,D4Science Labs,bb,dataset,[],"iMarine Consortium,iMarine.eu",http://geonetwork.d4science.org:8080/geonetwork,2013-04-13T05:50:13.390+02:00,organization,info@i-marine.eu,"{""type"": ""Polygon"", ""coordinates"": [[[-43.75, 34.75], [67.75, 34.75], [67.75, 80.75], [-43.75, 80.75], [-43.75, 34.75]]]}",http://geonetwork.d4science.org:8080/geonetwork/srv/en/metadata.show?uuid=8994163a-bde1-4ce7-818d-020a0cc41790,environment,22dde829-fe22-4db6-875d-5ae13aed8a5a,2017-12-16T00:00:51.038175,bluebridge.catalogue@d4science.org,False,creation,acanthocardia-paucicostata-aquamaps-native-2050-raster,8,3d110c96-b3ca-4bb3-aea9-fa9bafb137ee,[],b75b7f61-a110-4c79-a65a-13ebdd616575,730e5b91-2265-431e-b033-7f310474e4f3,active,7bb38141-20ec-4736-a60c-2b052056088c,approved,11680099-3fd0-427c-8cfc-b1fbcde0623e,environment,active,https://ckan-bb2.d4science.org/images/organisations/d4sciencelabs.png,OGC:WFS-1.0.0-http-get-feature,iMarine.eu,dataset,2017-11-24T11:56:48.241435,11680099-3fd0-427c-8cfc-b1fbcde0623e,asNeeded,environment,http://data.d4science.org/ctlg/gCubeApps/acanthocardia-paucicostata-aquamaps-native-2050-raster,"[{""name"": """", ""roles"": [""originator""]}]"
