a6bffe8a-3990-4599-b0b7-8987212e9558,0,http://node49.p.d4science.research-infrastructures.eu:9003/83/Animalia/Chordata/Actinopterygii/Perciformes/Acanthuridae/Fis-31079/Ocean_View__Pacific.jpg,NetCDF,-179.75,active,38.25,environment,fd7c6a28-7308-4c16-be63-9d49757009f6,http://geonetwork.d4science.org:8080/geonetwork/srv/en/xml.metadata.get?uuid=8ae53b6d-294f-4a03-8cc5-4c17fc56086a,2017-11-25T15:15:12.548791,2017-10-10T17:48:13.506+02:00,True,Unnamed resource,True,False,Actinopyga Mauritiana Aquamaps Native Raster,False,d4sciencelabs,172d04b9-eb96-4684-a7e3-0cf40b2b8af4,8ae53b6d-294f-4a03-8cc5-4c17fc56086a,"[{""type"": ""creation"", ""value"": ""2017-10-10T17:48:13.506+02:00""}, {""type"": ""publication"", ""value"": ""2017-10-10T17:48:13.506+02:00""}, {""type"": ""revision"", ""value"": ""2017-10-10T17:48:13.506+02:00""}]",-38.75,eng,active,2017-11-25T15:15:11.531224,"This Actinopyga Mauritiana Species Distribution Map has been generated with the AquaMaps methodology by exploiting the technology and the computational resources provided by iMarine. In particular, this map has been produced using the HSPEC Native Range dataset, generated using the AquaMaps NativeRange algorithm. Hosted on the D4Science Thredds CataSystem.out.println: http://thredds.d4science.org",ebc02b4a-f774-4e7e-afe1-d52ab93126de,http://thredds.d4science.org/thredds/fileServer/public/netcdf/AquamapsNative/aquamaps_native_actinopyga_mauritiana.nc,WCS,4,4ac289eb-0b8a-4e74-8058-90aaf29d3089,180.25,"ISO 19115 Topic Category. Environmental resources, protection and conservation, for example environmental pollution, waste storage and treatment, environmental impact assessment, monitoring environmental risk, nature reserves, landscape, water quality, air quality, environmental modeling",[],"D4Science has developed a series of applications (accessible through the D4Science Labs) which can be used by any user to upload, manipulate, use and re-use products with the aim to share them with other users following the principle of the OpenScience",Dataset,D4Science Labs,bb,dataset,[],"iMarine Consortium,iMarine.eu",http://geonetwork.d4science.org:8080/geonetwork,2012-12-21T03:10:05.607+01:00,organization,info@i-marine.eu,"{""type"": ""Polygon"", ""coordinates"": [[[-179.75, -38.75], [180.25, -38.75], [180.25, 38.25], [-179.75, 38.25], [-179.75, -38.75]]]}",http://geonetwork.d4science.org:8080/geonetwork/srv/en/metadata.show?uuid=8ae53b6d-294f-4a03-8cc5-4c17fc56086a,environment,22dde829-fe22-4db6-875d-5ae13aed8a5a,2017-10-13T17:38:48.690487,bluebridge.catalogue@d4science.org,False,creation,actinopyga-mauritiana-aquamaps-native-raster,8,fd7c6a28-7308-4c16-be63-9d49757009f6,[],d3f0ea74-4b45-471b-9539-7f89c6891063,730e5b91-2265-431e-b033-7f310474e4f3,active,a6bffe8a-3990-4599-b0b7-8987212e9558,approved,11680099-3fd0-427c-8cfc-b1fbcde0623e,environment,active,https://ckan-bb2.d4science.org/images/organisations/d4sciencelabs.png,OGC:WFS-1.0.0-http-get-feature,iMarine.eu,dataset,2017-11-24T11:56:48.241435,11680099-3fd0-427c-8cfc-b1fbcde0623e,asNeeded,environment,http://data.d4science.org/ctlg/gCubeApps/actinopyga-mauritiana-aquamaps-native-raster,"[{""name"": """", ""roles"": [""originator""]}]"
81b669b3-7e63-4ee0-8fa9-cb08779710cc,0,http://node49.p.d4science.research-infrastructures.eu:9003/80/Animalia/Arthropoda/Malacostraca/Decapoda/Alpheidae/ITS-96623/Ocean_View__Pacific.jpg,SpeciesDistribution,-180.0,active,90.0,biota,c32b7e3f-3056-4dbb-9638-92b83f4b7c63,http://geonetwork.d4science.org:8080/geonetwork/srv/en/xml.metadata.get?uuid=2c3ea1fa-7450-4b2a-aa9e-9f481270ba51,2017-11-25T07:54:55.271343,2013-06-18T22:07:07.629+02:00,True,WMS link to resource,True,False,Acanthurus dussumieri,False,imarine,c415fab9-35e8-45df-8790-d087f71698ae,2c3ea1fa-7450-4b2a-aa9e-9f481270ba51,"[{""type"": ""creation"", ""value"": ""2012-12-18T04:56:34.363+01:00""}]",-90.0,eng,active,2017-11-25T07:54:54.734490,"This Acanthurus dussumieri Species Distribution Map has been generated with the AquaMaps methodology by exploiting the technology and the computational resources provided by iMarine. In particular, this map has been produced using the HSPEC Native Range dataset, generated using AquaMaps NativeRange algorithm.",ebc02b4a-f774-4e7e-afe1-d52ab93126de,"http://geoserver2.d4science.research-infrastructures.eu/geoserver/wms?service=wms&version=1.1.0&request=GetMap&layers=lacanthurusdussumieri20121218045620048cet&styles=&bbox=-180,-90,180,90&width=676&height=330&srs=EPSG:4326&crs=EPSG:4326&format=application/openlayers",WMS,4,Acanthurus dussumieri,180.0,"ISO 19115 Topic Category. Flora or fauna in natural environment, for example wildlife, vegetation, biological sciences, ecology, wilderness, sea life, wetlands, habitat, biological resources",[],"iMarine is an access point to a number of Virtual Research Environments deployed and operated in the context of the iMarine project to support the Ecosystem Approach to fisheries management and conservation of marine living resources. It empowers practitioners and policy makers from multiple scientific fields such as fisheries, biodiversity and ocean observation by ensuring that otherwise dispersed and heterogeneous data is available to all stakeholder communities through a shared virtual environment that brings together multidisciplinary data sources, supports cross-cutting scientific analysis, and assists communication.
See More: https://i-marine.d4science.org/",Dataset,iMarine,bb,dataset,[],"iMarine Consortium,iMarine.eu",http://geonetwork.d4science.org:8080/geonetwork,2012-12-17T16:28:20.886+01:00,organization,info@i-marine.eu,"{""type"": ""Polygon"", ""coordinates"": [[[-180.0, -90.0], [180.0, -90.0], [180.0, 90.0], [-180.0, 90.0], [-180.0, -90.0]]]}",http://geonetwork.d4science.org:8080/geonetwork/srv/en/metadata.show?uuid=2c3ea1fa-7450-4b2a-aa9e-9f481270ba51,biota,70a489ea-a910-40b8-ae63-431084dc99a6,2017-09-21T16:25:51.431281,bluebridge.catalogue@d4science.org,False,creation,acanthurus-dussumieri,6,c32b7e3f-3056-4dbb-9638-92b83f4b7c63,[],62307314-9cef-4581-be21-16844c19e438,7bf889d1-7829-4c2e-ad72-222798006eee,active,81b669b3-7e63-4ee0-8fa9-cb08779710cc,approved,81f5e6ae-92ab-410a-9a75-f809d43ec1ee,biota,active,https://ckan-bb2.d4science.org/images/organisations/imarine.png,OGC:WFS-1.0.0-http-get-feature,iMarine.eu,dataset,2017-11-24T11:56:37.199304,81f5e6ae-92ab-410a-9a75-f809d43ec1ee,asNeeded,biota,http://data.d4science.org/ctlg/d4science.research-infrastructures.eu/acanthurus-dussumieri,"[{""name"": ""iMarine Consortium"", ""roles"": [""author""]}, {""name"": ""iMarine.eu"", ""roles"": [""distributor"", ""resourceProvider""]}]"
6070dfe0-4bd6-4f1e-9808-cf764f3d8382,0,http://node49.p.d4science.research-infrastructures.eu:9003/83/Animalia/Chordata/Actinopterygii/Perciformes/Labridae/Fis-29141/Earth.jpg,NetCDF,-41.75,active,63.25,environment,78e6bc88-357a-4ea7-9cb4-3e4c44a6113d,http://geonetwork.d4science.org:8080/geonetwork/srv/en/xml.metadata.get?uuid=776b60cd-dbf5-4bb4-ae44-657f6fc7f642,2017-11-25T01:35:07.664030,2017-10-10T17:46:17.495+02:00,True,Unnamed resource,True,False,Acanthomenia Arcuata Aquamaps Native Raster,False,d4sciencelabs,bf9c1fc6-610c-4683-9906-ab38eeb55835,776b60cd-dbf5-4bb4-ae44-657f6fc7f642,"[{""type"": ""creation"", ""value"": ""2017-10-10T17:46:17.495+02:00""}, {""type"": ""publication"", ""value"": ""2017-10-10T17:46:17.495+02:00""}, {""type"": ""revision"", ""value"": ""2017-10-10T17:46:17.495+02:00""}]",36.25,eng,active,2017-11-25T01:35:07.161893,"This Acanthomenia Arcuata Species Distribution Map has been generated with the AquaMaps methodology by exploiting the technology and the computational resources provided by iMarine. In particular, this map has been produced using the HSPEC Native Range dataset, generated using the AquaMaps NativeRange algorithm. Hosted on the D4Science Thredds CataSystem.out.println: http://thredds.d4science.org",ebc02b4a-f774-4e7e-afe1-d52ab93126de,http://thredds.d4science.org/thredds/fileServer/public/netcdf/AquamapsNative/aquamaps_native_acanthomenia_arcuata.nc,WCS,4,0ee02d07-d6c5-4882-b86f-42318601ae5a,-2.25,"ISO 19115 Topic Category. Environmental resources, protection and conservation, for example environmental pollution, waste storage and treatment, environmental impact assessment, monitoring environmental risk, nature reserves, landscape, water quality, air quality, environmental modeling",[],"D4Science has developed a series of applications (accessible through the D4Science Labs) which can be used by any user to upload, manipulate, use and re-use products with the aim to share them with other users following the principle of the OpenScience",Dataset,D4Science Labs,bb,dataset,[],"iMarine Consortium,iMarine.eu",http://geonetwork.d4science.org:8080/geonetwork,2012-12-20T22:27:10.696+01:00,organization,info@i-marine.eu,"{""type"": ""Polygon"", ""coordinates"": [[[-41.75, 36.25], [-2.25, 36.25], [-2.25, 63.25], [-41.75, 63.25], [-41.75, 36.25]]]}",http://geonetwork.d4science.org:8080/geonetwork/srv/en/metadata.show?uuid=776b60cd-dbf5-4bb4-ae44-657f6fc7f642,environment,22dde829-fe22-4db6-875d-5ae13aed8a5a,2017-10-13T16:43:27.011315,bluebridge.catalogue@d4science.org,False,creation,acanthomenia-arcuata-aquamaps-native-raster,8,78e6bc88-357a-4ea7-9cb4-3e4c44a6113d,[],c687ca61-376b-4424-bfef-a4e8afed3b2b,730e5b91-2265-431e-b033-7f310474e4f3,active,6070dfe0-4bd6-4f1e-9808-cf764f3d8382,approved,11680099-3fd0-427c-8cfc-b1fbcde0623e,environment,active,https://ckan-bb2.d4science.org/images/organisations/d4sciencelabs.png,OGC:WFS-1.0.0-http-get-feature,iMarine.eu,dataset,2017-11-24T11:56:48.241435,11680099-3fd0-427c-8cfc-b1fbcde0623e,asNeeded,environment,http://data.d4science.org/ctlg/gCubeApps/acanthomenia-arcuata-aquamaps-native-raster,"[{""name"": """", ""roles"": [""originator""]}]"
6e3ff5b4-68e7-4788-b567-520b4694afdb,0,http://node49.p.d4science.research-infrastructures.eu:9003/407/Animalia/Chordata/Actinopterygii/Tetraodontiformes/Monacanthidae/Fis-24410/Ocean_View__Pacific.jpg,NetCDF,-179.75,active,26.25,environment,b4615631-3581-4ee2-9a16-45c7cfed6f49,http://geonetwork.d4science.org:8080/geonetwork/srv/en/xml.metadata.get?uuid=95f7ba8a-572f-4f20-970f-ade610b60264,2017-11-25T04:17:55.528846,2017-10-10T17:52:05.425+02:00,True,Unnamed resource,True,False,Amissidens Hainesi Aquamaps Native Raster,False,d4sciencelabs,c415fab9-35e8-45df-8790-d087f71698ae,95f7ba8a-572f-4f20-970f-ade610b60264,"[{""type"": ""creation"", ""value"": ""2017-10-10T17:52:05.425+02:00""}, {""type"": ""publication"", ""value"": ""2017-10-10T17:52:05.425+02:00""}, {""type"": ""revision"", ""value"": ""2017-10-10T17:52:05.425+02:00""}]",-20.75,eng,active,2017-11-25T04:17:54.556474,"This Amissidens Hainesi Species Distribution Map has been generated with the AquaMaps methodology by exploiting the technology and the computational resources provided by iMarine. In particular, this map has been produced using the HSPEC Native Range dataset, generated using the AquaMaps NativeRange algorithm. Hosted on the D4Science Thredds CataSystem.out.println: http://thredds.d4science.org",ebc02b4a-f774-4e7e-afe1-d52ab93126de,http://thredds.d4science.org/thredds/fileServer/public/netcdf/AquamapsNative/aquamaps_native_amissidens_hainesi.nc,WCS,4,10606d26-86ab-4f8e-b07a-62d5d612b6dd,180.25,"ISO 19115 Topic Category. Environmental resources, protection and conservation, for example environmental pollution, waste storage and treatment, environmental impact assessment, monitoring environmental risk, nature reserves, landscape, water quality, air quality, environmental modeling",[],"D4Science has developed a series of applications (accessible through the D4Science Labs) which can be used by any user to upload, manipulate, use and re-use products with the aim to share them with other users following the principle of the OpenScience",Dataset,D4Science Labs,bb,dataset,[],"iMarine Consortium,iMarine.eu",http://geonetwork.d4science.org:8080/geonetwork,2013-04-13T08:30:37.206+02:00,organization,info@i-marine.eu,"{""type"": ""Polygon"", ""coordinates"": [[[-179.75, -20.75], [180.25, -20.75], [180.25, 26.25], [-179.75, 26.25], [-179.75, -20.75]]]}",http://geonetwork.d4science.org:8080/geonetwork/srv/en/metadata.show?uuid=95f7ba8a-572f-4f20-970f-ade610b60264,environment,22dde829-fe22-4db6-875d-5ae13aed8a5a,2017-10-13T19:34:46.637518,bluebridge.catalogue@d4science.org,False,creation,amissidens-hainesi-aquamaps-native-raster,8,b4615631-3581-4ee2-9a16-45c7cfed6f49,[],cea245ba-ec93-4ad2-8472-731ec9d572e3,730e5b91-2265-431e-b033-7f310474e4f3,active,6e3ff5b4-68e7-4788-b567-520b4694afdb,approved,11680099-3fd0-427c-8cfc-b1fbcde0623e,environment,active,https://ckan-bb2.d4science.org/images/organisations/d4sciencelabs.png,OGC:WFS-1.0.0-http-get-feature,iMarine.eu,dataset,2017-11-24T11:56:48.241435,11680099-3fd0-427c-8cfc-b1fbcde0623e,asNeeded,environment,http://data.d4science.org/ctlg/gCubeApps/amissidens-hainesi-aquamaps-native-raster,"[{""name"": """", ""roles"": [""originator""]}]"
538f3bf0-a517-4fdf-ba34-b3249bacb9fd,0,http://node49.p.d4science.research-infrastructures.eu:9003/407/Animalia/Chordata/Actinopterygii/Perciformes/Labridae/Fis-31133/Ocean_View__Pacific.jpg,Raster,-179.75,active,30.25,environment,d9bc29c5-396e-4031-a63f-56eee7e672fe,http://geonetwork.d4science.org:8080/geonetwork/srv/en/xml.metadata.get?uuid=33565380-a874-429c-baf1-b0a51e2a73f7,2017-12-16T09:16:58.007576,2017-12-03T10:28:39.675+01:00,True,Unnamed resource,True,False,anampses melanurus Aquamaps Native 2050 Raster,False,d4sciencelabs,172d04b9-eb96-4684-a7e3-0cf40b2b8af4,33565380-a874-429c-baf1-b0a51e2a73f7,"[{""type"": ""creation"", ""value"": ""2017-12-03T10:28:39.675+01:00""}, {""type"": ""publication"", ""value"": ""2017-12-03T10:28:39.675+01:00""}, {""type"": ""revision"", ""value"": ""2017-12-03T10:28:39.675+01:00""}]",-17.75,eng,active,2017-12-16T09:16:54.434308,"This anampses melanurus Species Distribution Map for 2050 has been generated with the AquaMaps methodology by exploiting the technology and the computational resources provided by iMarine. In particular, this map has been produced using the HSPEC Native Range dataset, generated using the AquaMaps NativeRange 2050 algorithm. Hosted on the D4Science Thredds CataSystem.out.println: http://thredds.d4science.org",ebc02b4a-f774-4e7e-afe1-d52ab93126de,http://thredds.d4science.org/thredds/fileServer/public/netcdf/AquamapsNative2050/aquamaps_native2050_anampses_melanurus.nc,WCS,4,AquaMaps,180.25,"ISO 19115 Topic Category. Environmental resources, protection and conservation, for example environmental pollution, waste storage and treatment, environmental impact assessment, monitoring environmental risk, nature reserves, landscape, water quality, air quality, environmental modeling",[],"D4Science has developed a series of applications (accessible through the D4Science Labs) which can be used by any user to upload, manipulate, use and re-use products with the aim to share them with other users following the principle of the OpenScience",Dataset,D4Science Labs,bb,dataset,[],"iMarine Consortium,iMarine.eu",http://geonetwork.d4science.org:8080/geonetwork,2013-04-14T00:54:12.418+02:00,organization,info@i-marine.eu,"{""type"": ""Polygon"", ""coordinates"": [[[-179.75, -17.75], [180.25, -17.75], [180.25, 30.25], [-179.75, 30.25], [-179.75, -17.75]]]}",http://geonetwork.d4science.org:8080/geonetwork/srv/en/metadata.show?uuid=33565380-a874-429c-baf1-b0a51e2a73f7,environment,22dde829-fe22-4db6-875d-5ae13aed8a5a,2017-12-15T16:55:45.821780,bluebridge.catalogue@d4science.org,False,creation,anampses-melanurus-aquamaps-native-2050-raster,8,d9bc29c5-396e-4031-a63f-56eee7e672fe,[],0a3ffd49-2572-4fb9-b7a2-ca31f9c9b035,730e5b91-2265-431e-b033-7f310474e4f3,active,538f3bf0-a517-4fdf-ba34-b3249bacb9fd,approved,11680099-3fd0-427c-8cfc-b1fbcde0623e,environment,active,https://ckan-bb2.d4science.org/images/organisations/d4sciencelabs.png,OGC:WFS-1.0.0-http-get-feature,iMarine.eu,dataset,2017-11-24T11:56:48.241435,11680099-3fd0-427c-8cfc-b1fbcde0623e,asNeeded,environment,http://data.d4science.org/ctlg/gCubeApps/anampses-melanurus-aquamaps-native-2050-raster,"[{""name"": """", ""roles"": [""originator""]}]"
50a3ff2e-3793-4095-b599-de0c5b5f8dde,0,http://node49.p.d4science.research-infrastructures.eu:9003/80/Animalia/Chordata/Actinopterygii/Perciformes/Gobiidae/Fis-31863/Ocean_View__Pacific.jpg,SpeciesDistribution,-180.0,active,90.0,biota,64cfd81e-e1aa-441f-8f05-ea60bcae3aa1,http://geonetwork.d4science.org:8080/geonetwork/srv/en/xml.metadata.get?uuid=d2e1ab66-b39e-4b08-b341-f32d131b196a,2017-11-29T11:02:47.078840,2013-06-18T23:52:34.416+02:00,True,WMS link to resource,True,False,Anodontia vesicula,False,imarine,172d04b9-eb96-4684-a7e3-0cf40b2b8af4,d2e1ab66-b39e-4b08-b341-f32d131b196a,"[{""type"": ""creation"", ""value"": ""2012-12-18T20:49:19.841+01:00""}]",-90.0,eng,active,2017-11-29T11:02:45.627327,"This Anodontia vesicula Species Distribution Map has been generated with the AquaMaps methodology by exploiting the technology and the computational resources provided by iMarine. In particular, this map has been produced using the HSPEC Native Range dataset, generated using AquaMaps NativeRange algorithm.",ebc02b4a-f774-4e7e-afe1-d52ab93126de,"http://geoserver.d4science-ii.research-infrastructures.eu/geoserver/wms?service=wms&version=1.1.0&request=GetMap&layers=lanodontiavesicula20121218204851642cet&styles=&bbox=-180,-90,180,90&width=676&height=330&srs=EPSG:4326&crs=EPSG:4326&format=application/openlayers",WMS,4,7614324,180.0,"ISO 19115 Topic Category. Flora or fauna in natural environment, for example wildlife, vegetation, biological sciences, ecology, wilderness, sea life, wetlands, habitat, biological resources",[],"iMarine is an access point to a number of Virtual Research Environments deployed and operated in the context of the iMarine project to support the Ecosystem Approach to fisheries management and conservation of marine living resources. It empowers practitioners and policy makers from multiple scientific fields such as fisheries, biodiversity and ocean observation by ensuring that otherwise dispersed and heterogeneous data is available to all stakeholder communities through a shared virtual environment that brings together multidisciplinary data sources, supports cross-cutting scientific analysis, and assists communication.
See More: https://i-marine.d4science.org/",Dataset,iMarine,bb,dataset,[],"iMarine Consortium,iMarine.eu",http://geonetwork.d4science.org:8080/geonetwork,2012-12-18T06:55:49.769+01:00,organization,info@i-marine.eu,"{""type"": ""Polygon"", ""coordinates"": [[[-180.0, -90.0], [180.0, -90.0], [180.0, 90.0], [-180.0, 90.0], [-180.0, -90.0]]]}",http://geonetwork.d4science.org:8080/geonetwork/srv/en/metadata.show?uuid=d2e1ab66-b39e-4b08-b341-f32d131b196a,biota,70a489ea-a910-40b8-ae63-431084dc99a6,2017-09-21T20:23:49.182904,bluebridge.catalogue@d4science.org,False,creation,anodontia-vesicula,7,64cfd81e-e1aa-441f-8f05-ea60bcae3aa1,[],fa1d948f-374b-42df-b2fb-f97c1d64a86c,7bf889d1-7829-4c2e-ad72-222798006eee,active,50a3ff2e-3793-4095-b599-de0c5b5f8dde,approved,81f5e6ae-92ab-410a-9a75-f809d43ec1ee,biota,active,https://ckan-bb2.d4science.org/images/organisations/imarine.png,OGC:WFS-1.0.0-http-get-feature,iMarine.eu,dataset,2017-11-24T11:56:37.199304,81f5e6ae-92ab-410a-9a75-f809d43ec1ee,asNeeded,biota,http://data.d4science.org/ctlg/d4science.research-infrastructures.eu/anodontia-vesicula,"[{""name"": ""iMarine Consortium"", ""roles"": [""author""]}, {""name"": ""iMarine.eu"", ""roles"": [""distributor"", ""resourceProvider""]}]"
58dca7df-a468-4ae7-a875-250bd20eec7d,0,http://node49.p.d4science.research-infrastructures.eu:9003/407/Animalia/Chordata/Actinopterygii/Perciformes/Gobiidae/Fis-21787/Ocean_View__Pacific.jpg,SpeciesDistribution,2.69709825515747,active,40.0964660644531,biota,326cfe40-7257-41a3-9c18-29d262f7f408,http://geonetwork.d4science.org:8080/geonetwork/srv/en/xml.metadata.get?uuid=5e72c7a0e79b0f81fb3b87ab8997d4c18cae4a50,2017-11-25T00:16:47.527025,2017-09-16T00:39:05,True,A boring default style (LegendURL),True,False,Absences of coralligenous outcrop (points),False,emodnet,c415fab9-35e8-45df-8790-d087f71698ae,5e72c7a0e79b0f81fb3b87ab8997d4c18cae4a50,"[{""type"": ""revision"", ""value"": ""2017-09-16T00:39:05""}]",39.2369346618652,eng,active,2017-11-25T00:16:47.024359,Coral Absence Data from the dataset Coralligenous and merl beds distribution along the Mediterranean coasts - Mediterranean Sensitive Habitats (MEDISEH). A lot for information has been derived from three critical sources: the first is the Action plan for the conservation of the coralligenous and other calcareous bio-concretions in the Mediterranean Sea by the UNEP-MAP-RAC/SPA (2008) followed by the report in the State of knowledge of the geographical distribution of the coralligenous and other calcareous bio-concretions in the Mediterranean by UNEP (2009).,ebc02b4a-f774-4e7e-afe1-d52ab93126de,http://geo.vliz.be:80/geoserver/Emodnet/ows?SERVICE=WMS&,WMS,3,Absence data,4.13495206832886,"ISO 19115 Topic Category. Flora or fauna in natural environment, for example wildlife, vegetation, biological sciences, ecology, wilderness, sea life, wetlands, habitat, biological resources",[],"iMarine is an access point to a number of Virtual Research Environments deployed and operated in the context of the iMarine project to support the Ecosystem Approach to fisheries management and conservation of marine living resources. It empowers practitioners and policy makers from multiple scientific fields such as fisheries, biodiversity and ocean observation by ensuring that otherwise dispersed and heterogeneous data is available to all stakeholder communities through a shared virtual environment that brings together multidisciplinary data sources, supports cross-cutting scientific analysis, and assists communication.
See More: https://i-marine.d4science.org/",Dataset,EMODnet,bb,dataset,[],"iMarine Consortium,iMarine.eu",http://geonetwork.d4science.org:8080/geonetwork,2013-04-13T02:53:50.196+02:00,organization,info@i-marine.eu,"{""type"": ""Polygon"", ""coordinates"": [[[2.69709825516, 39.2369346619], [4.13495206833, 39.2369346619], [4.13495206833, 40.0964660645], [2.69709825516, 40.0964660645], [2.69709825516, 39.2369346619]]]}",http://geonetwork.d4science.org:8080/geonetwork/srv/en/metadata.show?uuid=5e72c7a0e79b0f81fb3b87ab8997d4c18cae4a50,biota,26535071-0d0b-4a7b-930d-6efe5274d218,2017-09-22T15:22:18.259212,bluebridge.catalogue@d4science.org,False,creation,absences-of-coralligenous-outcrop-points,4,326cfe40-7257-41a3-9c18-29d262f7f408,[],4b1f5800-e21a-4ab8-8605-40937f89ba45,7bf889d1-7829-4c2e-ad72-222798006eee,active,58dca7df-a468-4ae7-a875-250bd20eec7d,approved,89eea70a-901a-4718-9015-be9cd0444f37,biota,active,https://ckan-bb2.d4science.org/images/organisations/emodnet.png,OGC:WFS-1.0.0-http-get-feature,iMarine.eu,dataset,2017-11-24T11:56:54.869891,89eea70a-901a-4718-9015-be9cd0444f37,asNeeded,biota,http://data.d4science.org/ctlg/BlueBridgeProject/absences-of-coralligenous-outcrop-points,"[{""name"": ""Flanders Marine Institute (VLIZ)"", ""roles"": [""pointOfContact""]}]"
