2e61a917-e201-41f3-9b2d-20f54d18191b,0,,SpeciesDistribution,-180.0,active,90.0,biota,d0349f0f-e260-4930-97b3-f7b37fb3c3af,http://geonetwork.d4science.org:8080/geonetwork/srv/en/xml.metadata.get?uuid=9d4f2a62-3b07-4338-a2ee-e84be43ae082,2017-11-24T17:23:17.621603,2013-06-18T20:39:31.250+02:00,True,WMS link to resource,True,False,Amblygaster leiogaster,False,imarine,26a86c41-69f5-4462-a043-0d46135fc2d9,9d4f2a62-3b07-4338-a2ee-e84be43ae082,"[{""type"": ""creation"", ""value"": ""2012-12-17T19:04:12.979+01:00""}]",-90.0,eng,active,2017-11-24T17:23:17.176224,"This Amblygaster leiogaster Species Distribution Map has been generated with the AquaMaps methodology by exploiting the technology and the computational resources provided by iMarine. In particular, this map has been produced using the HSPEC Native Range dataset, generated using AquaMaps NativeRange algorithm.",ebc02b4a-f774-4e7e-afe1-d52ab93126de,"http://geoserver2.d4science.research-infrastructures.eu/geoserver/wms?service=wms&version=1.1.0&request=GetMap&layers=lamblygasterleiogaster20121217190344079cet&styles=&bbox=-180,-90,180,90&width=676&height=330&srs=EPSG:4326&crs=EPSG:4326&format=application/openlayers",WMS,4,Amblygaster leiogaster,180.0,"ISO 19115 Topic Category. Flora or fauna in natural environment, for example wildlife, vegetation, biological sciences, ecology, wilderness, sea life, wetlands, habitat, biological resources",[],"iMarine is an access point to a number of Virtual Research Environments deployed and operated in the context of the iMarine project to support the Ecosystem Approach to fisheries management and conservation of marine living resources. It empowers practitioners and policy makers from multiple scientific fields such as fisheries, biodiversity and ocean observation by ensuring that otherwise dispersed and heterogeneous data is available to all stakeholder communities through a shared virtual environment that brings together multidisciplinary data sources, supports cross-cutting scientific analysis, and assists communication.
See More: https://i-marine.d4science.org/",Dataset,iMarine,bb,,[],,http://geonetwork.d4science.org:8080/geonetwork,,organization,,"{""type"": ""Polygon"", ""coordinates"": [[[-180.0, -90.0], [180.0, -90.0], [180.0, 90.0], [-180.0, 90.0], [-180.0, -90.0]]]}",http://geonetwork.d4science.org:8080/geonetwork/srv/en/metadata.show?uuid=9d4f2a62-3b07-4338-a2ee-e84be43ae082,biota,70a489ea-a910-40b8-ae63-431084dc99a6,2017-09-22T12:45:33.960151,bluebridge.catalogue@d4science.org,False,,amblygaster-leiogaster,6,d0349f0f-e260-4930-97b3-f7b37fb3c3af,[],0c995f1e-55d0-4255-bc59-e5edd14877e6,7bf889d1-7829-4c2e-ad72-222798006eee,active,2e61a917-e201-41f3-9b2d-20f54d18191b,approved,81f5e6ae-92ab-410a-9a75-f809d43ec1ee,biota,active,https://ckan-bb2.d4science.org/images/organisations/imarine.png,OGC:WMS-1.3.0-http-get-map,iMarine Consortium,dataset,2017-11-24T11:56:37.199304,81f5e6ae-92ab-410a-9a75-f809d43ec1ee,asNeeded,biota,http://data.d4science.org/ctlg/d4science.research-infrastructures.eu/amblygaster-leiogaster,"[{""name"": ""iMarine Consortium"", ""roles"": [""author""]}, {""name"": ""iMarine.eu"", ""roles"": [""distributor"", ""resourceProvider""]}]"
ef984bcd-a409-420e-8107-cbdd6857e98c,0,,Probability Distribution,-180.0,active,90.0,biota,a7006047-77ea-48eb-8303-0465406a0583,http://geonetwork.d4science.org:8080/geonetwork/srv/en/xml.metadata.get?uuid=7fe1c137-e73f-4d5a-aa83-15cfbd473a0f,2017-12-01T01:02:53.567438,2013-06-19T07:20:35.292+02:00,True,WMS link to resource,True,False,Aglaophamus ornatus,False,imarine,c4418477-a9f9-4340-a417-9a16364cc98e,7fe1c137-e73f-4d5a-aa83-15cfbd473a0f,"[{""type"": ""creation"", ""value"": ""2012-12-22T04:54:42.540+01:00""}]",-90.0,eng,active,2017-12-01T01:02:51.888003,"This Aglaophamus ornatus Species Distribution Map has been generated with the AquaMaps methodology by exploiting the technology and the computational resources provided by iMarine. In particular, this map has been produced using the HSPEC 2050 Native Range dataset, generated using AquaMaps NativeRange2050 algorithm.",ebc02b4a-f774-4e7e-afe1-d52ab93126de,"http://geoserver.d4science-ii.research-infrastructures.eu/geoserver/wms?service=wms&version=1.1.0&request=GetMap&layers=laglaophamusornatus20121222045426689cet&styles=&bbox=-180,-90,180,90&width=676&height=330&srs=EPSG:4326&crs=EPSG:4326&format=application/openlayers",WMS,4,7614324,180.0,"ISO 19115 Topic Category. Flora or fauna in natural environment, for example wildlife, vegetation, biological sciences, ecology, wilderness, sea life, wetlands, habitat, biological resources",[],"D4Science has developed a series of applications (accessible through the D4Science Labs) which can be used by any user to upload, manipulate, use and re-use products with the aim to share them with other users following the principle of the OpenScience",Dataset,iMarine,bb,,[],,http://geonetwork.d4science.org:8080/geonetwork,,organization,,"{""type"": ""Polygon"", ""coordinates"": [[[-180.0, -90.0], [180.0, -90.0], [180.0, 90.0], [-180.0, 90.0], [-180.0, -90.0]]]}",http://geonetwork.d4science.org:8080/geonetwork/srv/en/metadata.show?uuid=7fe1c137-e73f-4d5a-aa83-15cfbd473a0f,biota,70a489ea-a910-40b8-ae63-431084dc99a6,2017-10-13T18:27:14.575250,bluebridge.catalogue@d4science.org,False,,aglaophamus-ornatus2,7,a7006047-77ea-48eb-8303-0465406a0583,[],7b5d684b-2271-473f-9b47-089bf22c5c49,7bf889d1-7829-4c2e-ad72-222798006eee,active,ef984bcd-a409-420e-8107-cbdd6857e98c,approved,81f5e6ae-92ab-410a-9a75-f809d43ec1ee,biota,active,https://ckan-bb2.d4science.org/images/organisations/imarine.png,OGC:WMS-1.3.0-http-get-map,iMarine Consortium,dataset,2017-11-24T11:56:37.199304,81f5e6ae-92ab-410a-9a75-f809d43ec1ee,asNeeded,biota,http://data.d4science.org/ctlg/d4science.research-infrastructures.eu/aglaophamus-ornatus2,"[{""name"": ""iMarine Consortium"", ""roles"": [""author""]}, {""name"": ""iMarine.eu"", ""roles"": [""distributor"", ""resourceProvider""]}]"
c00df0a4-2bd5-4e90-9b5a-514318bf9f1c,0,,SpeciesDistribution,-179.75,active,5.25,environment,c5aa4ac7-f599-4d34-a667-34fd2a43de50,http://geonetwork.d4science.org:8080/geonetwork/srv/en/xml.metadata.get?uuid=7615950a-3681-4804-9126-c09fec8d4d9e,2017-11-25T20:57:17.978008,2017-10-10T17:51:17.889+02:00,True,Unnamed resource,True,False,Ambassis Vachellii Aquamaps Native Raster,False,d4sciencelabs,90ea26b7-8080-42e4-8348-71adcc44b284,7615950a-3681-4804-9126-c09fec8d4d9e,"[{""type"": ""creation"", ""value"": ""2017-10-10T17:51:17.889+02:00""}, {""type"": ""publication"", ""value"": ""2017-10-10T17:51:17.889+02:00""}, {""type"": ""revision"", ""value"": ""2017-10-10T17:51:17.889+02:00""}]",-16.75,eng,active,2017-11-25T20:57:12.449615,"This Ambassis Vachellii Species Distribution Map has been generated with the AquaMaps methodology by exploiting the technology and the computational resources provided by iMarine. In particular, this map has been produced using the HSPEC Native Range dataset, generated using the AquaMaps NativeRange algorithm. Hosted on the D4Science Thredds CataSystem.out.println: http://thredds.d4science.org",ebc02b4a-f774-4e7e-afe1-d52ab93126de,http://thredds.d4science.org/thredds/fileServer/public/netcdf/AquamapsNative/aquamaps_native_ambassis_vachellii.nc,WCS,4,Ambassis Vachellii,180.25,"ISO 19115 Topic Category. Environmental resources, protection and conservation, for example environmental pollution, waste storage and treatment, environmental impact assessment, monitoring environmental risk, nature reserves, landscape, water quality, air quality, environmental modeling",[],"iMarine is an access point to a number of Virtual Research Environments deployed and operated in the context of the iMarine project to support the Ecosystem Approach to fisheries management and conservation of marine living resources. It empowers practitioners and policy makers from multiple scientific fields such as fisheries, biodiversity and ocean observation by ensuring that otherwise dispersed and heterogeneous data is available to all stakeholder communities through a shared virtual environment that brings together multidisciplinary data sources, supports cross-cutting scientific analysis, and assists communication.
See More: https://i-marine.d4science.org/",Dataset,D4Science Labs,bb,,[],,http://geonetwork.d4science.org:8080/geonetwork,,organization,,"{""type"": ""Polygon"", ""coordinates"": [[[-179.75, -16.75], [180.25, -16.75], [180.25, 5.25], [-179.75, 5.25], [-179.75, -16.75]]]}",http://geonetwork.d4science.org:8080/geonetwork/srv/en/metadata.show?uuid=7615950a-3681-4804-9126-c09fec8d4d9e,environment,22dde829-fe22-4db6-875d-5ae13aed8a5a,2017-09-22T22:19:45.987932,bluebridge.catalogue@d4science.org,False,,ambassis-vachellii-aquamaps-native-raster,8,c5aa4ac7-f599-4d34-a667-34fd2a43de50,[],3efb9df3-25e1-46b3-9d6f-0511837abb75,730e5b91-2265-431e-b033-7f310474e4f3,active,c00df0a4-2bd5-4e90-9b5a-514318bf9f1c,approved,11680099-3fd0-427c-8cfc-b1fbcde0623e,environment,active,https://ckan-bb2.d4science.org/images/organisations/d4sciencelabs.png,OGC:WMS-1.3.0-http-get-map,iMarine Consortium,dataset,2017-11-24T11:56:48.241435,11680099-3fd0-427c-8cfc-b1fbcde0623e,asNeeded,environment,http://data.d4science.org/ctlg/gCubeApps/ambassis-vachellii-aquamaps-native-raster,"[{""name"": """", ""roles"": [""originator""]}]"
9458d294-f0a0-4a47-a0d5-aad12f6c0ebd,0,,SpeciesDistribution,-180.0,active,90.0,biota,5ca3c2a9-64e8-46ca-bdb9-7b28f36f2d87,http://geonetwork.d4science.org:8080/geonetwork/srv/en/xml.metadata.get?uuid=012d53c5-fd93-49d5-8443-5be0ad14040e,2017-11-30T03:44:17.472427,2013-06-19T12:19:03.880+02:00,True,WMS link to resource,True,False,Actinopyga echinites,False,imarine,26a86c41-69f5-4462-a043-0d46135fc2d9,012d53c5-fd93-49d5-8443-5be0ad14040e,"[{""type"": ""creation"", ""value"": ""2013-04-11T23:43:18.345+02:00""}]",-90.0,eng,active,2017-11-30T03:44:14.777716,"This Actinopyga echinites Species Distribution Map has been generated with the AquaMaps methodology by exploiting the technology and the computational resources provided by iMarine. In particular, this map has been produced using the Default Suitable maps_SuitableRange dataset, generated using AquaMaps SuitableRange algorithm.",ebc02b4a-f774-4e7e-afe1-d52ab93126de,"http://geoserver3.d4science.research-infrastructures.eu/geoserver/wms?service=wms&version=1.1.0&request=GetMap&layers=lactinopygaechinites20130411234241997cest&styles=&bbox=-180,-90,180,90&width=676&height=330&srs=EPSG:4326&crs=EPSG:4326&format=application/openlayers",WMS,4,7614324,180.0,"ISO 19115 Topic Category. Flora or fauna in natural environment, for example wildlife, vegetation, biological sciences, ecology, wilderness, sea life, wetlands, habitat, biological resources",[],"iMarine is an access point to a number of Virtual Research Environments deployed and operated in the context of the iMarine project to support the Ecosystem Approach to fisheries management and conservation of marine living resources. It empowers practitioners and policy makers from multiple scientific fields such as fisheries, biodiversity and ocean observation by ensuring that otherwise dispersed and heterogeneous data is available to all stakeholder communities through a shared virtual environment that brings together multidisciplinary data sources, supports cross-cutting scientific analysis, and assists communication.
See More: https://i-marine.d4science.org/",Dataset,iMarine,bb,,[],,http://geonetwork.d4science.org:8080/geonetwork,,organization,,"{""type"": ""Polygon"", ""coordinates"": [[[-180.0, -90.0], [180.0, -90.0], [180.0, 90.0], [-180.0, 90.0], [-180.0, -90.0]]]}",http://geonetwork.d4science.org:8080/geonetwork/srv/en/metadata.show?uuid=012d53c5-fd93-49d5-8443-5be0ad14040e,biota,70a489ea-a910-40b8-ae63-431084dc99a6,2017-09-23T00:12:35.090905,bluebridge.catalogue@d4science.org,False,,actinopyga-echinites,8,5ca3c2a9-64e8-46ca-bdb9-7b28f36f2d87,[],582238c1-bce0-4d55-8248-c34a760f203a,7bf889d1-7829-4c2e-ad72-222798006eee,active,9458d294-f0a0-4a47-a0d5-aad12f6c0ebd,approved,81f5e6ae-92ab-410a-9a75-f809d43ec1ee,biota,active,https://ckan-bb2.d4science.org/images/organisations/imarine.png,OGC:WMS-1.3.0-http-get-map,iMarine Consortium,dataset,2017-11-24T11:56:37.199304,81f5e6ae-92ab-410a-9a75-f809d43ec1ee,asNeeded,biota,http://data.d4science.org/ctlg/d4science.research-infrastructures.eu/actinopyga-echinites,"[{""name"": ""iMarine Consortium"", ""roles"": [""author""]}, {""name"": ""iMarine.eu"", ""roles"": [""distributor"", ""resourceProvider""]}]"
2110d34d-89eb-482e-97a1-5d7387f17aac,0,,Probability Distribution,-180.0,active,90.0,biota,4555aec3-4502-4011-8ecf-d16ad03fde81,http://geonetwork.d4science.org:8080/geonetwork/srv/en/xml.metadata.get?uuid=466c4589-0fc9-477f-9923-72f9fe84869f,2017-11-28T23:43:03.659132,2013-06-18T18:16:25.464+02:00,True,WMS link to resource,True,False,Allenbatrachus reticulatus,False,imarine,c4418477-a9f9-4340-a417-9a16364cc98e,466c4589-0fc9-477f-9923-72f9fe84869f,"[{""type"": ""creation"", ""value"": ""2012-12-09T06:57:26.943+01:00""}]",-90.0,eng,active,2017-11-28T23:43:02.108529,"This Allenbatrachus reticulatus Species Distribution Map has been generated with the AquaMaps methodology by exploiting the technology and the computational resources provided by iMarine. In particular, this map has been produced using the HSPEC Native Range dataset, generated using AquaMaps NativeRange algorithm.",ebc02b4a-f774-4e7e-afe1-d52ab93126de,"http://geoserver4.d4science.research-infrastructures.eu/geoserver/wms?service=wms&version=1.1.0&request=GetMap&layers=lallenbatrachusreticulatus20121209065700242cet&styles=&bbox=-180,-90,180,90&width=676&height=330&srs=EPSG:4326&crs=EPSG:4326&format=application/openlayers",WMS,4,7614324,180.0,"ISO 19115 Topic Category. Flora or fauna in natural environment, for example wildlife, vegetation, biological sciences, ecology, wilderness, sea life, wetlands, habitat, biological resources",[],"D4Science has developed a series of applications (accessible through the D4Science Labs) which can be used by any user to upload, manipulate, use and re-use products with the aim to share them with other users following the principle of the OpenScience",Dataset,iMarine,bb,,[],,http://geonetwork.d4science.org:8080/geonetwork,,organization,,"{""type"": ""Polygon"", ""coordinates"": [[[-180.0, -90.0], [180.0, -90.0], [180.0, 90.0], [-180.0, 90.0], [-180.0, -90.0]]]}",http://geonetwork.d4science.org:8080/geonetwork/srv/en/metadata.show?uuid=466c4589-0fc9-477f-9923-72f9fe84869f,biota,70a489ea-a910-40b8-ae63-431084dc99a6,2017-12-01T16:41:32.135816,bluebridge.catalogue@d4science.org,False,,allenbatrachus-reticulatus2,7,4555aec3-4502-4011-8ecf-d16ad03fde81,[],d5233302-8a6a-442b-8f05-4f59b3495a7d,7bf889d1-7829-4c2e-ad72-222798006eee,active,2110d34d-89eb-482e-97a1-5d7387f17aac,approved,81f5e6ae-92ab-410a-9a75-f809d43ec1ee,biota,active,https://ckan-bb2.d4science.org/images/organisations/imarine.png,OGC:WMS-1.3.0-http-get-map,iMarine Consortium,dataset,2017-11-24T11:56:37.199304,81f5e6ae-92ab-410a-9a75-f809d43ec1ee,asNeeded,biota,http://data.d4science.org/ctlg/d4science.research-infrastructures.eu/allenbatrachus-reticulatus2,"[{""name"": ""iMarine Consortium"", ""roles"": [""author""]}, {""name"": ""iMarine.eu"", ""roles"": [""distributor"", ""resourceProvider""]}]"
9a280faf-665b-45e4-b4a0-2783ee712341,0,,Probability Distribution,-179.75,active,21.25,environment,a4d1aa9b-72fc-483c-bd3c-9f803c98a645,http://geonetwork.d4science.org:8080/geonetwork/srv/en/xml.metadata.get?uuid=65f74fb9-921c-41a2-88d8-a91f76c178af,2017-12-09T22:53:26.413621,2017-11-30T20:48:12.802+01:00,True,Unnamed resource,True,False,amblygobius buanensis Aquamaps Native 2050 Raster,False,d4sciencelabs,e00c05aa-c5c3-438a-9ea5-2422f7ba1112,65f74fb9-921c-41a2-88d8-a91f76c178af,"[{""type"": ""creation"", ""value"": ""2017-11-30T20:48:12.802+01:00""}, {""type"": ""publication"", ""value"": ""2017-11-30T20:48:12.802+01:00""}, {""type"": ""revision"", ""value"": ""2017-11-30T20:48:12.802+01:00""}]",-16.75,eng,active,2017-12-09T22:53:22.819339,"This amblygobius buanensis Species Distribution Map for 2050 has been generated with the AquaMaps methodology by exploiting the technology and the computational resources provided by iMarine. In particular, this map has been produced using the HSPEC Native Range dataset, generated using the AquaMaps NativeRange 2050 algorithm. Hosted on the D4Science Thredds CataSystem.out.println: http://thredds.d4science.org",ebc02b4a-f774-4e7e-afe1-d52ab93126de,http://thredds.d4science.org/thredds/fileServer/public/netcdf/AquamapsNative2050/aquamaps_native2050_amblygobius_buanensis.nc,WCS,4,1e1f27a9-af55-41d5-9e9d-ac81fd4441e3,180.25,"ISO 19115 Topic Category. Environmental resources, protection and conservation, for example environmental pollution, waste storage and treatment, environmental impact assessment, monitoring environmental risk, nature reserves, landscape, water quality, air quality, environmental modeling",[],"D4Science has developed a series of applications (accessible through the D4Science Labs) which can be used by any user to upload, manipulate, use and re-use products with the aim to share them with other users following the principle of the OpenScience",Dataset,D4Science Labs,bb,,[],,http://geonetwork.d4science.org:8080/geonetwork,,organization,,"{""type"": ""Polygon"", ""coordinates"": [[[-179.75, -16.75], [180.25, -16.75], [180.25, 21.25], [-179.75, 21.25], [-179.75, -16.75]]]}",http://geonetwork.d4science.org:8080/geonetwork/srv/en/metadata.show?uuid=65f74fb9-921c-41a2-88d8-a91f76c178af,environment,22dde829-fe22-4db6-875d-5ae13aed8a5a,2017-10-13T13:32:47.586921,bluebridge.catalogue@d4science.org,False,,amblygobius-buanensis-aquamaps-native-2050-raster,8,a4d1aa9b-72fc-483c-bd3c-9f803c98a645,[],5638c76b-24f5-483b-ae1b-c14b175e8106,730e5b91-2265-431e-b033-7f310474e4f3,active,9a280faf-665b-45e4-b4a0-2783ee712341,approved,11680099-3fd0-427c-8cfc-b1fbcde0623e,environment,active,https://ckan-bb2.d4science.org/images/organisations/d4sciencelabs.png,OGC:WMS-1.3.0-http-get-map,iMarine Consortium,dataset,2017-11-24T11:56:48.241435,11680099-3fd0-427c-8cfc-b1fbcde0623e,asNeeded,environment,http://data.d4science.org/ctlg/gCubeApps/amblygobius-buanensis-aquamaps-native-2050-raster,"[{""name"": """", ""roles"": [""originator""]}]"
b04c67a8-d5bd-4003-95a5-1ecfbe5a9a8f,0,,Tudor s flounder,140.25,active,-17.75,environment,51e1e1e6-d64e-4bc9-819d-5a8c2be34dd4,http://geonetwork.d4science.org:8080/geonetwork/srv/en/xml.metadata.get?uuid=15fbd139-3c7a-46c5-bf3d-5478f3200bf5,2017-11-25T17:16:32.253247,2017-10-10T17:54:07.176+02:00,True,Unnamed resource,True,False,Anguilla Australis australis Aquamaps Native Raster,False,d4sciencelabs,bf9c1fc6-610c-4683-9906-ab38eeb55835,15fbd139-3c7a-46c5-bf3d-5478f3200bf5,"[{""type"": ""creation"", ""value"": ""2017-10-10T17:54:07.176+02:00""}, {""type"": ""publication"", ""value"": ""2017-10-10T17:54:07.176+02:00""}, {""type"": ""revision"", ""value"": ""2017-10-10T17:54:07.176+02:00""}]",-46.75,eng,active,2017-11-25T17:16:31.466030,"This Anguilla Australis australis Species Distribution Map has been generated with the AquaMaps methodology by exploiting the technology and the computational resources provided by iMarine. In particular, this map has been produced using the HSPEC Native Range dataset, generated using the AquaMaps NativeRange algorithm. Hosted on the D4Science Thredds CataSystem.out.println: http://thredds.d4science.org",ebc02b4a-f774-4e7e-afe1-d52ab93126de,http://thredds.d4science.org/thredds/fileServer/public/netcdf/AquamapsNative/aquamaps_native_anguilla_australis_australis.nc,WCS,4,Anguilla Australis australis,168.25,"ISO 19115 Topic Category. Environmental resources, protection and conservation, for example environmental pollution, waste storage and treatment, environmental impact assessment, monitoring environmental risk, nature reserves, landscape, water quality, air quality, environmental modeling",[],"iMarine is an access point to a number of Virtual Research Environments deployed and operated in the context of the iMarine project to support the Ecosystem Approach to fisheries management and conservation of marine living resources. It empowers practitioners and policy makers from multiple scientific fields such as fisheries, biodiversity and ocean observation by ensuring that otherwise dispersed and heterogeneous data is available to all stakeholder communities through a shared virtual environment that brings together multidisciplinary data sources, supports cross-cutting scientific analysis, and assists communication.
See More: https://i-marine.d4science.org/",Dataset,D4Science Labs,bb,,[],,http://geonetwork.d4science.org:8080/geonetwork,,organization,,"{""type"": ""Polygon"", ""coordinates"": [[[140.25, -46.75], [168.25, -46.75], [168.25, -17.75], [140.25, -17.75], [140.25, -46.75]]]}",http://geonetwork.d4science.org:8080/geonetwork/srv/en/metadata.show?uuid=15fbd139-3c7a-46c5-bf3d-5478f3200bf5,environment,22dde829-fe22-4db6-875d-5ae13aed8a5a,2017-09-23T12:41:17.379593,bluebridge.catalogue@d4science.org,False,,anguilla-australis-australis-aquamaps-native-raster,8,51e1e1e6-d64e-4bc9-819d-5a8c2be34dd4,[],3eb323d3-b544-44e0-8b51-6c0ae468225c,730e5b91-2265-431e-b033-7f310474e4f3,active,b04c67a8-d5bd-4003-95a5-1ecfbe5a9a8f,approved,11680099-3fd0-427c-8cfc-b1fbcde0623e,environment,active,https://ckan-bb2.d4science.org/images/organisations/d4sciencelabs.png,OGC:WMS-1.3.0-http-get-map,iMarine Consortium,dataset,2017-11-24T11:56:48.241435,11680099-3fd0-427c-8cfc-b1fbcde0623e,asNeeded,environment,http://data.d4science.org/ctlg/gCubeApps/anguilla-australis-australis-aquamaps-native-raster,"[{""name"": """", ""roles"": [""originator""]}]"
0e5e8631-17a1-4563-93ca-60b78a817e33,0,,NetCDF,-180.0,active,90.0,biota,86197cea-88a5-4171-acdd-216afd716706,http://geonetwork.d4science.org:8080/geonetwork/srv/en/xml.metadata.get?uuid=5fc31543-f00e-4b74-9aa1-42767c264872,2017-11-24T12:55:37.823556,2013-06-19T12:09:48.060+02:00,True,WMS link to resource,True,False,Ammotretis lituratus,False,imarine,a6352807-7a8f-4801-a475-9445ad0062c6,5fc31543-f00e-4b74-9aa1-42767c264872,"[{""type"": ""creation"", ""value"": ""2013-04-11T21:50:05.058+02:00""}]",-90.0,eng,active,2017-11-24T12:55:37.378699,"This Ammotretis lituratus Species Distribution Map has been generated with the AquaMaps methodology by exploiting the technology and the computational resources provided by iMarine. In particular, this map has been produced using the Default Suitable maps_SuitableRange dataset, generated using AquaMaps SuitableRange algorithm.",ebc02b4a-f774-4e7e-afe1-d52ab93126de,"http://geoserver4.d4science.research-infrastructures.eu/geoserver/wms?service=wms&version=1.1.0&request=GetMap&layers=lammotretislituratus20130411214948505cest&styles=&bbox=-180,-90,180,90&width=676&height=330&srs=EPSG:4326&crs=EPSG:4326&format=application/openlayers",WMS,4,Ammotretis lituratus,180.0,"ISO 19115 Topic Category. Flora or fauna in natural environment, for example wildlife, vegetation, biological sciences, ecology, wilderness, sea life, wetlands, habitat, biological resources",[],"D4Science has developed a series of applications (accessible through the D4Science Labs) which can be used by any user to upload, manipulate, use and re-use products with the aim to share them with other users following the principle of the OpenScience",Dataset,iMarine,bb,,[],,http://geonetwork.d4science.org:8080/geonetwork,,organization,,"{""type"": ""Polygon"", ""coordinates"": [[[-180.0, -90.0], [180.0, -90.0], [180.0, 90.0], [-180.0, 90.0], [-180.0, -90.0]]]}",http://geonetwork.d4science.org:8080/geonetwork/srv/en/metadata.show?uuid=5fc31543-f00e-4b74-9aa1-42767c264872,biota,70a489ea-a910-40b8-ae63-431084dc99a6,2017-10-14T01:13:27.320783,bluebridge.catalogue@d4science.org,False,,ammotretis-lituratus3,6,86197cea-88a5-4171-acdd-216afd716706,[],8f4db3f3-1ab7-4028-89a3-626ab1c46d7a,7bf889d1-7829-4c2e-ad72-222798006eee,active,0e5e8631-17a1-4563-93ca-60b78a817e33,approved,81f5e6ae-92ab-410a-9a75-f809d43ec1ee,biota,active,https://ckan-bb2.d4science.org/images/organisations/imarine.png,OGC:WMS-1.3.0-http-get-map,iMarine Consortium,dataset,2017-11-24T11:56:37.199304,81f5e6ae-92ab-410a-9a75-f809d43ec1ee,asNeeded,biota,http://data.d4science.org/ctlg/d4science.research-infrastructures.eu/ammotretis-lituratus3,"[{""name"": ""iMarine Consortium"", ""roles"": [""author""]}, {""name"": ""iMarine.eu"", ""roles"": [""distributor"", ""resourceProvider""]}]"
