has_identifier_has_id_value,unknown,unknown,has_name,unknown,unknown,unknown,unknown,has_identifier_has_id_value,unknown,has_identifier_is_source_of_has_startDate,unknown,unknown,unknown,unknown,unknown,has_name,unknown,unknown,unknown,unknown,unknown,unknown,unknown,unknown,is_source_of_has_startDate,has_description,is_destination_of_has_source_has_identifier_has_id_value,unknown,unknown,unknown,has_name,unknown,unknown,unknown,unknown,is_source_of_has_classification_has_term,unknown,is_destination_of_has_source_is_source_of_has_destination_has_name,is_source_of_has_classification_has_term,unknown,is_destination_of_has_source_is_source_of_has_destination_has_name,unknown,unknown,unknown,unknown,unknown,unknown,unknown,unknown,unknown,is_destination_of_has_source_is_source_of_has_destination_has_URI,unknown,unknown,has_identifier_has_id_value,unknown,has_identifier_has_id_value,unknown,unknown,unknown,unknown,has_identifier_has_id_value,unknown,unknown,unknown,unknown,unknown,unknown,is_destination_of_has_source_is_source_of_has_destination_has_name,is_source_of_has_classification_has_term,unknown,unknown,unknown,unknown,unknown,unknown
5a5f6322-271d-47c3-8a0f-dc626a6cbc60,0,http://node49.p.d4science.research-infrastructures.eu:9003/405/Animalia/Chordata/Actinopterygii/Perciformes/Acanthuridae/Fis-25284/Ocean_View__Pacific.jpg,SpeciesDistribution,-180.0,active,90.0,biota,4c504de5-71b1-4f0e-a4af-c930d1c7dbd3,http://geonetwork.d4science.org:8080/geonetwork/srv/en/xml.metadata.get?uuid=f0b0182d-d07d-4e36-ae76-2039b1ddc07f,2017-11-25T00:31:47.875801,2013-06-19T08:53:33.742+02:00,True,WMS link to resource,True,False,Acanthurus nigrofuscus,False,imarine,172d04b9-eb96-4684-a7e3-0cf40b2b8af4,f0b0182d-d07d-4e36-ae76-2039b1ddc07f,"[{""type"": ""creation"", ""value"": ""2013-04-10T13:23:36.948+02:00""}]",-90.0,eng,active,2017-11-25T00:31:47.333143,"This Acanthurus nigrofuscus Species Distribution Map has been generated with the AquaMaps methodology by exploiting the technology and the computational resources provided by iMarine. In particular, this map has been produced using the Default Suitable maps_SuitableRange dataset, generated using AquaMaps SuitableRange algorithm.",ebc02b4a-f774-4e7e-afe1-d52ab93126de,"http://geoserver4.d4science.research-infrastructures.eu/geoserver/wms?service=wms&version=1.1.0&request=GetMap&layers=lacanthurusnigrofuscus20130410132320817cest&styles=&bbox=-180,-90,180,90&width=676&height=330&srs=EPSG:4326&crs=EPSG:4326&format=application/openlayers",WMS,4,Acanthurus nigrofuscus,180.0,"ISO 19115 Topic Category. Flora or fauna in natural environment, for example wildlife, vegetation, biological sciences, ecology, wilderness, sea life, wetlands, habitat, biological resources",[],"iMarine is an access point to a number of Virtual Research Environments deployed and operated in the context of the iMarine project to support the Ecosystem Approach to fisheries management and conservation of marine living resources. It empowers practitioners and policy makers from multiple scientific fields such as fisheries, biodiversity and ocean observation by ensuring that otherwise dispersed and heterogeneous data is available to all stakeholder communities through a shared virtual environment that brings together multidisciplinary data sources, supports cross-cutting scientific analysis, and assists communication.
See More: https://i-marine.d4science.org/",Dataset,iMarine,bb,dataset,[],"iMarine Consortium,iMarine.eu",http://geonetwork.d4science.org:8080/geonetwork,2013-04-10T13:23:36.948+02:00,organization,info@i-marine.eu,"{""type"": ""Polygon"", ""coordinates"": [[[-180.0, -90.0], [180.0, -90.0], [180.0, 90.0], [-180.0, 90.0], [-180.0, -90.0]]]}",http://geonetwork.d4science.org:8080/geonetwork/srv/en/metadata.show?uuid=f0b0182d-d07d-4e36-ae76-2039b1ddc07f,biota,70a489ea-a910-40b8-ae63-431084dc99a6,2017-09-23T06:38:53.788539,bluebridge.catalogue@d4science.org,False,creation,acanthurus-nigrofuscus3,6,4c504de5-71b1-4f0e-a4af-c930d1c7dbd3,[],ab242867-a4b8-4d13-b8a8-d2e59578c922,7bf889d1-7829-4c2e-ad72-222798006eee,active,5a5f6322-271d-47c3-8a0f-dc626a6cbc60,approved,81f5e6ae-92ab-410a-9a75-f809d43ec1ee,biota,active,https://ckan-bb2.d4science.org/images/organisations/imarine.png,OGC:WFS-1.0.0-http-get-feature,Flanders Marine Institute (VLIZ),dataset,2017-11-24T11:56:37.199304,81f5e6ae-92ab-410a-9a75-f809d43ec1ee,asNeeded,biota,http://data.d4science.org/ctlg/d4science.research-infrastructures.eu/acanthurus-nigrofuscus3,"[{""name"": ""iMarine Consortium"", ""roles"": [""author""]}, {""name"": ""iMarine.eu"", ""roles"": [""distributor"", ""resourceProvider""]}]"
817cde8e-215e-4a19-8e2e-57ec701da560,0,http://node49.p.d4science.research-infrastructures.eu:9003/407/Animalia/Arthropoda/Malacostraca/Amphipoda/Ampeliscidae/ITS-93330/Ocean_View__Pacific.jpg,SpeciesDistribution,-180.0,active,90.0,biota,8b2444ca-a0f5-4d85-af77-d44e4dae9004,http://geonetwork.d4science.org:8080/geonetwork/srv/en/xml.metadata.get?uuid=3b5155a3-f6fa-444c-a6ff-573d8a1e3e4e,2017-11-29T23:10:36.619225,2013-06-19T19:24:17.137+02:00,True,WMS link to resource,True,False,Ampelisca vadorum,False,imarine,c415fab9-35e8-45df-8790-d087f71698ae,3b5155a3-f6fa-444c-a6ff-573d8a1e3e4e,"[{""type"": ""creation"", ""value"": ""2013-04-14T15:07:43.591+02:00""}]",-90.0,eng,active,2017-11-29T23:10:34.657952,"This Ampelisca vadorum Species Distribution Map has been generated with the AquaMaps methodology by exploiting the technology and the computational resources provided by iMarine. In particular, this map has been produced using the Default Suitable 2050 maps_SuitableRange2050 dataset, generated using AquaMaps SuitableRange2050 algorithm.",ebc02b4a-f774-4e7e-afe1-d52ab93126de,"http://geoserver4.d4science.research-infrastructures.eu/geoserver/wms?service=wms&version=1.1.0&request=GetMap&layers=lampeliscavadorum20130414150728526cest&styles=&bbox=-180,-90,180,90&width=676&height=330&srs=EPSG:4326&crs=EPSG:4326&format=application/openlayers",WMS,4,7614324,180.0,"ISO 19115 Topic Category. Flora or fauna in natural environment, for example wildlife, vegetation, biological sciences, ecology, wilderness, sea life, wetlands, habitat, biological resources",[],"iMarine is an access point to a number of Virtual Research Environments deployed and operated in the context of the iMarine project to support the Ecosystem Approach to fisheries management and conservation of marine living resources. It empowers practitioners and policy makers from multiple scientific fields such as fisheries, biodiversity and ocean observation by ensuring that otherwise dispersed and heterogeneous data is available to all stakeholder communities through a shared virtual environment that brings together multidisciplinary data sources, supports cross-cutting scientific analysis, and assists communication.
See More: https://i-marine.d4science.org/",Dataset,iMarine,bb,dataset,[],"iMarine Consortium,iMarine.eu",http://geonetwork.d4science.org:8080/geonetwork,2013-04-14T15:07:43.591+02:00,organization,info@i-marine.eu,"{""type"": ""Polygon"", ""coordinates"": [[[-180.0, -90.0], [180.0, -90.0], [180.0, 90.0], [-180.0, 90.0], [-180.0, -90.0]]]}",http://geonetwork.d4science.org:8080/geonetwork/srv/en/metadata.show?uuid=3b5155a3-f6fa-444c-a6ff-573d8a1e3e4e,biota,70a489ea-a910-40b8-ae63-431084dc99a6,2017-09-23T06:37:36.734817,bluebridge.catalogue@d4science.org,False,creation,ampelisca-vadorum2,7,8b2444ca-a0f5-4d85-af77-d44e4dae9004,[],e528862e-8edb-46d5-b6f5-4ec4af4aad78,7bf889d1-7829-4c2e-ad72-222798006eee,active,817cde8e-215e-4a19-8e2e-57ec701da560,approved,81f5e6ae-92ab-410a-9a75-f809d43ec1ee,biota,active,https://ckan-bb2.d4science.org/images/organisations/imarine.png,OGC:WFS-1.0.0-http-get-feature,iMarine.eu,dataset,2017-11-24T11:56:37.199304,81f5e6ae-92ab-410a-9a75-f809d43ec1ee,asNeeded,biota,http://data.d4science.org/ctlg/d4science.research-infrastructures.eu/ampelisca-vadorum2,"[{""name"": ""iMarine Consortium"", ""roles"": [""author""]}, {""name"": ""iMarine.eu"", ""roles"": [""distributor"", ""resourceProvider""]}]"
472cd023-a3eb-488e-ac39-84dd848abe79,0,http://node49.p.d4science.research-infrastructures.eu:9003/83/Animalia/Chordata/Actinopterygii/Perciformes/Gobiidae/Fis-54058/Ocean_View__Pacific.jpg,Probability Distribution,-91.75,active,24.25,environment,56cdcce7-8cd8-45f2-bccc-a159095f5fad,http://geonetwork.d4science.org:8080/geonetwork/srv/en/xml.metadata.get?uuid=2bdb2279-a447-44f4-8556-7d0d815a20e2,2017-11-24T21:04:47.419714,2017-10-10T17:48:49.423+02:00,True,Unnamed resource,True,False,Agaricia Lamarcki Aquamaps Native Raster,False,d4sciencelabs,bf9c1fc6-610c-4683-9906-ab38eeb55835,2bdb2279-a447-44f4-8556-7d0d815a20e2,"[{""type"": ""creation"", ""value"": ""2017-10-10T17:48:49.423+02:00""}, {""type"": ""publication"", ""value"": ""2017-10-10T17:48:49.423+02:00""}, {""type"": ""revision"", ""value"": ""2017-10-10T17:48:49.423+02:00""}]",6.75,eng,active,2017-11-24T21:04:46.941616,"This Agaricia Lamarcki Species Distribution Map has been generated with the AquaMaps methodology by exploiting the technology and the computational resources provided by iMarine. In particular, this map has been produced using the HSPEC Native Range dataset, generated using the AquaMaps NativeRange algorithm. Hosted on the D4Science Thredds CataSystem.out.println: http://thredds.d4science.org",ebc02b4a-f774-4e7e-afe1-d52ab93126de,http://thredds.d4science.org/thredds/fileServer/public/netcdf/AquamapsNative/aquamaps_native_agaricia_lamarcki.nc,WCS,4,Agaricia Lamarcki,-57.75,"ISO 19115 Topic Category. Environmental resources, protection and conservation, for example environmental pollution, waste storage and treatment, environmental impact assessment, monitoring environmental risk, nature reserves, landscape, water quality, air quality, environmental modeling",[],"D4Science has developed a series of applications (accessible through the D4Science Labs) which can be used by any user to upload, manipulate, use and re-use products with the aim to share them with other users following the principle of the OpenScience",Dataset,D4Science Labs,bb,dataset,[],"iMarine Consortium,iMarine.eu",http://geonetwork.d4science.org:8080/geonetwork,2012-12-21T15:01:28.123+01:00,organization,info@i-marine.eu,"{""type"": ""Polygon"", ""coordinates"": [[[-91.75, 6.75], [-57.75, 6.75], [-57.75, 24.25], [-91.75, 24.25], [-91.75, 6.75]]]}",http://geonetwork.d4science.org:8080/geonetwork/srv/en/metadata.show?uuid=2bdb2279-a447-44f4-8556-7d0d815a20e2,environment,22dde829-fe22-4db6-875d-5ae13aed8a5a,2017-10-13T16:27:19.685053,bluebridge.catalogue@d4science.org,False,creation,agaricia-lamarcki-aquamaps-native-raster,8,56cdcce7-8cd8-45f2-bccc-a159095f5fad,[],46b8928e-ee55-42d6-ba96-5bf7a037dc27,730e5b91-2265-431e-b033-7f310474e4f3,active,472cd023-a3eb-488e-ac39-84dd848abe79,approved,11680099-3fd0-427c-8cfc-b1fbcde0623e,environment,active,https://ckan-bb2.d4science.org/images/organisations/d4sciencelabs.png,OGC:WFS-1.0.0-http-get-feature,iMarine.eu,dataset,2017-11-24T11:56:48.241435,11680099-3fd0-427c-8cfc-b1fbcde0623e,asNeeded,environment,http://data.d4science.org/ctlg/gCubeApps/agaricia-lamarcki-aquamaps-native-raster,"[{""name"": """", ""roles"": [""originator""]}]"
c7de9ca3-5daa-4685-bece-3d0fc685557a,0,http://node49.p.d4science.research-infrastructures.eu:9003/405/Animalia/Chordata/Actinopterygii/Perciformes/Embiotocidae/Fis-24418/Ocean_View__Pacific.jpg,NetCDF,-179.75,active,19.25,environment,829e0ea1-921c-452b-87d4-ef9bcda4a9ed,http://geonetwork.d4science.org:8080/geonetwork/srv/en/xml.metadata.get?uuid=79feaa0b-8e32-4368-86c2-cb546a32187b,2017-11-25T23:05:22.360399,2017-10-10T17:51:10.343+02:00,True,Unnamed resource,True,False,Ambassis Interrupta Aquamaps Native Raster,False,d4sciencelabs,c415fab9-35e8-45df-8790-d087f71698ae,79feaa0b-8e32-4368-86c2-cb546a32187b,"[{""type"": ""creation"", ""value"": ""2017-10-10T17:51:10.343+02:00""}, {""type"": ""publication"", ""value"": ""2017-10-10T17:51:10.343+02:00""}, {""type"": ""revision"", ""value"": ""2017-10-10T17:51:10.343+02:00""}]",-22.75,eng,active,2017-11-25T23:05:21.511840,"This Ambassis Interrupta Species Distribution Map has been generated with the AquaMaps methodology by exploiting the technology and the computational resources provided by iMarine. In particular, this map has been produced using the HSPEC Native Range dataset, generated using the AquaMaps NativeRange algorithm. Hosted on the D4Science Thredds CataSystem.out.println: http://thredds.d4science.org",ebc02b4a-f774-4e7e-afe1-d52ab93126de,http://thredds.d4science.org/thredds/fileServer/public/netcdf/AquamapsNative/aquamaps_native_ambassis_interrupta.nc,WCS,4,8f559439-60c7-47f6-acce-34f03acdd4a6,180.25,"ISO 19115 Topic Category. Environmental resources, protection and conservation, for example environmental pollution, waste storage and treatment, environmental impact assessment, monitoring environmental risk, nature reserves, landscape, water quality, air quality, environmental modeling",[],"D4Science has developed a series of applications (accessible through the D4Science Labs) which can be used by any user to upload, manipulate, use and re-use products with the aim to share them with other users following the principle of the OpenScience",Dataset,D4Science Labs,bb,dataset,[],"iMarine Consortium,iMarine.eu",http://geonetwork.d4science.org:8080/geonetwork,2013-04-11T12:07:57.269+02:00,organization,info@i-marine.eu,"{""type"": ""Polygon"", ""coordinates"": [[[-179.75, -22.75], [180.25, -22.75], [180.25, 19.25], [-179.75, 19.25], [-179.75, -22.75]]]}",http://geonetwork.d4science.org:8080/geonetwork/srv/en/metadata.show?uuid=79feaa0b-8e32-4368-86c2-cb546a32187b,environment,22dde829-fe22-4db6-875d-5ae13aed8a5a,2017-10-13T19:33:08.155853,bluebridge.catalogue@d4science.org,False,creation,ambassis-interrupta-aquamaps-native-raster,8,829e0ea1-921c-452b-87d4-ef9bcda4a9ed,[],859d53e8-4f78-4f40-bc02-6132d4dbaff2,730e5b91-2265-431e-b033-7f310474e4f3,active,c7de9ca3-5daa-4685-bece-3d0fc685557a,approved,11680099-3fd0-427c-8cfc-b1fbcde0623e,environment,active,https://ckan-bb2.d4science.org/images/organisations/d4sciencelabs.png,OGC:WFS-1.0.0-http-get-feature,iMarine.eu,dataset,2017-11-24T11:56:48.241435,11680099-3fd0-427c-8cfc-b1fbcde0623e,asNeeded,environment,http://data.d4science.org/ctlg/gCubeApps/ambassis-interrupta-aquamaps-native-raster,"[{""name"": """", ""roles"": [""originator""]}]"
30d4f2d8-7dc9-4012-b0f8-51ab3e164943,0,http://node49.p.d4science.research-infrastructures.eu:9003/83/Animalia/Chordata/Actinopterygii/Pleuronectiformes/Pleuronectidae/Fis-29171/Earth.jpg,SpeciesDistribution,-180.0,active,90.0,biota,25746478-839a-44f9-944b-b599f55ef22a,http://geonetwork.d4science.org:8080/geonetwork/srv/en/xml.metadata.get?uuid=58d14d9c-1088-461e-a08f-3e50540e98b1,2017-11-24T17:44:18.363568,2013-06-19T06:01:45.897+02:00,True,WMS link to resource,True,False,Acentrogobius janthinopterus,False,imarine,c415fab9-35e8-45df-8790-d087f71698ae,58d14d9c-1088-461e-a08f-3e50540e98b1,"[{""type"": ""creation"", ""value"": ""2012-12-21T15:01:28.123+01:00""}]",-90.0,eng,active,2017-11-24T17:44:17.891337,"This Acentrogobius janthinopterus Species Distribution Map has been generated with the AquaMaps methodology by exploiting the technology and the computational resources provided by iMarine. In particular, this map has been produced using the HSPEC 2050 Native Range dataset, generated using AquaMaps NativeRange2050 algorithm.",ebc02b4a-f774-4e7e-afe1-d52ab93126de,"http://geoserver.d4science-ii.research-infrastructures.eu/geoserver/wms?service=wms&version=1.1.0&request=GetMap&layers=lacentrogobiusjanthinopterus20121221150044647cet&styles=&bbox=-180,-90,180,90&width=676&height=330&srs=EPSG:4326&crs=EPSG:4326&format=application/openlayers",WMS,4,Acentrogobius janthinopterus,180.0,"ISO 19115 Topic Category. Flora or fauna in natural environment, for example wildlife, vegetation, biological sciences, ecology, wilderness, sea life, wetlands, habitat, biological resources",[],"iMarine is an access point to a number of Virtual Research Environments deployed and operated in the context of the iMarine project to support the Ecosystem Approach to fisheries management and conservation of marine living resources. It empowers practitioners and policy makers from multiple scientific fields such as fisheries, biodiversity and ocean observation by ensuring that otherwise dispersed and heterogeneous data is available to all stakeholder communities through a shared virtual environment that brings together multidisciplinary data sources, supports cross-cutting scientific analysis, and assists communication.
See More: https://i-marine.d4science.org/",Dataset,iMarine,bb,dataset,[],"iMarine Consortium,iMarine.eu",http://geonetwork.d4science.org:8080/geonetwork,2012-12-20T22:29:59.984+01:00,organization,info@i-marine.eu,"{""type"": ""Polygon"", ""coordinates"": [[[-180.0, -90.0], [180.0, -90.0], [180.0, 90.0], [-180.0, 90.0], [-180.0, -90.0]]]}",http://geonetwork.d4science.org:8080/geonetwork/srv/en/metadata.show?uuid=58d14d9c-1088-461e-a08f-3e50540e98b1,biota,70a489ea-a910-40b8-ae63-431084dc99a6,2017-09-23T15:06:40.277558,bluebridge.catalogue@d4science.org,False,creation,acentrogobius-janthinopterus3,6,25746478-839a-44f9-944b-b599f55ef22a,[],9c1939f5-da54-42c4-8d20-416a79403999,7bf889d1-7829-4c2e-ad72-222798006eee,active,30d4f2d8-7dc9-4012-b0f8-51ab3e164943,approved,81f5e6ae-92ab-410a-9a75-f809d43ec1ee,biota,active,https://ckan-bb2.d4science.org/images/organisations/imarine.png,OGC:WFS-1.0.0-http-get-feature,iMarine.eu,dataset,2017-11-24T11:56:37.199304,81f5e6ae-92ab-410a-9a75-f809d43ec1ee,asNeeded,biota,http://data.d4science.org/ctlg/d4science.research-infrastructures.eu/acentrogobius-janthinopterus3,"[{""name"": ""iMarine Consortium"", ""roles"": [""author""]}, {""name"": ""iMarine.eu"", ""roles"": [""distributor"", ""resourceProvider""]}]"
da5a1e17-c224-4046-a526-c4dbc63292c8,0,http://node49.p.d4science.research-infrastructures.eu:9003/83/Animalia/Arthropoda/Malacostraca/Decapoda/Sergestidae/ITS-95902/Earth.jpg,Probability Distribution,-179.75,active,37.25,environment,927e3cbd-953a-4d8b-9ba5-01cea1a91aa6,http://geonetwork.d4science.org:8080/geonetwork/srv/en/xml.metadata.get?uuid=aad0fb92-4f42-456c-a65c-0b32f0ad87bd,2017-12-17T09:34:56.587771,2017-12-02T12:17:23.100+01:00,True,Unnamed resource,True,False,actinopyga echinites Aquamaps Native 2050 Raster,False,d4sciencelabs,a89fe007-f2fa-4c8f-b90d-062e80400a2d,aad0fb92-4f42-456c-a65c-0b32f0ad87bd,"[{""type"": ""creation"", ""value"": ""2017-12-02T12:17:23.100+01:00""}, {""type"": ""publication"", ""value"": ""2017-12-02T12:17:23.100+01:00""}, {""type"": ""revision"", ""value"": ""2017-12-02T12:17:23.100+01:00""}]",-34.25,eng,active,2017-12-17T09:34:53.339794,"This actinopyga echinites Species Distribution Map for 2050 has been generated with the AquaMaps methodology by exploiting the technology and the computational resources provided by iMarine. In particular, this map has been produced using the HSPEC Native Range dataset, generated using the AquaMaps NativeRange 2050 algorithm. Hosted on the D4Science Thredds CataSystem.out.println: http://thredds.d4science.org",ebc02b4a-f774-4e7e-afe1-d52ab93126de,http://thredds.d4science.org/thredds/fileServer/public/netcdf/AquamapsNative2050/aquamaps_native2050_actinopyga_echinites.nc,WCS,4,6efb55e6-df98-493d-882f-5ab54750c2e1,180.25,"ISO 19115 Topic Category. Environmental resources, protection and conservation, for example environmental pollution, waste storage and treatment, environmental impact assessment, monitoring environmental risk, nature reserves, landscape, water quality, air quality, environmental modeling",[],"D4Science has developed a series of applications (accessible through the D4Science Labs) which can be used by any user to upload, manipulate, use and re-use products with the aim to share them with other users following the principle of the OpenScience",Dataset,D4Science Labs,bb,dataset,[],"iMarine Consortium,iMarine.eu",http://geonetwork.d4science.org:8080/geonetwork,2012-12-21T22:51:36.516+01:00,organization,info@i-marine.eu,"{""type"": ""Polygon"", ""coordinates"": [[[-179.75, -34.25], [180.25, -34.25], [180.25, 37.25], [-179.75, 37.25], [-179.75, -34.25]]]}",http://geonetwork.d4science.org:8080/geonetwork/srv/en/metadata.show?uuid=aad0fb92-4f42-456c-a65c-0b32f0ad87bd,environment,22dde829-fe22-4db6-875d-5ae13aed8a5a,2017-12-15T16:44:41.977247,bluebridge.catalogue@d4science.org,False,creation,actinopyga-echinites-aquamaps-native-2050-raster,8,927e3cbd-953a-4d8b-9ba5-01cea1a91aa6,[],f2274f4c-b54f-4a25-9133-eb572204c80a,730e5b91-2265-431e-b033-7f310474e4f3,active,da5a1e17-c224-4046-a526-c4dbc63292c8,approved,11680099-3fd0-427c-8cfc-b1fbcde0623e,environment,active,https://ckan-bb2.d4science.org/images/organisations/d4sciencelabs.png,OGC:WFS-1.0.0-http-get-feature,iMarine.eu,dataset,2017-11-24T11:56:48.241435,11680099-3fd0-427c-8cfc-b1fbcde0623e,asNeeded,environment,http://data.d4science.org/ctlg/gCubeApps/actinopyga-echinites-aquamaps-native-2050-raster,"[{""name"": """", ""roles"": [""originator""]}]"
6e8745e2-598f-4296-b589-b798a0d3160e,0,http://node49.p.d4science.research-infrastructures.eu:9003/405/Animalia/Chordata/Actinopterygii/Tetraodontiformes/Monacanthidae/Fis-22077/Ocean_View__Pacific.jpg,SpeciesDistribution,-180.0,active,90.0,biota,a00a2880-115a-4f38-8bac-fa0946a1e9d7,http://geonetwork.d4science.org:8080/geonetwork/srv/en/xml.metadata.get?uuid=8bed04cc-7966-4468-8350-3ffd44348242,2017-11-25T04:21:42.596307,2013-06-19T11:11:24.360+02:00,True,WMS link to resource,True,False,Amphistichus rhodoterus,False,imarine,86304c25-7262-4587-90e1-f44017ad1a55,8bed04cc-7966-4468-8350-3ffd44348242,"[{""type"": ""creation"", ""value"": ""2013-04-11T12:07:57.269+02:00""}]",-90.0,eng,active,2017-11-25T04:21:41.827332,"This Amphistichus rhodoterus Species Distribution Map has been generated with the AquaMaps methodology by exploiting the technology and the computational resources provided by iMarine. In particular, this map has been produced using the Default Suitable maps_SuitableRange dataset, generated using AquaMaps SuitableRange algorithm.",ebc02b4a-f774-4e7e-afe1-d52ab93126de,"http://geoserver4.d4science.research-infrastructures.eu/geoserver/wms?service=wms&version=1.1.0&request=GetMap&layers=lamphistichusrhodoterus20130411120742684cest&styles=&bbox=-180,-90,180,90&width=676&height=330&srs=EPSG:4326&crs=EPSG:4326&format=application/openlayers",WMS,4,Amphistichus rhodoterus,180.0,"ISO 19115 Topic Category. Flora or fauna in natural environment, for example wildlife, vegetation, biological sciences, ecology, wilderness, sea life, wetlands, habitat, biological resources",[],"iMarine is an access point to a number of Virtual Research Environments deployed and operated in the context of the iMarine project to support the Ecosystem Approach to fisheries management and conservation of marine living resources. It empowers practitioners and policy makers from multiple scientific fields such as fisheries, biodiversity and ocean observation by ensuring that otherwise dispersed and heterogeneous data is available to all stakeholder communities through a shared virtual environment that brings together multidisciplinary data sources, supports cross-cutting scientific analysis, and assists communication.
See More: https://i-marine.d4science.org/",Dataset,iMarine,bb,dataset,[],"iMarine Consortium,iMarine.eu",http://geonetwork.d4science.org:8080/geonetwork,2013-04-12T09:27:14.187+02:00,organization,info@i-marine.eu,"{""type"": ""Polygon"", ""coordinates"": [[[-180.0, -90.0], [180.0, -90.0], [180.0, 90.0], [-180.0, 90.0], [-180.0, -90.0]]]}",http://geonetwork.d4science.org:8080/geonetwork/srv/en/metadata.show?uuid=8bed04cc-7966-4468-8350-3ffd44348242,biota,70a489ea-a910-40b8-ae63-431084dc99a6,2017-09-21T20:01:33.447646,bluebridge.catalogue@d4science.org,False,creation,amphistichus-rhodoterus,6,a00a2880-115a-4f38-8bac-fa0946a1e9d7,[],87b285cb-7e8a-43ca-ba4e-f8ea42e30519,7bf889d1-7829-4c2e-ad72-222798006eee,active,6e8745e2-598f-4296-b589-b798a0d3160e,approved,81f5e6ae-92ab-410a-9a75-f809d43ec1ee,biota,active,https://ckan-bb2.d4science.org/images/organisations/imarine.png,OGC:WFS-1.0.0-http-get-feature,iMarine.eu,dataset,2017-11-24T11:56:37.199304,81f5e6ae-92ab-410a-9a75-f809d43ec1ee,asNeeded,biota,http://data.d4science.org/ctlg/d4science.research-infrastructures.eu/amphistichus-rhodoterus,"[{""name"": ""iMarine Consortium"", ""roles"": [""author""]}, {""name"": ""iMarine.eu"", ""roles"": [""distributor"", ""resourceProvider""]}]"
