has_identifier_has_id_value,unknown,unknown,has_name,unknown,unknown,unknown,unknown,has_identifier_has_id_value,unknown,has_identifier_is_source_of_has_startDate,unknown,unknown,unknown,unknown,unknown,has_name,unknown,unknown,unknown,unknown,unknown,unknown,unknown,unknown,is_source_of_has_startDate,has_description,is_destination_of_has_source_has_identifier_has_id_value,unknown,unknown,unknown,has_name,unknown,unknown,unknown,unknown,is_source_of_has_classification_has_term,unknown,is_destination_of_has_source_is_source_of_has_destination_has_name,is_source_of_has_classification_has_term,unknown,is_destination_of_has_source_is_source_of_has_destination_has_name,unknown,unknown,unknown,unknown,unknown,unknown,unknown,unknown,unknown,is_destination_of_has_source_is_source_of_has_destination_has_URI,unknown,unknown,has_identifier_has_id_value,unknown,has_identifier_has_id_value,unknown,unknown,unknown,unknown,has_identifier_has_id_value,unknown,unknown,unknown,unknown,unknown,unknown,is_destination_of_has_source_is_source_of_has_destination_has_name,is_source_of_has_classification_has_term,unknown,unknown,unknown,unknown,unknown,unknown
1c129c7d-f55e-4919-95e6-df48cea6167c,0,http://node49.p.d4science.research-infrastructures.eu:9003/407/Animalia/Mollusca/Cephalopoda/Octopoda/Octopodidae/ITS-556329/Ocean_View__Pacific.jpg,SpeciesDistribution,-180.0,active,90.0,biota,020212b3-98bd-460b-b686-7f28201f6de8,http://geonetwork.d4science.org:8080/geonetwork/srv/en/xml.metadata.get?uuid=5bf4b1b6-3cf4-4b28-836b-9b76dd6ccad7,2017-11-28T22:27:58.626676,2013-06-19T19:11:21.671+02:00,True,WMS link to resource,True,False,Ameloctopus litoralis,False,imarine,172d04b9-eb96-4684-a7e3-0cf40b2b8af4,5bf4b1b6-3cf4-4b28-836b-9b76dd6ccad7,"[{""type"": ""creation"", ""value"": ""2013-04-14T12:34:08.792+02:00""}]",-90.0,eng,active,2017-11-28T22:27:55.255874,"This Ameloctopus litoralis Species Distribution Map has been generated with the AquaMaps methodology by exploiting the technology and the computational resources provided by iMarine. In particular, this map has been produced using the Default Suitable 2050 maps_SuitableRange2050 dataset, generated using AquaMaps SuitableRange2050 algorithm.",ebc02b4a-f774-4e7e-afe1-d52ab93126de,"http://geoserver4.d4science.research-infrastructures.eu/geoserver/wms?service=wms&version=1.1.0&request=GetMap&layers=lameloctopuslitoralis20130414123352697cest&styles=&bbox=-180,-90,180,90&width=676&height=330&srs=EPSG:4326&crs=EPSG:4326&format=application/openlayers",WMS,4,7614324,180.0,"ISO 19115 Topic Category. Flora or fauna in natural environment, for example wildlife, vegetation, biological sciences, ecology, wilderness, sea life, wetlands, habitat, biological resources",[],"iMarine is an access point to a number of Virtual Research Environments deployed and operated in the context of the iMarine project to support the Ecosystem Approach to fisheries management and conservation of marine living resources. It empowers practitioners and policy makers from multiple scientific fields such as fisheries, biodiversity and ocean observation by ensuring that otherwise dispersed and heterogeneous data is available to all stakeholder communities through a shared virtual environment that brings together multidisciplinary data sources, supports cross-cutting scientific analysis, and assists communication.
See More: https://i-marine.d4science.org/",Dataset,iMarine,bb,dataset,[],"iMarine Consortium,iMarine.eu",http://geonetwork.d4science.org:8080/geonetwork,2013-04-14T12:34:08.792+02:00,organization,info@i-marine.eu,"{""type"": ""Polygon"", ""coordinates"": [[[-180.0, -90.0], [180.0, -90.0], [180.0, 90.0], [-180.0, 90.0], [-180.0, -90.0]]]}",http://geonetwork.d4science.org:8080/geonetwork/srv/en/metadata.show?uuid=5bf4b1b6-3cf4-4b28-836b-9b76dd6ccad7,biota,70a489ea-a910-40b8-ae63-431084dc99a6,2017-09-21T16:46:44.412128,bluebridge.catalogue@d4science.org,False,creation,ameloctopus-litoralis1,7,020212b3-98bd-460b-b686-7f28201f6de8,[],10841d14-0ccd-4c94-9a8b-2e8d4f9fd8d9,7bf889d1-7829-4c2e-ad72-222798006eee,active,1c129c7d-f55e-4919-95e6-df48cea6167c,approved,81f5e6ae-92ab-410a-9a75-f809d43ec1ee,biota,active,https://ckan-bb2.d4science.org/images/organisations/imarine.png,OGC:WFS-1.0.0-http-get-feature,iMarine.eu,dataset,2017-11-24T11:56:37.199304,81f5e6ae-92ab-410a-9a75-f809d43ec1ee,asNeeded,biota,http://data.d4science.org/ctlg/d4science.research-infrastructures.eu/ameloctopus-litoralis1,"[{""name"": ""iMarine Consortium"", ""roles"": [""author""]}, {""name"": ""iMarine.eu"", ""roles"": [""distributor"", ""resourceProvider""]}]"
2891ed6b-2bf5-419b-a5d9-e5c9ced299ed,0,http://node49.p.d4science.research-infrastructures.eu:9003/80/Animalia/Chordata/Actinopterygii/Tetraodontiformes/Monacanthidae/Fis-26724/Ocean_View__Pacific.jpg,SpeciesDistribution,-180.0,active,90.0,biota,88d14f15-e111-45bb-9588-d74f1ac618b7,http://geonetwork.d4science.org:8080/geonetwork/srv/en/xml.metadata.get?uuid=2d076198-af7e-4f22-a0ad-ff67a66d1a8c,2017-11-24T16:34:21.240570,2013-06-18T21:52:15.146+02:00,True,WMS link to resource,True,False,Acreichthys tomentosus,False,imarine,c415fab9-35e8-45df-8790-d087f71698ae,2d076198-af7e-4f22-a0ad-ff67a66d1a8c,"[{""type"": ""creation"", ""value"": ""2012-12-18T02:45:35.928+01:00""}]",-90.0,eng,active,2017-11-24T16:34:20.741418,"This Acreichthys tomentosus Species Distribution Map has been generated with the AquaMaps methodology by exploiting the technology and the computational resources provided by iMarine. In particular, this map has been produced using the HSPEC Native Range dataset, generated using AquaMaps NativeRange algorithm.",ebc02b4a-f774-4e7e-afe1-d52ab93126de,"http://geoserver4.d4science.research-infrastructures.eu/geoserver/wms?service=wms&version=1.1.0&request=GetMap&layers=lacreichthystomentosus20121218024521008cet&styles=&bbox=-180,-90,180,90&width=676&height=330&srs=EPSG:4326&crs=EPSG:4326&format=application/openlayers",WMS,4,Acreichthys tomentosus,180.0,"ISO 19115 Topic Category. Flora or fauna in natural environment, for example wildlife, vegetation, biological sciences, ecology, wilderness, sea life, wetlands, habitat, biological resources",[],"iMarine is an access point to a number of Virtual Research Environments deployed and operated in the context of the iMarine project to support the Ecosystem Approach to fisheries management and conservation of marine living resources. It empowers practitioners and policy makers from multiple scientific fields such as fisheries, biodiversity and ocean observation by ensuring that otherwise dispersed and heterogeneous data is available to all stakeholder communities through a shared virtual environment that brings together multidisciplinary data sources, supports cross-cutting scientific analysis, and assists communication.
See More: https://i-marine.d4science.org/",Dataset,iMarine,bb,dataset,[],"iMarine Consortium,iMarine.eu",http://geonetwork.d4science.org:8080/geonetwork,2012-12-18T02:45:35.928+01:00,organization,info@i-marine.eu,"{""type"": ""Polygon"", ""coordinates"": [[[-180.0, -90.0], [180.0, -90.0], [180.0, 90.0], [-180.0, 90.0], [-180.0, -90.0]]]}",http://geonetwork.d4science.org:8080/geonetwork/srv/en/metadata.show?uuid=2d076198-af7e-4f22-a0ad-ff67a66d1a8c,biota,70a489ea-a910-40b8-ae63-431084dc99a6,2017-09-21T23:32:40.076040,bluebridge.catalogue@d4science.org,False,creation,acreichthys-tomentosus1,6,88d14f15-e111-45bb-9588-d74f1ac618b7,[],a303f642-2396-4992-8e2d-f1517180e24f,7bf889d1-7829-4c2e-ad72-222798006eee,active,2891ed6b-2bf5-419b-a5d9-e5c9ced299ed,approved,81f5e6ae-92ab-410a-9a75-f809d43ec1ee,biota,active,https://ckan-bb2.d4science.org/images/organisations/imarine.png,OGC:WFS-1.0.0-http-get-feature,iMarine.eu,dataset,2017-11-24T11:56:37.199304,81f5e6ae-92ab-410a-9a75-f809d43ec1ee,asNeeded,biota,http://data.d4science.org/ctlg/d4science.research-infrastructures.eu/acreichthys-tomentosus1,"[{""name"": ""iMarine Consortium"", ""roles"": [""author""]}, {""name"": ""iMarine.eu"", ""roles"": [""distributor"", ""resourceProvider""]}]"
4fa988d2-82c9-45ce-b220-767c5d2e76ac,0,http://node49.p.d4science.research-infrastructures.eu:9003/407/Animalia/Chordata/Elasmobranchii/Rajiformes/Rajidae/Fis-131855/Ocean_View__Pacific.jpg,Probability Distribution,-179.75,active,30.25,environment,644af533-e1d0-456a-80ae-9540e722bf9d,http://geonetwork.d4science.org:8080/geonetwork/srv/en/xml.metadata.get?uuid=b07bd6b2-52eb-408a-b9d1-61364df3380b,2017-11-24T22:46:27.965510,2017-10-10T17:47:58.600+02:00,True,Unnamed resource,True,False,Acropora Formosa Aquamaps Native Raster,False,d4sciencelabs,bf9c1fc6-610c-4683-9906-ab38eeb55835,b07bd6b2-52eb-408a-b9d1-61364df3380b,"[{""type"": ""creation"", ""value"": ""2017-10-10T17:47:58.600+02:00""}, {""type"": ""publication"", ""value"": ""2017-10-10T17:47:58.600+02:00""}, {""type"": ""revision"", ""value"": ""2017-10-10T17:47:58.600+02:00""}]",-31.25,eng,active,2017-11-24T22:46:27.428197,"This Acropora Formosa Species Distribution Map has been generated with the AquaMaps methodology by exploiting the technology and the computational resources provided by iMarine. In particular, this map has been produced using the HSPEC Native Range dataset, generated using the AquaMaps NativeRange algorithm. Hosted on the D4Science Thredds CataSystem.out.println: http://thredds.d4science.org",ebc02b4a-f774-4e7e-afe1-d52ab93126de,http://thredds.d4science.org/thredds/fileServer/public/netcdf/AquamapsNative/aquamaps_native_acropora_formosa.nc,WCS,4,Acropora Formosa,180.25,"ISO 19115 Topic Category. Environmental resources, protection and conservation, for example environmental pollution, waste storage and treatment, environmental impact assessment, monitoring environmental risk, nature reserves, landscape, water quality, air quality, environmental modeling",[],"D4Science has developed a series of applications (accessible through the D4Science Labs) which can be used by any user to upload, manipulate, use and re-use products with the aim to share them with other users following the principle of the OpenScience",Dataset,D4Science Labs,bb,dataset,[],"iMarine Consortium,iMarine.eu",http://geonetwork.d4science.org:8080/geonetwork,2013-04-12T21:19:07.093+02:00,organization,info@i-marine.eu,"{""type"": ""Polygon"", ""coordinates"": [[[-179.75, -31.25], [180.25, -31.25], [180.25, 30.25], [-179.75, 30.25], [-179.75, -31.25]]]}",http://geonetwork.d4science.org:8080/geonetwork/srv/en/metadata.show?uuid=b07bd6b2-52eb-408a-b9d1-61364df3380b,environment,22dde829-fe22-4db6-875d-5ae13aed8a5a,2017-10-13T15:02:21.488287,bluebridge.catalogue@d4science.org,False,creation,acropora-formosa-aquamaps-native-raster,8,644af533-e1d0-456a-80ae-9540e722bf9d,[],c3cd5e42-7527-490c-9947-74e550c2e71a,730e5b91-2265-431e-b033-7f310474e4f3,active,4fa988d2-82c9-45ce-b220-767c5d2e76ac,approved,11680099-3fd0-427c-8cfc-b1fbcde0623e,environment,active,https://ckan-bb2.d4science.org/images/organisations/d4sciencelabs.png,OGC:WFS-1.0.0-http-get-feature,iMarine.eu,dataset,2017-11-24T11:56:48.241435,11680099-3fd0-427c-8cfc-b1fbcde0623e,asNeeded,environment,http://data.d4science.org/ctlg/gCubeApps/acropora-formosa-aquamaps-native-raster,"[{""name"": """", ""roles"": [""originator""]}]"
52ac1155-c222-49c5-bfc4-416c306488d6,0,http://node49.p.d4science.research-infrastructures.eu:9003/405/Animalia/Chordata/Actinopterygii/Clupeiformes/Engraulidae/Fis-23362/Ocean_View__Pacific.jpg,SpeciesDistribution,-180.0,active,90.0,biota,b772b8a6-94c3-44a0-802f-a58ec368c138,http://geonetwork.d4science.org:8080/geonetwork/srv/en/xml.metadata.get?uuid=3f554111-f9b6-4812-9af6-9d9dc296fc6d,2017-11-24T23:16:28.076126,2013-06-19T14:39:22.475+02:00,True,WMS link to resource,True,False,Amblyraja jenseni,False,imarine,172d04b9-eb96-4684-a7e3-0cf40b2b8af4,3f554111-f9b6-4812-9af6-9d9dc296fc6d,"[{""type"": ""creation"", ""value"": ""2013-04-12T21:19:07.093+02:00""}]",-90.0,eng,active,2017-11-24T23:16:27.555156,"This Amblyraja jenseni Species Distribution Map has been generated with the AquaMaps methodology by exploiting the technology and the computational resources provided by iMarine. In particular, this map has been produced using the Default Suitable 2050 maps_SuitableRange2050 dataset, generated using AquaMaps SuitableRange2050 algorithm.",ebc02b4a-f774-4e7e-afe1-d52ab93126de,"http://geoserver3.d4science.research-infrastructures.eu/geoserver/wms?service=wms&version=1.1.0&request=GetMap&layers=lamblyrajajenseni20130412211833686cest&styles=&bbox=-180,-90,180,90&width=676&height=330&srs=EPSG:4326&crs=EPSG:4326&format=application/openlayers",WMS,4,Amblyraja jenseni,180.0,"ISO 19115 Topic Category. Flora or fauna in natural environment, for example wildlife, vegetation, biological sciences, ecology, wilderness, sea life, wetlands, habitat, biological resources",[],"iMarine is an access point to a number of Virtual Research Environments deployed and operated in the context of the iMarine project to support the Ecosystem Approach to fisheries management and conservation of marine living resources. It empowers practitioners and policy makers from multiple scientific fields such as fisheries, biodiversity and ocean observation by ensuring that otherwise dispersed and heterogeneous data is available to all stakeholder communities through a shared virtual environment that brings together multidisciplinary data sources, supports cross-cutting scientific analysis, and assists communication.
See More: https://i-marine.d4science.org/",Dataset,iMarine,bb,dataset,[],"iMarine Consortium,iMarine.eu",http://geonetwork.d4science.org:8080/geonetwork,2013-04-10T02:33:51.233+02:00,organization,info@i-marine.eu,"{""type"": ""Polygon"", ""coordinates"": [[[-180.0, -90.0], [180.0, -90.0], [180.0, 90.0], [-180.0, 90.0], [-180.0, -90.0]]]}",http://geonetwork.d4science.org:8080/geonetwork/srv/en/metadata.show?uuid=3f554111-f9b6-4812-9af6-9d9dc296fc6d,biota,70a489ea-a910-40b8-ae63-431084dc99a6,2017-09-23T05:14:05.628527,bluebridge.catalogue@d4science.org,False,creation,amblyraja-jenseni3,6,b772b8a6-94c3-44a0-802f-a58ec368c138,[],b8378858-b5eb-4b10-8efa-8604167c6fcd,7bf889d1-7829-4c2e-ad72-222798006eee,active,52ac1155-c222-49c5-bfc4-416c306488d6,approved,81f5e6ae-92ab-410a-9a75-f809d43ec1ee,biota,active,https://ckan-bb2.d4science.org/images/organisations/imarine.png,OGC:WFS-1.0.0-http-get-feature,iMarine.eu,dataset,2017-11-24T11:56:37.199304,81f5e6ae-92ab-410a-9a75-f809d43ec1ee,asNeeded,biota,http://data.d4science.org/ctlg/d4science.research-infrastructures.eu/amblyraja-jenseni3,"[{""name"": ""iMarine Consortium"", ""roles"": [""author""]}, {""name"": ""iMarine.eu"", ""roles"": [""distributor"", ""resourceProvider""]}]"
352ee0cf-2cfc-43bc-8826-8490856391e8,0,http://node49.p.d4science.research-infrastructures.eu:9003/80/Animalia/Chordata/Actinopterygii/Perciformes/Labridae/Fis-31134/Ocean_View__Pacific.jpg,NetCDF,-179.75,active,35.25,environment,ef67b97f-067b-4477-b0f2-a8edd2359941,http://geonetwork.d4science.org:8080/geonetwork/srv/en/xml.metadata.get?uuid=9f35e27c-2164-4658-b5dc-a07000a4da8b,2017-11-24T18:22:54.370307,2017-10-10T17:47:52.368+02:00,True,Unnamed resource,True,False,Acropora Anthocercis Aquamaps Native Raster,False,d4sciencelabs,172d04b9-eb96-4684-a7e3-0cf40b2b8af4,9f35e27c-2164-4658-b5dc-a07000a4da8b,"[{""type"": ""creation"", ""value"": ""2017-10-10T17:47:52.368+02:00""}, {""type"": ""publication"", ""value"": ""2017-10-10T17:47:52.368+02:00""}, {""type"": ""revision"", ""value"": ""2017-10-10T17:47:52.368+02:00""}]",-33.75,eng,active,2017-11-24T18:22:53.894604,"This Acropora Anthocercis Species Distribution Map has been generated with the AquaMaps methodology by exploiting the technology and the computational resources provided by iMarine. In particular, this map has been produced using the HSPEC Native Range dataset, generated using the AquaMaps NativeRange algorithm. Hosted on the D4Science Thredds CataSystem.out.println: http://thredds.d4science.org",ebc02b4a-f774-4e7e-afe1-d52ab93126de,http://thredds.d4science.org/thredds/fileServer/public/netcdf/AquamapsNative/aquamaps_native_acropora_anthocercis.nc,WCS,4,754bf79a-886a-47ad-a899-7d04811aae4c,180.25,"ISO 19115 Topic Category. Environmental resources, protection and conservation, for example environmental pollution, waste storage and treatment, environmental impact assessment, monitoring environmental risk, nature reserves, landscape, water quality, air quality, environmental modeling",[],"D4Science has developed a series of applications (accessible through the D4Science Labs) which can be used by any user to upload, manipulate, use and re-use products with the aim to share them with other users following the principle of the OpenScience",Dataset,D4Science Labs,bb,dataset,[],"iMarine Consortium,iMarine.eu",http://geonetwork.d4science.org:8080/geonetwork,2012-12-07T16:58:18.937+01:00,organization,info@i-marine.eu,"{""type"": ""Polygon"", ""coordinates"": [[[-179.75, -33.75], [180.25, -33.75], [180.25, 35.25], [-179.75, 35.25], [-179.75, -33.75]]]}",http://geonetwork.d4science.org:8080/geonetwork/srv/en/metadata.show?uuid=9f35e27c-2164-4658-b5dc-a07000a4da8b,environment,22dde829-fe22-4db6-875d-5ae13aed8a5a,2017-10-13T21:55:56.553509,bluebridge.catalogue@d4science.org,False,creation,acropora-anthocercis-aquamaps-native-raster,8,ef67b97f-067b-4477-b0f2-a8edd2359941,[],0e578176-244c-4900-b0f3-166fa885347f,730e5b91-2265-431e-b033-7f310474e4f3,active,352ee0cf-2cfc-43bc-8826-8490856391e8,approved,11680099-3fd0-427c-8cfc-b1fbcde0623e,environment,active,https://ckan-bb2.d4science.org/images/organisations/d4sciencelabs.png,WWW:LINK-1.0-http--link,iMarine.eu,dataset,2017-11-24T11:56:48.241435,11680099-3fd0-427c-8cfc-b1fbcde0623e,asNeeded,environment,http://data.d4science.org/ctlg/gCubeApps/acropora-anthocercis-aquamaps-native-raster,"[{""name"": """", ""roles"": [""originator""]}]"
e43b1153-2051-4255-b481-cb55c6e5cb01,0,http://node49.p.d4science.research-infrastructures.eu:9003/405/Animalia/Cnidaria/Anthozoa/Scleractinia/Acroporidae/URM-Cn-4751/Ocean_View__Pacific.jpg,SpeciesDistribution,-180.0,active,90.0,biota,d7121f10-22f4-4635-84e5-53f2bd9c3fde,http://geonetwork.d4science.org:8080/geonetwork/srv/en/xml.metadata.get?uuid=fb398ce7-fca1-4437-a67b-b1f9c12c85e4,2017-11-26T06:43:32.209272,2013-06-19T07:56:50.777+02:00,True,WMS link to resource,True,False,Anchoviella perfasciata,False,imarine,172d04b9-eb96-4684-a7e3-0cf40b2b8af4,fb398ce7-fca1-4437-a67b-b1f9c12c85e4,"[{""type"": ""creation"", ""value"": ""2013-04-10T02:33:51.233+02:00""}]",-90.0,eng,active,2017-11-26T06:43:31.064902,"This Anchoviella perfasciata Species Distribution Map has been generated with the AquaMaps methodology by exploiting the technology and the computational resources provided by iMarine. In particular, this map has been produced using the Default Suitable maps_SuitableRange dataset, generated using AquaMaps SuitableRange algorithm.",ebc02b4a-f774-4e7e-afe1-d52ab93126de,"http://geoserver.d4science-ii.research-infrastructures.eu/geoserver/wms?service=wms&version=1.1.0&request=GetMap&layers=lanchoviellaperfasciata20130410023336553cest&styles=&bbox=-180,-90,180,90&width=676&height=330&srs=EPSG:4326&crs=EPSG:4326&format=application/openlayers",WMS,4,Anchoviella perfasciata,180.0,"ISO 19115 Topic Category. Flora or fauna in natural environment, for example wildlife, vegetation, biological sciences, ecology, wilderness, sea life, wetlands, habitat, biological resources",[],"iMarine is an access point to a number of Virtual Research Environments deployed and operated in the context of the iMarine project to support the Ecosystem Approach to fisheries management and conservation of marine living resources. It empowers practitioners and policy makers from multiple scientific fields such as fisheries, biodiversity and ocean observation by ensuring that otherwise dispersed and heterogeneous data is available to all stakeholder communities through a shared virtual environment that brings together multidisciplinary data sources, supports cross-cutting scientific analysis, and assists communication.
See More: https://i-marine.d4science.org/",Dataset,iMarine,bb,dataset,[],"iMarine Consortium,iMarine.eu",http://geonetwork.d4science.org:8080/geonetwork,2013-04-11T08:46:13.043+02:00,organization,info@i-marine.eu,"{""type"": ""Polygon"", ""coordinates"": [[[-180.0, -90.0], [180.0, -90.0], [180.0, 90.0], [-180.0, 90.0], [-180.0, -90.0]]]}",http://geonetwork.d4science.org:8080/geonetwork/srv/en/metadata.show?uuid=fb398ce7-fca1-4437-a67b-b1f9c12c85e4,biota,70a489ea-a910-40b8-ae63-431084dc99a6,2017-09-21T12:21:53.988116,bluebridge.catalogue@d4science.org,False,creation,anchoviella-perfasciata,6,d7121f10-22f4-4635-84e5-53f2bd9c3fde,[],d2065e63-b2f9-4013-b771-6063bf39add9,7bf889d1-7829-4c2e-ad72-222798006eee,active,e43b1153-2051-4255-b481-cb55c6e5cb01,approved,81f5e6ae-92ab-410a-9a75-f809d43ec1ee,biota,active,https://ckan-bb2.d4science.org/images/organisations/imarine.png,OGC:WFS-1.0.0-http-get-feature,iMarine.eu,dataset,2017-11-24T11:56:37.199304,81f5e6ae-92ab-410a-9a75-f809d43ec1ee,asNeeded,biota,http://data.d4science.org/ctlg/d4science.research-infrastructures.eu/anchoviella-perfasciata,"[{""name"": ""iMarine Consortium"", ""roles"": [""author""]}, {""name"": ""iMarine.eu"", ""roles"": [""distributor"", ""resourceProvider""]}]"
3c3f31d0-fe3b-4618-bd16-e124a40fac88,0,http://node49.p.d4science.research-infrastructures.eu:9003/80/Animalia/Arthropoda/Malacostraca/Decapoda/Alpheidae/SLB-130775/Ocean_View__Pacific.jpg,SpeciesDistribution,-180.0,active,90.0,biota,c271f0ac-af62-4970-b78f-4a8029e6fc25,http://geonetwork.d4science.org:8080/geonetwork/srv/en/xml.metadata.get?uuid=7a1ef7b5-c17f-445e-b241-6b3437209457,2017-11-24T19:26:01.920999,2013-05-10T19:57:52+02:00,True,WMS link to resource,True,False,Anampses neoguinaicus,False,imarine,c415fab9-35e8-45df-8790-d087f71698ae,7a1ef7b5-c17f-445e-b241-6b3437209457,"[{""type"": ""creation"", ""value"": ""2012-12-07T16:58:18.937+01:00""}]",-90.0,eng,active,2017-11-24T19:26:01.493803,"This Anampses neoguinaicus Species Distribution Map has been generated with the AquaMaps methodology by exploiting the technology and the computational resources provided by iMarine.In particular, this map has been produced using the HSPEC Native Range dataset, generated using AquaMaps NativeRange algorithm.",ebc02b4a-f774-4e7e-afe1-d52ab93126de,http://geoserver2.d4science.research-infrastructures.eu/geoserver,WMS,2,Anampses neoguinaicus,180.0,"ISO 19115 Topic Category. Flora or fauna in natural environment, for example wildlife, vegetation, biological sciences, ecology, wilderness, sea life, wetlands, habitat, biological resources",[],"iMarine is an access point to a number of Virtual Research Environments deployed and operated in the context of the iMarine project to support the Ecosystem Approach to fisheries management and conservation of marine living resources. It empowers practitioners and policy makers from multiple scientific fields such as fisheries, biodiversity and ocean observation by ensuring that otherwise dispersed and heterogeneous data is available to all stakeholder communities through a shared virtual environment that brings together multidisciplinary data sources, supports cross-cutting scientific analysis, and assists communication.
See More: https://i-marine.d4science.org/",Dataset,iMarine,bb,dataset,[],"iMarine Consortium,iMarine.eu",http://geonetwork.d4science.org:8080/geonetwork,2012-12-18T21:28:04.653+01:00,organization,info@i-marine.eu,"{""type"": ""Polygon"", ""coordinates"": [[[-180.0, -90.0], [180.0, -90.0], [180.0, 90.0], [-180.0, 90.0], [-180.0, -90.0]]]}",http://geonetwork.d4science.org:8080/geonetwork/srv/en/metadata.show?uuid=7a1ef7b5-c17f-445e-b241-6b3437209457,biota,70a489ea-a910-40b8-ae63-431084dc99a6,2017-09-23T05:18:38.969207,bluebridge.catalogue@d4science.org,False,creation,anampses-neoguinaicus3,6,c271f0ac-af62-4970-b78f-4a8029e6fc25,[],03d42a4f-4ac0-4fe3-b626-1f4b55f21694,7bf889d1-7829-4c2e-ad72-222798006eee,active,b41fcf9e-8a32-40f3-abc8-e7dde5740eaf,approved,81f5e6ae-92ab-410a-9a75-f809d43ec1ee,biota,active,https://ckan-bb2.d4science.org/images/organisations/imarine.png,OGC:WFS-1.0.0-http-get-feature,iMarine.eu,dataset,2017-11-24T11:56:37.199304,81f5e6ae-92ab-410a-9a75-f809d43ec1ee,asNeeded,biota,http://data.d4science.org/ctlg/d4science.research-infrastructures.eu/anampses-neoguinaicus3,"[{""name"": ""iMarine Consortium"", ""roles"": [""author""]}, {""name"": ""iMarine.eu"", ""roles"": [""resourceProvider"", ""distributor""]}]"
