3f59e4e5-91b4-45f9-816c-3a1eef309dd9,0,http://node49.p.d4science.research-infrastructures.eu:9003/80/Animalia/Mollusca/Polyplacophora/Chitonida/Acanthochitonidae/URM-Pol-27/Ocean_View__Pacific.jpg,SpeciesDistribution,-97.75,active,43.25,environment,01e93583-77ec-4652-b243-12d260ddf1cd,http://geonetwork.d4science.org:8080/geonetwork/srv/en/xml.metadata.get?uuid=31f1c2ae-e6b0-46e9-bdc9-0e012ec22949,2017-12-23T09:18:16.022490,2017-12-03T10:28:39.675+01:00,True,WMS link to resource,True,False,aluterus heudelotii Aquamaps Native 2050 Raster,False,d4sciencelabs,c4418477-a9f9-4340-a417-9a16364cc98e,31f1c2ae-e6b0-46e9-bdc9-0e012ec22949,"[{""type"": ""creation"", ""value"": ""2017-12-03T10:28:39.675+01:00""}, {""type"": ""publication"", ""value"": ""2017-12-03T10:28:39.675+01:00""}, {""type"": ""revision"", ""value"": ""2017-12-03T10:28:39.675+01:00""}]",-23.75,eng,active,2017-12-23T09:18:13.819629,"This aluterus heudelotii Species Distribution Map for 2050 has been generated with the AquaMaps methodology by exploiting the technology and the computational resources provided by iMarine. In particular, this map has been produced using the HSPEC Native Range dataset, generated using the AquaMaps NativeRange 2050 algorithm. Hosted on the D4Science Thredds CataSystem.out.println: http://thredds.d4science.org",ebc02b4a-f774-4e7e-afe1-d52ab93126de,http://thredds.d4science.org/thredds/fileServer/public/netcdf/AquamapsNative2050/aquamaps_native2050_aluterus_heudelotii.nc,WMS,4,AquaMaps,15.25,"ISO 19115 Topic Category. Environmental resources, protection and conservation, for example environmental pollution, waste storage and treatment, environmental impact assessment, monitoring environmental risk, nature reserves, landscape, water quality, air quality, environmental modeling",[],"D4Science has developed a series of applications (accessible through the D4Science Labs) which can be used by any user to upload, manipulate, use and re-use products with the aim to share them with other users following the principle of the OpenScience",Dataset,D4Science Labs,bb,dataset,[],"iMarine Consortium,iMarine.eu",http://geonetwork.d4science.org:8080/geonetwork,2012-12-19T02:58:39.672+01:00,organization,,"{""type"": ""Polygon"", ""coordinates"": [[[-97.75, -23.75], [15.25, -23.75], [15.25, 43.25], [-97.75, 43.25], [-97.75, -23.75]]]}",http://geonetwork.d4science.org:8080/geonetwork/srv/en/metadata.show?uuid=31f1c2ae-e6b0-46e9-bdc9-0e012ec22949,environment,22dde829-fe22-4db6-875d-5ae13aed8a5a,2017-09-22T16:03:36.782073,bluebridge.catalogue@d4science.org,False,creation,aluterus-heudelotii-aquamaps-native-2050-raster,8,01e93583-77ec-4652-b243-12d260ddf1cd,[],6c16cceb-3d9c-45d9-aa93-812ce513a7e3,730e5b91-2265-431e-b033-7f310474e4f3,active,a4712e85-df63-42cd-bb14-37179f18d526,approved,11680099-3fd0-427c-8cfc-b1fbcde0623e,environment,active,https://ckan-bb2.d4science.org/images/organisations/d4sciencelabs.png,OGC:WFS-1.0.0-http-get-feature,iMarine.eu,dataset,2017-11-24T11:56:48.241435,11680099-3fd0-427c-8cfc-b1fbcde0623e,asNeeded,environment,http://data.d4science.org/ctlg/gCubeApps/aluterus-heudelotii-aquamaps-native-2050-raster,"[{""name"": """", ""roles"": [""originator""]}]"
a4712e85-df63-42cd-bb14-37179f18d526,0,,SpeciesDistribution,-180.0,active,90.0,biota,4b242b2d-12a1-4ce6-9d59-35ec5d850626,http://geonetwork.d4science.org:8080/geonetwork/srv/en/xml.metadata.get?uuid=a623b9d4-0a94-42b1-895a-f6ab345c24d6,2017-11-30T07:20:10.597827,2013-06-19T10:53:14.240+02:00,True,Unnamed resource,True,False,Aegina citrea,False,imarine,26a86c41-69f5-4462-a043-0d46135fc2d9,a623b9d4-0a94-42b1-895a-f6ab345c24d6,"[{""type"": ""creation"", ""value"": ""2013-04-11T09:15:16.373+02:00""}]",-90.0,eng,active,2017-11-30T07:20:08.590774,"This Aegina citrea Species Distribution Map has been generated with the AquaMaps methodology by exploiting the technology and the computational resources provided by iMarine. In particular, this map has been produced using the Default Suitable maps_SuitableRange dataset, generated using AquaMaps SuitableRange algorithm.",ebc02b4a-f774-4e7e-afe1-d52ab93126de,"http://geoserver2.d4science.research-infrastructures.eu/geoserver/wms?service=wms&version=1.1.0&request=GetMap&layers=laeginacitrea20130411091502729cest&styles=&bbox=-180,-90,180,90&width=676&height=330&srs=EPSG:4326&crs=EPSG:4326&format=application/openlayers",WCS,4,7614324,180.0,"ISO 19115 Topic Category. Flora or fauna in natural environment, for example wildlife, vegetation, biological sciences, ecology, wilderness, sea life, wetlands, habitat, biological resources",[],"iMarine is an access point to a number of Virtual Research Environments deployed and operated in the context of the iMarine project to support the Ecosystem Approach to fisheries management and conservation of marine living resources. It empowers practitioners and policy makers from multiple scientific fields such as fisheries, biodiversity and ocean observation by ensuring that otherwise dispersed and heterogeneous data is available to all stakeholder communities through a shared virtual environment that brings together multidisciplinary data sources, supports cross-cutting scientific analysis, and assists communication.
See More: https://i-marine.d4science.org/",Dataset,iMarine,bb,,[],,http://geonetwork.d4science.org:8080/geonetwork,,organization,,"{""type"": ""Polygon"", ""coordinates"": [[[-180.0, -90.0], [180.0, -90.0], [180.0, 90.0], [-180.0, 90.0], [-180.0, -90.0]]]}",http://geonetwork.d4science.org:8080/geonetwork/srv/en/metadata.show?uuid=a623b9d4-0a94-42b1-895a-f6ab345c24d6,biota,70a489ea-a910-40b8-ae63-431084dc99a6,2017-10-13T13:33:35.604149,bluebridge.catalogue@d4science.org,False,,aegina-citrea2,7,4b242b2d-12a1-4ce6-9d59-35ec5d850626,[],891b901e-e0b4-4232-be8c-56b8e5453427,7bf889d1-7829-4c2e-ad72-222798006eee,active,03e2b43a-155a-45a0-8c81-b419138edc02,approved,81f5e6ae-92ab-410a-9a75-f809d43ec1ee,biota,active,https://ckan-bb2.d4science.org/images/organisations/imarine.png,OGC:WMS-1.3.0-http-get-map,iMarine Consortium,dataset,2017-11-24T11:56:37.199304,81f5e6ae-92ab-410a-9a75-f809d43ec1ee,asNeeded,biota,http://data.d4science.org/ctlg/d4science.research-infrastructures.eu/aegina-citrea2,"[{""name"": ""iMarine Consortium"", ""roles"": [""author""]}, {""name"": ""iMarine.eu"", ""roles"": [""distributor"", ""resourceProvider""]}]"
03e2b43a-155a-45a0-8c81-b419138edc02,0,,NetCDF,-174.75,active,36.25,environment,1f13976d-c3a8-4a43-9071-f28930ff927c,http://geonetwork.d4science.org:8080/geonetwork/srv/en/xml.metadata.get?uuid=d9a1453e-6449-42a6-a9f4-860ebc0311e7,2017-11-24T11:27:04.468730,2017-10-10T17:50:55.884+02:00,True,Unnamed resource,True,False,Amakusanthura Magnifica Aquamaps Native Raster,False,d4sciencelabs,c4418477-a9f9-4340-a417-9a16364cc98e,d9a1453e-6449-42a6-a9f4-860ebc0311e7,"[{""type"": ""creation"", ""value"": ""2017-10-10T17:50:55.884+02:00""}, {""type"": ""publication"", ""value"": ""2017-10-10T17:50:55.884+02:00""}, {""type"": ""revision"", ""value"": ""2017-10-10T17:50:55.884+02:00""}]",-31.75,eng,active,2017-11-24T11:27:03.929365,"This Amakusanthura Magnifica Species Distribution Map has been generated with the AquaMaps methodology by exploiting the technology and the computational resources provided by iMarine. In particular, this map has been produced using the HSPEC Native Range dataset, generated using the AquaMaps NativeRange algorithm. Hosted on the D4Science Thredds CataSystem.out.println: http://thredds.d4science.org",ebc02b4a-f774-4e7e-afe1-d52ab93126de,http://thredds.d4science.org/thredds/fileServer/public/netcdf/AquamapsNative/aquamaps_native_amakusanthura_magnifica.nc,WCS,4,Amakusanthura Magnifica,-33.75,"ISO 19115 Topic Category. Environmental resources, protection and conservation, for example environmental pollution, waste storage and treatment, environmental impact assessment, monitoring environmental risk, nature reserves, landscape, water quality, air quality, environmental modeling",[],"D4Science has developed a series of applications (accessible through the D4Science Labs) which can be used by any user to upload, manipulate, use and re-use products with the aim to share them with other users following the principle of the OpenScience",Dataset,D4Science Labs,bb,,[],,http://geonetwork.d4science.org:8080/geonetwork,,organization,,"{""type"": ""Polygon"", ""coordinates"": [[[-174.75, -31.75], [-33.75, -31.75], [-33.75, 36.25], [-174.75, 36.25], [-174.75, -31.75]]]}",http://geonetwork.d4science.org:8080/geonetwork/srv/en/metadata.show?uuid=d9a1453e-6449-42a6-a9f4-860ebc0311e7,environment,22dde829-fe22-4db6-875d-5ae13aed8a5a,2017-10-14T00:47:55.441422,bluebridge.catalogue@d4science.org,False,,amakusanthura-magnifica-aquamaps-native-raster,8,1f13976d-c3a8-4a43-9071-f28930ff927c,[],7ffc033b-57cc-432f-9c3e-78a95a0aca1a,730e5b91-2265-431e-b033-7f310474e4f3,active,16065575-a217-49aa-b039-1cb54fb19adb,approved,11680099-3fd0-427c-8cfc-b1fbcde0623e,environment,active,https://ckan-bb2.d4science.org/images/organisations/d4sciencelabs.png,OGC:WMS-1.3.0-http-get-map,iMarine Consortium,dataset,2017-11-24T11:56:48.241435,11680099-3fd0-427c-8cfc-b1fbcde0623e,asNeeded,environment,http://data.d4science.org/ctlg/gCubeApps/amakusanthura-magnifica-aquamaps-native-raster,"[{""name"": """", ""roles"": [""originator""]}]"
16065575-a217-49aa-b039-1cb54fb19adb,0,,White-freckled surgeonfish,-179.75,active,-0.75,environment,28e2271a-bfcc-449b-8ab2-f75277c72ea8,http://geonetwork.d4science.org:8080/geonetwork/srv/en/xml.metadata.get?uuid=5c37921a-86aa-4434-a7a9-2e192b2e4dad,2017-11-24T13:55:33.670783,2017-10-10T17:54:13.041+02:00,True,WMS link to resource,True,False,Anguilla Megastoma Aquamaps Native Raster,False,d4sciencelabs,c4418477-a9f9-4340-a417-9a16364cc98e,5c37921a-86aa-4434-a7a9-2e192b2e4dad,"[{""type"": ""creation"", ""value"": ""2017-10-10T17:54:13.041+02:00""}, {""type"": ""publication"", ""value"": ""2017-10-10T17:54:13.041+02:00""}, {""type"": ""revision"", ""value"": ""2017-10-10T17:54:13.041+02:00""}]",-24.75,eng,active,2017-11-24T13:55:33.219946,"This Anguilla Megastoma Species Distribution Map has been generated with the AquaMaps methodology by exploiting the technology and the computational resources provided by iMarine. In particular, this map has been produced using the HSPEC Native Range dataset, generated using the AquaMaps NativeRange algorithm. Hosted on the D4Science Thredds CataSystem.out.println: http://thredds.d4science.org",ebc02b4a-f774-4e7e-afe1-d52ab93126de,http://thredds.d4science.org/thredds/fileServer/public/netcdf/AquamapsNative/aquamaps_native_anguilla_megastoma.nc,WMS,4,84e93073-2cce-49c0-8d22-6cafbf8c34d5,180.25,"ISO 19115 Topic Category. Environmental resources, protection and conservation, for example environmental pollution, waste storage and treatment, environmental impact assessment, monitoring environmental risk, nature reserves, landscape, water quality, air quality, environmental modeling",[],"D4Science has developed a series of applications (accessible through the D4Science Labs) which can be used by any user to upload, manipulate, use and re-use products with the aim to share them with other users following the principle of the OpenScience",Dataset,D4Science Labs,bb,,[],,http://geonetwork.d4science.org:8080/geonetwork,,organization,,"{""type"": ""Polygon"", ""coordinates"": [[[-179.75, -24.75], [180.25, -24.75], [180.25, -0.75], [-179.75, -0.75], [-179.75, -24.75]]]}",http://geonetwork.d4science.org:8080/geonetwork/srv/en/metadata.show?uuid=5c37921a-86aa-4434-a7a9-2e192b2e4dad,environment,22dde829-fe22-4db6-875d-5ae13aed8a5a,2017-09-23T16:52:56.941277,bluebridge.catalogue@d4science.org,False,,anguilla-megastoma-aquamaps-native-raster,8,28e2271a-bfcc-449b-8ab2-f75277c72ea8,[],e3c6ba7f-4e00-456e-aa2c-030a33ee9e7d,730e5b91-2265-431e-b033-7f310474e4f3,active,909e442d-77ec-404c-8bce-865be3ddc955,approved,11680099-3fd0-427c-8cfc-b1fbcde0623e,environment,active,https://ckan-bb2.d4science.org/images/organisations/d4sciencelabs.png,OGC:WMS-1.3.0-http-get-map,iMarine Consortium,dataset,2017-11-24T11:56:48.241435,11680099-3fd0-427c-8cfc-b1fbcde0623e,asNeeded,environment,http://data.d4science.org/ctlg/gCubeApps/anguilla-megastoma-aquamaps-native-raster,"[{""name"": """", ""roles"": [""originator""]}]"
909e442d-77ec-404c-8bce-865be3ddc955,0,,SpeciesDistribution,-180.0,active,90.0,biota,277086b5-1336-4bf6-8b61-e76f80e41a58,http://geonetwork.d4science.org:8080/geonetwork/srv/en/xml.metadata.get?uuid=2d4f229e-20f4-453e-838d-7d655f0b6646,2017-11-25T10:48:28.956851,2013-06-19T04:34:35.086+02:00,True,WMS link to resource,True,False,Amblygaster clupeoides,False,imarine,c4418477-a9f9-4340-a417-9a16364cc98e,2d4f229e-20f4-453e-838d-7d655f0b6646,"[{""type"": ""creation"", ""value"": ""2012-12-20T23:39:55.643+01:00""}]",-90.0,eng,active,2017-11-25T10:48:27.883549,"This Amblygaster clupeoides Species Distribution Map has been generated with the AquaMaps methodology by exploiting the technology and the computational resources provided by iMarine. In particular, this map has been produced using the HSPEC 2050 Native Range dataset, generated using AquaMaps NativeRange2050 algorithm.",ebc02b4a-f774-4e7e-afe1-d52ab93126de,"http://geoserver3.d4science.research-infrastructures.eu/geoserver/wms?service=wms&version=1.1.0&request=GetMap&layers=lamblygasterclupeoides20121220233938837cet&styles=&bbox=-180,-90,180,90&width=676&height=330&srs=EPSG:4326&crs=EPSG:4326&format=application/openlayers",WMS,4,Amblygaster clupeoides,180.0,"ISO 19115 Topic Category. Flora or fauna in natural environment, for example wildlife, vegetation, biological sciences, ecology, wilderness, sea life, wetlands, habitat, biological resources",[],"iMarine is an access point to a number of Virtual Research Environments deployed and operated in the context of the iMarine project to support the Ecosystem Approach to fisheries management and conservation of marine living resources. It empowers practitioners and policy makers from multiple scientific fields such as fisheries, biodiversity and ocean observation by ensuring that otherwise dispersed and heterogeneous data is available to all stakeholder communities through a shared virtual environment that brings together multidisciplinary data sources, supports cross-cutting scientific analysis, and assists communication.
See More: https://i-marine.d4science.org/",Dataset,iMarine,bb,,[],,http://geonetwork.d4science.org:8080/geonetwork,,organization,,"{""type"": ""Polygon"", ""coordinates"": [[[-180.0, -90.0], [180.0, -90.0], [180.0, 90.0], [-180.0, 90.0], [-180.0, -90.0]]]}",http://geonetwork.d4science.org:8080/geonetwork/srv/en/metadata.show?uuid=2d4f229e-20f4-453e-838d-7d655f0b6646,biota,70a489ea-a910-40b8-ae63-431084dc99a6,2017-09-21T13:57:30.223780,bluebridge.catalogue@d4science.org,False,,amblygaster-clupeoides3,6,277086b5-1336-4bf6-8b61-e76f80e41a58,[],72b37bee-1f12-403c-9e20-601144dd0d11,7bf889d1-7829-4c2e-ad72-222798006eee,active,64a6cf57-8ff1-4d6b-a28e-36bbaf0b523f,approved,81f5e6ae-92ab-410a-9a75-f809d43ec1ee,biota,active,https://ckan-bb2.d4science.org/images/organisations/imarine.png,OGC:WMS-1.3.0-http-get-map,iMarine Consortium,dataset,2017-11-24T11:56:37.199304,81f5e6ae-92ab-410a-9a75-f809d43ec1ee,asNeeded,biota,http://data.d4science.org/ctlg/d4science.research-infrastructures.eu/amblygaster-clupeoides3,"[{""name"": ""iMarine Consortium"", ""roles"": [""author""]}, {""name"": ""iMarine.eu"", ""roles"": [""distributor"", ""resourceProvider""]}]"
64a6cf57-8ff1-4d6b-a28e-36bbaf0b523f,0,,NetCDF,-180.0,active,90.0,biota,2a886ad7-09c0-4b2a-b8c8-e49672283d80,http://geonetwork.d4science.org:8080/geonetwork/srv/en/xml.metadata.get?uuid=694e50b8-b226-45ae-abf5-ba49674a5bb0,2017-11-25T02:27:44.381262,2013-06-19T12:10:00.256+02:00,True,Unnamed resource,True,False,Acanthurus leucosternon,False,imarine,c4418477-a9f9-4340-a417-9a16364cc98e,694e50b8-b226-45ae-abf5-ba49674a5bb0,"[{""type"": ""creation"", ""value"": ""2013-04-11T21:53:56.995+02:00""}]",-90.0,eng,active,2017-11-25T02:27:43.113171,"This Acanthurus leucosternon Species Distribution Map has been generated with the AquaMaps methodology by exploiting the technology and the computational resources provided by iMarine. In particular, this map has been produced using the Default Suitable maps_SuitableRange dataset, generated using AquaMaps SuitableRange algorithm.",ebc02b4a-f774-4e7e-afe1-d52ab93126de,"http://geoserver2.d4science.research-infrastructures.eu/geoserver/wms?service=wms&version=1.1.0&request=GetMap&layers=lacanthurusleucosternon20130411215335034cest&styles=&bbox=-180,-90,180,90&width=676&height=330&srs=EPSG:4326&crs=EPSG:4326&format=application/openlayers",WCS,4,Acanthurus leucosternon,180.0,"ISO 19115 Topic Category. Flora or fauna in natural environment, for example wildlife, vegetation, biological sciences, ecology, wilderness, sea life, wetlands, habitat, biological resources",[],"iMarine is an access point to a number of Virtual Research Environments deployed and operated in the context of the iMarine project to support the Ecosystem Approach to fisheries management and conservation of marine living resources. It empowers practitioners and policy makers from multiple scientific fields such as fisheries, biodiversity and ocean observation by ensuring that otherwise dispersed and heterogeneous data is available to all stakeholder communities through a shared virtual environment that brings together multidisciplinary data sources, supports cross-cutting scientific analysis, and assists communication.
See More: https://i-marine.d4science.org/",Dataset,iMarine,bb,,[],,http://geonetwork.d4science.org:8080/geonetwork,,organization,,"{""type"": ""Polygon"", ""coordinates"": [[[-180.0, -90.0], [180.0, -90.0], [180.0, 90.0], [-180.0, 90.0], [-180.0, -90.0]]]}",http://geonetwork.d4science.org:8080/geonetwork/srv/en/metadata.show?uuid=694e50b8-b226-45ae-abf5-ba49674a5bb0,biota,70a489ea-a910-40b8-ae63-431084dc99a6,2017-10-13T18:26:11.550738,bluebridge.catalogue@d4science.org,False,,acanthurus-leucosternon,6,2a886ad7-09c0-4b2a-b8c8-e49672283d80,[],4afe49a4-0356-4342-8d7f-080481db1c37,7bf889d1-7829-4c2e-ad72-222798006eee,active,61d162d8-d13c-4f2d-aceb-9633b0554a66,approved,81f5e6ae-92ab-410a-9a75-f809d43ec1ee,biota,active,https://ckan-bb2.d4science.org/images/organisations/imarine.png,OGC:WMS-1.3.0-http-get-map,iMarine Consortium,dataset,2017-11-24T11:56:37.199304,81f5e6ae-92ab-410a-9a75-f809d43ec1ee,asNeeded,biota,http://data.d4science.org/ctlg/d4science.research-infrastructures.eu/acanthurus-leucosternon,"[{""name"": ""iMarine Consortium"", ""roles"": [""author""]}, {""name"": ""iMarine.eu"", ""roles"": [""distributor"", ""resourceProvider""]}]"
61d162d8-d13c-4f2d-aceb-9633b0554a66,0,,SpeciesDistribution,-179.75,active,30.25,environment,6f668127-abb5-4662-b553-8b112fffa405,http://geonetwork.d4science.org:8080/geonetwork/srv/en/xml.metadata.get?uuid=03c66bf9-48b4-43a6-8860-adc1c5dd93dc,2017-11-25T01:49:48.574330,2017-10-10T17:51:29.920+02:00,True,WMS link to resource,True,False,Amblyeleotris Periophthalma Aquamaps Native Raster,False,d4sciencelabs,bf9c1fc6-610c-4683-9906-ab38eeb55835,03c66bf9-48b4-43a6-8860-adc1c5dd93dc,"[{""type"": ""creation"", ""value"": ""2017-10-10T17:51:29.920+02:00""}, {""type"": ""publication"", ""value"": ""2017-10-10T17:51:29.920+02:00""}, {""type"": ""revision"", ""value"": ""2017-10-10T17:51:29.920+02:00""}]",-14.75,eng,active,2017-11-25T01:49:48.064313,"This Amblyeleotris Periophthalma Species Distribution Map has been generated with the AquaMaps methodology by exploiting the technology and the computational resources provided by iMarine. In particular, this map has been produced using the HSPEC Native Range dataset, generated using the AquaMaps NativeRange algorithm. Hosted on the D4Science Thredds CataSystem.out.println: http://thredds.d4science.org",ebc02b4a-f774-4e7e-afe1-d52ab93126de,http://thredds.d4science.org/thredds/fileServer/public/netcdf/AquamapsNative/aquamaps_native_amblyeleotris_periophthalma.nc,WMS,4,5283e469-7d67-4fe8-8c6a-f3564d37e7ef,180.25,"ISO 19115 Topic Category. Environmental resources, protection and conservation, for example environmental pollution, waste storage and treatment, environmental impact assessment, monitoring environmental risk, nature reserves, landscape, water quality, air quality, environmental modeling",[],"D4Science has developed a series of applications (accessible through the D4Science Labs) which can be used by any user to upload, manipulate, use and re-use products with the aim to share them with other users following the principle of the OpenScience",Dataset,D4Science Labs,bb,,[],,http://geonetwork.d4science.org:8080/geonetwork,,organization,,"{""type"": ""Polygon"", ""coordinates"": [[[-179.75, -14.75], [180.25, -14.75], [180.25, 30.25], [-179.75, 30.25], [-179.75, -14.75]]]}",http://geonetwork.d4science.org:8080/geonetwork/srv/en/metadata.show?uuid=03c66bf9-48b4-43a6-8860-adc1c5dd93dc,environment,22dde829-fe22-4db6-875d-5ae13aed8a5a,2017-09-23T01:34:54.610535,bluebridge.catalogue@d4science.org,False,,amblyeleotris-periophthalma-aquamaps-native-raster,8,6f668127-abb5-4662-b553-8b112fffa405,[],d754a98c-0867-43dd-acec-b148aa1f1a0d,730e5b91-2265-431e-b033-7f310474e4f3,active,fe07aa0b-b835-45e1-b8ee-c3c71f6d24e4,approved,11680099-3fd0-427c-8cfc-b1fbcde0623e,environment,active,https://ckan-bb2.d4science.org/images/organisations/d4sciencelabs.png,OGC:WMS-1.3.0-http-get-map,iMarine Consortium,dataset,2017-11-24T11:56:48.241435,11680099-3fd0-427c-8cfc-b1fbcde0623e,asNeeded,environment,http://data.d4science.org/ctlg/gCubeApps/amblyeleotris-periophthalma-aquamaps-native-raster,"[{""name"": """", ""roles"": [""originator""]}]"
fe07aa0b-b835-45e1-b8ee-c3c71f6d24e4,0,,SpeciesDistribution,-180.0,active,90.0,biota,2e6e0557-e95e-4f81-9168-4cee0ca6989d,http://geonetwork.d4science.org:8080/geonetwork/srv/en/xml.metadata.get?uuid=c288d836-9f5a-4227-b20e-dab1470ba406,2017-11-26T13:29:48.733807,2013-06-19T08:54:07.003+02:00,True,WMS link to resource,True,False,Acanthurus maculiceps,False,imarine,c4418477-a9f9-4340-a417-9a16364cc98e,c288d836-9f5a-4227-b20e-dab1470ba406,"[{""type"": ""creation"", ""value"": ""2013-04-10T13:25:54.074+02:00""}]",-90.0,eng,active,2017-11-26T13:29:47.070104,"This Acanthurus maculiceps Species Distribution Map has been generated with the AquaMaps methodology by exploiting the technology and the computational resources provided by iMarine. In particular, this map has been produced using the Default Suitable maps_SuitableRange dataset, generated using AquaMaps SuitableRange algorithm.",ebc02b4a-f774-4e7e-afe1-d52ab93126de,"http://geoserver3.d4science.research-infrastructures.eu/geoserver/wms?service=wms&version=1.1.0&request=GetMap&layers=lacanthurusmaculiceps20130410132539789cest&styles=&bbox=-180,-90,180,90&width=676&height=330&srs=EPSG:4326&crs=EPSG:4326&format=application/openlayers",WMS,4,Acanthurus maculiceps,180.0,"ISO 19115 Topic Category. Flora or fauna in natural environment, for example wildlife, vegetation, biological sciences, ecology, wilderness, sea life, wetlands, habitat, biological resources",[],"iMarine is an access point to a number of Virtual Research Environments deployed and operated in the context of the iMarine project to support the Ecosystem Approach to fisheries management and conservation of marine living resources. It empowers practitioners and policy makers from multiple scientific fields such as fisheries, biodiversity and ocean observation by ensuring that otherwise dispersed and heterogeneous data is available to all stakeholder communities through a shared virtual environment that brings together multidisciplinary data sources, supports cross-cutting scientific analysis, and assists communication.
See More: https://i-marine.d4science.org/",Dataset,iMarine,bb,,[],,http://geonetwork.d4science.org:8080/geonetwork,,organization,,"{""type"": ""Polygon"", ""coordinates"": [[[-180.0, -90.0], [180.0, -90.0], [180.0, 90.0], [-180.0, 90.0], [-180.0, -90.0]]]}",http://geonetwork.d4science.org:8080/geonetwork/srv/en/metadata.show?uuid=c288d836-9f5a-4227-b20e-dab1470ba406,biota,70a489ea-a910-40b8-ae63-431084dc99a6,2017-09-21T18:16:03.234775,bluebridge.catalogue@d4science.org,False,,acanthurus-maculiceps3,6,2e6e0557-e95e-4f81-9168-4cee0ca6989d,[],6059ec1f-4b23-4911-b87c-290dad5849df,7bf889d1-7829-4c2e-ad72-222798006eee,active,27353a40-72ea-4343-b417-a6b09485243f,approved,81f5e6ae-92ab-410a-9a75-f809d43ec1ee,biota,active,https://ckan-bb2.d4science.org/images/organisations/imarine.png,OGC:WMS-1.3.0-http-get-map,iMarine Consortium,dataset,2017-11-24T11:56:37.199304,81f5e6ae-92ab-410a-9a75-f809d43ec1ee,asNeeded,biota,http://data.d4science.org/ctlg/d4science.research-infrastructures.eu/acanthurus-maculiceps3,"[{""name"": ""iMarine Consortium"", ""roles"": [""author""]}, {""name"": ""iMarine.eu"", ""roles"": [""distributor"", ""resourceProvider""]}]"
