has_identifier_has_id_value,unknown,unknown,has_name,unknown,unknown,unknown,unknown,has_identifier_has_id_value,unknown,has_identifier_is_source_of_has_startDate,unknown,unknown,unknown,unknown,unknown,has_name,unknown,unknown,unknown,unknown,unknown,unknown,unknown,unknown,is_source_of_has_startDate,has_description,is_destination_of_has_source_has_identifier_has_id_value,unknown,unknown,unknown,has_name,unknown,unknown,unknown,unknown,is_source_of_has_classification_has_term,unknown,is_destination_of_has_source_is_source_of_has_destination_has_name,is_source_of_has_classification_has_term,unknown,is_destination_of_has_source_is_source_of_has_destination_has_name,unknown,unknown,unknown,unknown,unknown,unknown,unknown,unknown,unknown,is_destination_of_has_source_is_source_of_has_destination_has_URI,unknown,unknown,has_identifier_has_id_value,unknown,has_identifier_has_id_value,unknown,unknown,unknown,unknown,has_identifier_has_id_value,unknown,unknown,unknown,unknown,unknown,unknown,is_destination_of_has_source_is_source_of_has_destination_has_name,is_source_of_has_classification_has_term,unknown,unknown,unknown,unknown,unknown,unknown
5b000c79-eea6-4c4b-86f8-f0436b0ba035,0,http://node49.p.d4science.research-infrastructures.eu:9003/405/Animalia/Chordata/Actinopterygii/Perciformes/Pomacentridae/Fis-32656/Ocean_View__Pacific.jpg,SpeciesDistribution,-180.0,active,90.0,biota,730d945c-f07b-46aa-bef3-61d391cb25fe,http://geonetwork.d4science.org:8080/geonetwork/srv/en/xml.metadata.get?uuid=67a1b45e-8e0a-49b3-a2a0-b0d616cd5a8f,2017-11-25T00:38:32.244518,2013-06-19T13:29:30.926+02:00,True,WMS link to resource,True,False,Amphiprion polymnus,False,imarine,c415fab9-35e8-45df-8790-d087f71698ae,67a1b45e-8e0a-49b3-a2a0-b0d616cd5a8f,"[{""type"": ""creation"", ""value"": ""2013-04-12T08:55:21.053+02:00""}]",-90.0,eng,active,2017-11-25T00:38:31.680501,"This Amphiprion polymnus Species Distribution Map has been generated with the AquaMaps methodology by exploiting the technology and the computational resources provided by iMarine. In particular, this map has been produced using the Default Suitable maps_SuitableRange dataset, generated using AquaMaps SuitableRange algorithm.",ebc02b4a-f774-4e7e-afe1-d52ab93126de,"http://geoserver3.d4science.research-infrastructures.eu/geoserver/wms?service=wms&version=1.1.0&request=GetMap&layers=lamphiprionpolymnus20130412085453111cest&styles=&bbox=-180,-90,180,90&width=676&height=330&srs=EPSG:4326&crs=EPSG:4326&format=application/openlayers",WMS,4,Amphiprion polymnus,180.0,"ISO 19115 Topic Category. Flora or fauna in natural environment, for example wildlife, vegetation, biological sciences, ecology, wilderness, sea life, wetlands, habitat, biological resources",[],"iMarine is an access point to a number of Virtual Research Environments deployed and operated in the context of the iMarine project to support the Ecosystem Approach to fisheries management and conservation of marine living resources. It empowers practitioners and policy makers from multiple scientific fields such as fisheries, biodiversity and ocean observation by ensuring that otherwise dispersed and heterogeneous data is available to all stakeholder communities through a shared virtual environment that brings together multidisciplinary data sources, supports cross-cutting scientific analysis, and assists communication.
See More: https://i-marine.d4science.org/",Dataset,iMarine,bb,dataset,[],"iMarine Consortium,iMarine.eu",http://geonetwork.d4science.org:8080/geonetwork,2013-04-12T08:55:21.053+02:00,organization,info@i-marine.eu,"{""type"": ""Polygon"", ""coordinates"": [[[-180.0, -90.0], [180.0, -90.0], [180.0, 90.0], [-180.0, 90.0], [-180.0, -90.0]]]}",http://geonetwork.d4science.org:8080/geonetwork/srv/en/metadata.show?uuid=67a1b45e-8e0a-49b3-a2a0-b0d616cd5a8f,biota,70a489ea-a910-40b8-ae63-431084dc99a6,2017-09-23T08:44:33.408067,bluebridge.catalogue@d4science.org,False,creation,amphiprion-polymnus3,6,730d945c-f07b-46aa-bef3-61d391cb25fe,[],b0a899fb-9152-4d68-bbd1-62015a7ebda9,7bf889d1-7829-4c2e-ad72-222798006eee,active,5b000c79-eea6-4c4b-86f8-f0436b0ba035,approved,81f5e6ae-92ab-410a-9a75-f809d43ec1ee,biota,active,https://ckan-bb2.d4science.org/images/organisations/imarine.png,OGC:WFS-1.0.0-http-get-feature,iMarine.eu,dataset,2017-11-24T11:56:37.199304,81f5e6ae-92ab-410a-9a75-f809d43ec1ee,asNeeded,biota,http://data.d4science.org/ctlg/d4science.research-infrastructures.eu/amphiprion-polymnus3,"[{""name"": ""iMarine Consortium"", ""roles"": [""author""]}, {""name"": ""iMarine.eu"", ""roles"": [""distributor"", ""resourceProvider""]}]"
e0899d51-7cf3-4fe9-bdf2-2ccc1b6a9868,0,http://node49.p.d4science.research-infrastructures.eu:9003/407/Animalia/Mollusca/Cephalopoda/Teuthida/Onychoteuthidae/ITS-82456/Ocean_View__Pacific.jpg,Probability Distribution,92.25,active,35.25,environment,38191f42-ea7f-4f94-9498-f155b87aaaa3,http://geonetwork.d4science.org:8080/geonetwork/srv/en/xml.metadata.get?uuid=26e1dd71-21ec-47b5-90b6-5dfe11033baa,2017-11-26T05:42:36.823717,2017-10-10T17:52:40.706+02:00,True,Unnamed resource,True,False,Amphiprion Ocellaris Aquamaps Native Raster,False,d4sciencelabs,c415fab9-35e8-45df-8790-d087f71698ae,26e1dd71-21ec-47b5-90b6-5dfe11033baa,"[{""type"": ""creation"", ""value"": ""2017-10-10T17:52:40.706+02:00""}, {""type"": ""publication"", ""value"": ""2017-10-10T17:52:40.706+02:00""}, {""type"": ""revision"", ""value"": ""2017-10-10T17:52:40.706+02:00""}]",-16.75,eng,active,2017-11-26T05:42:35.827117,"This Amphiprion Ocellaris Species Distribution Map has been generated with the AquaMaps methodology by exploiting the technology and the computational resources provided by iMarine. In particular, this map has been produced using the HSPEC Native Range dataset, generated using the AquaMaps NativeRange algorithm. Hosted on the D4Science Thredds CataSystem.out.println: http://thredds.d4science.org",ebc02b4a-f774-4e7e-afe1-d52ab93126de,http://thredds.d4science.org/thredds/fileServer/public/netcdf/AquamapsNative/aquamaps_native_amphiprion_ocellaris.nc,WCS,4,Amphiprion Ocellaris,147.25,"ISO 19115 Topic Category. Environmental resources, protection and conservation, for example environmental pollution, waste storage and treatment, environmental impact assessment, monitoring environmental risk, nature reserves, landscape, water quality, air quality, environmental modeling",[],"D4Science has developed a series of applications (accessible through the D4Science Labs) which can be used by any user to upload, manipulate, use and re-use products with the aim to share them with other users following the principle of the OpenScience",Dataset,D4Science Labs,bb,dataset,[],"iMarine Consortium,iMarine.eu",http://geonetwork.d4science.org:8080/geonetwork,2013-04-14T14:49:30.648+02:00,organization,info@i-marine.eu,"{""type"": ""Polygon"", ""coordinates"": [[[92.25, -16.75], [147.25, -16.75], [147.25, 35.25], [92.25, 35.25], [92.25, -16.75]]]}",http://geonetwork.d4science.org:8080/geonetwork/srv/en/metadata.show?uuid=26e1dd71-21ec-47b5-90b6-5dfe11033baa,environment,22dde829-fe22-4db6-875d-5ae13aed8a5a,2017-10-14T02:38:16.298093,bluebridge.catalogue@d4science.org,False,creation,amphiprion-ocellaris-aquamaps-native-raster,8,38191f42-ea7f-4f94-9498-f155b87aaaa3,[],3ae5ab20-5fa7-4471-86ff-c5620f5ccc8b,730e5b91-2265-431e-b033-7f310474e4f3,active,e0899d51-7cf3-4fe9-bdf2-2ccc1b6a9868,approved,11680099-3fd0-427c-8cfc-b1fbcde0623e,environment,active,https://ckan-bb2.d4science.org/images/organisations/d4sciencelabs.png,OGC:WFS-1.0.0-http-get-feature,iMarine.eu,dataset,2017-11-24T11:56:48.241435,11680099-3fd0-427c-8cfc-b1fbcde0623e,asNeeded,environment,http://data.d4science.org/ctlg/gCubeApps/amphiprion-ocellaris-aquamaps-native-raster,"[{""name"": """", ""roles"": [""originator""]}]"
ffe533c4-2653-4c94-9eed-38af4cb1bd00,0,http://node49.p.d4science.research-infrastructures.eu:9003/83/Animalia/Arthropoda/Malacostraca/Decapoda/Alpheidae/ITS-96607/Ocean_View__Pacific.jpg,Probability Distribution,-179.75,active,36.25,environment,7a12272f-b8b3-4490-b53a-149818c4c0c8,http://geonetwork.d4science.org:8080/geonetwork/srv/en/xml.metadata.get?uuid=c9415835-34f5-4748-9193-c1afe4dd93b4,2017-11-26T14:03:37.259950,2017-10-10T17:54:30.067+02:00,True,Unnamed resource,True,False,Anodontia Ovum Aquamaps Native Raster,False,d4sciencelabs,00eed8fa-42e4-43ad-b2c6-098a9ac44743,c9415835-34f5-4748-9193-c1afe4dd93b4,"[{""type"": ""creation"", ""value"": ""2017-10-10T17:54:30.067+02:00""}, {""type"": ""publication"", ""value"": ""2017-10-10T17:54:30.067+02:00""}, {""type"": ""revision"", ""value"": ""2017-10-10T17:54:30.067+02:00""}]",-34.75,eng,active,2017-11-26T14:03:36.128249,"This Anodontia Ovum Species Distribution Map has been generated with the AquaMaps methodology by exploiting the technology and the computational resources provided by iMarine. In particular, this map has been produced using the HSPEC Native Range dataset, generated using the AquaMaps NativeRange algorithm. Hosted on the D4Science Thredds CataSystem.out.println: http://thredds.d4science.org",ebc02b4a-f774-4e7e-afe1-d52ab93126de,http://thredds.d4science.org/thredds/fileServer/public/netcdf/AquamapsNative/aquamaps_native_anodontia_ovum.nc,WCS,4,Anodontia Ovum,180.25,"ISO 19115 Topic Category. Environmental resources, protection and conservation, for example environmental pollution, waste storage and treatment, environmental impact assessment, monitoring environmental risk, nature reserves, landscape, water quality, air quality, environmental modeling",[],"D4Science has developed a series of applications (accessible through the D4Science Labs) which can be used by any user to upload, manipulate, use and re-use products with the aim to share them with other users following the principle of the OpenScience",Dataset,D4Science Labs,bb,dataset,[],"iMarine Consortium,iMarine.eu",http://geonetwork.d4science.org:8080/geonetwork,2012-12-21T23:04:22.083+01:00,organization,info@i-marine.eu,"{""type"": ""Polygon"", ""coordinates"": [[[-179.75, -34.75], [180.25, -34.75], [180.25, 36.25], [-179.75, 36.25], [-179.75, -34.75]]]}",http://geonetwork.d4science.org:8080/geonetwork/srv/en/metadata.show?uuid=c9415835-34f5-4748-9193-c1afe4dd93b4,environment,22dde829-fe22-4db6-875d-5ae13aed8a5a,2017-10-13T21:33:04.086309,bluebridge.catalogue@d4science.org,False,creation,anodontia-ovum-aquamaps-native-raster,8,7a12272f-b8b3-4490-b53a-149818c4c0c8,[],c82611ac-0556-49a7-8484-515b3d95629d,730e5b91-2265-431e-b033-7f310474e4f3,active,ffe533c4-2653-4c94-9eed-38af4cb1bd00,approved,11680099-3fd0-427c-8cfc-b1fbcde0623e,environment,active,https://ckan-bb2.d4science.org/images/organisations/d4sciencelabs.png,OGC:WFS-1.0.0-http-get-feature,iMarine.eu,dataset,2017-11-24T11:56:48.241435,11680099-3fd0-427c-8cfc-b1fbcde0623e,asNeeded,environment,http://data.d4science.org/ctlg/gCubeApps/anodontia-ovum-aquamaps-native-raster,"[{""name"": """", ""roles"": [""originator""]}]"
02c17357-7e5e-4e46-bcd6-01ee42aa213b,0,http://node49.p.d4science.research-infrastructures.eu:9003/405/Animalia/Chordata/Actinopterygii/Siluriformes/Ariidae/Fis-159835/Ocean_View__Pacific.jpg,SpeciesDistribution,-180.0,active,90.0,biota,3cdcef06-93df-450b-957b-a199479b1d94,http://geonetwork.d4science.org:8080/geonetwork/srv/en/xml.metadata.get?uuid=7b529c99-5433-4b62-94c8-e6e21523614d,2017-11-28T16:12:10.414571,2013-06-19T19:22:27.091+02:00,True,WMS link to resource,True,False,Ancistroteuthis lichtensteini,False,imarine,bc4fdea5-431d-4b24-bcdb-dd462ff05e14,7b529c99-5433-4b62-94c8-e6e21523614d,"[{""type"": ""creation"", ""value"": ""2013-04-14T14:49:30.648+02:00""}]",-90.0,eng,active,2017-11-28T16:12:08.889371,"This Ancistroteuthis lichtensteini Species Distribution Map has been generated with the AquaMaps methodology by exploiting the technology and the computational resources provided by iMarine. In particular, this map has been produced using the Default Suitable 2050 maps_SuitableRange2050 dataset, generated using AquaMaps SuitableRange2050 algorithm.",ebc02b4a-f774-4e7e-afe1-d52ab93126de,"http://geoserver3.d4science.research-infrastructures.eu/geoserver/wms?service=wms&version=1.1.0&request=GetMap&layers=lancistroteuthislichtensteini20130414144902873cest&styles=&bbox=-180,-90,180,90&width=676&height=330&srs=EPSG:4326&crs=EPSG:4326&format=application/openlayers",WMS,4,7614324,180.0,"ISO 19115 Topic Category. Flora or fauna in natural environment, for example wildlife, vegetation, biological sciences, ecology, wilderness, sea life, wetlands, habitat, biological resources",[],"iMarine is an access point to a number of Virtual Research Environments deployed and operated in the context of the iMarine project to support the Ecosystem Approach to fisheries management and conservation of marine living resources. It empowers practitioners and policy makers from multiple scientific fields such as fisheries, biodiversity and ocean observation by ensuring that otherwise dispersed and heterogeneous data is available to all stakeholder communities through a shared virtual environment that brings together multidisciplinary data sources, supports cross-cutting scientific analysis, and assists communication.
See More: https://i-marine.d4science.org/",Dataset,iMarine,bb,dataset,[],"iMarine Consortium,iMarine.eu",http://geonetwork.d4science.org:8080/geonetwork,2013-04-11T20:17:38.543+02:00,organization,info@i-marine.eu,"{""type"": ""Polygon"", ""coordinates"": [[[-180.0, -90.0], [180.0, -90.0], [180.0, 90.0], [-180.0, 90.0], [-180.0, -90.0]]]}",http://geonetwork.d4science.org:8080/geonetwork/srv/en/metadata.show?uuid=7b529c99-5433-4b62-94c8-e6e21523614d,biota,70a489ea-a910-40b8-ae63-431084dc99a6,2017-09-23T00:14:08.296489,bluebridge.catalogue@d4science.org,False,creation,ancistroteuthis-lichtensteini2,8,3cdcef06-93df-450b-957b-a199479b1d94,[],6f54a519-72dc-48d8-a94d-e68de3dca77f,7bf889d1-7829-4c2e-ad72-222798006eee,active,02c17357-7e5e-4e46-bcd6-01ee42aa213b,approved,81f5e6ae-92ab-410a-9a75-f809d43ec1ee,biota,active,https://ckan-bb2.d4science.org/images/organisations/imarine.png,OGC:WFS-1.0.0-http-get-feature,iMarine.eu,dataset,2017-11-24T11:56:37.199304,81f5e6ae-92ab-410a-9a75-f809d43ec1ee,asNeeded,biota,http://data.d4science.org/ctlg/d4science.research-infrastructures.eu/ancistroteuthis-lichtensteini2,"[{""name"": ""iMarine Consortium"", ""roles"": [""author""]}, {""name"": ""iMarine.eu"", ""roles"": [""distributor"", ""resourceProvider""]}]"
e8b23c95-bd44-4cf2-bb61-bf150bab7214,0,http://node49.p.d4science.research-infrastructures.eu:9003/83/Animalia/Chordata/Actinopterygii/Syngnathiformes/Centriscidae/Fis-26161/Ocean_View__Pacific.jpg,iMarine,-180.0,active,90.0,biota,5e93dcff-2fc7-4132-8148-4e69d9dc07a5,http://geonetwork.d4science.org:8080/geonetwork/srv/en/xml.metadata.get?uuid=67aec6b5-75aa-402f-8218-64e1e93839f1,2017-11-26T07:57:13.824832,2013-06-19T06:47:43.113+02:00,True,WMS link to resource,True,False,Alpheus floridanus,False,imarine,2e6245dd-9f61-4ea7-8dad-774b69f16045,67aec6b5-75aa-402f-8218-64e1e93839f1,"[{""type"": ""creation"", ""value"": ""2012-12-21T23:04:22.083+01:00""}]",-90.0,eng,active,2017-11-26T07:57:11.516952,"This Alpheus floridanus Species Distribution Map has been generated with the AquaMaps methodology by exploiting the technology and the computational resources provided by iMarine. In particular, this map has been produced using the HSPEC 2050 Native Range dataset, generated using AquaMaps NativeRange2050 algorithm.",ebc02b4a-f774-4e7e-afe1-d52ab93126de,"http://geoserver3.d4science.research-infrastructures.eu/geoserver/wms?service=wms&version=1.1.0&request=GetMap&layers=lalpheusfloridanus20121221230345835cet&styles=&bbox=-180,-90,180,90&width=676&height=330&srs=EPSG:4326&crs=EPSG:4326&format=application/openlayers",WMS,4,Alpheus floridanus,180.0,"ISO 19115 Topic Category. Flora or fauna in natural environment, for example wildlife, vegetation, biological sciences, ecology, wilderness, sea life, wetlands, habitat, biological resources",[],"iMarine is an access point to a number of Virtual Research Environments deployed and operated in the context of the iMarine project to support the Ecosystem Approach to fisheries management and conservation of marine living resources. It empowers practitioners and policy makers from multiple scientific fields such as fisheries, biodiversity and ocean observation by ensuring that otherwise dispersed and heterogeneous data is available to all stakeholder communities through a shared virtual environment that brings together multidisciplinary data sources, supports cross-cutting scientific analysis, and assists communication.
See More: https://i-marine.d4science.org/",Dataset,iMarine,bb,dataset,[],"iMarine Consortium,iMarine.eu",http://geonetwork.d4science.org:8080/geonetwork,2012-12-20T16:26:48.327+01:00,organization,info@i-marine.eu,"{""type"": ""Polygon"", ""coordinates"": [[[-180.0, -90.0], [180.0, -90.0], [180.0, 90.0], [-180.0, 90.0], [-180.0, -90.0]]]}",http://geonetwork.d4science.org:8080/geonetwork/srv/en/metadata.show?uuid=67aec6b5-75aa-402f-8218-64e1e93839f1,biota,70a489ea-a910-40b8-ae63-431084dc99a6,2017-09-21T16:55:54.568032,bluebridge.catalogue@d4science.org,False,creation,alpheus-floridanus,6,5e93dcff-2fc7-4132-8148-4e69d9dc07a5,[],c1ac80f5-0054-43ff-bb47-b7e01e4af5cc,7bf889d1-7829-4c2e-ad72-222798006eee,active,e8b23c95-bd44-4cf2-bb61-bf150bab7214,approved,81f5e6ae-92ab-410a-9a75-f809d43ec1ee,biota,active,https://ckan-bb2.d4science.org/images/organisations/imarine.png,OGC:WFS-1.0.0-http-get-feature,iMarine.eu,dataset,2017-11-24T11:56:37.199304,81f5e6ae-92ab-410a-9a75-f809d43ec1ee,asNeeded,biota,http://data.d4science.org/ctlg/d4science.research-infrastructures.eu/alpheus-floridanus,"[{""name"": ""iMarine Consortium"", ""roles"": [""author""]}, {""name"": ""iMarine.eu"", ""roles"": [""distributor"", ""resourceProvider""]}]"
37f1d402-53ac-4c8c-ab71-52c185b1a3bb,0,http://node49.p.d4science.research-infrastructures.eu:9003/83/Animalia/Chordata/Actinopterygii/Perciformes/Gobiidae/Fis-26255/Ocean_View__Pacific.jpg,SpeciesDistribution,-180.0,active,90.0,biota,7740b270-dc98-4dd9-91e0-a20e7cc58233,http://geonetwork.d4science.org:8080/geonetwork/srv/en/xml.metadata.get?uuid=357aae22-6d8e-4bf2-b808-a62a84583d12,2017-11-24T18:46:39.546090,2013-06-19T11:56:30.075+02:00,True,WMS link to resource,True,False,Amphiarius rugispinis,False,imarine,172d04b9-eb96-4684-a7e3-0cf40b2b8af4,357aae22-6d8e-4bf2-b808-a62a84583d12,"[{""type"": ""creation"", ""value"": ""2013-04-11T20:17:38.543+02:00""}]",-90.0,eng,active,2017-11-24T18:46:39.022299,"This Amphiarius rugispinis Species Distribution Map has been generated with the AquaMaps methodology by exploiting the technology and the computational resources provided by iMarine. In particular, this map has been produced using the Default Suitable maps_SuitableRange dataset, generated using AquaMaps SuitableRange algorithm.",ebc02b4a-f774-4e7e-afe1-d52ab93126de,"http://geoserver.d4science-ii.research-infrastructures.eu/geoserver/wms?service=wms&version=1.1.0&request=GetMap&layers=lamphiariusrugispinis20130411201708570cest&styles=&bbox=-180,-90,180,90&width=676&height=330&srs=EPSG:4326&crs=EPSG:4326&format=application/openlayers",WMS,4,Amphiarius rugispinis,180.0,"ISO 19115 Topic Category. Flora or fauna in natural environment, for example wildlife, vegetation, biological sciences, ecology, wilderness, sea life, wetlands, habitat, biological resources",[],"iMarine is an access point to a number of Virtual Research Environments deployed and operated in the context of the iMarine project to support the Ecosystem Approach to fisheries management and conservation of marine living resources. It empowers practitioners and policy makers from multiple scientific fields such as fisheries, biodiversity and ocean observation by ensuring that otherwise dispersed and heterogeneous data is available to all stakeholder communities through a shared virtual environment that brings together multidisciplinary data sources, supports cross-cutting scientific analysis, and assists communication.
See More: https://i-marine.d4science.org/",Dataset,iMarine,bb,dataset,[],"iMarine Consortium,iMarine.eu",http://geonetwork.d4science.org:8080/geonetwork,2012-12-20T16:42:07.279+01:00,organization,info@i-marine.eu,"{""type"": ""Polygon"", ""coordinates"": [[[-180.0, -90.0], [180.0, -90.0], [180.0, 90.0], [-180.0, 90.0], [-180.0, -90.0]]]}",http://geonetwork.d4science.org:8080/geonetwork/srv/en/metadata.show?uuid=357aae22-6d8e-4bf2-b808-a62a84583d12,biota,70a489ea-a910-40b8-ae63-431084dc99a6,2017-09-21T10:29:57.016456,bluebridge.catalogue@d4science.org,False,creation,amphiarius-rugispinis,6,7740b270-dc98-4dd9-91e0-a20e7cc58233,[],7fb88868-c357-416b-bc5d-dbe4531fcc53,7bf889d1-7829-4c2e-ad72-222798006eee,active,37f1d402-53ac-4c8c-ab71-52c185b1a3bb,approved,81f5e6ae-92ab-410a-9a75-f809d43ec1ee,biota,active,https://ckan-bb2.d4science.org/images/organisations/imarine.png,OGC:WFS-1.0.0-http-get-feature,iMarine.eu,dataset,2017-11-24T11:56:37.199304,81f5e6ae-92ab-410a-9a75-f809d43ec1ee,asNeeded,biota,http://data.d4science.org/ctlg/d4science.research-infrastructures.eu/amphiarius-rugispinis,"[{""name"": ""iMarine Consortium"", ""roles"": [""author""]}, {""name"": ""iMarine.eu"", ""roles"": [""distributor"", ""resourceProvider""]}]"
80a40efb-5bac-428b-ab59-5873f4560938,0,http://node49.p.d4science.research-infrastructures.eu:9003/80/Animalia/Chordata/Elasmobranchii/Lamniformes/Alopiidae/Fis-31568/Ocean_View__Pacific.jpg,SpeciesDistribution,-180.0,active,90.0,biota,a206d9ac-613f-4a7f-a181-0220eee1bacf,http://geonetwork.d4science.org:8080/geonetwork/srv/en/xml.metadata.get?uuid=4aac11ee-59c5-418f-981d-0bdd45e97ea0,2017-11-25T07:42:23.062555,2013-06-19T03:50:36.496+02:00,True,WMS link to resource,True,False,Aeoliscus strigatus,False,imarine,172d04b9-eb96-4684-a7e3-0cf40b2b8af4,4aac11ee-59c5-418f-981d-0bdd45e97ea0,"[{""type"": ""creation"", ""value"": ""2012-12-20T16:26:48.327+01:00""}]",-90.0,eng,active,2017-11-25T07:42:22.370299,"This Aeoliscus strigatus Species Distribution Map has been generated with the AquaMaps methodology by exploiting the technology and the computational resources provided by iMarine. In particular, this map has been produced using the HSPEC 2050 Native Range dataset, generated using AquaMaps NativeRange2050 algorithm.",ebc02b4a-f774-4e7e-afe1-d52ab93126de,"http://geoserver.d4science-ii.research-infrastructures.eu/geoserver/wms?service=wms&version=1.1.0&request=GetMap&layers=laeoliscusstrigatus20121220162633131cet&styles=&bbox=-180,-90,180,90&width=676&height=330&srs=EPSG:4326&crs=EPSG:4326&format=application/openlayers",WMS,4,Aeoliscus strigatus,180.0,"ISO 19115 Topic Category. Flora or fauna in natural environment, for example wildlife, vegetation, biological sciences, ecology, wilderness, sea life, wetlands, habitat, biological resources",[],"iMarine is an access point to a number of Virtual Research Environments deployed and operated in the context of the iMarine project to support the Ecosystem Approach to fisheries management and conservation of marine living resources. It empowers practitioners and policy makers from multiple scientific fields such as fisheries, biodiversity and ocean observation by ensuring that otherwise dispersed and heterogeneous data is available to all stakeholder communities through a shared virtual environment that brings together multidisciplinary data sources, supports cross-cutting scientific analysis, and assists communication.
See More: https://i-marine.d4science.org/",Dataset,iMarine,bb,dataset,[],"iMarine Consortium,iMarine.eu",http://geonetwork.d4science.org:8080/geonetwork,2012-12-10T15:26:18.424+01:00,organization,info@i-marine.eu,"{""type"": ""Polygon"", ""coordinates"": [[[-180.0, -90.0], [180.0, -90.0], [180.0, 90.0], [-180.0, 90.0], [-180.0, -90.0]]]}",http://geonetwork.d4science.org:8080/geonetwork/srv/en/metadata.show?uuid=4aac11ee-59c5-418f-981d-0bdd45e97ea0,biota,70a489ea-a910-40b8-ae63-431084dc99a6,2017-09-22T21:38:35.599131,bluebridge.catalogue@d4science.org,False,creation,aeoliscus-strigatus,6,a206d9ac-613f-4a7f-a181-0220eee1bacf,[],facbec06-83f9-42e0-b5ce-5851bf59e5c8,7bf889d1-7829-4c2e-ad72-222798006eee,active,80a40efb-5bac-428b-ab59-5873f4560938,approved,81f5e6ae-92ab-410a-9a75-f809d43ec1ee,biota,active,https://ckan-bb2.d4science.org/images/organisations/imarine.png,OGC:WFS-1.0.0-http-get-feature,iMarine.eu,dataset,2017-11-24T11:56:37.199304,81f5e6ae-92ab-410a-9a75-f809d43ec1ee,asNeeded,biota,http://data.d4science.org/ctlg/d4science.research-infrastructures.eu/aeoliscus-strigatus,"[{""name"": ""iMarine Consortium"", ""roles"": [""author""]}, {""name"": ""iMarine.eu"", ""roles"": [""distributor"", ""resourceProvider""]}]"
