has_identifier_has_id_value,unknown,unknown,has_name,unknown,unknown,unknown,unknown,has_identifier_has_id_value,unknown,has_identifier_is_source_of_has_startDate,unknown,unknown,unknown,unknown,unknown,has_name,unknown,unknown,unknown,unknown,unknown,unknown,unknown,unknown,is_source_of_has_startDate,has_description,is_destination_of_has_source_has_identifier_has_id_value,unknown,unknown,unknown,has_name,unknown,unknown,unknown,unknown,is_source_of_has_classification_has_term,unknown,is_destination_of_has_source_is_source_of_has_destination_has_name,is_source_of_has_classification_has_term,unknown,is_destination_of_has_source_is_source_of_has_destination_has_name,unknown,unknown,unknown,unknown,unknown,unknown,unknown,unknown,unknown,is_destination_of_has_source_is_source_of_has_destination_has_URI,unknown,unknown,has_identifier_has_id_value,unknown,has_identifier_has_id_value,unknown,unknown,unknown,unknown,has_identifier_has_id_value,unknown,unknown,unknown,unknown,unknown,unknown,is_destination_of_has_source_is_source_of_has_destination_has_name,is_source_of_has_classification_has_term,unknown,unknown,unknown,unknown,unknown,unknown
bd9b2d97-892a-476b-b79d-b1fba5c1c461,0,http://node49.p.d4science.research-infrastructures.eu:9003/407/Animalia/Chordata/Actinopterygii/Perciformes/Pomacentridae/Fis-34858/Ocean_View__Pacific.jpg,Probability Distribution,-179.75,active,28.25,environment,1fa4b522-3578-4657-b384-b7862e7568ae,http://geonetwork.d4science.org:8080/geonetwork/srv/en/xml.metadata.get?uuid=bcb20f28-d3a1-413a-bb9b-94a536270abd,2017-11-25T20:20:00.556848,2017-10-10T17:48:10.522+02:00,True,Unnamed resource,True,False,Acropora Subglabra Aquamaps Native Raster,False,d4sciencelabs,c415fab9-35e8-45df-8790-d087f71698ae,bcb20f28-d3a1-413a-bb9b-94a536270abd,"[{""type"": ""creation"", ""value"": ""2017-10-10T17:48:10.522+02:00""}, {""type"": ""publication"", ""value"": ""2017-10-10T17:48:10.522+02:00""}, {""type"": ""revision"", ""value"": ""2017-10-10T17:48:10.522+02:00""}]",-25.75,eng,active,2017-11-25T20:19:59.644750,"This Acropora Subglabra Species Distribution Map has been generated with the AquaMaps methodology by exploiting the technology and the computational resources provided by iMarine. In particular, this map has been produced using the HSPEC Native Range dataset, generated using the AquaMaps NativeRange algorithm. Hosted on the D4Science Thredds CataSystem.out.println: http://thredds.d4science.org",ebc02b4a-f774-4e7e-afe1-d52ab93126de,http://thredds.d4science.org/thredds/fileServer/public/netcdf/AquamapsNative/aquamaps_native_acropora_subglabra.nc,WCS,4,Acropora Subglabra,180.25,"ISO 19115 Topic Category. Environmental resources, protection and conservation, for example environmental pollution, waste storage and treatment, environmental impact assessment, monitoring environmental risk, nature reserves, landscape, water quality, air quality, environmental modeling",[],"D4Science has developed a series of applications (accessible through the D4Science Labs) which can be used by any user to upload, manipulate, use and re-use products with the aim to share them with other users following the principle of the OpenScience",Dataset,D4Science Labs,bb,dataset,[],"iMarine Consortium,iMarine.eu",http://geonetwork.d4science.org:8080/geonetwork,2013-04-14T07:20:27.131+02:00,organization,info@i-marine.eu,"{""type"": ""Polygon"", ""coordinates"": [[[-179.75, -25.75], [180.25, -25.75], [180.25, 28.25], [-179.75, 28.25], [-179.75, -25.75]]]}",http://geonetwork.d4science.org:8080/geonetwork/srv/en/metadata.show?uuid=bcb20f28-d3a1-413a-bb9b-94a536270abd,environment,22dde829-fe22-4db6-875d-5ae13aed8a5a,2017-10-13T18:58:48.587557,bluebridge.catalogue@d4science.org,False,creation,acropora-subglabra-aquamaps-native-raster,8,1fa4b522-3578-4657-b384-b7862e7568ae,[],5e5d78a9-9667-4964-b63d-b96a8515571e,730e5b91-2265-431e-b033-7f310474e4f3,active,bd9b2d97-892a-476b-b79d-b1fba5c1c461,approved,11680099-3fd0-427c-8cfc-b1fbcde0623e,environment,active,https://ckan-bb2.d4science.org/images/organisations/d4sciencelabs.png,OGC:WFS-1.0.0-http-get-feature,iMarine Consortium,dataset,2017-11-24T11:56:48.241435,11680099-3fd0-427c-8cfc-b1fbcde0623e,asNeeded,environment,http://data.d4science.org/ctlg/gCubeApps/acropora-subglabra-aquamaps-native-raster,"[{""name"": """", ""roles"": [""originator""]}]"
d9c3f8de-c55b-4063-90fa-60beabfb76b9,0,http://node49.p.d4science.research-infrastructures.eu:9003/80/Animalia/Arthropoda/Malacostraca/Decapoda/Nephropidae/ITS-97319/Earth.jpg,Yellowfin damsel,-180.0,active,90.0,biota,9b3ee653-ac12-43db-9d4d-4d3ebb7e385c,http://geonetwork.d4science.org:8080/geonetwork/srv/en/xml.metadata.get?uuid=7e0ba535-5663-42ca-b796-05a3a383ae05,2017-11-26T03:51:04.252404,2013-06-19T18:39:35.620+02:00,True,WMS link to resource,True,False,Amblyglyphidodon flavilatus,False,imarine,f7683622-d24f-4fd0-b231-53cde2d3dec2,7e0ba535-5663-42ca-b796-05a3a383ae05,"[{""type"": ""creation"", ""value"": ""2013-04-14T07:20:27.131+02:00""}]",-90.0,eng,active,2017-11-26T03:51:02.527835,"This Amblyglyphidodon flavilatus Species Distribution Map has been generated with the AquaMaps methodology by exploiting the technology and the computational resources provided by iMarine. In particular, this map has been produced using the Default Suitable 2050 maps_SuitableRange2050 dataset, generated using AquaMaps SuitableRange2050 algorithm.",ebc02b4a-f774-4e7e-afe1-d52ab93126de,"http://geoserver2.d4science.research-infrastructures.eu/geoserver/wms?service=wms&version=1.1.0&request=GetMap&layers=lamblyglyphidodonflavilatus20130414071953128cest&styles=&bbox=-180,-90,180,90&width=676&height=330&srs=EPSG:4326&crs=EPSG:4326&format=application/openlayers",WMS,4,Amblyglyphidodon flavilatus,180.0,"ISO 19115 Topic Category. Flora or fauna in natural environment, for example wildlife, vegetation, biological sciences, ecology, wilderness, sea life, wetlands, habitat, biological resources",[],"iMarine is an access point to a number of Virtual Research Environments deployed and operated in the context of the iMarine project to support the Ecosystem Approach to fisheries management and conservation of marine living resources. It empowers practitioners and policy makers from multiple scientific fields such as fisheries, biodiversity and ocean observation by ensuring that otherwise dispersed and heterogeneous data is available to all stakeholder communities through a shared virtual environment that brings together multidisciplinary data sources, supports cross-cutting scientific analysis, and assists communication.
See More: https://i-marine.d4science.org/",Dataset,iMarine,bb,dataset,[],"iMarine Consortium,iMarine.eu",http://geonetwork.d4science.org:8080/geonetwork,2012-12-18T19:19:29.120+01:00,organization,info@i-marine.eu,"{""type"": ""Polygon"", ""coordinates"": [[[-180.0, -90.0], [180.0, -90.0], [180.0, 90.0], [-180.0, 90.0], [-180.0, -90.0]]]}",http://geonetwork.d4science.org:8080/geonetwork/srv/en/metadata.show?uuid=7e0ba535-5663-42ca-b796-05a3a383ae05,biota,70a489ea-a910-40b8-ae63-431084dc99a6,2017-09-22T03:42:31.218689,bluebridge.catalogue@d4science.org,False,creation,amblyglyphidodon-flavilatus,6,9b3ee653-ac12-43db-9d4d-4d3ebb7e385c,[],00f3501a-8271-439b-96b2-0c277526c12f,7bf889d1-7829-4c2e-ad72-222798006eee,active,d9c3f8de-c55b-4063-90fa-60beabfb76b9,approved,81f5e6ae-92ab-410a-9a75-f809d43ec1ee,biota,active,https://ckan-bb2.d4science.org/images/organisations/imarine.png,OGC:WFS-1.0.0-http-get-feature,iMarine Consortium,dataset,2017-11-24T11:56:37.199304,81f5e6ae-92ab-410a-9a75-f809d43ec1ee,asNeeded,biota,http://data.d4science.org/ctlg/d4science.research-infrastructures.eu/amblyglyphidodon-flavilatus,"[{""name"": ""iMarine Consortium"", ""roles"": [""author""]}, {""name"": ""iMarine.eu"", ""roles"": [""distributor"", ""resourceProvider""]}]"
a0d5a62d-7863-41fe-aaac-213b9643fef8,0,http://node49.p.d4science.research-infrastructures.eu:9003/407/Animalia/Chordata/Actinopterygii/Perciformes/Ammodytidae/Fis-29268/Ocean_View__Pacific.jpg,SpeciesDistribution,-180.0,active,90.0,biota,2273d662-b903-4d5d-b8a6-a7d040b98f61,http://geonetwork.d4science.org:8080/geonetwork/srv/en/xml.metadata.get?uuid=d6d1db15-ad56-4b11-a6da-696c393ae597,2017-11-25T14:02:11.272719,2013-06-18T23:37:32.373+02:00,True,WMS link to resource,True,False,Acanthacaris caeca,False,imarine,172d04b9-eb96-4684-a7e3-0cf40b2b8af4,d6d1db15-ad56-4b11-a6da-696c393ae597,"[{""type"": ""creation"", ""value"": ""2012-12-18T19:19:29.120+01:00""}]",-90.0,eng,active,2017-11-25T14:02:10.511885,"This Acanthacaris caeca Species Distribution Map has been generated with the AquaMaps methodology by exploiting the technology and the computational resources provided by iMarine. In particular, this map has been produced using the HSPEC Native Range dataset, generated using AquaMaps NativeRange algorithm.",ebc02b4a-f774-4e7e-afe1-d52ab93126de,"http://geoserver.d4science-ii.research-infrastructures.eu/geoserver/wms?service=wms&version=1.1.0&request=GetMap&layers=lacanthacariscaeca20121218191901978cet&styles=&bbox=-180,-90,180,90&width=676&height=330&srs=EPSG:4326&crs=EPSG:4326&format=application/openlayers",WMS,4,Acanthacaris caeca,180.0,"ISO 19115 Topic Category. Flora or fauna in natural environment, for example wildlife, vegetation, biological sciences, ecology, wilderness, sea life, wetlands, habitat, biological resources",[],"iMarine is an access point to a number of Virtual Research Environments deployed and operated in the context of the iMarine project to support the Ecosystem Approach to fisheries management and conservation of marine living resources. It empowers practitioners and policy makers from multiple scientific fields such as fisheries, biodiversity and ocean observation by ensuring that otherwise dispersed and heterogeneous data is available to all stakeholder communities through a shared virtual environment that brings together multidisciplinary data sources, supports cross-cutting scientific analysis, and assists communication.
See More: https://i-marine.d4science.org/",Dataset,iMarine,bb,dataset,[],"iMarine Consortium,iMarine.eu",http://geonetwork.d4science.org:8080/geonetwork,2013-04-13T20:08:20.053+02:00,organization,info@i-marine.eu,"{""type"": ""Polygon"", ""coordinates"": [[[-180.0, -90.0], [180.0, -90.0], [180.0, 90.0], [-180.0, 90.0], [-180.0, -90.0]]]}",http://geonetwork.d4science.org:8080/geonetwork/srv/en/metadata.show?uuid=d6d1db15-ad56-4b11-a6da-696c393ae597,biota,70a489ea-a910-40b8-ae63-431084dc99a6,2017-09-23T10:17:15.234507,bluebridge.catalogue@d4science.org,False,creation,acanthacaris-caeca3,6,2273d662-b903-4d5d-b8a6-a7d040b98f61,[],8b98d0ee-e803-4d9c-ab24-8b8b7c6c1d4e,7bf889d1-7829-4c2e-ad72-222798006eee,active,a0d5a62d-7863-41fe-aaac-213b9643fef8,approved,81f5e6ae-92ab-410a-9a75-f809d43ec1ee,biota,active,https://ckan-bb2.d4science.org/images/organisations/imarine.png,OGC:WFS-1.0.0-http-get-feature,iMarine Consortium,dataset,2017-11-24T11:56:37.199304,81f5e6ae-92ab-410a-9a75-f809d43ec1ee,asNeeded,biota,http://data.d4science.org/ctlg/d4science.research-infrastructures.eu/acanthacaris-caeca3,"[{""name"": ""iMarine Consortium"", ""roles"": [""author""]}, {""name"": ""iMarine.eu"", ""roles"": [""distributor"", ""resourceProvider""]}]"
70297339-a675-4bc2-ae9f-c2523f27b6b9,0,http://node49.p.d4science.research-infrastructures.eu:9003/405/Animalia/Bryozoa/Gymnolaemata/Cheilostomata/Aeteidae/ITS-155804/Ocean_View__Pacific.jpg,Raster,-179.75,active,50.25,environment,9d66e7f8-1daf-4067-a9c1-1673e12bfb00,http://geonetwork.d4science.org:8080/geonetwork/srv/en/xml.metadata.get?uuid=3e28a53b-9bcc-4e30-a358-3ad6c62a0582,2017-12-23T20:30:58.833813,2017-12-04T00:08:19.660+01:00,True,Unnamed resource,True,False,acanthochaenus luetkenii Aquamaps Native 2050 Raster,False,d4sciencelabs,bf9c1fc6-610c-4683-9906-ab38eeb55835,3e28a53b-9bcc-4e30-a358-3ad6c62a0582,"[{""type"": ""creation"", ""value"": ""2017-12-04T00:08:19.660+01:00""}, {""type"": ""publication"", ""value"": ""2017-12-04T00:08:19.660+01:00""}, {""type"": ""revision"", ""value"": ""2017-12-04T00:08:19.660+01:00""}]",-59.25,eng,active,2017-12-23T20:30:56.429088,"This acanthochaenus luetkenii Species Distribution Map for 2050 has been generated with the AquaMaps methodology by exploiting the technology and the computational resources provided by iMarine. In particular, this map has been produced using the HSPEC Native Range dataset, generated using the AquaMaps NativeRange 2050 algorithm. Hosted on the D4Science Thredds CataSystem.out.println: http://thredds.d4science.org",ebc02b4a-f774-4e7e-afe1-d52ab93126de,http://thredds.d4science.org/thredds/fileServer/public/netcdf/AquamapsNative2050/aquamaps_native2050_acanthochaenus_luetkenii.nc,WCS,4,AquaMaps,180.25,"ISO 19115 Topic Category. Environmental resources, protection and conservation, for example environmental pollution, waste storage and treatment, environmental impact assessment, monitoring environmental risk, nature reserves, landscape, water quality, air quality, environmental modeling",[],"D4Science has developed a series of applications (accessible through the D4Science Labs) which can be used by any user to upload, manipulate, use and re-use products with the aim to share them with other users following the principle of the OpenScience",Dataset,D4Science Labs,bb,dataset,[],"iMarine Consortium,iMarine.eu",http://geonetwork.d4science.org:8080/geonetwork,2013-04-12T10:45:20.823+02:00,organization,info@i-marine.eu,"{""type"": ""Polygon"", ""coordinates"": [[[-179.75, -59.25], [180.25, -59.25], [180.25, 50.25], [-179.75, 50.25], [-179.75, -59.25]]]}",http://geonetwork.d4science.org:8080/geonetwork/srv/en/metadata.show?uuid=3e28a53b-9bcc-4e30-a358-3ad6c62a0582,environment,22dde829-fe22-4db6-875d-5ae13aed8a5a,2017-12-16T03:31:51.349563,bluebridge.catalogue@d4science.org,False,creation,acanthochaenus-luetkenii-aquamaps-native-2050-raster,8,9d66e7f8-1daf-4067-a9c1-1673e12bfb00,[],b901a39a-50f0-42bf-a3b0-03640bdba07d,730e5b91-2265-431e-b033-7f310474e4f3,active,70297339-a675-4bc2-ae9f-c2523f27b6b9,approved,11680099-3fd0-427c-8cfc-b1fbcde0623e,environment,active,https://ckan-bb2.d4science.org/images/organisations/d4sciencelabs.png,OGC:WFS-1.0.0-http-get-feature,iMarine Consortium,dataset,2017-11-24T11:56:48.241435,11680099-3fd0-427c-8cfc-b1fbcde0623e,asNeeded,environment,http://data.d4science.org/ctlg/gCubeApps/acanthochaenus-luetkenii-aquamaps-native-2050-raster,"[{""name"": """", ""roles"": [""originator""]}]"
3e6aac04-ed1f-4ad2-91d7-18979d08c3e9,0,http://node49.p.d4science.research-infrastructures.eu:9003/80/Animalia/Chordata/Actinopterygii/Syngnathiformes/Syngnathidae/Fis-24416/Earth.jpg,SpeciesDistribution,-180.0,active,90.0,biota,9d01e5b9-b3fb-4fa2-8cd5-f60e7dd2adc3,http://geonetwork.d4science.org:8080/geonetwork/srv/en/xml.metadata.get?uuid=9ccd5800-6606-4251-9536-aff7895c3425,2017-11-24T19:45:19.568405,2013-06-19T17:12:04.362+02:00,True,WMS link to resource,True,False,Ammodytes personatus,False,imarine,bf9c1fc6-610c-4683-9906-ab38eeb55835,9ccd5800-6606-4251-9536-aff7895c3425,"[{""type"": ""creation"", ""value"": ""2013-04-13T20:08:20.053+02:00""}]",-90.0,eng,active,2017-11-24T19:45:19.077531,"This Ammodytes personatus Species Distribution Map has been generated with the AquaMaps methodology by exploiting the technology and the computational resources provided by iMarine. In particular, this map has been produced using the Default Suitable 2050 maps_SuitableRange2050 dataset, generated using AquaMaps SuitableRange2050 algorithm.",ebc02b4a-f774-4e7e-afe1-d52ab93126de,"http://geoserver2.d4science.research-infrastructures.eu/geoserver/wms?service=wms&version=1.1.0&request=GetMap&layers=lammodytespersonatus20130413200739372cest&styles=&bbox=-180,-90,180,90&width=676&height=330&srs=EPSG:4326&crs=EPSG:4326&format=application/openlayers",WMS,4,Ammodytes personatus,180.0,"ISO 19115 Topic Category. Flora or fauna in natural environment, for example wildlife, vegetation, biological sciences, ecology, wilderness, sea life, wetlands, habitat, biological resources",[],"iMarine is an access point to a number of Virtual Research Environments deployed and operated in the context of the iMarine project to support the Ecosystem Approach to fisheries management and conservation of marine living resources. It empowers practitioners and policy makers from multiple scientific fields such as fisheries, biodiversity and ocean observation by ensuring that otherwise dispersed and heterogeneous data is available to all stakeholder communities through a shared virtual environment that brings together multidisciplinary data sources, supports cross-cutting scientific analysis, and assists communication.
See More: https://i-marine.d4science.org/",Dataset,iMarine,bb,dataset,[],"iMarine Consortium,iMarine.eu",http://geonetwork.d4science.org:8080/geonetwork,2012-12-17T20:36:37.222+01:00,organization,info@i-marine.eu,"{""type"": ""Polygon"", ""coordinates"": [[[-180.0, -90.0], [180.0, -90.0], [180.0, 90.0], [-180.0, 90.0], [-180.0, -90.0]]]}",http://geonetwork.d4science.org:8080/geonetwork/srv/en/metadata.show?uuid=9ccd5800-6606-4251-9536-aff7895c3425,biota,70a489ea-a910-40b8-ae63-431084dc99a6,2017-09-22T18:33:45.100535,bluebridge.catalogue@d4science.org,False,creation,ammodytes-personatus,6,9d01e5b9-b3fb-4fa2-8cd5-f60e7dd2adc3,[],d7608b45-d7ab-4408-bf3d-dd6ef1afb117,7bf889d1-7829-4c2e-ad72-222798006eee,active,3e6aac04-ed1f-4ad2-91d7-18979d08c3e9,approved,81f5e6ae-92ab-410a-9a75-f809d43ec1ee,biota,active,https://ckan-bb2.d4science.org/images/organisations/imarine.png,OGC:WFS-1.0.0-http-get-feature,iMarine Consortium,dataset,2017-11-24T11:56:37.199304,81f5e6ae-92ab-410a-9a75-f809d43ec1ee,asNeeded,biota,http://data.d4science.org/ctlg/d4science.research-infrastructures.eu/ammodytes-personatus,"[{""name"": ""iMarine Consortium"", ""roles"": [""author""]}, {""name"": ""iMarine.eu"", ""roles"": [""distributor"", ""resourceProvider""]}]"
5eba9a1b-ba45-4ee2-b4a9-e7faf7352723,0,http://node49.p.d4science.research-infrastructures.eu:9003/80/Animalia/Chordata/Elasmobranchii/Rajiformes/Rajidae/Fis-131852/Ocean_View__Pacific.jpg,SpeciesDistribution,-180.0,active,90.0,biota,a46802ba-cda6-4e89-9536-0701a4acde20,http://geonetwork.d4science.org:8080/geonetwork/srv/en/xml.metadata.get?uuid=d746808e-54c4-4465-99b1-d4832c878545,2017-11-29T14:26:24.905359,2013-06-19T13:40:49.995+02:00,True,WMS link to resource,True,False,Aetea truncata,False,imarine,c415fab9-35e8-45df-8790-d087f71698ae,d746808e-54c4-4465-99b1-d4832c878545,"[{""type"": ""creation"", ""value"": ""2013-04-12T10:45:20.823+02:00""}]",-90.0,eng,active,2017-11-29T14:26:23.547002,"This Aetea truncata Species Distribution Map has been generated with the AquaMaps methodology by exploiting the technology and the computational resources provided by iMarine. In particular, this map has been produced using the Default Suitable maps_SuitableRange dataset, generated using AquaMaps SuitableRange algorithm.",ebc02b4a-f774-4e7e-afe1-d52ab93126de,"http://geoserver2.d4science.research-infrastructures.eu/geoserver/wms?service=wms&version=1.1.0&request=GetMap&layers=laeteatruncata20130412104504528cest&styles=&bbox=-180,-90,180,90&width=676&height=330&srs=EPSG:4326&crs=EPSG:4326&format=application/openlayers",WMS,4,7614324,180.0,"ISO 19115 Topic Category. Flora or fauna in natural environment, for example wildlife, vegetation, biological sciences, ecology, wilderness, sea life, wetlands, habitat, biological resources",[],"iMarine is an access point to a number of Virtual Research Environments deployed and operated in the context of the iMarine project to support the Ecosystem Approach to fisheries management and conservation of marine living resources. It empowers practitioners and policy makers from multiple scientific fields such as fisheries, biodiversity and ocean observation by ensuring that otherwise dispersed and heterogeneous data is available to all stakeholder communities through a shared virtual environment that brings together multidisciplinary data sources, supports cross-cutting scientific analysis, and assists communication.
See More: https://i-marine.d4science.org/",Dataset,iMarine,bb,dataset,[],"iMarine Consortium,iMarine.eu",http://geonetwork.d4science.org:8080/geonetwork,2012-12-09T19:02:07.212+01:00,organization,info@i-marine.eu,"{""type"": ""Polygon"", ""coordinates"": [[[-180.0, -90.0], [180.0, -90.0], [180.0, 90.0], [-180.0, 90.0], [-180.0, -90.0]]]}",http://geonetwork.d4science.org:8080/geonetwork/srv/en/metadata.show?uuid=d746808e-54c4-4465-99b1-d4832c878545,biota,70a489ea-a910-40b8-ae63-431084dc99a6,2017-09-21T23:48:38.693955,bluebridge.catalogue@d4science.org,False,creation,aetea-truncata1,7,a46802ba-cda6-4e89-9536-0701a4acde20,[],a06b2dd3-ba61-44e6-ba2b-a8fa20893626,7bf889d1-7829-4c2e-ad72-222798006eee,active,5eba9a1b-ba45-4ee2-b4a9-e7faf7352723,approved,81f5e6ae-92ab-410a-9a75-f809d43ec1ee,biota,active,https://ckan-bb2.d4science.org/images/organisations/imarine.png,OGC:WFS-1.0.0-http-get-feature,iMarine Consortium,dataset,2017-11-24T11:56:37.199304,81f5e6ae-92ab-410a-9a75-f809d43ec1ee,asNeeded,biota,http://data.d4science.org/ctlg/d4science.research-infrastructures.eu/aetea-truncata1,"[{""name"": ""iMarine Consortium"", ""roles"": [""author""]}, {""name"": ""iMarine.eu"", ""roles"": [""distributor"", ""resourceProvider""]}]"
22c99b37-4fbc-48d2-82a9-2d7574ef661d,0,http://node49.p.d4science.research-infrastructures.eu:9003/80/Animalia/Chordata/Reptilia/Squamata/Acrochordidae/Rep-110/Ocean_View__Pacific.jpg,SpeciesDistribution,-180.0,active,90.0,biota,b0d4304f-f2e0-4108-9aac-40e6146ac6b2,http://geonetwork.d4science.org:8080/geonetwork/srv/en/xml.metadata.get?uuid=ad0d003b-2bed-445e-b00d-5f223ab36620,2017-11-24T15:45:11.134860,2013-06-18T20:52:08.081+02:00,True,WMS link to resource,True,False,Acentronura dendritica,False,imarine,bf9c1fc6-610c-4683-9906-ab38eeb55835,ad0d003b-2bed-445e-b00d-5f223ab36620,"[{""type"": ""creation"", ""value"": ""2012-12-17T20:36:37.222+01:00""}]",-90.0,eng,active,2017-11-24T15:45:10.640843,"This Acentronura dendritica Species Distribution Map has been generated with the AquaMaps methodology by exploiting the technology and the computational resources provided by iMarine. In particular, this map has been produced using the HSPEC Native Range dataset, generated using AquaMaps NativeRange algorithm.",ebc02b4a-f774-4e7e-afe1-d52ab93126de,"http://geoserver3.d4science.research-infrastructures.eu/geoserver/wms?service=wms&version=1.1.0&request=GetMap&layers=lacentronuradendritica20121217203603287cet&styles=&bbox=-180,-90,180,90&width=676&height=330&srs=EPSG:4326&crs=EPSG:4326&format=application/openlayers",WMS,4,Acentronura dendritica,180.0,"ISO 19115 Topic Category. Flora or fauna in natural environment, for example wildlife, vegetation, biological sciences, ecology, wilderness, sea life, wetlands, habitat, biological resources",[],"iMarine is an access point to a number of Virtual Research Environments deployed and operated in the context of the iMarine project to support the Ecosystem Approach to fisheries management and conservation of marine living resources. It empowers practitioners and policy makers from multiple scientific fields such as fisheries, biodiversity and ocean observation by ensuring that otherwise dispersed and heterogeneous data is available to all stakeholder communities through a shared virtual environment that brings together multidisciplinary data sources, supports cross-cutting scientific analysis, and assists communication.
See More: https://i-marine.d4science.org/",Dataset,iMarine,bb,dataset,[],"iMarine Consortium,iMarine.eu",http://geonetwork.d4science.org:8080/geonetwork,2012-12-18T19:45:17.559+01:00,organization,info@i-marine.eu,"{""type"": ""Polygon"", ""coordinates"": [[[-180.0, -90.0], [180.0, -90.0], [180.0, 90.0], [-180.0, 90.0], [-180.0, -90.0]]]}",http://geonetwork.d4science.org:8080/geonetwork/srv/en/metadata.show?uuid=ad0d003b-2bed-445e-b00d-5f223ab36620,biota,70a489ea-a910-40b8-ae63-431084dc99a6,2017-09-22T00:32:26.587880,bluebridge.catalogue@d4science.org,False,creation,acentronura-dendritica1,6,b0d4304f-f2e0-4108-9aac-40e6146ac6b2,[],2229462e-5e6c-45c4-a6b3-6f862607981f,7bf889d1-7829-4c2e-ad72-222798006eee,active,22c99b37-4fbc-48d2-82a9-2d7574ef661d,approved,81f5e6ae-92ab-410a-9a75-f809d43ec1ee,biota,active,https://ckan-bb2.d4science.org/images/organisations/imarine.png,OGC:WFS-1.0.0-http-get-feature,iMarine Consortium,dataset,2017-11-24T11:56:37.199304,81f5e6ae-92ab-410a-9a75-f809d43ec1ee,asNeeded,biota,http://data.d4science.org/ctlg/d4science.research-infrastructures.eu/acentronura-dendritica1,"[{""name"": ""iMarine Consortium"", ""roles"": [""author""]}, {""name"": ""iMarine.eu"", ""roles"": [""distributor"", ""resourceProvider""]}]"
