has_identifier_has_id_value,unknown,unknown,has_name,unknown,unknown,unknown,unknown,has_identifier_has_id_value,unknown,has_identifier_is_source_of_has_startDate,unknown,unknown,unknown,unknown,unknown,has_name,unknown,unknown,unknown,unknown,unknown,unknown,unknown,unknown,is_source_of_has_startDate,has_description,is_destination_of_has_source_has_identifier_has_id_value,unknown,unknown,unknown,has_name,unknown,unknown,unknown,unknown,is_source_of_has_classification_has_term,unknown,is_destination_of_has_source_is_source_of_has_destination_has_name,is_source_of_has_classification_has_term,unknown,is_destination_of_has_source_is_source_of_has_destination_has_name,unknown,unknown,unknown,unknown,unknown,unknown,unknown,unknown,unknown,is_destination_of_has_source_is_source_of_has_destination_has_URI,unknown,unknown,has_identifier_has_id_value,unknown,has_identifier_has_id_value,unknown,unknown,unknown,unknown,has_identifier_has_id_value,unknown,unknown,unknown,unknown,unknown,unknown,is_destination_of_has_source_is_source_of_has_destination_has_name,is_source_of_has_classification_has_term,unknown,unknown,unknown,unknown,unknown,unknown
45c55b5b-00f0-4fb2-b54e-2c29731f6a5b,0,http://node49.p.d4science.research-infrastructures.eu:9003/405/Animalia/Chordata/Actinopterygii/Anguilliformes/Anguillidae/Fis-29636/Ocean_View__Pacific.jpg,SpeciesDistribution,-180.0,active,90.0,biota,552cace6-e6d1-4849-8fd8-0d34b358c61b,http://geonetwork.d4science.org:8080/geonetwork/srv/en/xml.metadata.get?uuid=0c43bb5b-94c4-41e2-a659-0077a9d49fb4,2017-11-24T20:51:40.381230,2013-06-19T09:23:10.968+02:00,True,WMS link to resource,True,False,Anguilla bicolor bicolor,False,imarine,bf9c1fc6-610c-4683-9906-ab38eeb55835,0c43bb5b-94c4-41e2-a659-0077a9d49fb4,"[{""type"": ""creation"", ""value"": ""2013-04-10T18:26:13.589+02:00""}]",-90.0,eng,active,2017-11-24T20:51:39.955287,"This Anguilla bicolor bicolor Species Distribution Map has been generated with the AquaMaps methodology by exploiting the technology and the computational resources provided by iMarine. In particular, this map has been produced using the Default Suitable maps_SuitableRange dataset, generated using AquaMaps SuitableRange algorithm.",ebc02b4a-f774-4e7e-afe1-d52ab93126de,"http://geoserver2.d4science.research-infrastructures.eu/geoserver/wms?service=wms&version=1.1.0&request=GetMap&layers=languillabicolorbicolor20130410182544901cest&styles=&bbox=-180,-90,180,90&width=676&height=330&srs=EPSG:4326&crs=EPSG:4326&format=application/openlayers",WMS,4,Anguilla bicolor bicolor,180.0,"ISO 19115 Topic Category. Flora or fauna in natural environment, for example wildlife, vegetation, biological sciences, ecology, wilderness, sea life, wetlands, habitat, biological resources",[],"iMarine is an access point to a number of Virtual Research Environments deployed and operated in the context of the iMarine project to support the Ecosystem Approach to fisheries management and conservation of marine living resources. It empowers practitioners and policy makers from multiple scientific fields such as fisheries, biodiversity and ocean observation by ensuring that otherwise dispersed and heterogeneous data is available to all stakeholder communities through a shared virtual environment that brings together multidisciplinary data sources, supports cross-cutting scientific analysis, and assists communication.
See More: https://i-marine.d4science.org/",Dataset,iMarine,bb,dataset,[],"iMarine Consortium,iMarine.eu",http://geonetwork.d4science.org:8080/geonetwork,2013-04-10T18:26:13.589+02:00,organization,info@i-marine.eu,"{""type"": ""Polygon"", ""coordinates"": [[[-180.0, -90.0], [180.0, -90.0], [180.0, 90.0], [-180.0, 90.0], [-180.0, -90.0]]]}",http://geonetwork.d4science.org:8080/geonetwork/srv/en/metadata.show?uuid=0c43bb5b-94c4-41e2-a659-0077a9d49fb4,biota,70a489ea-a910-40b8-ae63-431084dc99a6,2017-09-21T18:07:59.665425,bluebridge.catalogue@d4science.org,False,creation,anguilla-bicolor-bicolor,6,552cace6-e6d1-4849-8fd8-0d34b358c61b,[],c0c8a2f9-fc88-4208-825f-427746be1afe,7bf889d1-7829-4c2e-ad72-222798006eee,active,45c55b5b-00f0-4fb2-b54e-2c29731f6a5b,approved,81f5e6ae-92ab-410a-9a75-f809d43ec1ee,biota,active,https://ckan-bb2.d4science.org/images/organisations/imarine.png,OGC:WFS-1.0.0-http-get-feature,iMarine.eu,dataset,2017-11-24T11:56:37.199304,81f5e6ae-92ab-410a-9a75-f809d43ec1ee,asNeeded,biota,http://data.d4science.org/ctlg/d4science.research-infrastructures.eu/anguilla-bicolor-bicolor,"[{""name"": ""iMarine Consortium"", ""roles"": [""author""]}, {""name"": ""iMarine.eu"", ""roles"": [""distributor"", ""resourceProvider""]}]"
a2c48923-e6b0-4009-b20f-f87ea1c94db5,0,http://node49.p.d4science.research-infrastructures.eu:9003/407/Animalia/Chordata/Actinopterygii/Perciformes/Labridae/Fis-31132/Ocean_View__Pacific.jpg,NetCDF,-110.75,active,24.25,environment,54b8e343-f8ca-4427-9533-641b7733ff38,http://geonetwork.d4science.org:8080/geonetwork/srv/en/xml.metadata.get?uuid=bcf0b6e4-21a1-4ae6-b1cc-b27368214cc0,2017-11-25T14:25:54.928597,2017-10-10T17:45:49.746+02:00,True,Unnamed resource,True,False,Acanthemblemaria Hancocki Aquamaps Native Raster,False,d4sciencelabs,c415fab9-35e8-45df-8790-d087f71698ae,bcf0b6e4-21a1-4ae6-b1cc-b27368214cc0,"[{""type"": ""creation"", ""value"": ""2017-10-10T17:45:49.746+02:00""}, {""type"": ""publication"", ""value"": ""2017-10-10T17:45:49.746+02:00""}, {""type"": ""revision"", ""value"": ""2017-10-10T17:45:49.746+02:00""}]",5.25,eng,active,2017-11-25T14:25:54.157093,"This Acanthemblemaria Hancocki Species Distribution Map has been generated with the AquaMaps methodology by exploiting the technology and the computational resources provided by iMarine. In particular, this map has been produced using the HSPEC Native Range dataset, generated using the AquaMaps NativeRange algorithm. Hosted on the D4Science Thredds CataSystem.out.println: http://thredds.d4science.org",ebc02b4a-f774-4e7e-afe1-d52ab93126de,http://thredds.d4science.org/thredds/fileServer/public/netcdf/AquamapsNative/aquamaps_native_acanthemblemaria_hancocki.nc,WCS,4,0c2d6609-35bd-4f8b-9ba7-3eb00d4f3b13,-76.75,"ISO 19115 Topic Category. Environmental resources, protection and conservation, for example environmental pollution, waste storage and treatment, environmental impact assessment, monitoring environmental risk, nature reserves, landscape, water quality, air quality, environmental modeling",[],"D4Science has developed a series of applications (accessible through the D4Science Labs) which can be used by any user to upload, manipulate, use and re-use products with the aim to share them with other users following the principle of the OpenScience",Dataset,D4Science Labs,bb,dataset,[],"iMarine Consortium,iMarine.eu",http://geonetwork.d4science.org:8080/geonetwork,2013-04-14T00:53:22.597+02:00,organization,info@i-marine.eu,"{""type"": ""Polygon"", ""coordinates"": [[[-110.75, 5.25], [-76.75, 5.25], [-76.75, 24.25], [-110.75, 24.25], [-110.75, 5.25]]]}",http://geonetwork.d4science.org:8080/geonetwork/srv/en/metadata.show?uuid=bcf0b6e4-21a1-4ae6-b1cc-b27368214cc0,environment,22dde829-fe22-4db6-875d-5ae13aed8a5a,2017-10-13T20:57:42.900862,bluebridge.catalogue@d4science.org,False,creation,acanthemblemaria-hancocki-aquamaps-native-raster,8,54b8e343-f8ca-4427-9533-641b7733ff38,[],111a9400-0cf0-4492-baae-28837bc5cb4e,730e5b91-2265-431e-b033-7f310474e4f3,active,a2c48923-e6b0-4009-b20f-f87ea1c94db5,approved,11680099-3fd0-427c-8cfc-b1fbcde0623e,environment,active,https://ckan-bb2.d4science.org/images/organisations/d4sciencelabs.png,OGC:WFS-1.0.0-http-get-feature,iMarine.eu,dataset,2017-11-24T11:56:48.241435,11680099-3fd0-427c-8cfc-b1fbcde0623e,asNeeded,environment,http://data.d4science.org/ctlg/gCubeApps/acanthemblemaria-hancocki-aquamaps-native-raster,"[{""name"": """", ""roles"": [""originator""]}]"
5cbc3b2f-dfe8-4da8-98bc-e8cbbcb77da0,0,http://node49.p.d4science.research-infrastructures.eu:9003/80/Animalia/Chordata/Elasmobranchii/Rajiformes/Rajidae/Fis-131853/Ocean_View__Pacific.jpg,Probability Distribution,-43.75,active,81.75,environment,25e3f47a-71a6-426e-95d8-7f37cf47a74d,http://geonetwork.d4science.org:8080/geonetwork/srv/en/xml.metadata.get?uuid=d4662447-ff61-4d1a-a026-2f7376feb787,2017-12-16T10:53:02.621185,2017-12-03T10:28:39.675+01:00,True,Unnamed resource,True,False,agonus cataphractus Aquamaps Native 2050 Raster,False,d4sciencelabs,bf9c1fc6-610c-4683-9906-ab38eeb55835,d4662447-ff61-4d1a-a026-2f7376feb787,"[{""type"": ""creation"", ""value"": ""2017-12-03T10:28:39.675+01:00""}, {""type"": ""publication"", ""value"": ""2017-12-03T10:28:39.675+01:00""}, {""type"": ""revision"", ""value"": ""2017-12-03T10:28:39.675+01:00""}]",39.25,eng,active,2017-12-16T10:52:59.463170,"This agonus cataphractus Species Distribution Map for 2050 has been generated with the AquaMaps methodology by exploiting the technology and the computational resources provided by iMarine. In particular, this map has been produced using the HSPEC Native Range dataset, generated using the AquaMaps NativeRange 2050 algorithm. Hosted on the D4Science Thredds CataSystem.out.println: http://thredds.d4science.org",ebc02b4a-f774-4e7e-afe1-d52ab93126de,http://thredds.d4science.org/thredds/fileServer/public/netcdf/AquamapsNative2050/aquamaps_native2050_agonus_cataphractus.nc,WCS,4,9ec9b7ab-5c92-48dd-a184-8104a299372b,46.25,"ISO 19115 Topic Category. Environmental resources, protection and conservation, for example environmental pollution, waste storage and treatment, environmental impact assessment, monitoring environmental risk, nature reserves, landscape, water quality, air quality, environmental modeling",[],"D4Science has developed a series of applications (accessible through the D4Science Labs) which can be used by any user to upload, manipulate, use and re-use products with the aim to share them with other users following the principle of the OpenScience",Dataset,D4Science Labs,bb,dataset,[],"iMarine Consortium,iMarine.eu",http://geonetwork.d4science.org:8080/geonetwork,2012-12-09T19:04:13.360+01:00,organization,info@i-marine.eu,"{""type"": ""Polygon"", ""coordinates"": [[[-43.75, 39.25], [46.25, 39.25], [46.25, 81.75], [-43.75, 81.75], [-43.75, 39.25]]]}",http://geonetwork.d4science.org:8080/geonetwork/srv/en/metadata.show?uuid=d4662447-ff61-4d1a-a026-2f7376feb787,environment,22dde829-fe22-4db6-875d-5ae13aed8a5a,2017-12-15T15:55:08.006680,bluebridge.catalogue@d4science.org,False,creation,agonus-cataphractus-aquamaps-native-2050-raster,8,25e3f47a-71a6-426e-95d8-7f37cf47a74d,[],ff182eea-d984-4fb9-9708-179dc6868c79,730e5b91-2265-431e-b033-7f310474e4f3,active,5cbc3b2f-dfe8-4da8-98bc-e8cbbcb77da0,approved,11680099-3fd0-427c-8cfc-b1fbcde0623e,environment,active,https://ckan-bb2.d4science.org/images/organisations/d4sciencelabs.png,OGC:WFS-1.0.0-http-get-feature,iMarine.eu,dataset,2017-11-24T11:56:48.241435,11680099-3fd0-427c-8cfc-b1fbcde0623e,asNeeded,environment,http://data.d4science.org/ctlg/gCubeApps/agonus-cataphractus-aquamaps-native-2050-raster,"[{""name"": """", ""roles"": [""originator""]}]"
35655568-e260-4d37-bb04-d4c1acde491d,0,http://node49.p.d4science.research-infrastructures.eu:9003/83/Animalia/Arthropoda/Malacostraca/Amphipoda/Haustoriidae/ITS-93984/Ocean_View__Pacific.jpg,SpeciesDistribution,-180.0,active,90.0,biota,ae63ae9c-5879-4a78-89c0-6eba07509a61,http://geonetwork.d4science.org:8080/geonetwork/srv/en/xml.metadata.get?uuid=38f043b0-e9ae-4f7c-a81f-cfb3dd5acf4d,2017-11-24T18:24:34.858609,2013-06-19T17:57:49.890+02:00,True,WMS link to resource,True,False,Anampses caeruleopunctatus,False,imarine,bf9c1fc6-610c-4683-9906-ab38eeb55835,38f043b0-e9ae-4f7c-a81f-cfb3dd5acf4d,"[{""type"": ""creation"", ""value"": ""2013-04-14T00:53:22.597+02:00""}]",-90.0,eng,active,2017-11-24T18:24:34.308163,"This Anampses caeruleopunctatus Species Distribution Map has been generated with the AquaMaps methodology by exploiting the technology and the computational resources provided by iMarine. In particular, this map has been produced using the Default Suitable 2050 maps_SuitableRange2050 dataset, generated using AquaMaps SuitableRange2050 algorithm.",ebc02b4a-f774-4e7e-afe1-d52ab93126de,"http://geoserver3.d4science.research-infrastructures.eu/geoserver/wms?service=wms&version=1.1.0&request=GetMap&layers=lanampsescaeruleopunctatus20130414005254094cest&styles=&bbox=-180,-90,180,90&width=676&height=330&srs=EPSG:4326&crs=EPSG:4326&format=application/openlayers",WMS,4,Anampses caeruleopunctatus,180.0,"ISO 19115 Topic Category. Flora or fauna in natural environment, for example wildlife, vegetation, biological sciences, ecology, wilderness, sea life, wetlands, habitat, biological resources",[],"iMarine is an access point to a number of Virtual Research Environments deployed and operated in the context of the iMarine project to support the Ecosystem Approach to fisheries management and conservation of marine living resources. It empowers practitioners and policy makers from multiple scientific fields such as fisheries, biodiversity and ocean observation by ensuring that otherwise dispersed and heterogeneous data is available to all stakeholder communities through a shared virtual environment that brings together multidisciplinary data sources, supports cross-cutting scientific analysis, and assists communication.
See More: https://i-marine.d4science.org/",Dataset,iMarine,bb,dataset,[],"iMarine Consortium,iMarine.eu",http://geonetwork.d4science.org:8080/geonetwork,2012-12-21T22:33:55.920+01:00,organization,info@i-marine.eu,"{""type"": ""Polygon"", ""coordinates"": [[[-180.0, -90.0], [180.0, -90.0], [180.0, 90.0], [-180.0, 90.0], [-180.0, -90.0]]]}",http://geonetwork.d4science.org:8080/geonetwork/srv/en/metadata.show?uuid=38f043b0-e9ae-4f7c-a81f-cfb3dd5acf4d,biota,70a489ea-a910-40b8-ae63-431084dc99a6,2017-09-22T13:05:43.042560,bluebridge.catalogue@d4science.org,False,creation,anampses-caeruleopunctatus3,6,ae63ae9c-5879-4a78-89c0-6eba07509a61,[],09dd6762-5b99-4829-972e-a76cdbab4cfa,7bf889d1-7829-4c2e-ad72-222798006eee,active,35655568-e260-4d37-bb04-d4c1acde491d,approved,81f5e6ae-92ab-410a-9a75-f809d43ec1ee,biota,active,https://ckan-bb2.d4science.org/images/organisations/imarine.png,OGC:WFS-1.0.0-http-get-feature,iMarine.eu,dataset,2017-11-24T11:56:37.199304,81f5e6ae-92ab-410a-9a75-f809d43ec1ee,asNeeded,biota,http://data.d4science.org/ctlg/d4science.research-infrastructures.eu/anampses-caeruleopunctatus3,"[{""name"": ""iMarine Consortium"", ""roles"": [""author""]}, {""name"": ""iMarine.eu"", ""roles"": [""distributor"", ""resourceProvider""]}]"
afee5c30-1bed-48e0-aa9e-d739a3e90ee3,0,http://node49.p.d4science.research-infrastructures.eu:9003/407/Animalia/Mollusca/Gastropoda/Neogastropoda/Turridae/SLB-105102/Ocean_View__Pacific.jpg,NetCDF,-179.75,active,45.75,environment,dce9644e-f264-4bea-951e-bd15588da0e4,http://geonetwork.d4science.org:8080/geonetwork/srv/en/xml.metadata.get?uuid=ae64a5c4-10c3-4cf1-80b4-5868a8e9e908,2017-11-25T17:10:42.931508,2017-10-10T17:49:25.502+02:00,True,Unnamed resource,True,False,Alcockia Rostrata Aquamaps Native Raster,False,d4sciencelabs,ded0a282-4194-432e-93ae-a05e2acd26f9,ae64a5c4-10c3-4cf1-80b4-5868a8e9e908,"[{""type"": ""creation"", ""value"": ""2017-10-10T17:49:25.502+02:00""}, {""type"": ""publication"", ""value"": ""2017-10-10T17:49:25.502+02:00""}, {""type"": ""revision"", ""value"": ""2017-10-10T17:49:25.502+02:00""}]",-58.25,eng,active,2017-11-25T17:10:41.551027,"This Alcockia Rostrata Species Distribution Map has been generated with the AquaMaps methodology by exploiting the technology and the computational resources provided by iMarine. In particular, this map has been produced using the HSPEC Native Range dataset, generated using the AquaMaps NativeRange algorithm. Hosted on the D4Science Thredds CataSystem.out.println: http://thredds.d4science.org",ebc02b4a-f774-4e7e-afe1-d52ab93126de,http://thredds.d4science.org/thredds/fileServer/public/netcdf/AquamapsNative/aquamaps_native_alcockia_rostrata.nc,WCS,4,9efb0a24-9efe-4eb9-b72c-f953359ff4e2,180.25,"ISO 19115 Topic Category. Environmental resources, protection and conservation, for example environmental pollution, waste storage and treatment, environmental impact assessment, monitoring environmental risk, nature reserves, landscape, water quality, air quality, environmental modeling",[],"D4Science has developed a series of applications (accessible through the D4Science Labs) which can be used by any user to upload, manipulate, use and re-use products with the aim to share them with other users following the principle of the OpenScience",Dataset,D4Science Labs,bb,dataset,[],"iMarine Consortium,iMarine.eu",http://geonetwork.d4science.org:8080/geonetwork,2013-04-14T17:18:34.135+02:00,organization,info@i-marine.eu,"{""type"": ""Polygon"", ""coordinates"": [[[-179.75, -58.25], [180.25, -58.25], [180.25, 45.75], [-179.75, 45.75], [-179.75, -58.25]]]}",http://geonetwork.d4science.org:8080/geonetwork/srv/en/metadata.show?uuid=ae64a5c4-10c3-4cf1-80b4-5868a8e9e908,environment,22dde829-fe22-4db6-875d-5ae13aed8a5a,2017-10-14T02:31:49.353925,bluebridge.catalogue@d4science.org,False,creation,alcockia-rostrata-aquamaps-native-raster,8,dce9644e-f264-4bea-951e-bd15588da0e4,[],61fe9873-4652-4429-b0dc-8fc5f7d3bdf6,730e5b91-2265-431e-b033-7f310474e4f3,active,afee5c30-1bed-48e0-aa9e-d739a3e90ee3,approved,11680099-3fd0-427c-8cfc-b1fbcde0623e,environment,active,https://ckan-bb2.d4science.org/images/organisations/d4sciencelabs.png,OGC:WFS-1.0.0-http-get-feature,iMarine.eu,dataset,2017-11-24T11:56:48.241435,11680099-3fd0-427c-8cfc-b1fbcde0623e,asNeeded,environment,http://data.d4science.org/ctlg/gCubeApps/alcockia-rostrata-aquamaps-native-raster,"[{""name"": """", ""roles"": [""originator""]}]"
9b886c89-9e6b-4123-8085-7ebe23dff5a8,0,http://node49.p.d4science.research-infrastructures.eu:9003/80/Animalia/Chordata/Actinopterygii/Perciformes/Acanthuridae/Fis-31079/Ocean_View__Pacific.jpg,NetCDF,-179.75,active,36.25,environment,8757c7b3-f6d3-4f0f-9235-fca787b5b950,http://geonetwork.d4science.org:8080/geonetwork/srv/en/xml.metadata.get?uuid=9082d5f9-dc5c-4230-b053-464c1565c53b,2017-11-25T12:58:36.899371,2017-10-10T17:51:28.825+02:00,True,Unnamed resource,True,False,Amblyeleotris Ogasawarensis Aquamaps Native Raster,False,d4sciencelabs,c415fab9-35e8-45df-8790-d087f71698ae,9082d5f9-dc5c-4230-b053-464c1565c53b,"[{""type"": ""creation"", ""value"": ""2017-10-10T17:51:28.825+02:00""}, {""type"": ""publication"", ""value"": ""2017-10-10T17:51:28.825+02:00""}, {""type"": ""revision"", ""value"": ""2017-10-10T17:51:28.825+02:00""}]",-34.75,eng,active,2017-11-25T12:58:36.049336,"This Amblyeleotris Ogasawarensis Species Distribution Map has been generated with the AquaMaps methodology by exploiting the technology and the computational resources provided by iMarine. In particular, this map has been produced using the HSPEC Native Range dataset, generated using the AquaMaps NativeRange algorithm. Hosted on the D4Science Thredds CataSystem.out.println: http://thredds.d4science.org",ebc02b4a-f774-4e7e-afe1-d52ab93126de,http://thredds.d4science.org/thredds/fileServer/public/netcdf/AquamapsNative/aquamaps_native_amblyeleotris_ogasawarensis.nc,WCS,4,1590fd57-7478-4d44-89b0-7849c585dc44,180.25,"ISO 19115 Topic Category. Environmental resources, protection and conservation, for example environmental pollution, waste storage and treatment, environmental impact assessment, monitoring environmental risk, nature reserves, landscape, water quality, air quality, environmental modeling",[],"D4Science has developed a series of applications (accessible through the D4Science Labs) which can be used by any user to upload, manipulate, use and re-use products with the aim to share them with other users following the principle of the OpenScience",Dataset,D4Science Labs,bb,dataset,[],"iMarine Consortium,iMarine.eu",http://geonetwork.d4science.org:8080/geonetwork,2012-12-07T16:58:07.841+01:00,organization,info@i-marine.eu,"{""type"": ""Polygon"", ""coordinates"": [[[-179.75, -34.75], [180.25, -34.75], [180.25, 36.25], [-179.75, 36.25], [-179.75, -34.75]]]}",http://geonetwork.d4science.org:8080/geonetwork/srv/en/metadata.show?uuid=9082d5f9-dc5c-4230-b053-464c1565c53b,environment,22dde829-fe22-4db6-875d-5ae13aed8a5a,2017-10-14T02:16:15.831578,bluebridge.catalogue@d4science.org,False,creation,amblyeleotris-ogasawarensis-aquamaps-native-raster,8,8757c7b3-f6d3-4f0f-9235-fca787b5b950,[],4b660e12-9221-4424-9443-c0c772411df4,730e5b91-2265-431e-b033-7f310474e4f3,active,9b886c89-9e6b-4123-8085-7ebe23dff5a8,approved,11680099-3fd0-427c-8cfc-b1fbcde0623e,environment,active,https://ckan-bb2.d4science.org/images/organisations/d4sciencelabs.png,WWW:LINK-1.0-http--link,iMarine.eu,dataset,2017-11-24T11:56:48.241435,11680099-3fd0-427c-8cfc-b1fbcde0623e,asNeeded,environment,http://data.d4science.org/ctlg/gCubeApps/amblyeleotris-ogasawarensis-aquamaps-native-raster,"[{""name"": """", ""roles"": [""originator""]}]"
fd515f95-2dcf-40e6-a803-07db374c0189,0,http://node49.p.d4science.research-infrastructures.eu:9003/83/Animalia/Chordata/Actinopterygii/Perciformes/Pomacentridae/Fis-32656/Ocean_View__Pacific.jpg,Thorny skate,-180.0,active,90.0,biota,222cf57d-2048-4237-9fea-50d5bf0b2817,http://geonetwork.d4science.org:8080/geonetwork/srv/en/xml.metadata.get?uuid=3d2f8ad0-dc55-4f40-9fc2-11ff104a53e6,2017-11-26T13:16:46.914174,2013-06-18T18:24:38.405+02:00,True,WMS link to resource,True,False,Amblyraja radiata,False,imarine,172d04b9-eb96-4684-a7e3-0cf40b2b8af4,3d2f8ad0-dc55-4f40-9fc2-11ff104a53e6,"[{""type"": ""creation"", ""value"": ""2012-12-09T19:04:13.360+01:00""}]",-90.0,eng,active,2017-11-26T13:16:44.654343,"This Amblyraja radiata Species Distribution Map has been generated with the AquaMaps methodology by exploiting the technology and the computational resources provided by iMarine. In particular, this map has been produced using the HSPEC Native Range dataset, generated using AquaMaps NativeRange algorithm.",ebc02b4a-f774-4e7e-afe1-d52ab93126de,"http://geoserver2.d4science.research-infrastructures.eu/geoserver/wms?service=wms&version=1.1.0&request=GetMap&layers=lamblyrajaradiata20121209190400512cet&styles=&bbox=-180,-90,180,90&width=676&height=330&srs=EPSG:4326&crs=EPSG:4326&format=application/openlayers",WMS,4,Amblyraja radiata,180.0,"ISO 19115 Topic Category. Flora or fauna in natural environment, for example wildlife, vegetation, biological sciences, ecology, wilderness, sea life, wetlands, habitat, biological resources",[],"iMarine is an access point to a number of Virtual Research Environments deployed and operated in the context of the iMarine project to support the Ecosystem Approach to fisheries management and conservation of marine living resources. It empowers practitioners and policy makers from multiple scientific fields such as fisheries, biodiversity and ocean observation by ensuring that otherwise dispersed and heterogeneous data is available to all stakeholder communities through a shared virtual environment that brings together multidisciplinary data sources, supports cross-cutting scientific analysis, and assists communication.
See More: https://i-marine.d4science.org/",Dataset,iMarine,bb,dataset,[],"iMarine Consortium,iMarine.eu",http://geonetwork.d4science.org:8080/geonetwork,2012-12-21T06:44:36.516+01:00,organization,info@i-marine.eu,"{""type"": ""Polygon"", ""coordinates"": [[[-180.0, -90.0], [180.0, -90.0], [180.0, 90.0], [-180.0, 90.0], [-180.0, -90.0]]]}",http://geonetwork.d4science.org:8080/geonetwork/srv/en/metadata.show?uuid=3d2f8ad0-dc55-4f40-9fc2-11ff104a53e6,biota,70a489ea-a910-40b8-ae63-431084dc99a6,2017-09-22T00:25:51.422374,bluebridge.catalogue@d4science.org,False,creation,amblyraja-radiata,6,222cf57d-2048-4237-9fea-50d5bf0b2817,[],91274181-fd03-4979-989c-bdb8d83f0dfd,7bf889d1-7829-4c2e-ad72-222798006eee,active,fd515f95-2dcf-40e6-a803-07db374c0189,approved,81f5e6ae-92ab-410a-9a75-f809d43ec1ee,biota,active,https://ckan-bb2.d4science.org/images/organisations/imarine.png,OGC:WFS-1.0.0-http-get-feature,iMarine.eu,dataset,2017-11-24T11:56:37.199304,81f5e6ae-92ab-410a-9a75-f809d43ec1ee,asNeeded,biota,http://data.d4science.org/ctlg/d4science.research-infrastructures.eu/amblyraja-radiata,"[{""name"": ""iMarine Consortium"", ""roles"": [""author""]}, {""name"": ""iMarine.eu"", ""roles"": [""distributor"", ""resourceProvider""]}]"
